{
    "DOI": "http://dx.doi.org/doi:10.5880/enmap.2016.001",
    "DiscHierarchy": [
        "4.4.6",
        "Geosciences",
        "Earth System Research"
    ],
    "Discipline": "Earth System Research",
    "Format": [
        "application/octet-stream"
    ],
    "Language": [
        "English"
    ],
    "MetaDataAccess": "http://doidb.wdc-terra.org/oaip/oai?verb=GetRecord&metadataPrefix=oai_datacite&identifier=oai:doidb.wdc-terra.org:6193",
    "MetadataAccess": [
        "oai:doidb.wdc-terra.org:6193"
    ],
    "PublicationTimestamp": "2016-07-01T11:59:59Z",
    "PublicationYear": [
        "2016"
    ],
    "Publisher": [
        "GFZ Data Services"
    ],
    "Rights": [
        "CC BY-SA 4.0"
    ],
    "SpatialCoverage": [
        "35.4946 -115.56907778 35.46335333 -115.50759167",
        "36.8285917 -2.0724028 36.8897917 -2.0280639"
    ],
    "author": [
        "Brell, Maximilian",
        "Boesche, Nina K.",
        "Guanter, Luis",
        "Mielke, Christian",
        "Lundeen, Sarah",
        "Rogass, Christian",
        "Thomson, David",
        "Chabrillat, Sabine",
        "Segl, Karl"
    ],
    "fulltext": "oai:doidb.wdc-terra.org:6193;2016-11-25T13:58:05Z;DOIDB;DOIDB.ENMAP;false;3;DOIDB.ENMAP;10.5880/enmap.2016.001;Boesche, Nina K.;GFZ German Research Centre for Geosciences, Potsdam, Gemany;Mielke, Christian;GFZ German Research Centre for Geosciences, Potsdam, Gemany;Segl, Karl;GFZ German Research Centre for Geosciences, Potsdam, Gemany;Chabrillat, Sabine;0000-0001-8600-5168;GFZ German Research Centre for Geosciences, Potsdam, Gemany;Rogass, Christian;GFZ German Research Centre for Geosciences, Potsdam, Gemany;Thomson, David;Jet Propulsion Laboratory (JPL), 4800 Oak Grove Drive, Pasadena, CA 91109, USA;Lundeen, Sarah;Jet Propulsion Laboratory (JPL), 4800 Oak Grove Drive, Pasadena, CA 91109, USA;Brell, Maximilian;GFZ German Research Centre for Geosciences, Potsdam, Gemany;Guanter, Luis;0000-0002-8389-5764;GFZ German Research Centre for Geosciences, Potsdam, Gemany;EnGeoMAP Test Data: Simulated EnMAP Satellite Data for Mountain Pass, USA and Rodalquilar, Spain;GFZ Data Services;2016;Imaging spectroscopy;Mineral Mapping;Rare Earth Elements;EnMAP;EnGeoMAP;Simulated Data;Rodalquilar;Mountain Pass;Hyperspectral Imagery;Foerster, Saskia;0000-0001-7752-7394;GFZ German Research Centre for Geosciences, Potsdam, Gemany;Elger, Kirsten;0000-0001-5140-8602;GFZ German Research Centre for Geosciences, Potsdam, Gemany;en;urn:nbn:de:kobv:517-opus4-85363;10.2312/enmap.2016.003;978-3941493865;http://www.earsel.org/workshops/IS_Warsaw_2005/papers/Terrestial_Ecosystems/13_Chabrillat_113_118.pdf;10.2312/enmap.2016.001;10.3390/rs70708830;10.3390/rs8020127;http://pubs.usgs.gov/pp/0261/report.pdf;10.1109/JSTARS.2012.2188994;http://www.enmap.org/?q=flights;10.1016/j.rse.2015.02.010;36514690 Bytes;4 Files;application/octet-stream;application/octet-stream;application/octet-stream;application/octet-stream;CC BY-SA 4.0;This data pubilcation includes EnMAP-like imaging spectroscopy data files to be used for mineral mapping with the EnMAP BOX software. It is simulated EnMAP satellite data, which is based on hyperspectral flight campaign data with the AVIRIS-NG and HyMap sensors. In preparation of the EnMAP satellite mission, an EnMAP BOX software package provides tools for visualization and scientific analysis of the data. Among many applications, the EnMAP BOX contains geological mapping tools (EnGeoMAP). Here we apply these tools to several representative test cases (Boesche, 2015; Boesche et al. 2016; Mielke et al., 2016). The test data comprise two study sites. ;The Environmental Mapping and Analysis Program (EnMAP) is a German hyperspectral satellite mission that aims at monitoring and characterizing the Earth\u2019s environment on a global scale. EnMAP serves to measure and model key dynamic processes of the Earth\u2019s ecosystems by extracting geochemical, biochemical and biophysical parameters, which provide information on the status and evolution of various terrestrial and aquatic ecosystems. In the frame of the EnMAP preparatory phase, pre-flight campaigns including airborne and in-situ measurements in different environments and for several application fields are being conducted. The main purpose of these campaigns is to support the development of scientific applications for EnMAP. In addition, the acquired data are input in the EnMAP end-to-end simulation tool (EeteS) and are employed to test data pre-processing and calibration-validation methods. The campaign data are made freely available to the scientific community under a Creative Commons Attribution-ShareAlike 4.0 International License. An overview of all available data is provided in in the EnMAP Flight Campaigns Metadata Portal http://www.enmap.org/?q=flights.;35.4946 -115.56907778 35.46335333 -115.50759167;Mountain Pass;36.8285917 -2.0724028 36.8897917 -2.0280639;Rodalquilar",
    "group": "enmap",
    "groups": [
        {
            "name": "enmap"
        }
    ],
    "name": "b82929b0-3ed1-5a64-b9ec-fba2430db5da",
    "notes": [
        "This data pubilcation includes EnMAP-like imaging spectroscopy data files to be used for mineral mapping with the EnMAP BOX software. It is simulated EnMAP satellite data, which is based on hyperspectral flight campaign data with the AVIRIS-NG and HyMap sensors. In preparation of the EnMAP satellite mission, an EnMAP BOX software package provides tools for visualization and scientific analysis of the data. Among many applications, the EnMAP BOX contains geological mapping tools (EnGeoMAP). Here we apply these tools to several representative test cases (Boesche, 2015; Boesche et al. 2016; Mielke et al., 2016). The test data comprise two study sites. ",
        "The Environmental Mapping and Analysis Program (EnMAP) is a German hyperspectral satellite mission that aims at monitoring and characterizing the Earth\u2019s environment on a global scale. EnMAP serves to measure and model key dynamic processes of the Earth\u2019s ecosystems by extracting geochemical, biochemical and biophysical parameters, which provide information on the status and evolution of various terrestrial and aquatic ecosystems. In the frame of the EnMAP preparatory phase, pre-flight campaigns including airborne and in-situ measurements in different environments and for several application fields are being conducted. The main purpose of these campaigns is to support the development of scientific applications for EnMAP. In addition, the acquired data are input in the EnMAP end-to-end simulation tool (EeteS) and are employed to test data pre-processing and calibration-validation methods. The campaign data are made freely available to the scientific community under a Creative Commons Attribution-ShareAlike 4.0 International License. An overview of all available data is provided in in the EnMAP Flight Campaigns Metadata Portal http://www.enmap.org/?q=flights."
    ],
    "oai_identifier": [
        "oai:doidb.wdc-terra.org:6193"
    ],
    "oai_set": [
        "DOIDB",
        "DOIDB.ENMAP"
    ],
    "state": "active",
    "tags": [
        {
            "name": "Imaging spectroscopy"
        },
        {
            "name": "Mineral Mapping"
        },
        {
            "name": "Rare Earth Elements"
        },
        {
            "name": "EnMAP"
        },
        {
            "name": "EnGeoMAP"
        },
        {
            "name": "Simulated Data"
        },
        {
            "name": "Rodalquilar"
        },
        {
            "name": "Mountain Pass"
        },
        {
            "name": "Hyperspectral Imagery"
        }
    ],
    "title": [
        "EnGeoMAP Test Data: Simulated EnMAP Satellite Data for Mountain Pass, USA and Rodalquilar, Spain"
    ],
    "url": ""
}