{
    "Contributor": [
        "Federal Ministry of Economics and Technology"
    ],
    "DOI": "http://dx.doi.org/doi:10.5880/enmap.2015.001",
    "DiscHierarchy": [
        "4.4.6",
        "Geosciences",
        "Earth System Research"
    ],
    "Discipline": "Earth System Research",
    "Language": [
        "English"
    ],
    "MetaDataAccess": "http://doidb.wdc-terra.org/oaip/oai?verb=GetRecord&metadataPrefix=oai_datacite&identifier=oai:doidb.wdc-terra.org:6148",
    "MetadataAccess": [
        "oai:doidb.wdc-terra.org:6148"
    ],
    "PublicationTimestamp": "2015-07-01T11:59:59Z",
    "PublicationYear": [
        "2015"
    ],
    "Publisher": [
        "GFZ Data Services"
    ],
    "ResourceType": [
        "Dataset"
    ],
    "Rights": [
        "CC BY-SA 4.0"
    ],
    "SpatialCoverage": [
        "52.45412645595905 12.989959716796875 52.536064211791505 13.104286193847656",
        "52.35295738060679 12.9913330078125 52.53794364304724 13.04901123046875",
        "52.35127974891625 13.056564331054688 52.53961418106945 13.09844970703125",
        "52.45768304654543 12.965927124023438 52.53961418106945 13.105316162109375"
    ],
    "TemporalCoverage": [
        "2010-08-06",
        "2008-08-07T11:00:51/2008-08-07T11:21:10",
        "2009-08-20T09:14:39/2009-08-20T09:19:36",
        "2009-08-20T09:25:16/2009-08-20T09:30:20",
        "2007-05-01/2009-09-01"
    ],
    "author": [
        "Neumann, Carsten",
        "Itzerott, Sibylle",
        "Weiss, Gabriele"
    ],
    "fulltext": "oai:doidb.wdc-terra.org:6148;2016-11-25T13:57:58Z;DOIDB;DOIDB.ENMAP;false;3;DOIDB.ENMAP;10.5880/enmap.2015.001;Neumann, Carsten;GFZ German Research Centre for Geosciences;Weiss, Gabriele;Ecostrat GmbH;Itzerott, Sibylle;GFZ German Research Centre for Geosciences;D\u00f6beritzer Heide 2008/2009 - An EnMAP Preparatory Flight Campaign (Datasets);GFZ Data Services;2015;Imaging Spectroscopy;Vegetation Ecology;Environmental Gradients;Federal Ministry of Economics and Technology;Federal Ministry of Economics and Technology;Klinke, Randolf;GFZ German Research Centre for Geosciences;Fuerstenow, Joerg;Sielmanns Naturlandschaften gGmbH;Foerster, Saskia;0000-0001-7752-7394;GFZ German Research Centre for Geosciences;Kuester, Theres;GFZ German Research Centre for Geosciences;Elger, Kirsten;0000-0001-5140-8602;GFZ German Research Centre for Geosciences;Brosinsky, Arlena;GFZ German Research Centre for Geosciences;2010-08-06;2008-08-07T11:00:51/2008-08-07T11:21:10;2009-08-20T09:14:39/2009-08-20T09:19:36;2009-08-20T09:25:16/2009-08-20T09:30:20;2007-05-01/2009-09-01;eng;Dataset;10.3390/rs70708830;10.1016/j.ecolind.2014.06.025 ;10.2312/GFZ.b103-13024;10.3390/rs70302871 ;10.1127/pfg/2014/0243 ;10.2312/enmap.2015.001;http://www.enmap.org/?q=flights;CC BY-SA 4.0;The dataset is composed of a) hyperspectral imagery acquired during airplane overflights on August 7th, 2008 and August 20th, 2009 consisting of 126 and 125 spectral bands, respectively, ranging from VIS to SWIR (456 - 2490 nm and 453 - 2480 nm) wavelength regions; b) spectral reference measurements acquired with an portable ASD field spectroradiometer in 2150 spectral bands (350 - 2500nm) in the same phenological periods of July/August/September 2008/09 c) plant species assemblages on 81 moist and 72 dry habitats consisting of the fractional cover of all vascular plants, mosses and lichens. ;The Environmental Mapping and Analysis Program (EnMAP) is a German hyperspectral satellite mission that aims at monitoring and characterizing the Earth\u2019s environment on a global scale. EnMAP serves to measure and model key dynamic processes of the Earth\u2019s ecosystems by extracting geochemical, biochemical and biophysical parameters, which provide information on the status and evolution of various terrestrial and aquatic ecosystems. In the frame of the EnMAP preparatory phase, pre-flight campaigns including airborne and in-situ measurements in different environments and for several application fields are being conducted. The main purpose of these campaigns is to support the development of scientific applications for EnMAP. In addition, the acquired data are input in the EnMAP end-to-end simulation tool (EeteS) and are employed to test data pre-processing and calibration-validation methods. The campaign data are made freely available to the scientific community under a Creative Commons Attribution-ShareAlike 4.0 International License. An overview of all available data is provided in in the EnMAP Flight Campaigns Metadata Portal http://www.enmap.org/?q=flights.;52.45412645595905 12.989959716796875 52.536064211791505 13.104286193847656; HyMap campaign 2008, 4 flight lines, D\u00f6beritzer Heide;52.35295738060679 12.9913330078125 52.53794364304724 13.04901123046875; HyMap campaign 2009, flight line 1, D\u00f6beritzer Heide;52.35127974891625 13.056564331054688 52.53961418106945 13.09844970703125; HyMap campaign 2009, flight line 2, D\u00f6beritzer Heide;52.45768304654543 12.965927124023438 52.53961418106945 13.105316162109375;Plant species assemblages, D\u00f6beritzer Heide",
    "group": "enmap",
    "groups": [
        {
            "name": "enmap"
        }
    ],
    "name": "b8ab6505-b010-5265-b1e4-af8a6f67260a",
    "notes": [
        "The dataset is composed of a) hyperspectral imagery acquired during airplane overflights on August 7th, 2008 and August 20th, 2009 consisting of 126 and 125 spectral bands, respectively, ranging from VIS to SWIR (456 - 2490 nm and 453 - 2480 nm) wavelength regions; b) spectral reference measurements acquired with an portable ASD field spectroradiometer in 2150 spectral bands (350 - 2500nm) in the same phenological periods of July/August/September 2008/09 c) plant species assemblages on 81 moist and 72 dry habitats consisting of the fractional cover of all vascular plants, mosses and lichens. ",
        "The Environmental Mapping and Analysis Program (EnMAP) is a German hyperspectral satellite mission that aims at monitoring and characterizing the Earth\u2019s environment on a global scale. EnMAP serves to measure and model key dynamic processes of the Earth\u2019s ecosystems by extracting geochemical, biochemical and biophysical parameters, which provide information on the status and evolution of various terrestrial and aquatic ecosystems. In the frame of the EnMAP preparatory phase, pre-flight campaigns including airborne and in-situ measurements in different environments and for several application fields are being conducted. The main purpose of these campaigns is to support the development of scientific applications for EnMAP. In addition, the acquired data are input in the EnMAP end-to-end simulation tool (EeteS) and are employed to test data pre-processing and calibration-validation methods. The campaign data are made freely available to the scientific community under a Creative Commons Attribution-ShareAlike 4.0 International License. An overview of all available data is provided in in the EnMAP Flight Campaigns Metadata Portal http://www.enmap.org/?q=flights."
    ],
    "oai_identifier": [
        "oai:doidb.wdc-terra.org:6148"
    ],
    "oai_set": [
        "DOIDB",
        "DOIDB.ENMAP"
    ],
    "state": "active",
    "tags": [
        {
            "name": "Imaging Spectroscopy"
        },
        {
            "name": "Vegetation Ecology"
        },
        {
            "name": "Environmental Gradients"
        }
    ],
    "title": [
        "D\u00f6beritzer Heide 2008/2009 - An EnMAP Preparatory Flight Campaign (Datasets)"
    ],
    "url": ""
}