{
    "Contributor": [
        "Federal Ministry for Economic Affairs and Energy"
    ],
    "DOI": "http://dx.doi.org/doi:10.5880/enmap.2017.002",
    "DiscHierarchy": [
        "4.4.6",
        "Geosciences",
        "Earth System Research"
    ],
    "Discipline": "Earth System Research",
    "Language": [
        "English"
    ],
    "MetaDataAccess": "http://doidb.wdc-terra.org/oaip/oai?verb=GetRecord&metadataPrefix=oai_datacite&identifier=oai:doidb.wdc-terra.org:6284",
    "MetadataAccess": [
        "oai:doidb.wdc-terra.org:6284"
    ],
    "PublicationTimestamp": "2017-07-01T11:59:59Z",
    "PublicationYear": [
        "2017"
    ],
    "Publisher": [
        "GFZ Data Services"
    ],
    "ResourceType": [
        "Dataset"
    ],
    "Rights": [
        "CC BY-SA 4.0"
    ],
    "SpatialCoverage": [
        "51.77  11.87 51.82 11.97",
        "51.77 11.87 51.82 11.97",
        "51.77 11.84 51.88 11.94"
    ],
    "TemporalCoverage": [
        "2016-11-30",
        "2011-05-10T09:32:18/2011-05-10T11:07:26",
        "2011-06-27T08:35:23/2011-06-27T10:16:44",
        "2012-05-24T09:06:57/2012-05-24T11:12:03"
    ],
    "author": [
        "Siegmann, Bastian",
        "Jarmer, Thomas"
    ],
    "fulltext": "oai:doidb.wdc-terra.org:6284;2017-09-15T09:21:28Z;DOIDB;DOIDB.ENMAP;false;3;DOIDB.ENMAP;10.5880/enmap.2017.002;Jarmer, Thomas;0000-0002-4652-1640;University of Osnabrueck;Siegmann, Bastian;University of Osnabrueck;K\u00f6then 2011/ 2012 - An EnMAP Preparatory Flight Campaign;GFZ Data Services;2017;Imaging Spectroscopy;Precision Farming;Yield Estimation;Federal Ministry for Economic Affairs and Energy;Federal Ministry of Economics and Technology;Foerster, Saskia;0000-0001-7752-7394;GFZ German Research Centre for Geosciences, Potsdam, Germany;K\u00fcster Theres;GFZ German Research Centre for Geosciences, Potsdam, Germany;Elger, Kirsten;0000-0001-5140-8602;GFZ German Research Centre for Geosciences, Potsdam, Germany;2016-11-30;2011-05-10T09:32:18/2011-05-10T11:07:26;2011-06-27T08:35:23/2011-06-27T10:16:44;2012-05-24T09:06:57/2012-05-24T11:12:03;eng;Dataset;10.2312/enmap.2017.002;10.3390/rs70708830;10.3390/rs8110927;10.3390/rs71012737;10.1080/01431161.2015.1084438;http://www.enmap.org/?q=flights;CC BY-SA 4.0;The dataset is composed of hyperspectral imagery acquired during airplane overflights on May 10th, 2011, June 27th, 2011 and May 24th, 2012 consisting of 367 and 368 spectral bands, respective-ly, ranging from VIS to SWIR (400 - 2500 nm) wavelength regions. The hyperspectral image data was acquired in the framework of the  EnMAP preparation project HyLand (Hyperspectral remote sensing for the assessment of crop and soil parameters in precision farming and yield estimation). Within the project, innovative techniques were developed to derive crop and soil parameters from hyper-spectral remote sensing and terrestrial laser scanning data, which served as input parameters for novel yield estimation models. ;The Environmental Mapping and Analysis Program (EnMAP) is a German hyperspectral satellite mission that aims at monitoring and characterizing the Earth\u2019s environment on a global scale. EnMAP serves to measure and model key dynamic processes of the Earth\u2019s ecosystems by extract-ing geochemical, biochemical and biophysical parameters, which provide information on the status and evolution of various terrestrial and aquatic ecosystems. In the frame of the EnMAP preparatory phase, pre-flight campaigns including airborne and in-situ measurements in different environments and for several application fields are being conducted. The main purpose of these campaigns is to support the development of scientific applications for EnMAP. In addition, the acquired data are input in the EnMAP end-to-end simulation tool (EeteS) and are employed to test data pre-processing and calibration-validation methods. The campaign data are made freely available to the scientific community under a Creative Commons Attribution-ShareAlike 4.0 International License. An overview of all available data is provided in in the EnMAP Flight Campaigns Metadata Portal (http://www.enmap.org/?q=flightbeta).\n;51.77  11.87 51.82 11.97;Campaign 1, K\u00f6then;51.77 11.87 51.82 11.97;Campaign 2, K\u00f6then;51.77 11.84 51.88 11.94;Campaign 3, K\u00f6then",
    "group": "enmap",
    "groups": [
        {
            "name": "enmap"
        }
    ],
    "name": "c1641ba0-df5e-5da3-8462-fd232808fd8a",
    "notes": [
        "The dataset is composed of hyperspectral imagery acquired during airplane overflights on May 10th, 2011, June 27th, 2011 and May 24th, 2012 consisting of 367 and 368 spectral bands, respective-ly, ranging from VIS to SWIR (400 - 2500 nm) wavelength regions. The hyperspectral image data was acquired in the framework of the  EnMAP preparation project HyLand (Hyperspectral remote sensing for the assessment of crop and soil parameters in precision farming and yield estimation). Within the project, innovative techniques were developed to derive crop and soil parameters from hyper-spectral remote sensing and terrestrial laser scanning data, which served as input parameters for novel yield estimation models. ",
        "The Environmental Mapping and Analysis Program (EnMAP) is a German hyperspectral satellite mission that aims at monitoring and characterizing the Earth\u2019s environment on a global scale. EnMAP serves to measure and model key dynamic processes of the Earth\u2019s ecosystems by extract-ing geochemical, biochemical and biophysical parameters, which provide information on the status and evolution of various terrestrial and aquatic ecosystems. In the frame of the EnMAP preparatory phase, pre-flight campaigns including airborne and in-situ measurements in different environments and for several application fields are being conducted. The main purpose of these campaigns is to support the development of scientific applications for EnMAP. In addition, the acquired data are input in the EnMAP end-to-end simulation tool (EeteS) and are employed to test data pre-processing and calibration-validation methods. The campaign data are made freely available to the scientific community under a Creative Commons Attribution-ShareAlike 4.0 International License. An overview of all available data is provided in in the EnMAP Flight Campaigns Metadata Portal (http://www.enmap.org/?q=flightbeta).\n"
    ],
    "oai_identifier": [
        "oai:doidb.wdc-terra.org:6284"
    ],
    "oai_set": [
        "DOIDB",
        "DOIDB.ENMAP"
    ],
    "state": "active",
    "tags": [
        {
            "name": "Imaging Spectroscopy"
        },
        {
            "name": "Precision Farming"
        },
        {
            "name": "Yield Estimation"
        }
    ],
    "title": [
        "K\u00f6then 2011/ 2012 - An EnMAP Preparatory Flight Campaign"
    ],
    "url": ""
}