{
    "Contact": [
        "Foerster, Saskia"
    ],
    "Contributor": [
        "EUFAR Transnational Access",
        "BMWi"
    ],
    "DOI": "http://dx.doi.org/doi:10.5880/enmap.2015.007",
    "DiscHierarchy": [
        "4.4.6",
        "Geosciences",
        "Earth System Research"
    ],
    "Discipline": "Earth System Research",
    "Language": [
        "English"
    ],
    "MetaDataAccess": "http://doidb.wdc-terra.org/oaip/oai?verb=GetRecord&metadataPrefix=oai_datacite&identifier=oai:doidb.wdc-terra.org:6150",
    "MetadataAccess": [
        "oai:doidb.wdc-terra.org:6150"
    ],
    "PublicationTimestamp": "2015-07-01T11:59:59Z",
    "PublicationYear": [
        "2015"
    ],
    "Publisher": [
        "GFZ Data Services"
    ],
    "ResourceType": [
        "Dataset"
    ],
    "Rights": [
        "CC BY-SA 4.0"
    ],
    "SpatialCoverage": [
        "42.4379 0.4789 42.2710 0.5800",
        "42.4361 0.4719 42.2716 0.5737",
        "42.4361 0.4719 42.2716 0.5737",
        "42.4379 0.4789 42.2710 0.5800",
        "42.4361 0.4719 42.2716 0.5737"
    ],
    "TemporalCoverage": [
        "2015-04",
        "2011-04-02",
        "2011-08-09",
        "2011-08-09",
        "2011-04",
        "2011-08"
    ],
    "author": [
        "Foerster, Saskia",
        "Brosinsky, Arlena",
        "Wilczok, Charlotte",
        "Bauer, Marcus"
    ],
    "fulltext": "oai:doidb.wdc-terra.org:6150;2016-11-25T13:58:04Z;DOIDB;DOIDB.ENMAP;false;3;DOIDB.ENMAP;10.5880/enmap.2015.007;Foerster, Saskia;0000-0001-7752-7394;GFZ German Research Centre for Geosciences;Brosinsky, Arlena;GFZ German Research Centre for Geosciences;Wilczok, Charlotte;GFZ German Research Centre for Geosciences;Bauer, Marcus;University of Potsdam;Is\u00e1bena 2011 - An EnMAP Preparatory Flight Campaign (Datasets);GFZ Data Services;2015;Imaging Spectroscopy;Airborne Laserscanning;Mediterranean drylands;Ground fractional cover;Foerster, Saskia;0000-0001-7752-7394;GFZ German Research Centre for Geosciences;Foerster, Saskia;0000-0001-7752-7394;GFZ German Research Centre for Geosciences;Foerster, Saskia;0000-0001-7752-7394;GFZ German Research Centre for Geosciences;Brosinsky, Arlena;GFZ German Research Centre for Geosciences;Brosinsky, Arlena;GFZ German Research Centre for Geosciences;Wilczok, Charlotte;GFZ German Research Centre for Geosciences;Wilczok, Charlotte;GFZ German Research Centre for Geosciences;Bauer, Marcus;University of Potsdam;Bauer, Marcus;University of Potsdam;Bauer, Marcus;University of Potsdam;Bauer, Marcus;University of Potsdam;BMWi;Federal Ministry of Economics and Technology;EUFAR Transnational Access;EUFAR Transnational Access;Klinke, Randolf;GFZ German Research Centre for Geosciences;H\u00f6rhold, Simon;University of Potsdam;Lindenthal, Elfrun;University of Potsdam;Elger, Kirsten;0000-0001-5140-8602;GFZ German Research Centre for Geosciences;Brauer, Arne;University of Potsdam;2015-04;2011-04-02;2011-08-09;2011-08-09;2011-04;2011-08;eng;Dataset;10.3390/rs70708830;10.2312/enmap.2015.007;10.1007/s11368-014-0992-3;http://www.enmap.org/?q=flights;CC BY-SA 4.0;The dataset is composed of a) hyperspectral imagery acquired with AISA Eagle and Hawk imaging spectrometer data in the range 400 to 2500 nm on April 2 and August 9, 2011, with a ground sampling distance of 4 m in 12 and 15 flight lines, respectively; b) airborne LiDAR data acquired in single-pulse mode in August 2011 concurrent with hyperspectral data acquisition with an avarage point density of 0.7 hits per meter squared; c) spectral reference measurements acquired with a portable ASD field spectroradiometer around the days of image acquisitions d) fractional cover of green vegetation, dry vegetation, bare soil and rock were visually estimated for 60 (April) and 53 (August) transects of 20-m length. The overall goal of the study was to investigate the potential of hyperspectral and LiDAR data for assessing sediment connectivity at the hillslope to subcatchment scale. For that the fractional cover of green vegetation, dry vegetation, bare soil and rock was derived\nby applying a multiple endmember spectral mixture analysis approach to the hyperspectral image data. The LiDAR point clouds were pre-processed to generate a digital elevation map as well as a vegetation height map, both with 4-m spatial resolution.;The Environmental Mapping and Analysis Program (EnMAP) is a German hyperspectral satellite mission that aims at monitoring and characterizing the Earth\u2019s environment on a global scale. EnMAP serves to measure and model key dynamic processes of the Earth\u2019s ecosystems by extracting geochemical, biochemical and biophysical parameters, which provide information on the status and evolution of various terrestrial and aquatic ecosystems. In the frame of the EnMAP preparatory phase, pre-flight campaigns including airborne and in-situ measurements in different environments and for several application fields are being conducted. The main purpose of these campaigns is to support the development of scientific applications for EnMAP. In addition, the acquired data are input in the EnMAP end-to-end simulation tool (EeteS) and are employed to test data pre-processing and calibration-validation methods. The campaign data are made freely available to the scientific community under a Creative Commons Attribution-ShareAlike 4.0 International License. An overview of all available data is provided in in the EnMAP Flight Campaigns Metadata Portal http://www.enmap.org/?q=flights.;42.4379 0.4789 42.2710 0.5800;AISA Eagle and Hawk, Isabena, Spain;42.4361 0.4719 42.2716 0.5737;AISA Eagle and Hawk, Isabena, Spain;42.4361 0.4719 42.2716 0.5737;Airborne LiDAR, Isabena, Spain;42.4379 0.4789 42.2710 0.5800;Ground fractional cover in-situ estimation April, Isabena, Spain;42.4361 0.4719 42.2716 0.5737;Ground fractional cover in-situ estimation August, Isabena, Spain",
    "group": "enmap",
    "groups": [
        {
            "name": "enmap"
        }
    ],
    "name": "ea3f2c5f-839a-50d2-afb9-dd91d0092860",
    "notes": [
        "The dataset is composed of a) hyperspectral imagery acquired with AISA Eagle and Hawk imaging spectrometer data in the range 400 to 2500 nm on April 2 and August 9, 2011, with a ground sampling distance of 4 m in 12 and 15 flight lines, respectively; b) airborne LiDAR data acquired in single-pulse mode in August 2011 concurrent with hyperspectral data acquisition with an avarage point density of 0.7 hits per meter squared; c) spectral reference measurements acquired with a portable ASD field spectroradiometer around the days of image acquisitions d) fractional cover of green vegetation, dry vegetation, bare soil and rock were visually estimated for 60 (April) and 53 (August) transects of 20-m length. The overall goal of the study was to investigate the potential of hyperspectral and LiDAR data for assessing sediment connectivity at the hillslope to subcatchment scale. For that the fractional cover of green vegetation, dry vegetation, bare soil and rock was derived\nby applying a multiple endmember spectral mixture analysis approach to the hyperspectral image data. The LiDAR point clouds were pre-processed to generate a digital elevation map as well as a vegetation height map, both with 4-m spatial resolution.",
        "The Environmental Mapping and Analysis Program (EnMAP) is a German hyperspectral satellite mission that aims at monitoring and characterizing the Earth\u2019s environment on a global scale. EnMAP serves to measure and model key dynamic processes of the Earth\u2019s ecosystems by extracting geochemical, biochemical and biophysical parameters, which provide information on the status and evolution of various terrestrial and aquatic ecosystems. In the frame of the EnMAP preparatory phase, pre-flight campaigns including airborne and in-situ measurements in different environments and for several application fields are being conducted. The main purpose of these campaigns is to support the development of scientific applications for EnMAP. In addition, the acquired data are input in the EnMAP end-to-end simulation tool (EeteS) and are employed to test data pre-processing and calibration-validation methods. The campaign data are made freely available to the scientific community under a Creative Commons Attribution-ShareAlike 4.0 International License. An overview of all available data is provided in in the EnMAP Flight Campaigns Metadata Portal http://www.enmap.org/?q=flights."
    ],
    "oai_identifier": [
        "oai:doidb.wdc-terra.org:6150"
    ],
    "oai_set": [
        "DOIDB",
        "DOIDB.ENMAP"
    ],
    "state": "active",
    "tags": [
        {
            "name": "Imaging Spectroscopy"
        },
        {
            "name": "Airborne Laserscanning"
        },
        {
            "name": "Mediterranean drylands"
        },
        {
            "name": "Ground fractional cover"
        }
    ],
    "title": [
        "Is\u00e1bena 2011 - An EnMAP Preparatory Flight Campaign (Datasets)"
    ],
    "url": ""
}