{
    "Contact": [
        "Dirk Nikolaus Karger"
    ],
    "Contributor": [
        "EnviDat"
    ],
    "DOI": "http://dx.doi.org/doi:10.5061/dryad.kd1d4",
    "DiscHierarchy": [
        "4.4.7",
        "Geosciences",
        "Environmental Research"
    ],
    "Discipline": "Environmental Research",
    "Language": [
        "English"
    ],
    "MetaDataAccess": "https://www.envidat.ch/oai?verb=GetRecord&metadataPrefix=datacite&identifier=oai:envidat.ch:2adb0c83-4653-4337-af28-f75c63ab7c74",
    "MetadataAccess": [
        "oai:envidat.ch:2adb0c83-4653-4337-af28-f75c63ab7c74"
    ],
    "PublicationTimestamp": "2017-07-01T11:59:59Z",
    "PublicationYear": [
        "2017"
    ],
    "Publisher": [
        "Dryad Digital Repository"
    ],
    "RelatedIdentifier": [
        "https://www.envidat.ch/dataset/chelsa-climatologies"
    ],
    "ResourceType": [
        "Dataset"
    ],
    "Rights": [
        "Other (Open)"
    ],
    "SpatialCoverage": "(90S-90N,180W-180E)",
    "TempCoverageBegin": 63636231599,
    "TempCoverageEnd": 63636231599,
    "TemporalCoverage": " point in time : 2017-07-21T11:59:59Z",
    "TemporalCoverage:BeginDate": "2017-07-21T11:59:59Z",
    "TemporalCoverage:EndDate": "2017-07-21T11:59:59Z",
    "author": [
        "Dirk Nikolaus Karger",
        "J\u00fcrgen B\u00f6hner",
        "Tobias Kawohl",
        "Rodrigo Wilber Soria-Auza",
        "H. Peter Linder",
        "Olaf Conrad",
        "Niklaus E. Zimmermann",
        "Michael Kessler",
        "Holger Kreft"
    ],
    "fulltext": "oai:envidat.ch:2adb0c83-4653-4337-af28-f75c63ab7c74;2018-12-09T00:23:51Z;10.5061/dryad.kd1d4;Dirk Nikolaus Karger;WSL;Olaf Conrad;University of Hamburg;J\u00fcrgen B\u00f6hner;University of Hamburg;Tobias Kawohl;University of Hamburg;Holger Kreft;University of Goettingen;Rodrigo Wilber Soria-Auza;Rodrigo Wilber Soria-Auza;Niklaus E. Zimmermann;WSL;H. Peter Linder;University of Zurich;Michael Kessler;University of Zurich;Climatologies at high resolution for the earth\u2019s land surface areas;2017;Dryad Digital Repository;BIOCLIM;CLIMATE;CLIMATE CHANGE;CLIMATE LAYERS;CLIMATOLOGY;FREE CLIMATE DATA;PRECIPITATION;TEMPERATURE;Dirk Nikolaus Karger;WSL;2017-07-21;en;Dataset;https://www.envidat.ch/dataset/chelsa-climatologies;1.2;Other (Open);High-resolution information on climatic conditions is essential to many applications in environmental and ecological sciences. Here we present the CHELSA (Climatologies at high resolution for the earth\u2019s land surface areas) data of downscaled model output temperature and precipitation estimates of the ERA-Interim climatic reanalysis to a high resolution of 30\u2009arc\u2009sec. The temperature algorithm is based on statistical downscaling of atmospheric temperatures. The precipitation algorithm incorporates orographic predictors including wind fields, valley exposition, and boundary layer height, with a subsequent bias correction. The resulting data consist of a monthly temperature and precipitation climatology for the years 1979\u20132013. We compare the data derived from the CHELSA algorithm with other standard gridded products and station data from the Global Historical Climate Network. We compare the performance of the new climatologies in species distribution modelling and show that we can increase the accuracy of species range predictions. We further show that CHELSA climatological data has a similar accuracy as other products for temperature, but that its predictions of precipitation patterns are better.\n\nData Variable Codes:\n\n- Bio1 = Annual Mean Temperature\n- Bio2 = Mean Diurnal Range\n- Bio3 = Isothermality\n- Bio4 = Temperature Seasonality\n- Bio5 = Max Temperature of Warmest Month\n- Bio6 = Min Temperature of Coldest Month\n- Bio7 = Temperature Annual Range\n- Bio8 = Mean Temperature of Wettest Quarter\n- Bio9 = Mean Temperature of Driest Quarter\n- Bio10 = Mean Temperature of Warmest Quarter\n- Bio11 = Mean Temperature of Coldest Quarter\n- Bio12 = Annual Precipitation\n- Bio13 = Precipitation of Wettest Month\n- Bio14 = Precipitation of Driest Month\n- Bio15 = Precipitation Seasonality\n- Bio16 = Precipitation of Wettest Quarter\n- Bio17 = Precipitation of Driest Quarter\n- Bio18 = Precipitation of Warmest Quarter\n- Bio19 = Precipitation of Coldest Quarter\n\n&nbsp;\n__Paper Citation:__\n > _Karger DN. et al. Climatologies at high resolution for the earth\u2019s land surface areas, Scientific Data, 4, 170122 (2017)  [doi: 10.1038/sdata.2017.122](https://doi.org/10.1038/sdata.2017.122)._;-90.0 -180.0 90.0 180.0;global",
    "group": "envidat",
    "groups": [
        {
            "name": "envidat"
        }
    ],
    "name": "1044c699-0fb6-5da9-aaca-edd719d9b463",
    "notes": [
        "High-resolution information on climatic conditions is essential to many applications in environmental and ecological sciences. Here we present the CHELSA (Climatologies at high resolution for the earth\u2019s land surface areas) data of downscaled model output temperature and precipitation estimates of the ERA-Interim climatic reanalysis to a high resolution of 30\u2009arc\u2009sec. The temperature algorithm is based on statistical downscaling of atmospheric temperatures. The precipitation algorithm incorporates orographic predictors including wind fields, valley exposition, and boundary layer height, with a subsequent bias correction. The resulting data consist of a monthly temperature and precipitation climatology for the years 1979\u20132013. We compare the data derived from the CHELSA algorithm with other standard gridded products and station data from the Global Historical Climate Network. We compare the performance of the new climatologies in species distribution modelling and show that we can increase the accuracy of species range predictions. We further show that CHELSA climatological data has a similar accuracy as other products for temperature, but that its predictions of precipitation patterns are better.\n\nData Variable Codes:\n\n- Bio1 = Annual Mean Temperature\n- Bio2 = Mean Diurnal Range\n- Bio3 = Isothermality\n- Bio4 = Temperature Seasonality\n- Bio5 = Max Temperature of Warmest Month\n- Bio6 = Min Temperature of Coldest Month\n- Bio7 = Temperature Annual Range\n- Bio8 = Mean Temperature of Wettest Quarter\n- Bio9 = Mean Temperature of Driest Quarter\n- Bio10 = Mean Temperature of Warmest Quarter\n- Bio11 = Mean Temperature of Coldest Quarter\n- Bio12 = Annual Precipitation\n- Bio13 = Precipitation of Wettest Month\n- Bio14 = Precipitation of Driest Month\n- Bio15 = Precipitation Seasonality\n- Bio16 = Precipitation of Wettest Quarter\n- Bio17 = Precipitation of Driest Quarter\n- Bio18 = Precipitation of Warmest Quarter\n- Bio19 = Precipitation of Coldest Quarter\n\n&nbsp;\n__Paper Citation:__\n > _Karger DN. et al. Climatologies at high resolution for the earth\u2019s land surface areas, Scientific Data, 4, 170122 (2017)  [doi: 10.1038/sdata.2017.122](https://doi.org/10.1038/sdata.2017.122)._"
    ],
    "oai_identifier": [
        "oai:envidat.ch:2adb0c83-4653-4337-af28-f75c63ab7c74"
    ],
    "oai_set": "",
    "spatial": "{\"type\":\"Polygon\",\"coordinates\":[[[-180.0,-90.0],[-180.0,90.0],[180.0,90.0],[180.0,-90.0],[-180.0,-90.0]]]}",
    "state": "active",
    "tags": [
        {
            "name": "BIOCLIM"
        },
        {
            "name": "CLIMATE"
        },
        {
            "name": "CLIMATE CHANGE"
        },
        {
            "name": "CLIMATE LAYERS"
        },
        {
            "name": "CLIMATOLOGY"
        },
        {
            "name": "FREE CLIMATE DATA"
        },
        {
            "name": "PRECIPITATION"
        },
        {
            "name": "TEMPERATURE"
        }
    ],
    "title": [
        "Climatologies at high resolution for the earth\u2019s land surface areas"
    ],
    "url": ""
}