{
    "Contact": [
        "Vanessa Burg"
    ],
    "Contributor": [
        "EnviDat"
    ],
    "DOI": "http://dx.doi.org/doi:10.16904/18",
    "DiscHierarchy": [
        "4.4.7",
        "Geosciences",
        "Environmental Research"
    ],
    "Discipline": "Environmental Research",
    "Format": [
        "XLSX",
        "DOCX"
    ],
    "Language": [
        "English"
    ],
    "MetaDataAccess": "https://www.envidat.ch/oai?verb=GetRecord&metadataPrefix=datacite&identifier=oai:envidat.ch:21599a72-b714-4d11-a748-644d0016fae9",
    "MetadataAccess": [
        "oai:envidat.ch:21599a72-b714-4d11-a748-644d0016fae9"
    ],
    "PublicationTimestamp": "2017-07-01T11:59:59Z",
    "PublicationYear": [
        "2017"
    ],
    "Publisher": [
        "Swiss Federal Institute for Forest, Snow and Landscape Research WSL / Swiss Competence Center for Energy Research - Biomass for Swiss Energy Transition SCCER-BIOSWEET"
    ],
    "RelatedIdentifier": [
        "https://www.envidat.ch/dataset/swiss-biomass-potentials"
    ],
    "ResourceType": [
        "Dataset"
    ],
    "Rights": [
        "License not specified"
    ],
    "SpatialCoverage": "(46N-48N,6 E-10E)",
    "TempCoverageBegin": 63679694399,
    "TempCoverageEnd": 63679694399,
    "TemporalCoverage": " point in time : 2018-12-06T11:59:59Z",
    "TemporalCoverage:BeginDate": "2018-12-06T11:59:59Z",
    "TemporalCoverage:EndDate": "2018-12-06T11:59:59Z",
    "author": [
        "Gillianne Bowman",
        "Matthias Erni",
        "Oliver Thees",
        "Renato Lemm",
        "Vanessa Burg"
    ],
    "fulltext": "oai:envidat.ch:21599a72-b714-4d11-a748-644d0016fae9;2018-12-09T00:33:15Z;10.16904/18;Oliver Thees;WSL;Vanessa Burg;WSL;Matthias Erni;WSL;Gillianne Bowman;WSL;Renato Lemm;WSL;Potentials of domestic biomass resources for the energy transition in Switzerland;2017;Swiss Federal Institute for Forest, Snow and Landscape Research WSL / Swiss Competence Center for Energy Research - Biomass for Swiss Energy Transition SCCER-BIOSWEET;AVAILABILITY;BIOENERGY;BIOMASS RESOURCES;POTENTIAL ASSESSMENT;SUSTAINABILITY;Vanessa Burg;WSL;2018-12-06;en;Dataset;https://www.envidat.ch/dataset/swiss-biomass-potentials;10164033 bytes;138287 bytes;194315 bytes;XLSX;DOCX;1.0;License not specified;Switzerland has a reliable and cost efficient energy system. Due to phase  out of nuclear energy it is necessary to find new options to maintain this powerful energy system. The Swiss energy strategy 2050 aims to reduce CO2-emissions, increase efficiency and promote renewable energies. The Swiss Federal Institute for Forest, Snow and Landscape Research (WSL) examined relevant woody and non-woody biomass quantities (cubic meters, fresh-, dry weight) and their energy potentials (in Petajoules: primary energy and biomethane) with a similar methodological approach. The work was done within the frame of the Swiss Competence Centers for Energy Research (SCCER) especially in line with the SCCER Biomass for Swiss energy future (Biosweet). With a uniform and consistent approach for the current potentials ten biomass categories were estimated and aggregated for the whole of Switzerland. In this context solutions for the technical, social and political challenges are promoted. First, considering the different biomass resources characteristics and available data, appropriate methods at the finest scale possible were elaborated to estimate the annual quantities which could theoretically be collected (theoretical potential). Then, explicit and rational restrictions for sustainable bio-energy production were defined according to the current state of the art and subtracted from the theoretical potential to obtain the sustainable potential. The main restrictions are competing material utilizations, environmental factors and supply costs. Finally, the additional sustainable potential was estimated considering the current bioenergy production. Our main purpose was to provide potentials for developing conversion technologies as well as a detailed and comprehensive basis of the Swiss biomass potentials for energy use for economic and political decision makers. The complete report is available under https://www.dora.lib4ri.ch/wsl/islandora/object/wsl%3A13277/datastream/PDF/view;45.81802 5.95587 47.80838 10.49203;Switzerland",
    "group": "envidat",
    "groups": [
        {
            "name": "envidat"
        }
    ],
    "name": "10cd77be-9305-5b29-890d-bcdf60c3309a",
    "notes": [
        "Switzerland has a reliable and cost efficient energy system. Due to phase  out of nuclear energy it is necessary to find new options to maintain this powerful energy system. The Swiss energy strategy 2050 aims to reduce CO2-emissions, increase efficiency and promote renewable energies. The Swiss Federal Institute for Forest, Snow and Landscape Research (WSL) examined relevant woody and non-woody biomass quantities (cubic meters, fresh-, dry weight) and their energy potentials (in Petajoules: primary energy and biomethane) with a similar methodological approach. The work was done within the frame of the Swiss Competence Centers for Energy Research (SCCER) especially in line with the SCCER Biomass for Swiss energy future (Biosweet). With a uniform and consistent approach for the current potentials ten biomass categories were estimated and aggregated for the whole of Switzerland. In this context solutions for the technical, social and political challenges are promoted. First, considering the different biomass resources characteristics and available data, appropriate methods at the finest scale possible were elaborated to estimate the annual quantities which could theoretically be collected (theoretical potential). Then, explicit and rational restrictions for sustainable bio-energy production were defined according to the current state of the art and subtracted from the theoretical potential to obtain the sustainable potential. The main restrictions are competing material utilizations, environmental factors and supply costs. Finally, the additional sustainable potential was estimated considering the current bioenergy production. Our main purpose was to provide potentials for developing conversion technologies as well as a detailed and comprehensive basis of the Swiss biomass potentials for energy use for economic and political decision makers. The complete report is available under https://www.dora.lib4ri.ch/wsl/islandora/object/wsl%3A13277/datastream/PDF/view"
    ],
    "oai_identifier": [
        "oai:envidat.ch:21599a72-b714-4d11-a748-644d0016fae9"
    ],
    "oai_set": "",
    "spatial": "{\"type\":\"Polygon\",\"coordinates\":[[[5.95587,45.81802],[5.95587,47.80838],[10.49203,47.80838],[10.49203,45.81802],[5.95587,45.81802]]]}",
    "state": "active",
    "tags": [
        {
            "name": "AVAILABILITY"
        },
        {
            "name": "BIOENERGY"
        },
        {
            "name": "BIOMASS RESOURCES"
        },
        {
            "name": "POTENTIAL ASSESSMENT"
        },
        {
            "name": "SUSTAINABILITY"
        }
    ],
    "title": [
        "Potentials of domestic biomass resources for the energy transition in Switzerland"
    ],
    "url": ""
}