{
    "Contact": [
        "Christian Sommer"
    ],
    "Contributor": [
        "EnviDat"
    ],
    "DOI": "http://dx.doi.org/doi:10.16904/21",
    "DiscHierarchy": [
        "4.4.7",
        "Geosciences",
        "Environmental Research"
    ],
    "Discipline": "Environmental Research",
    "Format": [
        "TXT",
        "Link",
        "ZIP"
    ],
    "Language": [
        "English"
    ],
    "MetaDataAccess": "https://www.envidat.ch/oai?verb=GetRecord&metadataPrefix=datacite&identifier=oai:envidat.ch:9918d77c-3176-453f-b34c-062ba979144a",
    "MetadataAccess": [
        "oai:envidat.ch:9918d77c-3176-453f-b34c-062ba979144a"
    ],
    "PublicationTimestamp": "2017-07-01T11:59:59Z",
    "PublicationYear": [
        "2017"
    ],
    "Publisher": [
        "WSL Institute for Snow and Avalanche Research SLF, Davos, Switzerland"
    ],
    "RelatedIdentifier": [
        "https://www.envidat.ch/dataset/10-16904-21"
    ],
    "ResourceType": [
        "Dataset"
    ],
    "Rights": [
        "Open Data Commons Open Database License (ODbL)"
    ],
    "SpatialCoverage": "(47N,10E)",
    "TempCoverageBegin": 63679694399,
    "TempCoverageEnd": 63679694399,
    "TemporalCoverage": " point in time : 2018-12-06T11:59:59Z",
    "TemporalCoverage:BeginDate": "2018-12-06T11:59:59Z",
    "TemporalCoverage:EndDate": "2018-12-06T11:59:59Z",
    "author": [
        "Charles Fierz",
        "Michael Lehning",
        "Christian G. Sommer"
    ],
    "fulltext": "oai:envidat.ch:9918d77c-3176-453f-b34c-062ba979144a;2018-12-09T00:31:05Z;10.16904/21;Christian G. Sommer;WSL Institute for Snow and Avalanche Research SLF, Davos, Switzerland and CRYOS, School of Architecture and Civil Engineering, \u00c9cole Polytechnique F\u00e9d\u00e9rale de Lausanne, Lausanne, Switzerland;Michael Lehning;WSL Institute for Snow and Avalanche Research SLF, Davos, Switzerland and CRYOS, School of Architecture and Civil Engineering, \u00c9cole Polytechnique F\u00e9d\u00e9rale de Lausanne, Lausanne, Switzerland;Charles Fierz;WSL Institute for Snow and Avalanche Research SLF, Davos, Switzerland;Wind crust formation: SnowMicroPen data;2017;WSL Institute for Snow and Avalanche Research SLF, Davos, Switzerland;SMP;SNOW;SNOWMICROPEN;WIND CRUST;WIND-PACKING;Christian Sommer;WSL Institute for Snow and Avalanche Research SLF, Davos, Switzerland and CRYOS, School of Architecture and Civil Engineering, \u00c9cole Polytechnique F\u00e9d\u00e9rale de Lausanne, Lausanne, Switzerland;2018-12-06;en;Dataset;https://www.envidat.ch/dataset/10-16904-21;2701 bytes;12976 bytes;Link;TXT;ZIP;1.0;Open Data Commons Open Database License (ODbL);This dataset contains the SnowMicroPen (SMP) data from 38 wind tunnel experiments on wind-packing / wind crust formation. These experiments were performed in the winters 2015/16 and 2016/17 and include more than 1000 SMP measurements. \n\nThe SMPs are organized per experiment. Each experiment subfolder contains the processed SMP profiles and some additional files.\n\nPlease refer to the README for more details on the data. The processing scripts are available for download as well. The scripts are mainly provided as documentation and would need to be adjusted to be used.\n\nThis dataset is the basis of the following publication:\n\nSommer C.G., Lehning M., & Fierz C. (2017). Wind tunnel experiments: Saltation is necessary for wind-packing. Journal of Glaciology, 63(242), 950-958. doi:10.1017/jog.2017.53;46.80798 9.86752;Davos, Switzerland",
    "group": "envidat",
    "groups": [
        {
            "name": "envidat"
        }
    ],
    "name": "1187844d-f582-5576-bf58-81f02fa0aae7",
    "notes": [
        "This dataset contains the SnowMicroPen (SMP) data from 38 wind tunnel experiments on wind-packing / wind crust formation. These experiments were performed in the winters 2015/16 and 2016/17 and include more than 1000 SMP measurements. \n\nThe SMPs are organized per experiment. Each experiment subfolder contains the processed SMP profiles and some additional files.\n\nPlease refer to the README for more details on the data. The processing scripts are available for download as well. The scripts are mainly provided as documentation and would need to be adjusted to be used.\n\nThis dataset is the basis of the following publication:\n\nSommer C.G., Lehning M., & Fierz C. (2017). Wind tunnel experiments: Saltation is necessary for wind-packing. Journal of Glaciology, 63(242), 950-958. doi:10.1017/jog.2017.53"
    ],
    "oai_identifier": [
        "oai:envidat.ch:9918d77c-3176-453f-b34c-062ba979144a"
    ],
    "oai_set": "",
    "spatial": "{\"type\":\"Polygon\",\"coordinates\":[[[9.86752,46.80798],[9.86752,46.80798],[9.86752,46.80798],[9.86752,46.80798],[9.86752,46.80798]]]}",
    "state": "active",
    "tags": [
        {
            "name": "SMP"
        },
        {
            "name": "SNOW"
        },
        {
            "name": "SNOWMICROPEN"
        },
        {
            "name": "WIND CRUST"
        },
        {
            "name": "WIND-PACKING"
        }
    ],
    "title": [
        "Wind crust formation: SnowMicroPen data"
    ],
    "url": ""
}