{
    "Contact": [
        "Nander Wever"
    ],
    "Contributor": [
        "EnviDat"
    ],
    "DOI": "http://dx.doi.org/doi:10.16904/17",
    "DiscHierarchy": [
        "4.4.7",
        "Geosciences",
        "Environmental Research"
    ],
    "Discipline": "Environmental Research",
    "Language": [
        "English"
    ],
    "MetaDataAccess": "https://www.envidat.ch/oai?verb=GetRecord&metadataPrefix=datacite&identifier=oai:envidat.ch:df20d940-9653-4578-a32a-2d2ea7a1b347",
    "MetadataAccess": [
        "oai:envidat.ch:df20d940-9653-4578-a32a-2d2ea7a1b347"
    ],
    "PublicationTimestamp": "2017-07-01T11:59:59Z",
    "PublicationYear": [
        "2017"
    ],
    "Publisher": [
        "SLF"
    ],
    "RelatedIdentifier": [
        "https://www.envidat.ch/dataset/soil-moisture-measurements-davos"
    ],
    "ResourceType": [
        "Dataset"
    ],
    "Rights": [
        "Open Data Commons Open Database License (ODbL)"
    ],
    "SpatialCoverage": [
        "46.7968286797 9.8297824141",
        "46.8038436988 9.8940537806",
        "46.7717421009 9.8666676384",
        "46.8084926987 9.9034282695",
        "46.7315544045 9.914150411",
        "46.7897142035 9.8645693083",
        "46.812365 9.847212"
    ],
    "TempCoverageBegin": 63421527599,
    "TempCoverageEnd": 63421527599,
    "TemporalCoverage": " point in time : 2010-10-01T11:59:59Z",
    "TemporalCoverage:BeginDate": "2010-10-01T11:59:59Z",
    "TemporalCoverage:EndDate": "2010-10-01T11:59:59Z",
    "author": [
        "Nander Wever"
    ],
    "fulltext": "oai:envidat.ch:df20d940-9653-4578-a32a-2d2ea7a1b347;2018-12-09T00:24:13Z;10.16904/17;Nander Wever;SLF;IRKIS Soil moisture measurements Davos;2017;SLF;METEO STATION;SOIL MOISTURE;Nander Wever;SLF;2010-10-01;en;Dataset;https://www.envidat.ch/dataset/soil-moisture-measurements-davos;1.0;Open Data Commons Open Database License (ODbL);Meteorological and soil moisture measurements from soil moisture stations installed from October 2010 - October 2013 in the area surrounding Davos, in particular in the Dischma catchment.\n\nThere are in total 7 stations: 1202, 1203, 1204, 1205, 222, 333 and SLF2. For each of the stations, there is a:\n\n* vwc_[stn].smet: containing the soil moisture measurements\n\n* station_[stn].smet: in-situ measured meteorlogical parameters. Note, the quality of these measurements for stations 1202, 1203, 1204 and 1205 is very low, with data gaps. Use this data with care. For stations 222, 333 and SLF2, data quality is high and only the default cautiousness should be applied.\n\n* interpolatedmeteo_[stn].smet contains per stations a dataset derived by interpolating from several stations in the Davos area to the stations location. This dataset was generated from the output of the Alpine3D model, of which simulations are presented in the Wever et al. (2017) manuscript.\n\nAt the soil moisture measurement sites, Decagon 10HS sensors were installed, at 10, 30, 50, 80 and 120 cm depth. Per depth 2 sensors were installed, labelled A and B in the datafiles. Note that at stations 1203, 1204 and 1205, sensors were only installed at 10, 30 and 50 cm depth.\n\nThe files follow the SMET format: https://models.slf.ch/docserver/meteoio/SMET_specifications.pdf and metadata for the stations can be found in the header of the smet files.\n\nPlease cite the Wever et al. (2017) reference when using this data in publications.\n\nFor a more detailed description, please refer to: Wever, N., Comola, F., Bavay, M., and Lehning, M.: Simulating the influence of snow surface processes on soil moisture dynamics and streamflow generation in an alpine catchment, Hydrol. Earth Syst. Sci., 21, 4053-4071, https://doi.org/10.5194/hess-21-4053-2017, 2017.;46.7968286797 9.8297824141;46.8038436988 9.8940537806;46.7717421009 9.8666676384;46.8084926987 9.9034282695;46.7315544045 9.914150411;46.7897142035 9.8645693083;46.812365 9.847212;Davos, Switzerland",
    "group": "envidat",
    "groups": [
        {
            "name": "envidat"
        }
    ],
    "name": "51645b01-dfc8-5b48-8725-a32745e5dec1",
    "notes": [
        "Meteorological and soil moisture measurements from soil moisture stations installed from October 2010 - October 2013 in the area surrounding Davos, in particular in the Dischma catchment.\n\nThere are in total 7 stations: 1202, 1203, 1204, 1205, 222, 333 and SLF2. For each of the stations, there is a:\n\n* vwc_[stn].smet: containing the soil moisture measurements\n\n* station_[stn].smet: in-situ measured meteorlogical parameters. Note, the quality of these measurements for stations 1202, 1203, 1204 and 1205 is very low, with data gaps. Use this data with care. For stations 222, 333 and SLF2, data quality is high and only the default cautiousness should be applied.\n\n* interpolatedmeteo_[stn].smet contains per stations a dataset derived by interpolating from several stations in the Davos area to the stations location. This dataset was generated from the output of the Alpine3D model, of which simulations are presented in the Wever et al. (2017) manuscript.\n\nAt the soil moisture measurement sites, Decagon 10HS sensors were installed, at 10, 30, 50, 80 and 120 cm depth. Per depth 2 sensors were installed, labelled A and B in the datafiles. Note that at stations 1203, 1204 and 1205, sensors were only installed at 10, 30 and 50 cm depth.\n\nThe files follow the SMET format: https://models.slf.ch/docserver/meteoio/SMET_specifications.pdf and metadata for the stations can be found in the header of the smet files.\n\nPlease cite the Wever et al. (2017) reference when using this data in publications.\n\nFor a more detailed description, please refer to: Wever, N., Comola, F., Bavay, M., and Lehning, M.: Simulating the influence of snow surface processes on soil moisture dynamics and streamflow generation in an alpine catchment, Hydrol. Earth Syst. Sci., 21, 4053-4071, https://doi.org/10.5194/hess-21-4053-2017, 2017."
    ],
    "oai_identifier": [
        "oai:envidat.ch:df20d940-9653-4578-a32a-2d2ea7a1b347"
    ],
    "oai_set": "",
    "state": "active",
    "tags": [
        {
            "name": "METEO STATION"
        },
        {
            "name": "SOIL MOISTURE"
        }
    ],
    "title": [
        "IRKIS Soil moisture measurements Davos"
    ],
    "url": ""
}