{
    "Contact": [
        "Marcus Schaub"
    ],
    "Contributor": [
        "EnviDat"
    ],
    "DOI": "http://dx.doi.org/doi:10.16904/11",
    "DiscHierarchy": [
        "4.4.7",
        "Geosciences",
        "Environmental Research"
    ],
    "Discipline": "Environmental Research",
    "Format": [
        "URL",
        "XLSX",
        "JPEG"
    ],
    "Language": [
        "English"
    ],
    "MetaDataAccess": "https://www.envidat.ch/oai?verb=GetRecord&metadataPrefix=datacite&identifier=oai:envidat.ch:0e18a914-f2e4-47df-a86c-a44a1b0055e4",
    "MetadataAccess": [
        "oai:envidat.ch:0e18a914-f2e4-47df-a86c-a44a1b0055e4"
    ],
    "PublicationTimestamp": "2016-07-01T11:59:59Z",
    "PublicationYear": [
        "2016"
    ],
    "Publisher": [
        "Swiss Federal Research Institute WSL / SwissForestLab"
    ],
    "RelatedIdentifier": [
        "https://www.envidat.ch/dataset/pfynwald"
    ],
    "Rights": [
        "Open Data Commons Open Database License (ODbL)"
    ],
    "SpatialCoverage": "(46N,8 E)",
    "TempCoverageBegin": 63666471599,
    "TempCoverageEnd": 63666471599,
    "TemporalCoverage": " point in time : 2018-07-06T11:59:59Z",
    "TemporalCoverage:BeginDate": "2018-07-06T11:59:59Z",
    "TemporalCoverage:EndDate": "2018-07-06T11:59:59Z",
    "author": [
        "Matthias Haeni",
        "Arthur Gessler",
        "Marcus Schaub",
        "Christian Hug",
        "Andreas Rigling"
    ],
    "fulltext": "oai:envidat.ch:0e18a914-f2e4-47df-a86c-a44a1b0055e4;2018-12-09T00:32:52Z;10.16904/11;Marcus Schaub;Swiss Federal Research Institute WSL;Matthias Haeni;Swiss Federal Research Institute WSL;Christian Hug;Swiss Federal Research Institute WSL;Arthur Gessler;Swiss Federal Research Institute WSL;Andreas Rigling;Swiss Federal Research Institute WSL;Tree\tmeasurements 2002-2016 from the long-term irrigation experiment Pfynwald, Switzerland;2016;Swiss Federal Research Institute WSL / SwissForestLab;CROWN CONDITION;DBH;DIAMETER AT BREAST HEIGHT;DROUGHT;IRRIGATION;SCOTS PINE;TREE;TREE SPECIES;Marcus Schaub;Swiss Federal Research Institute WSL;2018-07-06;en;https://www.envidat.ch/dataset/pfynwald;XLSX;JPEG;URL;2016;Open Data Commons Open Database License (ODbL);To study the performance of mature Scots pine (_Pinus sylvestris_ L.) under chronic drought conditions in comparison to their immediate physiological response to drought release, a controlled long-term and large-scale irrigation experiment has been set up in 2003. The experiment is located in a xeric mature Scots pine forest in the Pfynwald (46\u00b0 18' N, 7\u00b0 36' E, 615 m a.s.l.) in one of the driest inner-Alpine valleys of the European Alps, the Valais (mean annual temperature: 9.2\u00b0C, annual precipitation sum: 657 mm, both 1961-1990). Tree age is on average 100 years, the top height is 10.8 m and the stand density is 730 stems ha-1 with a basal area of 27.3 m2 ha-1. The forest is described as _Erico Pinetum sylvestris_ and the soil is a shallow pararendzina characterized by low water retention. The experimental site (1.2 ha; 800 trees) is split up into eight plots of 1'000 m2 each. During April-October, irrigation is applied on four randomly selected plots with sprinklers of 1 m height at night using water from an adjacent water channel. The amount of irrigation corresponds to a supplementary rainfall of 700 mm year-1. Trees in the other four plots grow under naturally dry conditions. Soil moisture has been monitored since the beginning of the project at 3 soil depths (10, 20 and 60 cm). The crown condition of each tree is being assessed each year since 2003. Tree measurement data such as diameter at breast height, tree height, and social status were assessed in 2002, 2009 and 2014. The duration of the irrigation experiment is planned for 20 years.;46.30284 7.61192;Pfynwald, Valais, Switzerland",
    "group": "envidat",
    "groups": [
        {
            "name": "envidat"
        }
    ],
    "name": "54d6fab8-3c37-52b3-a237-aa52ea6238af",
    "notes": [
        "To study the performance of mature Scots pine (_Pinus sylvestris_ L.) under chronic drought conditions in comparison to their immediate physiological response to drought release, a controlled long-term and large-scale irrigation experiment has been set up in 2003. The experiment is located in a xeric mature Scots pine forest in the Pfynwald (46\u00b0 18' N, 7\u00b0 36' E, 615 m a.s.l.) in one of the driest inner-Alpine valleys of the European Alps, the Valais (mean annual temperature: 9.2\u00b0C, annual precipitation sum: 657 mm, both 1961-1990). Tree age is on average 100 years, the top height is 10.8 m and the stand density is 730 stems ha-1 with a basal area of 27.3 m2 ha-1. The forest is described as _Erico Pinetum sylvestris_ and the soil is a shallow pararendzina characterized by low water retention. The experimental site (1.2 ha; 800 trees) is split up into eight plots of 1'000 m2 each. During April-October, irrigation is applied on four randomly selected plots with sprinklers of 1 m height at night using water from an adjacent water channel. The amount of irrigation corresponds to a supplementary rainfall of 700 mm year-1. Trees in the other four plots grow under naturally dry conditions. Soil moisture has been monitored since the beginning of the project at 3 soil depths (10, 20 and 60 cm). The crown condition of each tree is being assessed each year since 2003. Tree measurement data such as diameter at breast height, tree height, and social status were assessed in 2002, 2009 and 2014. The duration of the irrigation experiment is planned for 20 years."
    ],
    "oai_identifier": [
        "oai:envidat.ch:0e18a914-f2e4-47df-a86c-a44a1b0055e4"
    ],
    "oai_set": "",
    "spatial": "{\"type\":\"Polygon\",\"coordinates\":[[[7.61192,46.30284],[7.61192,46.30284],[7.61192,46.30284],[7.61192,46.30284],[7.61192,46.30284]]]}",
    "state": "active",
    "tags": [
        {
            "name": "CROWN CONDITION"
        },
        {
            "name": "DBH"
        },
        {
            "name": "DIAMETER BREAST HEIGHT"
        },
        {
            "name": "DROUGHT"
        },
        {
            "name": "IRRIGATION"
        },
        {
            "name": "SCOTS PINE"
        },
        {
            "name": "TREE"
        },
        {
            "name": "TREE SPECIES"
        }
    ],
    "title": [
        "Tree\tmeasurements 2002-2016 from the long-term irrigation experiment Pfynwald, Switzerland"
    ],
    "url": ""
}