{
    "Contact": [
        "Franziska Koch"
    ],
    "Contributor": [
        "EnviDat"
    ],
    "DOI": "http://dx.doi.org/doi:10.16904/envidat.56",
    "DiscHierarchy": [
        "4.4.7",
        "Geosciences",
        "Environmental Research"
    ],
    "Discipline": "Environmental Research",
    "Format": [
        "PDF",
        "CSV"
    ],
    "Language": [
        "English"
    ],
    "MetaDataAccess": "https://www.envidat.ch/oai?verb=GetRecord&metadataPrefix=datacite&identifier=oai:envidat.ch:cd57ac77-a276-4783-88c9-f52f51552d2c",
    "MetadataAccess": [
        "oai:envidat.ch:cd57ac77-a276-4783-88c9-f52f51552d2c"
    ],
    "PublicationTimestamp": "2018-07-01T11:59:59Z",
    "PublicationYear": [
        "2018"
    ],
    "Publisher": [
        "EnviDat"
    ],
    "RelatedIdentifier": [
        "https://www.envidat.ch/dataset/gps-derived-data-of-swe-hs-and-lwc-and-corresponding-validation-data"
    ],
    "ResourceType": [
        "Dataset"
    ],
    "Rights": [
        "Open Data Commons Open Database License (ODbL)"
    ],
    "SpatialCoverage": "(47N,10E)",
    "TempCoverageBegin": 63579293999,
    "TempCoverageEnd": 63579293999,
    "TemporalCoverage": " point in time : 2015-10-01T11:59:59Z",
    "TemporalCoverage:BeginDate": "2015-10-01T11:59:59Z",
    "TemporalCoverage:EndDate": "2015-10-01T11:59:59Z",
    "author": [
        "Wolfram Mauser",
        "Patrick Henkel",
        "Florian Appel",
        "Franziska Koch",
        "J\u00fcrg Schweizer"
    ],
    "fulltext": "oai:envidat.ch:cd57ac77-a276-4783-88c9-f52f51552d2c;2018-12-06T17:42:20Z;10.16904/envidat.56;Franziska Koch;0000-0001-5826-295X;University of Natural Resources and Life Sciences;Patrick Henkel;0000-0003-2934-3456;Advanced Navigation Solutions GmbH;Florian Appel;0000-0002-1907-9076;Vista Remote Sensing GmbH;Wolfram Mauser;0000-0002-2963-8759;Ludwig-Maximilians-Universit\u00e4t M\u00fcnchen;J\u00fcrg Schweizer;0000-0001-5076-2968;WSL Institute for Snow and Avalanche Research SLF;GPS-derived data of SWE, HS and LWC and corresponding validation data;GPS-derived snow cover properties;2018;EnviDat;GPS;LIQUID WATER CONTENT;SNOW;SNOW COVER;SNOW DEPTH;Franziska Koch;0000-0001-5826-295X;University of Natural Resources and Life Sciences;2015-10-01;en;Dataset;https://www.envidat.ch/dataset/gps-derived-data-of-swe-hs-and-lwc-and-corresponding-validation-data;109310 bytes;90714 bytes;PDF;CSV;1.0;Open Data Commons Open Database License (ODbL);This dataset includes GPS-derived snow water equivalent (SWE), snow depth (HS) and liquid water content (LWC) data for three entire snow-covered seasons (2015-2016, 2016-2017, 2017-2018) at the study plot Weissfluhjoch 2540 m a.s.l. (Davos, Switzerland). The procedure to derive these snow properties is described in Koch et al. (submitted). The novel approach is based on a combination of GPS signal attenuation and time delay.\n\nThe dataset also includes corresponding validation data for SWE and HS measured at Weissfluhjoch, and some additional meteorological data used for interpretation of the snow cover evolution.\n\nPlease refer to the Read-me file for further details on the data.\n\nThese data are the basis of the following publication (and therefore the data are embargoed until the article will be accepted and published): \n > _Koch, F., Henkel, P., Appel, F., Schmid, L., Bach, H., Lamm, M., Prasch, M., Schweizer, J., and Mauser, W., 2018. Retrieval of snow water equivalent, liquid water content and snow height of dry and wet snow by combining GPS signal attenuation and time delay. Water Resources Research, submitted._;46.8295131395 9.80939626694;Switzerland",
    "group": "envidat",
    "groups": [
        {
            "name": "envidat"
        }
    ],
    "name": "5562a8a5-c08d-5c82-8de2-ed9baa33c4e4",
    "notes": [
        "This dataset includes GPS-derived snow water equivalent (SWE), snow depth (HS) and liquid water content (LWC) data for three entire snow-covered seasons (2015-2016, 2016-2017, 2017-2018) at the study plot Weissfluhjoch 2540 m a.s.l. (Davos, Switzerland). The procedure to derive these snow properties is described in Koch et al. (submitted). The novel approach is based on a combination of GPS signal attenuation and time delay.\n\nThe dataset also includes corresponding validation data for SWE and HS measured at Weissfluhjoch, and some additional meteorological data used for interpretation of the snow cover evolution.\n\nPlease refer to the Read-me file for further details on the data.\n\nThese data are the basis of the following publication (and therefore the data are embargoed until the article will be accepted and published): \n > _Koch, F., Henkel, P., Appel, F., Schmid, L., Bach, H., Lamm, M., Prasch, M., Schweizer, J., and Mauser, W., 2018. Retrieval of snow water equivalent, liquid water content and snow height of dry and wet snow by combining GPS signal attenuation and time delay. Water Resources Research, submitted._"
    ],
    "oai_identifier": [
        "oai:envidat.ch:cd57ac77-a276-4783-88c9-f52f51552d2c"
    ],
    "oai_set": "",
    "spatial": "{\"type\":\"Polygon\",\"coordinates\":[[[9.80939626694,46.8295131395],[9.80939626694,46.8295131395],[9.80939626694,46.8295131395],[9.80939626694,46.8295131395],[9.80939626694,46.8295131395]]]}",
    "state": "active",
    "tags": [
        {
            "name": "GPS"
        },
        {
            "name": "LIQUID WATER CONTENT"
        },
        {
            "name": "SNOW"
        },
        {
            "name": "SNOW COVER"
        },
        {
            "name": "SNOW DEPTH"
        }
    ],
    "title": [
        "GPS-derived data of SWE, HS and LWC and corresponding validation data",
        "GPS-derived snow cover properties"
    ],
    "url": ""
}