{
    "Contact": [
        "Frank Techel"
    ],
    "Contributor": [
        "EnviDat"
    ],
    "DOI": "http://dx.doi.org/doi:10.16904/envidat.26",
    "DiscHierarchy": [
        "4.4.7",
        "Geosciences",
        "Environmental Research"
    ],
    "Discipline": "Environmental Research",
    "Format": [
        "TXT"
    ],
    "Language": [
        "English"
    ],
    "MetaDataAccess": "https://www.envidat.ch/oai?verb=GetRecord&metadataPrefix=datacite&identifier=oai:envidat.ch:07dcd960-6197-4709-9a54-60407b4075ca",
    "MetadataAccess": [
        "oai:envidat.ch:07dcd960-6197-4709-9a54-60407b4075ca"
    ],
    "PublicationTimestamp": "2016-07-01T11:59:59Z",
    "PublicationYear": [
        "2016"
    ],
    "Publisher": [
        "Geographica Helvetica"
    ],
    "RelatedIdentifier": [
        "https://www.envidat.ch/dataset/avalanche-fatalities-european-alps-1969-2015"
    ],
    "ResourceType": [
        "Dataset"
    ],
    "Rights": [
        "Open Data Commons Open Database License (ODbL)"
    ],
    "SpatialCoverage": "(45N-43N,5 E-6 E)",
    "TempCoverageBegin": 63679694399,
    "TempCoverageEnd": 63679694399,
    "TemporalCoverage": " point in time : 2018-12-06T11:59:59Z",
    "TemporalCoverage:BeginDate": "2018-12-06T11:59:59Z",
    "TemporalCoverage:EndDate": "2018-12-06T11:59:59Z",
    "author": [
        "Miha Pav\u0161ek",
        "Patrick Nairz",
        "Fr\u00e9d\u00e9ric Jarry",
        "Mauro Valt",
        "Susanna Mitterer",
        "Frank Techel",
        "Georg Kronthaler"
    ],
    "fulltext": "oai:envidat.ch:07dcd960-6197-4709-9a54-60407b4075ca;2018-12-09T00:31:19Z;10.16904/envidat.26;Frank Techel;0000-0001-5686-6127;WSL Institute for Snow and Avalanche Research SLF;Fr\u00e9d\u00e9ric Jarry;Association Nationale pour l'\u00c9tude de la Neige et des Avalanches, Grenoble, France;Georg Kronthaler;Lawinenwarndienst Bayern, Munich, Germany;Susanna Mitterer;\u00d6sterreichisches Kuratorium f\u00fcr alpine Sicherheit, Innsbruck, Austria;Patrick Nairz;Lawinenwarndienst Tirol, Innsbruck, Austria;Miha Pav\u0161ek;Anton Melik Geographical Institute, Research Centre of the Slovenian Academy of Sciences and Arts, Ljubljana, Slovenia;Mauro Valt;Centro Valanghe di Arabba, Arabba, Italy;Avalanche fatalities in the European Alps (1969/1970 - 2014/2015);2016;Geographica Helvetica;AVALANCHE ACCIDENT;AVALANCHE ACCIDENT STATISTICS;AVALANCHE FATALITIES;Frank Techel;0000-0001-5686-6127;WSL Institute for Snow and Avalanchre Research SLF;2018-12-06;en;Dataset;https://www.envidat.ch/dataset/avalanche-fatalities-european-alps-1969-2015;753 bytes;TXT;1.0;Open Data Commons Open Database License (ODbL);During the last 45 years, about 100 people lost their lives in avalanches in the European Alps each year. Avalanche fatalities in settlements and on transportation corridors have considerably decreased since the 1970s. In contrast, the number of avalanche fatalities during recreational activities away from avalanche-secured terrain doubled between the 1960s and 1980s and has remained relatively stable since, despite a continuing strong increase in winter backcountry recreational activities.\n\nData complementing Figure 2 in:  \n_\"Avalanche fatalities in the European Alps: long-term trends and statistics\"_, by Techel, F., Jarry, F., Kronthaler, G., Mitterer, S., Nairz, P., Pav\u0161ek, M., Valt, M., and Darms, G.\n\nData description:  \nplease refer to section 2 (Data and Methods) in the mentioned publication;44.7779358963 5.1416015625 43.0367758576 5.888671875;European Alps",
    "group": "envidat",
    "groups": [
        {
            "name": "envidat"
        }
    ],
    "name": "665f7851-055d-56bc-ae3c-e46a0acb6398",
    "notes": [
        "During the last 45 years, about 100 people lost their lives in avalanches in the European Alps each year. Avalanche fatalities in settlements and on transportation corridors have considerably decreased since the 1970s. In contrast, the number of avalanche fatalities during recreational activities away from avalanche-secured terrain doubled between the 1960s and 1980s and has remained relatively stable since, despite a continuing strong increase in winter backcountry recreational activities.\n\nData complementing Figure 2 in:  \n_\"Avalanche fatalities in the European Alps: long-term trends and statistics\"_, by Techel, F., Jarry, F., Kronthaler, G., Mitterer, S., Nairz, P., Pav\u0161ek, M., Valt, M., and Darms, G.\n\nData description:  \nplease refer to section 2 (Data and Methods) in the mentioned publication"
    ],
    "oai_identifier": [
        "oai:envidat.ch:07dcd960-6197-4709-9a54-60407b4075ca"
    ],
    "oai_set": "",
    "spatial": "{\"type\":\"Polygon\",\"coordinates\":[[[5.1416015625,44.7779358963],[5.1416015625,43.0367758576],[5.888671875,43.0367758576],[5.888671875,44.7779358963],[5.1416015625,44.7779358963]]]}",
    "state": "active",
    "tags": [
        {
            "name": "AVALANCHE ACCIDENT"
        },
        {
            "name": "AVALANCHE ACCIDENT STATISTICS"
        },
        {
            "name": "AVALANCHE FATALITIES"
        }
    ],
    "title": [
        "Avalanche fatalities in the European Alps (1969/1970 - 2014/2015)"
    ],
    "url": ""
}