{
    "Contact": [
        "Franziska Gerber"
    ],
    "Contributor": [
        "EnviDat"
    ],
    "DOI": "http://dx.doi.org/doi:10.16904/envidat.50",
    "DiscHierarchy": [
        "4.4.7",
        "Geosciences",
        "Environmental Research"
    ],
    "Discipline": "Environmental Research",
    "Format": [
        "ZIP"
    ],
    "Language": [
        "English"
    ],
    "MetaDataAccess": "https://www.envidat.ch/oai?verb=GetRecord&metadataPrefix=datacite&identifier=oai:envidat.ch:68536bc6-0990-41c0-a06f-21b19c0f2ffe",
    "MetadataAccess": [
        "oai:envidat.ch:68536bc6-0990-41c0-a06f-21b19c0f2ffe"
    ],
    "PublicationTimestamp": "2018-07-01T11:59:59Z",
    "PublicationYear": [
        "2018"
    ],
    "Publisher": [
        "Laboratory of Cryospheric Sciences, School of Architecture and Civil Engineering, \u00c9cole Polytechnique F\u00e9d\u00e9rale de Lausanne, Lausanne, Switzerland"
    ],
    "RelatedIdentifier": [
        "https://www.envidat.ch/dataset/dischmex-high-resolution-wrf-simulations-in-complex-alpine-terrain-and-station-measurements"
    ],
    "ResourceType": [
        "Dataset"
    ],
    "Rights": [
        "Open Data Commons Open Database License (ODbL)"
    ],
    "SpatialCoverage": "(46N-47N,9 E-11E)",
    "TempCoverageBegin": 63679694399,
    "TempCoverageEnd": 63679694399,
    "TemporalCoverage": " point in time : 2018-12-06T11:59:59Z",
    "TemporalCoverage:BeginDate": "2018-12-06T11:59:59Z",
    "TemporalCoverage:EndDate": "2018-12-06T11:59:59Z",
    "author": [
        "Rebecca Mott",
        "Franziska Gerber",
        "Varun Sharma",
        "Michael Lehning",
        "Megan Daniels"
    ],
    "fulltext": "oai:envidat.ch:68536bc6-0990-41c0-a06f-21b19c0f2ffe;2018-12-09T00:31:41Z;10.16904/envidat.50;Franziska Gerber;CRYOS, EPFL; WSL-SLF;Varun Sharma;CRYOS, EPFL;Rebecca Mott;KIT/IMK_IFU; WSL-SLF;Megan Daniels;unaffiliated;Michael Lehning;CRYOS, EPFL; WSL-SLF;DISCHMEX - High-resolution WRF simulations in complex alpine terrain and station measurements;2018;Laboratory of Cryospheric Sciences, School of Architecture and Civil Engineering, \u00c9cole Polytechnique F\u00e9d\u00e9rale de Lausanne, Lausanne, Switzerland;COMPLEX TERRAIN;COSMO-WRF;OROGRAPHIC PRECIPITATION;PRECIPITATION VARIABILITY;Franziska Gerber;Laboratory of Cryospheric Sciences, School of Architecture and Civil Engineering, \u00c9cole Polytechnique F\u00e9d\u00e9rale de Lausanne, Lausanne, Switzerland and WSL Institute for Snow and Avalanche Research SLF, Davos, Switzerland;2018-12-06;en;Dataset;https://www.envidat.ch/dataset/dischmex-high-resolution-wrf-simulations-in-complex-alpine-terrain-and-station-measurements;1161085 bytes;ZIP;1.0;Open Data Commons Open Database License (ODbL);The data presented here corresponds to the publication \"Spatial variability in snow precipitation and accumulation in COSMO-WRF simulations and radar estimations over complex terrain\" (Gerber et al., 2018a), which investigates the precipitation variability of snow precipitation in the central northern part of the Grisons (CH) and the publication \"The importance of near-surface winter precipitation processes in complex alpine terrain\" (Gerber et al., 2018b). The dataset contains:\n\n* WRFsimulations: WRF simulation output for simulations with 4x (14x) terrain smoothing with an output timestep of 30 min/5 min and horizontal grid spacings of 1350 m, 450 m, 150 m and 50 m (currently: data available upon request).\n* StationData: Meteorological station data of 18 meteorological stations in the central northern part of the Grisons with 30 minute resolution for the period 1 January 2016 till 1 May 2016.\n\nFor more details about the simulation and observation data, see Gerber et al., 2018 and Gerber and Sharma (2018).\n\n__Publications:__\n\nGerber, F., Besic, N., Sharma, V., Mott, R., Daniels, M., Gabella, M., Berne, A., Germann, U., and Lehning, M.: Spatial variability in snow precipitation and accumulation in COSMO-WRF simulations and radar estimations over complex terrain, The Cryosphere, doi:10.5194/tc-12-3137-2018, 2018.\n\nGerber, F., Mott, R. and Lehning, M.: The importance of near-surface winter precipitation processes in complex alpine terrain, Journal of Hydrometeorology, in review, 2018.\n\nGerber, F., and Sharma, V.:  Running COSMO-WRF on very-high resolution over complex terrain. Laboratory of Cryospheric Sciences CRYOS, \u00c9cole Polytechnique F\u00e9d\u00e9rale de Lausanne EPFL, Lausanne, Switzerland. doi:10.16904/envidat.35, 2018.;46.3969575109 9.40704345703 47.1643219976 10.5661010742;central northern part of the Grisons",
    "group": "envidat",
    "groups": [
        {
            "name": "envidat"
        }
    ],
    "name": "77b0bf16-5cc7-5844-ad5f-e89dfd11ac29",
    "notes": [
        "The data presented here corresponds to the publication \"Spatial variability in snow precipitation and accumulation in COSMO-WRF simulations and radar estimations over complex terrain\" (Gerber et al., 2018a), which investigates the precipitation variability of snow precipitation in the central northern part of the Grisons (CH) and the publication \"The importance of near-surface winter precipitation processes in complex alpine terrain\" (Gerber et al., 2018b). The dataset contains:\n\n* WRFsimulations: WRF simulation output for simulations with 4x (14x) terrain smoothing with an output timestep of 30 min/5 min and horizontal grid spacings of 1350 m, 450 m, 150 m and 50 m (currently: data available upon request).\n* StationData: Meteorological station data of 18 meteorological stations in the central northern part of the Grisons with 30 minute resolution for the period 1 January 2016 till 1 May 2016.\n\nFor more details about the simulation and observation data, see Gerber et al., 2018 and Gerber and Sharma (2018).\n\n__Publications:__\n\nGerber, F., Besic, N., Sharma, V., Mott, R., Daniels, M., Gabella, M., Berne, A., Germann, U., and Lehning, M.: Spatial variability in snow precipitation and accumulation in COSMO-WRF simulations and radar estimations over complex terrain, The Cryosphere, doi:10.5194/tc-12-3137-2018, 2018.\n\nGerber, F., Mott, R. and Lehning, M.: The importance of near-surface winter precipitation processes in complex alpine terrain, Journal of Hydrometeorology, in review, 2018.\n\nGerber, F., and Sharma, V.:  Running COSMO-WRF on very-high resolution over complex terrain. Laboratory of Cryospheric Sciences CRYOS, \u00c9cole Polytechnique F\u00e9d\u00e9rale de Lausanne EPFL, Lausanne, Switzerland. doi:10.16904/envidat.35, 2018."
    ],
    "oai_identifier": [
        "oai:envidat.ch:68536bc6-0990-41c0-a06f-21b19c0f2ffe"
    ],
    "oai_set": "",
    "spatial": "{\"type\":\"Polygon\",\"coordinates\":[[[9.40704345703,46.3969575109],[9.40704345703,47.1643219976],[10.5661010742,47.1643219976],[10.5661010742,46.3969575109],[9.40704345703,46.3969575109]]]}",
    "state": "active",
    "tags": [
        {
            "name": "COMPLEX TERRAIN"
        },
        {
            "name": "COSMO-WRF"
        },
        {
            "name": "OROGRAPHIC PRECIPITATION"
        },
        {
            "name": "PRECIPITATION VARIABILITY"
        }
    ],
    "title": [
        "DISCHMEX - High-resolution WRF simulations in complex alpine terrain and station measurements"
    ],
    "url": ""
}