{
    "Contact": [
        "Peter Bebi"
    ],
    "Contributor": [
        "EnviDat"
    ],
    "DOI": "http://dx.doi.org/doi:10.16904/envidat.43",
    "DiscHierarchy": [
        "4.4.7",
        "Geosciences",
        "Environmental Research"
    ],
    "Discipline": "Environmental Research",
    "Format": [
        "JPEG",
        "SMET",
        "TXT",
        "PNG"
    ],
    "Language": [
        "English"
    ],
    "MetaDataAccess": "https://www.envidat.ch/oai?verb=GetRecord&metadataPrefix=datacite&identifier=oai:envidat.ch:938e0cc0-0f75-41da-a358-679f27c254d4",
    "MetadataAccess": [
        "oai:envidat.ch:938e0cc0-0f75-41da-a358-679f27c254d4"
    ],
    "PublicationTimestamp": "2016-07-01T11:59:59Z",
    "PublicationYear": [
        "2016"
    ],
    "Publisher": [
        "WSL Institute for Snow and Avalanche Research SLF"
    ],
    "RelatedIdentifier": [
        "https://www.envidat.ch/dataset/stillberg-climate"
    ],
    "ResourceType": [
        "Dataset"
    ],
    "Rights": [
        "Open Data Commons Open Database License (ODbL)"
    ],
    "SpatialCoverage": "(47N,10E)",
    "TempCoverageBegin": 62293406399,
    "TempCoverageEnd": 62293406399,
    "TemporalCoverage": " point in time : 1975-01-01T11:59:59Z",
    "TemporalCoverage:BeginDate": "1975-01-01T11:59:59Z",
    "TemporalCoverage:EndDate": "1975-01-01T11:59:59Z",
    "author": [
        "Peter Bebi"
    ],
    "fulltext": "oai:envidat.ch:938e0cc0-0f75-41da-a358-679f27c254d4;2018-07-18T13:33:14Z;10.16904/envidat.43;Peter Bebi;WSL Institute for Snow and Avalanche Research SLF;Long-term meteorological and snow station at 2090 m a.s.l., Stillberg, Davos, Switzerland (1975 - present);2016;WSL Institute for Snow and Avalanche Research SLF;AIR TEMPERATURE;HUMIDITY;LONGWAVE RADIATION;PRECIPITATION AMOUNT;SHORTWAVE RADIATION;SNOW DEPTH;Peter Bebi;WSL;1975-01-01;en;Dataset;https://www.envidat.ch/dataset/stillberg-climate;SMET;TXT;PNG;JPEG;1.0;Open Data Commons Open Database License (ODbL);Longterm meteorological and snow station on a steep (c. 40 degrees) North-East exposed slope at 2090 m a.s.l above  Davos, Switzerland. Established 1975 and ongoing measurements made, although instruments have changed during this period. The station is located within a experimental plantation that serves as avalanche protection to downslope communities as well as a unique site for treeline dynamics research.;46.773573 9.86716;Switzerland, Davos",
    "group": "envidat",
    "groups": [
        {
            "name": "envidat"
        }
    ],
    "name": "7c940496-db15-57dd-9ed6-4a1345696f7a",
    "notes": [
        "Longterm meteorological and snow station on a steep (c. 40 degrees) North-East exposed slope at 2090 m a.s.l above  Davos, Switzerland. Established 1975 and ongoing measurements made, although instruments have changed during this period. The station is located within a experimental plantation that serves as avalanche protection to downslope communities as well as a unique site for treeline dynamics research."
    ],
    "oai_identifier": [
        "oai:envidat.ch:938e0cc0-0f75-41da-a358-679f27c254d4"
    ],
    "oai_set": "",
    "spatial": "{\"type\":\"Polygon\",\"coordinates\":[[[9.86716,46.773573],[9.86716,46.773573],[9.86716,46.773573],[9.86716,46.773573],[9.86716,46.773573]]]}",
    "state": "active",
    "tags": [
        {
            "name": "AIR TEMPERATURE"
        },
        {
            "name": "HUMIDITY"
        },
        {
            "name": "LONGWAVE RADIATION"
        },
        {
            "name": "PRECIPITATION AMOUNT"
        },
        {
            "name": "SHORTWAVE RADIATION"
        },
        {
            "name": "SNOW DEPTH"
        }
    ],
    "title": [
        "Long-term meteorological and snow station at 2090 m a.s.l., Stillberg, Davos, Switzerland (1975 - present)"
    ],
    "url": ""
}