{
    "Contact": [
        "Rebecca Mott"
    ],
    "Contributor": [
        "EnviDat"
    ],
    "DOI": "http://dx.doi.org/doi:10.16904/10",
    "DiscHierarchy": [
        "4.4.7",
        "Geosciences",
        "Environmental Research"
    ],
    "Discipline": "Environmental Research",
    "Format": [
        "XLSX",
        "PNG",
        "ZIP"
    ],
    "Language": [
        "English"
    ],
    "MetaDataAccess": "https://www.envidat.ch/oai?verb=GetRecord&metadataPrefix=datacite&identifier=oai:envidat.ch:7e8c6dac-80cf-49d7-bd85-2a61d3336e6f",
    "MetadataAccess": [
        "oai:envidat.ch:7e8c6dac-80cf-49d7-bd85-2a61d3336e6f"
    ],
    "PublicationTimestamp": "2017-07-01T11:59:59Z",
    "PublicationYear": [
        "2017"
    ],
    "Publisher": [
        "WSL Institute for Snow and Avalanche Research SLF"
    ],
    "RelatedIdentifier": [
        "https://www.envidat.ch/dataset/10-16904-10"
    ],
    "ResourceType": [
        "Dataset"
    ],
    "Rights": [
        "Open Data Commons Open Database License (ODbL)"
    ],
    "SpatialCoverage": "(47N,10E)",
    "TemporalCoverage": [
        "2014-04-17",
        "2015-04-15",
        "2016-04-21"
    ],
    "author": [
        "Rebecca Mott",
        "Lisa Dirks",
        "Michael Lehning",
        "Sebastian Schl\u00f6gl"
    ],
    "fulltext": "oai:envidat.ch:7e8c6dac-80cf-49d7-bd85-2a61d3336e6f;2018-12-09T00:24:04Z;10.16904/10;Rebecca Mott;WSL Institute for Snow and Avalanche Research SLF, Davos, Switzerland;Sebastian Schl\u00f6gl;E\u0300cole Polytechnique Fe\u0300de\u0300rale de Lausanne, Lausanne, Switzerland School of Architecture, Civil and Environmental Engineering, Laboratory of Cryospheric Sciences (CRYOS) and WSL Institute for Snow and Avalanche Research SLF, Davos, Switzerland;Lisa Dirks;WSL Institute for Snow and Avalanche Research SLF, Davos, Switzerland;Michael Lehning;E\u0300cole Polytechnique Fe\u0300de\u0300rale de Lausanne, Lausanne, Switzerland School of Architecture, Civil and Environmental Engineering, Laboratory of Cryospheric Sciences (CRYOS) and WSL Institute for Snow and Avalanche Research SLF, Davos, Switzerland;DISCHMEX - Impact of extreme land-surface heterogeneity on micrometeorology over spring snow-cover;Eddy-covariance measurements;2017;WSL Institute for Snow and Avalanche Research SLF;DISCHMEX;EDDY-COVARIANCE MEASUREMENTS;PATCHY SNOW COVERS;TURBULENT SENSIBLE HEAT FLUXES;Rebecca Mott;SLF;2014-04-17;2015-04-15;2016-04-21;en;Dataset;https://www.envidat.ch/dataset/10-16904-10;725025 bytes;726971 bytes;717361 bytes;717473 bytes;212111 bytes;765677 bytes;764023 bytes;737846 bytes;735270 bytes;271399 bytes;842796 bytes;571682 bytes;860498 bytes;54602 bytes;17405 bytes;1723556 bytes;ZIP;XLSX;PNG;1.0;Open Data Commons Open Database License (ODbL);This dataset contains eddy-covariance measurements in the ablation period of 2014-2016. Measurements were taken from two turbulence towers over a long-lasting snow patch, which are 5 m apart from each other (2014 and 2015). The turbulence towers were equipped with two YOUNG ultrasonic anemometers mounted 0.7 m (in 2014) and 3.3 m (in 2015) above snow-free ground, two ultrasonic anemometers (CSAT3, Campbell Scientific, Inc.) mounted at 2.6 m (in 2014) and 2.2 m (in 2015) above snow-free ground and one anemometer (DA-600, Kaijo Denki) mounted at 0.3 m above snow surface.  \n\nThe measurement setup changed in 2016 and includes a measurement above the snow-free ground in upwind direction (Swiss coordinates: 790191/176689). The measurement tower is equipped with one ultrasonic anemometer (CSAT3, Campbell Scientific, Inc.) in 3.3 m above the snow-free ground. Additionally, one measurement tower is installed above the long-Lasting snow patch and equipped with the same setup as 2015.\n\nTurbulence data were sampled at a frequency of 20 Hz. The processing of the data to quality controlled fluxes has been done with the Biomicrometeorology flux software (Thomas et al., 2009). The program applies plausibility tests and a despiking test after Vickers and Mahrt (1997) on the measured data. The routine further applies a time-lag correction and considers the deployment (e.g.  the sonic azimuth). A frequency response correction (Moore, 1986) is done and a three-dimensional rotation is performed. Finally, quality assurance/quality control (QA/QC) flags after Foken et al., (2004) are issued and fast Fourier transform power and co-spectra are calculated.  The change in snow height is considered in the post-processing for every measurement day. The turbulence data were averaged to 30 minute intervals.;46.71291 9.92665;The dataset was recorded at the Gletschboden area (2094 m asl) in the upper Dischma valley, Davos, Switzerland. Swiss coordinates: 790211/176539",
    "group": "envidat",
    "groups": [
        {
            "name": "envidat"
        }
    ],
    "name": "91a80c53-020a-559f-9aad-ced39bba3a35",
    "notes": [
        "This dataset contains eddy-covariance measurements in the ablation period of 2014-2016. Measurements were taken from two turbulence towers over a long-lasting snow patch, which are 5 m apart from each other (2014 and 2015). The turbulence towers were equipped with two YOUNG ultrasonic anemometers mounted 0.7 m (in 2014) and 3.3 m (in 2015) above snow-free ground, two ultrasonic anemometers (CSAT3, Campbell Scientific, Inc.) mounted at 2.6 m (in 2014) and 2.2 m (in 2015) above snow-free ground and one anemometer (DA-600, Kaijo Denki) mounted at 0.3 m above snow surface.  \n\nThe measurement setup changed in 2016 and includes a measurement above the snow-free ground in upwind direction (Swiss coordinates: 790191/176689). The measurement tower is equipped with one ultrasonic anemometer (CSAT3, Campbell Scientific, Inc.) in 3.3 m above the snow-free ground. Additionally, one measurement tower is installed above the long-Lasting snow patch and equipped with the same setup as 2015.\n\nTurbulence data were sampled at a frequency of 20 Hz. The processing of the data to quality controlled fluxes has been done with the Biomicrometeorology flux software (Thomas et al., 2009). The program applies plausibility tests and a despiking test after Vickers and Mahrt (1997) on the measured data. The routine further applies a time-lag correction and considers the deployment (e.g.  the sonic azimuth). A frequency response correction (Moore, 1986) is done and a three-dimensional rotation is performed. Finally, quality assurance/quality control (QA/QC) flags after Foken et al., (2004) are issued and fast Fourier transform power and co-spectra are calculated.  The change in snow height is considered in the post-processing for every measurement day. The turbulence data were averaged to 30 minute intervals."
    ],
    "oai_identifier": [
        "oai:envidat.ch:7e8c6dac-80cf-49d7-bd85-2a61d3336e6f"
    ],
    "oai_set": "",
    "spatial": "{\"type\":\"Polygon\",\"coordinates\":[[[9.92665,46.71291],[9.92665,46.71291],[9.92665,46.71291],[9.92665,46.71291],[9.92665,46.71291]]]}",
    "state": "active",
    "tags": [
        {
            "name": "DISCHMEX"
        },
        {
            "name": "EDDY-COVARIANCE MEASUREMENTS"
        },
        {
            "name": "PATCHY SNOW COVERS"
        },
        {
            "name": "TURBULENT SENSIBLE HEAT FLUXES"
        }
    ],
    "title": [
        "DISCHMEX - Impact of extreme land-surface heterogeneity on micrometeorology over spring snow-cover",
        "Eddy-covariance measurements"
    ],
    "url": ""
}