{
    "Contact": [
        "Dr. Manfred Staehli"
    ],
    "Contributor": [
        "EnviDat"
    ],
    "DOI": "http://dx.doi.org/doi:10.16904/7",
    "DiscHierarchy": [
        "4.4.7",
        "Geosciences",
        "Environmental Research"
    ],
    "Discipline": "Environmental Research",
    "Format": [
        "ZIP"
    ],
    "Language": [
        "English"
    ],
    "MetaDataAccess": "https://www.envidat.ch/oai?verb=GetRecord&metadataPrefix=datacite&identifier=oai:envidat.ch:c54a616a-4419-4ba8-840e-82f6ec5c05ff",
    "MetadataAccess": [
        "oai:envidat.ch:c54a616a-4419-4ba8-840e-82f6ec5c05ff"
    ],
    "PublicationTimestamp": "2016-07-01T11:59:59Z",
    "PublicationYear": [
        "2016"
    ],
    "Publisher": [
        "Swiss Federal Institute for Forest, Snow and Landscape WSL"
    ],
    "RelatedIdentifier": [
        "https://www.envidat.ch/dataset/10-16904-7"
    ],
    "ResourceType": [
        "Dataset"
    ],
    "Rights": [
        "Other (Open)"
    ],
    "SpatialCoverage": [
        "47.01576 7.84273",
        "47.0163 7.8903",
        "47.01555 7.88684",
        "47.02267 7.84487",
        "47.01343 7.84105",
        "47.01867 7.88851",
        "47.01745 7.88764",
        "47.01353 7.88702",
        "47.03105 7.85199"
    ],
    "TempCoverageBegin": 63666471599,
    "TempCoverageEnd": 63666471599,
    "TemporalCoverage": " point in time : 2018-07-06T11:59:59Z",
    "TemporalCoverage:BeginDate": "2018-07-06T11:59:59Z",
    "TemporalCoverage:EndDate": "2018-07-06T11:59:59Z",
    "author": [
        "Karl Steiner",
        "Alexandre Badoux",
        "A. Ludwig",
        "Manfred St\u00e4hli"
    ],
    "fulltext": "oai:envidat.ch:c54a616a-4419-4ba8-840e-82f6ec5c05ff;2018-12-09T00:31:13Z;10.16904/7;Manfred St\u00e4hli;WSL;A. Ludwig;None;Karl Steiner;WSL;Alexandre Badoux;WSL;More than one century of hydrological monitoring in two small catchments with different forest coverage, Sperbelgraben and Rappengraben (Switzerland);Hydrologische Messungen Sperbel- und Rappengraben (1903 \u2013 2009);2016;Swiss Federal Institute for Forest, Snow and Landscape WSL;AIR TEMPERATURE;PRECIPITATION;RUNOFF;SNOW DEPTH;WATERSHED DRAINAGE BASINS;Dr. Manfred Staehli;WSL;2018-07-06;en;Dataset;https://www.envidat.ch/dataset/10-16904-7;2482693 bytes;ZIP;1;Other (Open);Long-term data on precipitation and runoff are essential to draw firm conclusions about the behavior and trends of hydrological catchments that may be influenced by land-use and climate change. Here the longest continuous runoff records (1903 - 2015) from small catchments (less than 1 km2) in Switzerland (and possibly worldwide) are provided as a data set. The history of the hydrological monitoring in the Sperbel- and Rappengraben (Emmental) is summarized in St\u00e4hli et al., Environ Monit Assess (2011). The runoff stations operated safely for more than 90% of the summer months when most of the major flood events occurred. Nevertheless, the absolute values of peak runoff during the largest flood events are subject to considerable uncertainty (also discussed in St\u00e4hli et al., 2011). This treasure trove of data can be used in various ways, eg. for analysis of the generalized extreme value distributions of the two catchments, of the mechanisms governing the runoff behavior of small catchments, as well as for testing stochastic and deterministic models.;47.01576 7.84273;47.0163 7.8903;47.01555 7.88684;47.02267 7.84487;47.01343 7.84105;47.01867 7.88851;47.01745 7.88764;47.01353 7.88702;47.03105 7.85199;Sperbelgraben and Rappengraben (Switzerland)",
    "group": "envidat",
    "groups": [
        {
            "name": "envidat"
        }
    ],
    "name": "9d490baa-18c7-569e-a393-2a5dbd63cec1",
    "notes": [
        "Long-term data on precipitation and runoff are essential to draw firm conclusions about the behavior and trends of hydrological catchments that may be influenced by land-use and climate change. Here the longest continuous runoff records (1903 - 2015) from small catchments (less than 1 km2) in Switzerland (and possibly worldwide) are provided as a data set. The history of the hydrological monitoring in the Sperbel- and Rappengraben (Emmental) is summarized in St\u00e4hli et al., Environ Monit Assess (2011). The runoff stations operated safely for more than 90% of the summer months when most of the major flood events occurred. Nevertheless, the absolute values of peak runoff during the largest flood events are subject to considerable uncertainty (also discussed in St\u00e4hli et al., 2011). This treasure trove of data can be used in various ways, eg. for analysis of the generalized extreme value distributions of the two catchments, of the mechanisms governing the runoff behavior of small catchments, as well as for testing stochastic and deterministic models."
    ],
    "oai_identifier": [
        "oai:envidat.ch:c54a616a-4419-4ba8-840e-82f6ec5c05ff"
    ],
    "oai_set": "",
    "state": "active",
    "tags": [
        {
            "name": "AIR TEMPERATURE"
        },
        {
            "name": "PRECIPITATION"
        },
        {
            "name": "RUNOFF"
        },
        {
            "name": "SNOW DEPTH"
        },
        {
            "name": "WATERSHED DRAINAGE BASINS"
        }
    ],
    "title": [
        "More than one century of hydrological monitoring in two small catchments with different forest coverage, Sperbelgraben and Rappengraben (Switzerland)",
        "Hydrologische Messungen Sperbel- und Rappengraben (1903 \u2013 2009)"
    ],
    "url": ""
}