{
    "Contact": [
        "Christian Sommer"
    ],
    "Contributor": [
        "EnviDat"
    ],
    "DOI": "http://dx.doi.org/doi:10.16904/22",
    "DiscHierarchy": [
        "4.4.7",
        "Geosciences",
        "Environmental Research"
    ],
    "Discipline": "Environmental Research",
    "Format": [
        "TXT",
        "Link",
        "ZIP"
    ],
    "Language": [
        "English"
    ],
    "MetaDataAccess": "https://www.envidat.ch/oai?verb=GetRecord&metadataPrefix=datacite&identifier=oai:envidat.ch:d57b3332-804d-463b-bbf8-0ed38593e180",
    "MetadataAccess": [
        "oai:envidat.ch:d57b3332-804d-463b-bbf8-0ed38593e180"
    ],
    "PublicationTimestamp": "2017-07-01T11:59:59Z",
    "PublicationYear": [
        "2017"
    ],
    "Publisher": [
        "WSL Institute for Snow and Avalanche Research SLF, Davos, Switzerland"
    ],
    "RelatedIdentifier": [
        "https://www.envidat.ch/dataset/10-16904-22"
    ],
    "ResourceType": [
        "Dataset"
    ],
    "Rights": [
        "Open Data Commons Open Database License (ODbL)"
    ],
    "SpatialCoverage": "(47N,10E)",
    "TempCoverageBegin": 63679694399,
    "TempCoverageEnd": 63679694399,
    "TemporalCoverage": " point in time : 2018-12-06T11:59:59Z",
    "TemporalCoverage:BeginDate": "2018-12-06T11:59:59Z",
    "TemporalCoverage:EndDate": "2018-12-06T11:59:59Z",
    "author": [
        "Charles Fierz",
        "Michael Lehning",
        "Christian G. Sommer"
    ],
    "fulltext": "oai:envidat.ch:d57b3332-804d-463b-bbf8-0ed38593e180;2018-12-09T00:31:07Z;10.16904/22;Christian G. Sommer;WSL Institute for Snow and Avalanche Research SLF, Davos, Switzerland and CRYOS, School of Architecture and Civil Engineering, \u00c9cole Polytechnique F\u00e9d\u00e9rale de Lausanne, Lausanne, Switzerland;Michael Lehning;WSL Institute for Snow and Avalanche Research SLF, Davos, Switzerland and CRYOS, School of Architecture and Civil Engineering, \u00c9cole Polytechnique F\u00e9d\u00e9rale de Lausanne, Lausanne, Switzerland;Charles Fierz;WSL Institute for Snow and Avalanche Research SLF, Davos, Switzerland;Wind crust formation: Microsoft Kinect data;2017;WSL Institute for Snow and Avalanche Research SLF, Davos, Switzerland;KINECT;SNOW;WIND CRUST;WIND-PACKING;Christian Sommer;WSL Institute for Snow and Avalanche Research SLF, Davos, Switzerland and CRYOS, School of Architecture and Civil Engineering, \u00c9cole Polytechnique F\u00e9d\u00e9rale de Lausanne, Lausanne, Switzerland;2018-12-06;en;Dataset;https://www.envidat.ch/dataset/10-16904-22;967 bytes;35366 bytes;Link;TXT;ZIP;1.0;Open Data Commons Open Database License (ODbL);This data sets contains the Microsoft Kinect data from 15 wind tunnel experiments on wind-packing / wind crust formation. These experiments were performed in the winter 2016/17. The Kinect measures distributed snow depth.\n\nThe Kinect data is organized per experiment. Each experiment subfolder contains the processed Kinect depth images and some additional files.\n\nPlease refer to the README for more details on the data. The processing scripts are available for download as well. The scripts are mainly provided as documentation and would need to be adjusted to be used.\n\nThis dataset is the basis of the following publication:\n\nSommer C.G., Lehning M. & Fierz C. (2018). Wind Tunnel Experiments: Influence of Erosion and Deposition on Wind-Packing of New Snow. Front. Earth Sci. 6:4. doi: 10.3389/feart.2018.00004;46.80798 9.86752;Davos, Switzerland",
    "group": "envidat",
    "groups": [
        {
            "name": "envidat"
        }
    ],
    "name": "aa4e37a7-3b2c-54df-8f60-0cdca951d0c4",
    "notes": [
        "This data sets contains the Microsoft Kinect data from 15 wind tunnel experiments on wind-packing / wind crust formation. These experiments were performed in the winter 2016/17. The Kinect measures distributed snow depth.\n\nThe Kinect data is organized per experiment. Each experiment subfolder contains the processed Kinect depth images and some additional files.\n\nPlease refer to the README for more details on the data. The processing scripts are available for download as well. The scripts are mainly provided as documentation and would need to be adjusted to be used.\n\nThis dataset is the basis of the following publication:\n\nSommer C.G., Lehning M. & Fierz C. (2018). Wind Tunnel Experiments: Influence of Erosion and Deposition on Wind-Packing of New Snow. Front. Earth Sci. 6:4. doi: 10.3389/feart.2018.00004"
    ],
    "oai_identifier": [
        "oai:envidat.ch:d57b3332-804d-463b-bbf8-0ed38593e180"
    ],
    "oai_set": "",
    "spatial": "{\"type\":\"Polygon\",\"coordinates\":[[[9.86752,46.80798],[9.86752,46.80798],[9.86752,46.80798],[9.86752,46.80798],[9.86752,46.80798]]]}",
    "state": "active",
    "tags": [
        {
            "name": "KINECT"
        },
        {
            "name": "SNOW"
        },
        {
            "name": "WIND CRUST"
        },
        {
            "name": "WIND-PACKING"
        }
    ],
    "title": [
        "Wind crust formation: Microsoft Kinect data"
    ],
    "url": ""
}