{
    "Contact": [
        "Michael Lehning"
    ],
    "Contributor": [
        "EnviDat"
    ],
    "DOI": "http://dx.doi.org/doi:10.16904/envidat.28",
    "DiscHierarchy": [
        "4.4.7",
        "Geosciences",
        "Environmental Research"
    ],
    "Discipline": "Environmental Research",
    "Format": [
        "SNO",
        "SMET",
        "TXT"
    ],
    "Language": [
        "English"
    ],
    "MetaDataAccess": "https://www.envidat.ch/oai?verb=GetRecord&metadataPrefix=datacite&identifier=oai:envidat.ch:640b09be-3b86-492e-aba2-449329969989",
    "MetadataAccess": [
        "oai:envidat.ch:640b09be-3b86-492e-aba2-449329969989"
    ],
    "PublicationTimestamp": "2018-07-01T11:59:59Z",
    "PublicationYear": [
        "2018"
    ],
    "Publisher": [
        "WSL Institute for Snow and Avalanche Research SLF"
    ],
    "RelatedIdentifier": [
        "https://www.envidat.ch/dataset/10-16904-envidat-28"
    ],
    "ResourceType": [
        "Dataset"
    ],
    "Rights": [
        "Open Data Commons Open Database License (ODbL)"
    ],
    "SpatialCoverage": [
        "46.808 9.868",
        "46.517 10.727"
    ],
    "TempCoverageBegin": 63565901999,
    "TempCoverageEnd": 63565901999,
    "TemporalCoverage": " point in time : 2015-04-29T11:59:59Z",
    "TemporalCoverage:BeginDate": "2015-04-29T11:59:59Z",
    "TemporalCoverage:EndDate": "2015-04-29T11:59:59Z",
    "author": [
        "Fabian Wolfsperger",
        "Michael Lehning",
        "Thomas Gr\u00fcnewald"
    ],
    "fulltext": "oai:envidat.ch:640b09be-3b86-492e-aba2-449329969989;2018-12-06T17:34:44Z;10.16904/envidat.28;Thomas Gr\u00fcnewald;WSL Institute for Snow and Avalanche Research SLF;Fabian Wolfsperger;WSL Institute for Snow and Avalanche Research SLF;Michael Lehning;WSL Institute for Snow and Avalanche Research SLF;Snowfarming data set Davos and Martell 2015;TLS measurements and Meteodata;2018;WSL Institute for Snow and Avalanche Research SLF;SNOW;SNOW CONSERVATION;SNOW FARMING;SNOWPACK;TERRESTRIAL LASER SCANNING;WINTER TOURISM;Michael Lehning;SLF;2015-04-29;en;Dataset;https://www.envidat.ch/dataset/10-16904-envidat-28;1919 bytes;1761 bytes;827214 bytes;889965 bytes;1702059 bytes;1720506 bytes;2412003 bytes;2332516 bytes;SNO;SMET;TXT;1.0;Open Data Commons Open Database License (ODbL);Two data sets obtained for snow farming projects (Fluela, Davos, CH and Martell, IT) in 2015. \n\nThe data set contains for each site:\n\n* 10 cm GIS raster of snow depth calculated from terrestrial laserscanning surveys (TLS) in the end of winter season (April/May)\n\n* 10 cm GIS raster of snow depth calculated from TLS in the end of summer season (October)\n\nInput files for SNOWPACK model:\n\n* .sno: snow profile at the end of winter\n\n* .smet: meteorological data measured by weather stations in the area\n\nFor more details see  Gr\u00fcnewald, T., Lehning, M., and Wolfsperger, F.: Snow farming: Conserving snow over the summer season, The Cryosphere Discuss., https://doi.org/10.5194/tc-2017-93, in review, 2017.;46.808 9.868;46.517 10.727;Davos, Switzerland (lat: 46.808\u00b0 N, long: 9.868\u00b0 E) and Martell, South Tyrol (lat: 46.517\u00b0 N, long: 10.727\u00b0 E",
    "group": "envidat",
    "groups": [
        {
            "name": "envidat"
        }
    ],
    "name": "afe2314f-2499-52e1-bf56-db2492a9840a",
    "notes": [
        "Two data sets obtained for snow farming projects (Fluela, Davos, CH and Martell, IT) in 2015. \n\nThe data set contains for each site:\n\n* 10 cm GIS raster of snow depth calculated from terrestrial laserscanning surveys (TLS) in the end of winter season (April/May)\n\n* 10 cm GIS raster of snow depth calculated from TLS in the end of summer season (October)\n\nInput files for SNOWPACK model:\n\n* .sno: snow profile at the end of winter\n\n* .smet: meteorological data measured by weather stations in the area\n\nFor more details see  Gr\u00fcnewald, T., Lehning, M., and Wolfsperger, F.: Snow farming: Conserving snow over the summer season, The Cryosphere Discuss., https://doi.org/10.5194/tc-2017-93, in review, 2017."
    ],
    "oai_identifier": [
        "oai:envidat.ch:640b09be-3b86-492e-aba2-449329969989"
    ],
    "oai_set": "",
    "state": "active",
    "tags": [
        {
            "name": "SNOW"
        },
        {
            "name": "SNOW CONSERVATION"
        },
        {
            "name": "SNOW FARMING"
        },
        {
            "name": "SNOWPACK"
        },
        {
            "name": "TERRESTRIAL LASER SCANNING"
        },
        {
            "name": "WINTER TOURISM"
        }
    ],
    "title": [
        "Snowfarming data set Davos and Martell 2015",
        "TLS measurements and Meteodata"
    ],
    "url": ""
}