{
    "Contact": [
        "Franziska Gerber"
    ],
    "Contributor": [
        "EnviDat"
    ],
    "DOI": "http://dx.doi.org/doi:10.16904/19",
    "DiscHierarchy": [
        "4.4.7",
        "Geosciences",
        "Environmental Research"
    ],
    "Discipline": "Environmental Research",
    "Format": [
        "ZIP"
    ],
    "Language": [
        "English"
    ],
    "MetaDataAccess": "https://www.envidat.ch/oai?verb=GetRecord&metadataPrefix=datacite&identifier=oai:envidat.ch:361a9977-c156-485a-b77f-9a7a92e15bac",
    "MetadataAccess": [
        "oai:envidat.ch:361a9977-c156-485a-b77f-9a7a92e15bac"
    ],
    "PublicationTimestamp": "2017-07-01T11:59:59Z",
    "PublicationYear": [
        "2017"
    ],
    "Publisher": [
        "Laboratory of Cryospheric Sciences, School of Architecture and Civil Engineering, \u00c9cole Polytechnique F\u00e9d\u00e9rale de Lausanne, Lausanne, Switzerland"
    ],
    "RelatedIdentifier": [
        "https://www.envidat.ch/dataset/10-16904-19"
    ],
    "ResourceType": [
        "Dataset"
    ],
    "Rights": [
        "Open Data Commons Open Database License (ODbL)"
    ],
    "SpatialCoverage": "(47N-47N,10E-10E)",
    "TempCoverageBegin": 63679694399,
    "TempCoverageEnd": 63679694399,
    "TemporalCoverage": " point in time : 2018-12-06T11:59:59Z",
    "TemporalCoverage:BeginDate": "2018-12-06T11:59:59Z",
    "TemporalCoverage:EndDate": "2018-12-06T11:59:59Z",
    "author": [
        "Rebecca Mott",
        "Franziska Gerber",
        "Mathias Bavay",
        "Sebastian W. Hoch",
        "Michael Lehning"
    ],
    "fulltext": "oai:envidat.ch:361a9977-c156-485a-b77f-9a7a92e15bac;2018-12-09T00:31:03Z;10.16904/19;Franziska Gerber;Laboratory of Cryospheric Sciences, School of Architecture and Civil Engineering, \u00c9cole Polytechnique F\u00e9d\u00e9rale de Lausanne, Lausanne, Switzerland and WSL Institute for Snow and Avalanche Research SLF, Davos, Switzerland;Rebecca Mott;WSL Institute for Snow and Avalanche Research SLF, Davos, Switzerland;Sebastian W. Hoch;Department of Atmospheric Sciences, University of Utah, Salt Lake City, Utah;Mathias Bavay;WSL Institute for Snow and Avalanche Research SLF, Davos, Switzerland;Michael Lehning;Laboratory of Cryospheric Sciences, School of Architecture and Civil Engineering, \u00c9cole Polytechnique F\u00e9d\u00e9rale de Lausanne, Lausanne, Switzerland and WSL Institute for Snow and Avalanche Research SLF, Davos, Switzerland;DISCHMEX - Observations and simulations of the close-ridge small-scale atmospheric flow field and snow accumulation at Sattelhorn, Dischma valley, Davos, Switzerland.;2017;Laboratory of Cryospheric Sciences, School of Architecture and Civil Engineering, \u00c9cole Polytechnique F\u00e9d\u00e9rale de Lausanne, Lausanne, Switzerland;LEE-SIDE FLOW FIELD;LIDAR;PREFERENTIAL DEPOSITION;TLS;Franziska Gerber;Laboratory of Cryospheric Sciences, School of Architecture and Civil Engineering, \u00c9cole Polytechnique F\u00e9d\u00e9rale de Lausanne, Lausanne, Switzerland and WSL Institute for Snow and Avalanche Research SLF, Davos, Switzerland;2018-12-06;en;Dataset;https://www.envidat.ch/dataset/10-16904-19;ZIP;1.0;Open Data Commons Open Database License (ODbL);The data presented here corresponds to the publication \"A Close-Ridge Small-Scale Atmospheric Flow Field and its Influence on Snow Accumulation\" (Gerber et al., 2017), which investigates an eddy-like structure in the vicinity of the Sattelhorn in the Dischma valley (Davos Switzerland)  and its influence on snow accumulation. The dataset contains:\n\n* Alpine3D: Alpine3D snow depth grids (25 m resolution) for two simulations with and without snow redistribution.\n* ARPS: 10 ARPS simulations (25 m horizontal resolution) with different model setups (wind direction, wind speed, stability).\n* LiDAR: Processed LiDAR PPI (D2_PPI_1h) and RHI (D2_cross_1h) across the valley with a hourly resolution for the period 27 October 2015 01:00 - 29 October 2015c 21:00 (spatial resolution: 25 m).\n* meteostations-dischma: Meteorological station data of two meteorological stations in the Dischma valley with 10 minute resolution for the period 28 October 2015 - 30 October 2015.\n* TLS: Snow depth change data (m) between 28 October 2015 and 30 October 2015 based on terrestrial laser scans.\n\nFor more details about the simulation and observation data, see Gerber et al., 2017.\n\n__Publication__: Gerber et al., 2017: A Close-Ridge Small-Scale Atmospheric Flow Field and its Influence on Snow Accumulation, submitted to JGR - Atmospheres.;46.700152853 9.852357673 46.739303111 9.935928682;Dischma Valley, Davos, Switzerland",
    "group": "envidat",
    "groups": [
        {
            "name": "envidat"
        }
    ],
    "name": "c3dd1031-3bf0-59a5-8cf5-d2d58ac36368",
    "notes": [
        "The data presented here corresponds to the publication \"A Close-Ridge Small-Scale Atmospheric Flow Field and its Influence on Snow Accumulation\" (Gerber et al., 2017), which investigates an eddy-like structure in the vicinity of the Sattelhorn in the Dischma valley (Davos Switzerland)  and its influence on snow accumulation. The dataset contains:\n\n* Alpine3D: Alpine3D snow depth grids (25 m resolution) for two simulations with and without snow redistribution.\n* ARPS: 10 ARPS simulations (25 m horizontal resolution) with different model setups (wind direction, wind speed, stability).\n* LiDAR: Processed LiDAR PPI (D2_PPI_1h) and RHI (D2_cross_1h) across the valley with a hourly resolution for the period 27 October 2015 01:00 - 29 October 2015c 21:00 (spatial resolution: 25 m).\n* meteostations-dischma: Meteorological station data of two meteorological stations in the Dischma valley with 10 minute resolution for the period 28 October 2015 - 30 October 2015.\n* TLS: Snow depth change data (m) between 28 October 2015 and 30 October 2015 based on terrestrial laser scans.\n\nFor more details about the simulation and observation data, see Gerber et al., 2017.\n\n__Publication__: Gerber et al., 2017: A Close-Ridge Small-Scale Atmospheric Flow Field and its Influence on Snow Accumulation, submitted to JGR - Atmospheres."
    ],
    "oai_identifier": [
        "oai:envidat.ch:361a9977-c156-485a-b77f-9a7a92e15bac"
    ],
    "oai_set": "",
    "spatial": "{\"type\":\"Polygon\",\"coordinates\":[[[9.852357673,46.700152853],[9.852357673,46.739303111],[9.935928682,46.739303111],[9.935928682,46.700152853],[9.852357673,46.700152853]]]}",
    "state": "active",
    "tags": [
        {
            "name": "LEE-SIDE FLOW FIELD"
        },
        {
            "name": "LIDAR"
        },
        {
            "name": "PREFERENTIAL DEPOSITION"
        },
        {
            "name": "TLS"
        }
    ],
    "title": [
        "DISCHMEX - Observations and simulations of the close-ridge small-scale atmospheric flow field and snow accumulation at Sattelhorn, Dischma valley, Davos, Switzerland."
    ],
    "url": ""
}