{
    "Contact": [
        "Christian Sommer"
    ],
    "Contributor": [
        "EnviDat"
    ],
    "DOI": "http://dx.doi.org/doi:10.16904/envidat.30",
    "DiscHierarchy": [
        "4.4.7",
        "Geosciences",
        "Environmental Research"
    ],
    "Discipline": "Environmental Research",
    "Format": [
        "TXT",
        "Link"
    ],
    "Language": [
        "English"
    ],
    "MetaDataAccess": "https://www.envidat.ch/oai?verb=GetRecord&metadataPrefix=datacite&identifier=oai:envidat.ch:b5c9438a-83c3-4afb-8f37-b3ec18d3db6e",
    "MetadataAccess": [
        "oai:envidat.ch:b5c9438a-83c3-4afb-8f37-b3ec18d3db6e"
    ],
    "PublicationTimestamp": "2018-07-01T11:59:59Z",
    "PublicationYear": [
        "2018"
    ],
    "Publisher": [
        "WSL Institute for Snow and Avalanche Research SLF, Davos, Switzerland"
    ],
    "RelatedIdentifier": [
        "https://www.envidat.ch/dataset/10-16904-envidat-30"
    ],
    "ResourceType": [
        "Dataset"
    ],
    "Rights": [
        "Open Data Commons Open Database License (ODbL)"
    ],
    "SpatialCoverage": "(72S,23E)",
    "TempCoverageBegin": 63679694399,
    "TempCoverageEnd": 63679694399,
    "TemporalCoverage": " point in time : 2018-12-06T11:59:59Z",
    "TemporalCoverage:BeginDate": "2018-12-06T11:59:59Z",
    "TemporalCoverage:EndDate": "2018-12-06T11:59:59Z",
    "author": [
        "Nander Wever",
        "Michael Lehning",
        "Christian Sommer",
        "Philip Crivelli"
    ],
    "fulltext": "oai:envidat.ch:b5c9438a-83c3-4afb-8f37-b3ec18d3db6e;2018-12-09T00:31:15Z;10.16904/envidat.30;Nander Wever;WSL Institute for Snow and Avalanche Research SLF, Davos, Switzerland;Michael Lehning;WSL Institute for Snow and Avalanche Research SLF, Davos, Switzerland and CRYOS, School of Architecture and Civil Engineering, \u00c9cole Polytechnique F\u00e9d\u00e9rale de Lausanne, Lausanne, Switzerland;Christian Sommer;WSL Institute for Snow and Avalanche Research SLF, Davos, Switzerland and CRYOS, School of Architecture and Civil Engineering, \u00c9cole Polytechnique F\u00e9d\u00e9rale de Lausanne, Lausanne, Switzerland;Philip Crivelli;WSL Institute for Snow and Avalanche Research SLF, Davos, Switzerland and CRYOS, School of Architecture and Civil Engineering, \u00c9cole Polytechnique F\u00e9d\u00e9rale de Lausanne, Lausanne, Switzerland;Expedition to Princess Elisabeth Antarctica Station, 2016/2017;2018;WSL Institute for Snow and Avalanche Research SLF, Davos, Switzerland;ANTARCTICA;DRIFTING SNOW;MASS FLUX;METEOROLOGICAL DATA;SNOWMICROPEN;TERRESTRIAL LASER SCANNING;Christian Sommer;2018-12-06;en;Dataset;https://www.envidat.ch/dataset/10-16904-envidat-30;3534 bytes;Link;TXT;1.0;Open Data Commons Open Database License (ODbL);This dataset contains the data acquired during the expedition to Princess Elisabeth Antarctica Station in December 2016 and January 2017. The dataset consits of meterorological data, drifting snow mass flux data, SnowMicroPen data and Terrestrial Laser Scanning data.\n\nPlease refer to the README for more information about the data.\n\nThis dataset is the basis of the following publication:\n\nSommer, C. G., Wever, N., Fierz, C., and Lehning, M.: Wind-packing of snow in Antarctica, The Cryosphere Discuss., https://doi.org/10.5194/tc-2018-36, in review, 2018.;-71.95 23.35;Princess Elisabeth Antarctica Station",
    "group": "envidat",
    "groups": [
        {
            "name": "envidat"
        }
    ],
    "name": "e10d0c67-c12c-52c6-81b7-4709efe3c0b5",
    "notes": [
        "This dataset contains the data acquired during the expedition to Princess Elisabeth Antarctica Station in December 2016 and January 2017. The dataset consits of meterorological data, drifting snow mass flux data, SnowMicroPen data and Terrestrial Laser Scanning data.\n\nPlease refer to the README for more information about the data.\n\nThis dataset is the basis of the following publication:\n\nSommer, C. G., Wever, N., Fierz, C., and Lehning, M.: Wind-packing of snow in Antarctica, The Cryosphere Discuss., https://doi.org/10.5194/tc-2018-36, in review, 2018."
    ],
    "oai_identifier": [
        "oai:envidat.ch:b5c9438a-83c3-4afb-8f37-b3ec18d3db6e"
    ],
    "oai_set": "",
    "spatial": "{\"type\":\"Polygon\",\"coordinates\":[[[23.35,-71.95],[23.35,-71.95],[23.35,-71.95],[23.35,-71.95],[23.35,-71.95]]]}",
    "state": "active",
    "tags": [
        {
            "name": "ANTARCTICA"
        },
        {
            "name": "DRIFTING SNOW"
        },
        {
            "name": "MASS FLUX"
        },
        {
            "name": "METEOROLOGICAL DATA"
        },
        {
            "name": "SNOWMICROPEN"
        },
        {
            "name": "TERRESTRIAL LASER SCANNING"
        }
    ],
    "title": [
        "Expedition to Princess Elisabeth Antarctica Station, 2016/2017"
    ],
    "url": ""
}