{
    "Contact": [
        "Foerster, Saskia",
        "L\u00f3pez-Taraz\u00f3n, Jos\u00e9 A.",
        "Helmholtz Centre for Environmental Research (UFZ)",
        "German Research Foundation",
        "Brosinsky, Arlena",
        "Elger, Kirsten",
        "Batalla, Ramon",
        "Bronstert, Axel",
        "Ebro Water Authorities",
        "Marie Curie Intra-European Fellowship",
        "Economy and Knowledge Department of the Catalan Government",
        "G\u00fcntner, Andreas",
        "Francke, Till",
        "Sommerer, Erik"
    ],
    "Contributor": [
        "Foerster, Saskia",
        "L\u00f3pez-Taraz\u00f3n, Jos\u00e9 A.",
        "Helmholtz Centre for Environmental Research (UFZ)",
        "German Research Foundation",
        "Brosinsky, Arlena",
        "Elger, Kirsten",
        "Batalla, Ramon",
        "Bronstert, Axel",
        "Ebro Water Authorities",
        "Marie Curie Intra-European Fellowship",
        "Economy and Knowledge Department of the Catalan Government",
        "G\u00fcntner, Andreas",
        "Francke, Till",
        "Sommerer, Erik"
    ],
    "DOI": "http://dx.doi.org/doi:10.5880/fidgeo.2017.003",
    "DiscHierarchy": [],
    "Discipline": "Not stated",
    "Format": [
        "application/x-zip-compressed",
        "application/pdf",
        "application/octet-stream"
    ],
    "Language": [
        "English"
    ],
    "MetaDataAccess": "http://doidb.wdc-terra.org/oaip/oai?verb=GetRecord&metadataPrefix=oai_datacite&identifier=oai:doidb.wdc-terra.org:6287",
    "MetadataAccess": [
        "oai:doidb.wdc-terra.org:6287"
    ],
    "PublicationTimestamp": "2017-07-01T11:59:59Z",
    "PublicationYear": [
        "2017"
    ],
    "Publisher": [
        "GFZ Data Services"
    ],
    "ResourceType": [
        "Dataset"
    ],
    "Rights": [
        "CC BY 4.0"
    ],
    "SpatialCoverage": "(42N-43N,0 E-1 E)",
    "TempCoverageBegin": 63632948399,
    "TempCoverageEnd": 63413578799,
    "TemporalCoverage": " period : ( 2017-06-13T11:59:59Z - 2010-07-01T11:59:59Z ) ",
    "TemporalCoverage:BeginDate": "2017-06-13T11:59:59Z",
    "TemporalCoverage:EndDate": "2010-07-01T11:59:59Z",
    "author": [
        "Foerster, Saskia",
        "L\u00f3pez-Taraz\u00f3n, Jos\u00e9 A.",
        "Brosinsky, Arlena",
        "Batalla, Ramon",
        "Bronstert, Axel",
        "G\u00fcntner, Andreas",
        "Francke, Till",
        "Sommerer, Erik"
    ],
    "fulltext": "oai:doidb.wdc-terra.org:6287;2017-10-04T14:21:34Z;DOIDB;DOIDB.FID;false;3;DOIDB.FID;10.5880/fidgeo.2017.003;Francke, Till;University of Potsdam, Institute of Earth and Environmental Science, Potsdam, Germany;Foerster, Saskia;GFZ German Research Centre for Geosciences, Section 1.4 Remote Sensing, Potsdam, Germany;Brosinsky, Arlena; University of Potsdam, Institute of Earth and Environmental Science, Potsdam, Germany; GFZ German Research Centre for Geosciences, Section 1.4 Remote Sensing, Potsdam, Germany;Sommerer, Erik;GFZ German Research Centre for Geosciences, Section 5.4 Hydrology, Potsdam, Germany;L\u00f3pez-Taraz\u00f3n, Jos\u00e9 A.;University of Potsdam, Institute of Earth and Environmental Science, Potsdam, Germany; Liverpool John Moores University, School of Natural Sciences and Psychology, Liverpool, UK; University of Lleida, Department of Environment and Soil Sciences, Fluvial Dynamics Research Group, Lleida, Spain; University of the Balearic Islands, Department of Geography, Palma, Spain;G\u00fcntner, Andreas;GFZ German Research Centre for Geosciences, Section 5.4 Hydrology; Potsdam, Germany; University of Potsdam; Institute of Earth and Environmental Science, Potsdam, Germany;Batalla, Ramon;University of Lleida, Department of Environment and Soil Sciences, Fluvial Dynamics Research Group, Lleida, Spain;Bronstert, Axel;University of Potsdam, Institute of Earth and Environmental Science, Potsdam, Germany;Hydro-sedimentological dataset for the mesoscale      mountainous Is\u00e1bena catchment, NE Spain;GFZ Data Services;2017;rainfall;discharge;suspended sediment concentration;soil spectroscopy;fingerprint properties;meso-scale;Francke, Till;University of Potsdam, Institute of Earth and Environmental Science, Potsdam, Germany;Francke, Till;University of Potsdam, Institute of Earth and Environmental Science, Potsdam, Germany;Francke, Till;University of Potsdam, Institute of Earth and Environmental Science, Potsdam, Germany;Foerster, Saskia;GFZ German Research Centre for Geosciences, Section 1.4 Remote Sensing, Potsdam, Germany;Foerster, Saskia;GFZ German Research Centre for Geosciences, Section 1.4 Remote Sensing, Potsdam, Germany;Brosinsky, Arlena; University of Potsdam, Institute of Earth and Environmental Science, Potsdam, Germany; GFZ German Research Centre for Geosciences, Section 1.4 Remote Sensing, Potsdam, Germany;Sommerer, Erik;GFZ German Research Centre for Geosciences, Section 5.4 Hydrology, Potsdam, Germany;L\u00f3pez-Taraz\u00f3n, Jos\u00e9 A.;University of Potsdam, Institute of Earth and Environmental Science, Potsdam, Germany; Liverpool John Moores University, School of Natural Sciences and Psychology, Liverpool, UK; University of Lleida, Department of Environment and Soil Sciences, Fluvial Dynamics Research Group, Lleida, Spain; University of the Balearic Islands, Department of Geography, Palma, Spain;G\u00fcntner, Andreas;GFZ German Research Centre for Geosciences, Section 5.4 Hydrology; Potsdam, Germany; University of Potsdam; Institute of Earth and Environmental Science, Potsdam, Germany;Batalla, Ramon;University of Lleida, Department of Environment and Soil Sciences, Fluvial Dynamics Research Group, Lleida, Spain;Batalla, Ramon;University of Lleida, Department of Environment and Soil Sciences, Fluvial Dynamics Research Group, Lleida, Spain;Bronstert, Axel;University of Potsdam, Institute of Earth and Environmental Science, Potsdam, Germany;Elger, Kirsten;0000-0001-5140-8602;GFZ German Research Center for Geosciences;German Research Foundation;German Research Foundation;Helmholtz Centre for Environmental Research (UFZ);Marie Curie Intra-European Fellowship;Economy and Knowledge Department of the Catalan Government;Ebro Water Authorities;Ebro Water Authorities;2017-06-13;2010/2016;eng;Dataset;DOI of ESSD Paper;10.1007/s11368-014-0927-z;10.1007/s11368-014-0925-1;10.1007/s11368-014-0992-3;10.1007/s11368-014-0990-5;10.1007/s11368-014-0961-x;10.1016/j.geomorph.2011.08.020;http://his.cuahsi.org/documents/ODM1.1DesignSpecifications.pdf;190270085 Bytes;7 Files;application/octet-stream;application/pdf;application/octet-stream;application/octet-stream;application/octet-stream;application/octet-stream;application/x-zip-compressed;CC BY 4.0;A comprehensive hydro-sedimentological dataset for the Is\u00e1bena catchment, NE Spain, for the period 2010-2016 is presented to analyse water and sediment fluxes in a Mediterranean meso-scale catchment. The dataset includes rainfall data from twelve rain gauges distributed within the study area complemented by meteorological data of twelve official meteo-stations. It comprises discharge data derived from water stage measurements as well as suspended sediment concentrations (SSC) at six gauging stations of the Is\u00e1bena river and its sub-catchments. ;42.1256 0.237 42.5807 0.6581;Is\u00e1bena catchment",
    "group": "fidgeo",
    "groups": [
        {
            "name": "fidgeo"
        }
    ],
    "name": "7e3f69c6-58d2-5e37-818f-05e88d792513",
    "notes": [
        "A comprehensive hydro-sedimentological dataset for the Is\u00e1bena catchment, NE Spain, for the period 2010-2016 is presented to analyse water and sediment fluxes in a Mediterranean meso-scale catchment. The dataset includes rainfall data from twelve rain gauges distributed within the study area complemented by meteorological data of twelve official meteo-stations. It comprises discharge data derived from water stage measurements as well as suspended sediment concentrations (SSC) at six gauging stations of the Is\u00e1bena river and its sub-catchments. "
    ],
    "oai_identifier": [
        "oai:doidb.wdc-terra.org:6287"
    ],
    "oai_set": [
        "DOIDB",
        "DOIDB.FID"
    ],
    "spatial": "{\"type\":\"Polygon\",\"coordinates\":[[[0.237,42.1256],[0.237,42.5807],[0.6581,42.5807],[0.6581,42.1256],[0.237,42.1256]]]}",
    "state": "active",
    "tags": [
        {
            "name": "rainfall"
        },
        {
            "name": "discharge"
        },
        {
            "name": "suspended sediment concentration"
        },
        {
            "name": "soil spectroscopy"
        },
        {
            "name": "fingerprint properties"
        },
        {
            "name": "meso-scale"
        }
    ],
    "title": [
        "Hydro-sedimentological dataset for the mesoscale      mountainous Is\u00e1bena catchment, NE Spain"
    ],
    "url": ""
}