{
    "Contact": [
        "Aarhus University (www.au.dk)",
        "Slots- og Kulturstyrelsen (www.slks.dk)"
    ],
    "DiscHierarchy": [],
    "Discipline": "Not stated",
    "Language": [
        "Danish"
    ],
    "MetaDataAccess": "https://www.archaeo.dk/ff/oai-pmh/??verb=GetRecord&metadataPrefix=oai_dc&identifier=00ab2967-86b9-5ed6-aa81-98e738389b15",
    "MetadataAccess": [
        "http://www.kulturarv.dk/fundogfortidsminder/Lokalitet/1049/"
    ],
    "OpenAccess": [
        "true"
    ],
    "Publisher": [
        "Aarhus University (www.au.dk)",
        "Slots- og Kulturstyrelsen (www.slks.dk)"
    ],
    "ResourceType": [
        "Dataset"
    ],
    "Rights": [
        "Public"
    ],
    "SpatialCoverage": [
        "14.792395,55.239139"
    ],
    "TemporalCoverage": [
        "Jernalder",
        "375,1066",
        "CYXX"
    ],
    "author": [
        "Bornholms Museum"
    ],
    "fulltext": "http://www.kulturarv.dk/fundogfortidsminder/Lokalitet/1049/;2020-03-06T17:00:01.743162+01:00;http://www.kulturarv.dk/fundogfortidsminder/Lokalitet/1049/;060105-46 Dahlegaard;Bornholms Museum;This record describes ancient sites and monuments as well archaeological excavations undertaken by Danish museums. Excerpt of the Danish description of events:\n1884      : Fundet 2 sammenh\u00e6ngende Guldst\u00e6nger, vistnok saakaldt Ringguld til Betalingsmiddel, nedlagt under en stor Sten; de siges at v\u00e6re indsendte til Museet for en 15-16 Aar siden [1865] gennem Amtmand Vedel. (Grundejeren er af den Mening, at der ligger mere Guld under en lignende Sten t\u00e6t derved).1884      : Fundet 2 sammenh\u00e6ngende Guldst\u00e6nger, vistnok saakaldt Ringguld til Betalingsmiddel, nedlagt under en stor Sten; de siges at v\u00e6re indsendte til Museet for en 15-16 Aar siden [1865] gennem Amtmand Vedel. (Grundejeren er af den Mening, at der ligger mere Guld under en lignende Sten t\u00e6t derved).\n;Slots- og Kulturstyrelsen (www.slks.dk);Aarhus University (www.au.dk);Dataset;060105-46;dan;Dahlegaard;14.792395,55.239139;Enkeltfund;Single find, Diverse features and objects;Jernalder;375,1066;CYXX;Public",
    "group": "slks2",
    "groups": [
        {
            "name": "slks2"
        }
    ],
    "name": "00ab2967-86b9-5ed6-aa81-98e738389b15",
    "notes": [
        "This record describes ancient sites and monuments as well archaeological excavations undertaken by Danish museums. Excerpt of the Danish description of events:\n1884      : Fundet 2 sammenh\u00e6ngende Guldst\u00e6nger, vistnok saakaldt Ringguld til Betalingsmiddel, nedlagt under en stor Sten; de siges at v\u00e6re indsendte til Museet for en 15-16 Aar siden [1865] gennem Amtmand Vedel. (Grundejeren er af den Mening, at der ligger mere Guld under en lignende Sten t\u00e6t derved).1884      : Fundet 2 sammenh\u00e6ngende Guldst\u00e6nger, vistnok saakaldt Ringguld til Betalingsmiddel, nedlagt under en stor Sten; de siges at v\u00e6re indsendte til Museet for en 15-16 Aar siden [1865] gennem Amtmand Vedel. (Grundejeren er af den Mening, at der ligger mere Guld under en lignende Sten t\u00e6t derved).\n"
    ],
    "oai_identifier": [
        "00ab2967-86b9-5ed6-aa81-98e738389b15"
    ],
    "oai_set": "",
    "state": "active",
    "tags": [
        {
            "name": "Enkeltfund"
        },
        {
            "name": "Single find"
        },
        {
            "name": "Diverse features objects"
        }
    ],
    "title": [
        "060105-46 Dahlegaard"
    ],
    "url": "http://www.kulturarv.dk/fundogfortidsminder/Lokalitet/1049/"
}