{
    "Contact": [
        "Aarhus University (www.au.dk)",
        "Slots- og Kulturstyrelsen (www.slks.dk)"
    ],
    "DiscHierarchy": [
        "1.1.4",
        "Ancient Cultures",
        "Classical Archaeology"
    ],
    "Discipline": "Classical_Archaeology",
    "Language": [],
    "MetaDataAccess": "https://www.archaeo.dk/ff/oai-pmh/??verb=GetRecord&metadataPrefix=oai_dc&identifier=0b09a015-124b-5465-9a95-b073f474bec2",
    "Publisher": [
        "Aarhus University (www.au.dk)",
        "Slots- og Kulturstyrelsen (www.slks.dk)"
    ],
    "ResourceType": [
        "dataset"
    ],
    "Rights": [
        "Public"
    ],
    "SpatialCoverage": [
        "14.792321708683962, 55.262935116903705"
    ],
    "TemporalCoverage": [
        "Oldtid",
        "250000 B.C.-1066 A.D.",
        "OXXX"
    ],
    "author": [
        "Bornholms Museum"
    ],
    "fulltext": "http://www.kulturarv.dk/fundogfortidsminder/Lokalitet/1042/;2020-03-06T17:00:01.743162+01:00;060105-39 Olsker;Bornholms Museum;This record describes ancient sites and monuments as well archaeological excavations undertaken by Danish museums. Excerpt of the Danish description of events:\n1884      : En aldeles bortf\u00f8rt Jordh\u00f8j, hvorfra mange tusende L\u00e6s Sand ere bortf\u00f8rte; Oldsager vides ikke at v\u00e6re fundne, og det har maaske blot v\u00e6ret en naturlig H\u00f8j.1884      : En aldeles bortf\u00f8rt Jordh\u00f8j, hvorfra mange tusende L\u00e6s Sand ere bortf\u00f8rte; Oldsager vides ikke at v\u00e6re fundne, og det har maaske blot v\u00e6ret en naturlig H\u00f8j.\n;Slots- og Kulturstyrelsen (www.slks.dk);Aarhus University (www.au.dk);dataset;060105-39;dk;Olsker;14.792321708683962, 55.262935116903705;Rundh\u00f8j;Round barrow, burial mound, Funerary;Oldtid;250000 B.C.-1066 A.D.;OXXX;Public",
    "group": "slks2",
    "groups": [
        {
            "name": "slks2"
        }
    ],
    "name": "0b09a015-124b-5465-9a95-b073f474bec2",
    "notes": [
        "This record describes ancient sites and monuments as well archaeological excavations undertaken by Danish museums. Excerpt of the Danish description of events:\n1884      : En aldeles bortf\u00f8rt Jordh\u00f8j, hvorfra mange tusende L\u00e6s Sand ere bortf\u00f8rte; Oldsager vides ikke at v\u00e6re fundne, og det har maaske blot v\u00e6ret en naturlig H\u00f8j.1884      : En aldeles bortf\u00f8rt Jordh\u00f8j, hvorfra mange tusende L\u00e6s Sand ere bortf\u00f8rte; Oldsager vides ikke at v\u00e6re fundne, og det har maaske blot v\u00e6ret en naturlig H\u00f8j.\n"
    ],
    "oai_identifier": [
        "0b09a015-124b-5465-9a95-b073f474bec2"
    ],
    "oai_set": "",
    "state": "active",
    "tags": [
        {
            "name": "Rundh\u00f8j"
        },
        {
            "name": "Round barrow"
        },
        {
            "name": "burial mound"
        },
        {
            "name": "Funerary"
        }
    ],
    "title": [
        "060105-39 Olsker"
    ],
    "url": ""
}