{
    "Contact": [
        "Aarhus University (www.au.dk)",
        "Slots- og Kulturstyrelsen (www.slks.dk)"
    ],
    "DiscHierarchy": [],
    "Discipline": "Not stated",
    "Language": [
        "Danish"
    ],
    "MetaDataAccess": "https://www.archaeo.dk/ff/oai-pmh/??verb=GetRecord&metadataPrefix=oai_dc&identifier=0b840adf-d1b0-50ab-8889-af2c460e9492",
    "MetadataAccess": [
        "http://www.kulturarv.dk/fundogfortidsminder/Lokalitet/156/"
    ],
    "OpenAccess": [
        "true"
    ],
    "Publisher": [
        "Aarhus University (www.au.dk)",
        "Slots- og Kulturstyrelsen (www.slks.dk)"
    ],
    "ResourceType": [
        "Dataset"
    ],
    "Rights": [
        "Public"
    ],
    "SpatialCoverage": [
        "14.734583,55.110549"
    ],
    "TemporalCoverage": [
        "Bronzealder",
        "-1700,-1101",
        "B\u00c6XX"
    ],
    "author": [
        "Bornholms Museum"
    ],
    "fulltext": "http://www.kulturarv.dk/fundogfortidsminder/Lokalitet/156/;2020-03-06T17:00:01.743162+01:00;http://www.kulturarv.dk/fundogfortidsminder/Lokalitet/156/;060301-38 Klippeg\u00e5rd;Bornholms Museum;This record describes ancient sites and monuments as well archaeological excavations undertaken by Danish museums. Excerpt of the Danish description of events:\n1879      : Udgravning af h\u00f8j indeholdende rester af en eller flere centralgrave d\u00e6kket af en eller flere stenl\u00e6gninger, der var forstyrret. Endvidere en hellekiste, der rummede en brandgrav fra bronzealderens per. III. I h\u00f8jens side var nedgravet et par kogegruber.1943      : H\u00f8j, 3 x 23 m. S\u00e6nkning i V-Siden n\u00e6r Toppen. Gr\u00e6skl\u00e6dt med Krat i Ager.1975      : Den pr. 28 januar 1944 p\u00e5 matr.nr. 25 Knudsker foretagne notering af fortidsmindet fr.nr.5233:35 bedes slettet, da gravh\u00f8jen er sl\u00f8jfet efter ark\u00e6ologisk unders\u00f8gelse i 1975.1975-11-05: Voksen mand.1879      : En mindre H\u00f8i - noget beskadiget. Paa Gaardens Jord skal der v\u00e6re fundet en hel Del \"Askekrukker\" i en lille naturlig Forh\u00f8jning.\n;Slots- og Kulturstyrelsen (www.slks.dk);Aarhus University (www.au.dk);Dataset;060301-38;dan;Klippeg\u00e5rd;14.734583,55.110549;Rundh\u00f8j;Round barrow, burial mound, Funerary;Bronzealder;-1700,-1101;B\u00c6XX;Public",
    "group": "slks2",
    "groups": [
        {
            "name": "slks2"
        }
    ],
    "name": "0b840adf-d1b0-50ab-8889-af2c460e9492",
    "notes": [
        "This record describes ancient sites and monuments as well archaeological excavations undertaken by Danish museums. Excerpt of the Danish description of events:\n1879      : Udgravning af h\u00f8j indeholdende rester af en eller flere centralgrave d\u00e6kket af en eller flere stenl\u00e6gninger, der var forstyrret. Endvidere en hellekiste, der rummede en brandgrav fra bronzealderens per. III. I h\u00f8jens side var nedgravet et par kogegruber.1943      : H\u00f8j, 3 x 23 m. S\u00e6nkning i V-Siden n\u00e6r Toppen. Gr\u00e6skl\u00e6dt med Krat i Ager.1975      : Den pr. 28 januar 1944 p\u00e5 matr.nr. 25 Knudsker foretagne notering af fortidsmindet fr.nr.5233:35 bedes slettet, da gravh\u00f8jen er sl\u00f8jfet efter ark\u00e6ologisk unders\u00f8gelse i 1975.1975-11-05: Voksen mand.1879      : En mindre H\u00f8i - noget beskadiget. Paa Gaardens Jord skal der v\u00e6re fundet en hel Del \"Askekrukker\" i en lille naturlig Forh\u00f8jning.\n"
    ],
    "oai_identifier": [
        "0b840adf-d1b0-50ab-8889-af2c460e9492"
    ],
    "oai_set": "",
    "state": "active",
    "tags": [
        {
            "name": "Rundh\u00f8j"
        },
        {
            "name": "Round barrow"
        },
        {
            "name": "burial mound"
        },
        {
            "name": "Funerary"
        }
    ],
    "title": [
        "060301-38 Klippeg\u00e5rd"
    ],
    "url": "http://www.kulturarv.dk/fundogfortidsminder/Lokalitet/156/"
}