{
    "Contact": [
        "Slots- og Kulturstyrelsen (www.slks.dk)",
        "Aarhus University (www.au.dk)"
    ],
    "DiscHierarchy": [],
    "Discipline": "Not stated",
    "Language": [],
    "MetaDataAccess": "https://www.archaeo.dk/ff/oai-pmh/??verb=GetRecord&metadataPrefix=oai_dc&identifier=1a829630-9a24-50a2-9836-91ff98e9d4d8",
    "Publisher": [
        "Slots- og Kulturstyrelsen (www.slks.dk)",
        "Aarhus University (www.au.dk)"
    ],
    "ResourceType": [
        "dataset"
    ],
    "Rights": [
        "Copyright \u00a9 Slots- og Kulturstyrelsen (www.slks.dk)."
    ],
    "author": [
        "Museum Lolland-Falster"
    ],
    "fulltext": "http://www.kulturarv.dk/fundogfortidsminder/Lokalitet/3108/;2020-03-06T17:00:01.743162+01:00;070304-23 Thors\u00f8;Museum Lolland-Falster;1993      : Fra Tuus Eskj\u00e6r Rantorp, Faxe, modtog Nationalmuseet i 1993 de sidste oldsager fra Thors\u00f8 Strand, udgravet i begyndelsen af 1900-tallet af l\u00e6ge J.P. Rasmussen. Imellem disse flintstykker l\u00e5 en stor Brommepil og en slebet tyndnakket flint\u00f8kse med p\u00e5skriften Thors\u00f8 Strand. Stykkerne har n\u00e6ppe med v\u00e6rkstedspladserne at g\u00f8re, men repr\u00e6senterer antagelig enkeltfund fra omr\u00e5det.1917      : Udgravning af bopladsomr\u00e5de med flintkoncentrationer (flinthugningspladser?) i indd\u00e6mmet vig.1918      : Fortsat udgravning med hj\u00e6lp af Friis Johansen, jvf. den endelige beretning, j.nr. 746/42. Publiceret i Aarb\u00f8ger 1918, s. 151-176.1993      : Fra Tuus Eskj\u00e6r Rantorp, Faxe, modtog Nationalmuseet i 1993 de sidste oldsager fra Thors\u00f8 Strand, udgravet i begyndelsen af 1900-tallet af l\u00e6ge J.P. Rasmussen. Imellem disse flintstykker l\u00e5 en stor Brommepil og en slebet tyndnakket flint\u00f8kse med p\u00e5skriften Thors\u00f8 Strand. Stykkerne har n\u00e6ppe med v\u00e6rkstedspladserne at g\u00f8re, men repr\u00e6senterer antagelig enkeltfund fra omr\u00e5det.1917      : Udgravning af bopladsomr\u00e5de med flintkoncentrationer (flinthugningspladser?) i indd\u00e6mmet vig.1918      : Fortsat udgravning med hj\u00e6lp af Friis Johansen, jvf. den endelige beretning, j.nr. 746/42. Publiceret i Aarb\u00f8ger 1918, s. 151-176.\n;Slots- og Kulturstyrelsen (www.slks.dk);Aarhus University (www.au.dk);dataset;070304-23;dk;Thors\u00f8;11.509805630471918, 54.640440752927795;Bos\u00e6ttelse, uspec undergruppe;Stenalder;250000 B.C.-3951 B.C.;Copyright \u00a9 Slots- og Kulturstyrelsen (www.slks.dk).",
    "group": "slks2",
    "groups": [
        {
            "name": "slks2"
        }
    ],
    "name": "1a829630-9a24-50a2-9836-91ff98e9d4d8",
    "notes": [
        "1993      : Fra Tuus Eskj\u00e6r Rantorp, Faxe, modtog Nationalmuseet i 1993 de sidste oldsager fra Thors\u00f8 Strand, udgravet i begyndelsen af 1900-tallet af l\u00e6ge J.P. Rasmussen. Imellem disse flintstykker l\u00e5 en stor Brommepil og en slebet tyndnakket flint\u00f8kse med p\u00e5skriften Thors\u00f8 Strand. Stykkerne har n\u00e6ppe med v\u00e6rkstedspladserne at g\u00f8re, men repr\u00e6senterer antagelig enkeltfund fra omr\u00e5det.1917      : Udgravning af bopladsomr\u00e5de med flintkoncentrationer (flinthugningspladser?) i indd\u00e6mmet vig.1918      : Fortsat udgravning med hj\u00e6lp af Friis Johansen, jvf. den endelige beretning, j.nr. 746/42. Publiceret i Aarb\u00f8ger 1918, s. 151-176.1993      : Fra Tuus Eskj\u00e6r Rantorp, Faxe, modtog Nationalmuseet i 1993 de sidste oldsager fra Thors\u00f8 Strand, udgravet i begyndelsen af 1900-tallet af l\u00e6ge J.P. Rasmussen. Imellem disse flintstykker l\u00e5 en stor Brommepil og en slebet tyndnakket flint\u00f8kse med p\u00e5skriften Thors\u00f8 Strand. Stykkerne har n\u00e6ppe med v\u00e6rkstedspladserne at g\u00f8re, men repr\u00e6senterer antagelig enkeltfund fra omr\u00e5det.1917      : Udgravning af bopladsomr\u00e5de med flintkoncentrationer (flinthugningspladser?) i indd\u00e6mmet vig.1918      : Fortsat udgravning med hj\u00e6lp af Friis Johansen, jvf. den endelige beretning, j.nr. 746/42. Publiceret i Aarb\u00f8ger 1918, s. 151-176.\n"
    ],
    "oai_identifier": [
        "1a829630-9a24-50a2-9836-91ff98e9d4d8"
    ],
    "oai_set": "",
    "state": "active",
    "tags": [
        {
            "name": "Bos\u00e6ttelse"
        },
        {
            "name": "uspec undergruppe"
        }
    ],
    "title": [
        "070304-23 Thors\u00f8"
    ]
}