{
    "DiscHierarchy": [
        "4.4.7",
        "Geosciences",
        "Environmental Research"
    ],
    "Discipline": "Environmental Research",
    "Format": [
        "inapplicable"
    ],
    "Language": [
        "English"
    ],
    "MetaDataAccess": "http://w3.avignon.inra.fr/geonetwork_anaee/srv/fre/csw-envriplus?verb=GetRecord&metadataPrefix=oai_dc&identifier=28e634ad-e4f4-5b54-a635-90c0c92d0692",
    "PublicationTimestamp": "2018-10-27T11:59:59Z",
    "PublicationYear": [
        "2018"
    ],
    "Publisher": [
        "AnaEE"
    ],
    "RelatedIdentifier": [
        "https://www.anaee-france.fr/en/about-us/introduction-to-anaee-france",
        "http://w3.avignon.inra.fr/geonetwork_anaee/srv/eng/catalog.search#/home",
        "http://w3.avignon.inra.fr/geonetwork_anaee/srv/eng/catalog.search#/metadata/864d43f1-fbba-4652-896d-61950f3d3a22",
        "http://w3.avignon.inra.fr/geonetwork_anaee/srv/eng/catalog.search#/metadata/ee520bf5-f86b-4064-97ce-8fb308d17efb",
        "http://w3.avignon.inra.fr/geonetwork_anaee/srv/eng/catalog.search#/metadata/59c9d6ec-057c-4ebf-b69f-35286784b9d2",
        "http://w3.avignon.inra.fr/geonetwork_anaee/srv/eng/catalog.search#/metadata/fd85ef74-988e-44c7-bb1b-c3655e6e5137",
        "http://w3.avignon.inra.fr/geonetwork_anaee/srv/eng/catalog.search#/metadata/c106e898-b8a4-4679-8e2b-eb8fc04e8337",
        "http://w3.avignon.inra.fr/geonetwork_anaee/srv/eng//resources.get?uuid=20b9aa10-5aa5-48e3-bb61-e5a5746796ae&fname=AnaEE_node5.png"
    ],
    "ResourceType": [
        "dataset"
    ],
    "Rights": [
        "intellectualPropertyRights",
        "intellectualPropertyRights"
    ],
    "SpatialCoverage": [
        "9.5 41.3",
        "-5.7 51"
    ],
    "fulltext": "20b9aa10-5aa5-48e3-bb61-e5a5746796ae;2018-10-27T08:49:34;Plateforme de mod\u00e9lisation et services de gestion des donn\u00e9es de AnaEE-France;dataset;France;Installations de suivi environnemental;plateforme de mod\u00e9lisation;base de donn\u00e9es;syst\u00e8me d'information;biodiversit\u00e9;imagerie;propri\u00e9t\u00e9 chimique de l'air;m\u00e9t\u00e9orologie;amendement organique;biologie du sol;flux de surface;chimie du sol;propri\u00e9t\u00e9 chimique de l'eau;v\u00e9g\u00e9tation;biologie de l'eau;physique du sol;paillis;gestion des \u00e9cosyst\u00e8mes;propri\u00e9t\u00e9 physique de l'eau;structure;inapplicable;AnaEE-France is the French national infrastructure devoted to the study of continental ecosystems and their biodiversity. It offers experimental facilities in controlled, semi-natural or natural environments, analysis platforms and shared instruments as well as modeling platforms and database Information Systems.\nModeling platforms are facilities specialized in developing models to support the projects run by AnaEE.  They streamline model development by providing the necessary hardware and software, as well as the access to expertise, datasets and modelling libraries. Two types of platforms are or will be provided: i) model factories which are nationally supported software platforms with advanced and well-established facilities providing users access to general and extensible modeling resources and ii) Modeling solution platforms which are implemented as self-contained software solutions that model specific aspects of ecosystem function and are centered on a well-established and supported model development team with a strong community of users.\nBoth types are used to exploit mathematical models to test and develop our understanding of the complex quantitative relationships between processes within ecosystems, the interactions with their environments, and their functioning and behaviour under various pressures.\n\nDatabase Information systems have been developed for the management of the data produced by the AnaEE-F experimental facilities. These IS rely on two main architectural models : databases for long term experiments (in natura) and databases for short to middle term experiments (mostly in ecotrons and mesocosms)\n\nBased on a distributed architecture, the overall AnaEE-F IS develops a semantic interoperability of modeling platforms and database IS and provides portals for the discovery and the exploitation of these resources.;AnaEE-France is the French national infrastructure devoted to the study of continental ecosystems and their biodiversity. It offers experimental facilities in controlled, semi-natural or natural environments, analysis platforms and shared instruments as well as modeling platforms and database Information Systems.\nModeling platforms are facilities specialized in developing models to support the projects run by AnaEE.  They streamline model development by providing the necessary hardware and software, as well as the access to expertise, datasets and modelling libraries. Two types of platforms are or will be provided: i) model factories which are nationally supported software platforms with advanced and well-established facilities providing users access to general and extensible modeling resources and ii) Modeling solution platforms which are implemented as self-contained software solutions that model specific aspects of ecosystem function and are centered on a well-established and supported model development team with a strong community of users.\nBoth types are used to exploit mathematical models to test and develop our understanding of the complex quantitative relationships between processes within ecosystems, the interactions with their environments, and their functioning and behaviour under various pressures.\n\nDatabase Information systems have been developed for the management of the data produced by the AnaEE-F experimental facilities. These IS rely on two main architectural models : databases for long term experiments (in natura) and databases for short to middle term experiments (mostly in ecotrons and mesocosms)\n\nBased on a distributed architecture, the overall AnaEE-F IS develops a semantic interoperability of modeling platforms and database IS and provides portals for the discovery and the exploitation of these resources.;intellectualPropertyRights;intellectualPropertyRights;eng;inapplicable;9.5 41.3;-5.7 51;https://www.anaee-france.fr/en/about-us/introduction-to-anaee-france;http://w3.avignon.inra.fr/geonetwork_anaee/srv/eng/catalog.search#/home;http://w3.avignon.inra.fr/geonetwork_anaee/srv/eng/catalog.search#/metadata/864d43f1-fbba-4652-896d-61950f3d3a22;http://w3.avignon.inra.fr/geonetwork_anaee/srv/eng/catalog.search#/metadata/ee520bf5-f86b-4064-97ce-8fb308d17efb;http://w3.avignon.inra.fr/geonetwork_anaee/srv/eng/catalog.search#/metadata/59c9d6ec-057c-4ebf-b69f-35286784b9d2;http://w3.avignon.inra.fr/geonetwork_anaee/srv/eng/catalog.search#/metadata/fd85ef74-988e-44c7-bb1b-c3655e6e5137;http://w3.avignon.inra.fr/geonetwork_anaee/srv/eng/catalog.search#/metadata/c106e898-b8a4-4679-8e2b-eb8fc04e8337;http://w3.avignon.inra.fr/geonetwork_anaee/srv/eng//resources.get?uuid=20b9aa10-5aa5-48e3-bb61-e5a5746796ae&fname=AnaEE_node5.png",
    "group": "anaee",
    "groups": [
        {
            "name": "anaee"
        }
    ],
    "name": "28e634ad-e4f4-5b54-a635-90c0c92d0692",
    "notes": [
        "AnaEE-France is the French national infrastructure devoted to the study of continental ecosystems and their biodiversity. It offers experimental facilities in controlled, semi-natural or natural environments, analysis platforms and shared instruments as well as modeling platforms and database Information Systems.\nModeling platforms are facilities specialized in developing models to support the projects run by AnaEE.  They streamline model development by providing the necessary hardware and software, as well as the access to expertise, datasets and modelling libraries. Two types of platforms are or will be provided: i) model factories which are nationally supported software platforms with advanced and well-established facilities providing users access to general and extensible modeling resources and ii) Modeling solution platforms which are implemented as self-contained software solutions that model specific aspects of ecosystem function and are centered on a well-established and supported model development team with a strong community of users.\nBoth types are used to exploit mathematical models to test and develop our understanding of the complex quantitative relationships between processes within ecosystems, the interactions with their environments, and their functioning and behaviour under various pressures.\n\nDatabase Information systems have been developed for the management of the data produced by the AnaEE-F experimental facilities. These IS rely on two main architectural models : databases for long term experiments (in natura) and databases for short to middle term experiments (mostly in ecotrons and mesocosms)\n\nBased on a distributed architecture, the overall AnaEE-F IS develops a semantic interoperability of modeling platforms and database IS and provides portals for the discovery and the exploitation of these resources."
    ],
    "oai_identifier": [
        "28e634ad-e4f4-5b54-a635-90c0c92d0692"
    ],
    "oai_set": "",
    "state": "active",
    "tags": [
        {
            "name": "France"
        },
        {
            "name": "Installations de suivi environnemental"
        },
        {
            "name": "Installations de suivi environnemental"
        },
        {
            "name": "Installations de suivi environnemental"
        },
        {
            "name": "Installations de suivi environnemental"
        },
        {
            "name": "Installations de suivi environnemental"
        },
        {
            "name": "imagerie"
        },
        {
            "name": "imagerie"
        },
        {
            "name": "imagerie"
        },
        {
            "name": "amendement organique"
        },
        {
            "name": "biologie du sol"
        },
        {
            "name": "flux de surface"
        }
    ],
    "title": [
        "Plateforme de mod\u00e9lisation et services de gestion des donn\u00e9es de AnaEE-France"
    ],
    "url": ""
}