{
    "Contact": [
        "Materials Cloud"
    ],
    "DOI": "http://dx.doi.org/doi:10.24435/materialscloud:2018.0017/v2",
    "DiscHierarchy": [
        "5.3",
        "Engineering Sciences",
        "Materials Science and Engineeringy"
    ],
    "Discipline": "Materials Science And Engineering",
    "Language": [
        "English"
    ],
    "MetaDataAccess": "https://archive.materialscloud.org/xml?verb=GetRecord&metadataPrefix=oai_dc&identifier=oai:materialscloud.org:2018.0017/v2",
    "MetadataAccess": [
        "oai:materialscloud.org:2018.0017/v2"
    ],
    "OpenAccess": "true",
    "PublicationTimestamp": "2018-11-29T11:59:59Z",
    "PublicationYear": [
        "2018"
    ],
    "Publisher": [
        "Materials Cloud"
    ],
    "ResourceType": [
        "Dataset"
    ],
    "Rights": [
        "Creative Commons Attribution 4.0 International https://creativecommons.org/licenses/by/4.0/legalcode",
        "info:eu-repo/semantics/openAccess"
    ],
    "author": [
        "Ongari, Daniele",
        "Keskin, Seda",
        "Kadioglu, Ozge",
        "Smit, Berend",
        "Boyd, Peter G.",
        "Mace, Amber K."
    ],
    "fulltext": "oai:materialscloud.org:2018.0017/v2;2019-06-12Z;DOI;Dataset;Ongari, Daniele;Boyd, Peter G.;Mace, Amber K.;Smit, Berend;Kadioglu, Ozge;Keskin, Seda;Evaluating charge equilibration methods to generate electrostatic fields in nanoporous materials;Materials Cloud;2018-11-29;Creative Commons Attribution 4.0 International https://creativecommons.org/licenses/by/4.0/legalcode;info:eu-repo/semantics/openAccess;partial charges;Qeq;charge equilibration methods;MARVEL;doi:10.24435/materialscloud:2018.0017/v2;https://archive.materialscloud.org/2018.0017/v2;en;Charge equilibration (Qeq) methods can estimate the electrostatic potential of molecules and periodic frameworks by assigning point charges to each atom, using only a small fraction of the resources needed to compute density functional (DFT)-derived charges. This makes possible, for example, the computational screening of thousands of microporous structures to assess their performance for the adsorption of polar molecules. Recently, different variants of the original Qeq scheme were proposed to improve the quality of the computed point charges. One focus of this research was to improve the gas adsorption predictions in Metal Organic Frameworks (MOFs), for which many different structures are available. In this work, we review the evolution of the method from the original Qeq scheme, understanding the role of the different modifications on the final output. We evaluated the result of combining different protocols and set of parameters, by comparing the Qeq charges with high quality DFT-derived DDEC charges for 2338 MOF structures. We focused on the systematic errors that are attributable to specific atom types to quantify the final precision that one can expect from Qeq methods in the context of gas adsorption where the electrostatic potential plays a significant role, namely CO2 and H2S adsorption. In conclusion, both the type of algorithm and the input parameters have a large impact on the resulting charges and we draw some guidelines to help the user to choose the proper combination of the two for obtaining a meaningful set of charges. We show that, considering this set of MOFs, the accuracy of the original Qeq scheme is often still comparable with the most recent variants, even if it clearly fails in the presence of certain atom types, such as alkali metals.<br/>\n<br/>\nVersion 2 of the record adds the data underlying the figures in CSV format.",
    "group": "materialscloud",
    "groups": [
        {
            "name": "materialscloud"
        }
    ],
    "name": "00f06222-1144-52e1-8b8d-a2745eaf95f3",
    "notes": [
        "Charge equilibration (Qeq) methods can estimate the electrostatic potential of molecules and periodic frameworks by assigning point charges to each atom, using only a small fraction of the resources needed to compute density functional (DFT)-derived charges. This makes possible, for example, the computational screening of thousands of microporous structures to assess their performance for the adsorption of polar molecules. Recently, different variants of the original Qeq scheme were proposed to improve the quality of the computed point charges. One focus of this research was to improve the gas adsorption predictions in Metal Organic Frameworks (MOFs), for which many different structures are available. In this work, we review the evolution of the method from the original Qeq scheme, understanding the role of the different modifications on the final output. We evaluated the result of combining different protocols and set of parameters, by comparing the Qeq charges with high quality DFT-derived DDEC charges for 2338 MOF structures. We focused on the systematic errors that are attributable to specific atom types to quantify the final precision that one can expect from Qeq methods in the context of gas adsorption where the electrostatic potential plays a significant role, namely CO2 and H2S adsorption. In conclusion, both the type of algorithm and the input parameters have a large impact on the resulting charges and we draw some guidelines to help the user to choose the proper combination of the two for obtaining a meaningful set of charges. We show that, considering this set of MOFs, the accuracy of the original Qeq scheme is often still comparable with the most recent variants, even if it clearly fails in the presence of certain atom types, such as alkali metals.<br/>\n<br/>\nVersion 2 of the record adds the data underlying the figures in CSV format."
    ],
    "oai_identifier": [
        "oai:materialscloud.org:2018.0017/v2"
    ],
    "oai_set": [
        "DOI"
    ],
    "state": "active",
    "tags": [
        {
            "name": "partial charges"
        },
        {
            "name": "Qeq"
        },
        {
            "name": "charge equilibration methods"
        },
        {
            "name": "MARVEL"
        }
    ],
    "title": [
        "Evaluating charge equilibration methods to generate electrostatic fields in nanoporous materials"
    ],
    "url": "https://archive.materialscloud.org/2018.0017/v2"
}