{
    "Contact": [
        "Materials Cloud"
    ],
    "DOI": "http://dx.doi.org/doi:10.24435/materialscloud:2017.0001/v1",
    "DiscHierarchy": [
        "5.3",
        "Engineering Sciences",
        "Materials Science and Engineeringy"
    ],
    "Discipline": "Materials Science And Engineering",
    "Language": [
        "English"
    ],
    "MetaDataAccess": "https://archive.materialscloud.org/xml?verb=GetRecord&metadataPrefix=oai_dc&identifier=oai:materialscloud.org:2017.0001/v1",
    "MetadataAccess": [
        "oai:materialscloud.org:2017.0001/v1"
    ],
    "OpenAccess": "true",
    "PublicationTimestamp": "2017-03-14T11:59:59Z",
    "PublicationYear": [
        "2017"
    ],
    "Publisher": [
        "Materials Cloud"
    ],
    "ResourceType": [
        "Dataset"
    ],
    "Rights": [
        "Creative Commons Attribution 4.0 International https://creativecommons.org/licenses/by/4.0/legalcode",
        "info:eu-repo/semantics/openAccess"
    ],
    "author": [
        "Barthel, Senja D.",
        "Smit, Berend",
        "Lee, Yongjin",
        "Moosavi, S. Mohamad",
        "D\u0142otko, Pawe\u0142",
        "Hess, Kathryn"
    ],
    "fulltext": "oai:materialscloud.org:2017.0001/v1;2019-06-12Z;DOI;Dataset;Lee, Yongjin;Barthel, Senja D.;D\u0142otko, Pawe\u0142;Moosavi, S. Mohamad;Hess, Kathryn;Smit, Berend;Barcodes for nanoporous materials;Materials Cloud;2017-03-14;Creative Commons Attribution 4.0 International https://creativecommons.org/licenses/by/4.0/legalcode;info:eu-repo/semantics/openAccess;zeolites;metal organic frameworks;nanoporous materials;topological data analysis;persistence homology;MARVEL;doi:10.24435/materialscloud:2017.0001/v1;https://archive.materialscloud.org/2017.0001/v1;en;In most applications of nanoporous materials the pore structure is as important as the chemical composition as a determinant of performance. For example, one can alter performance in applications like carbon capture or methane storage by orders of magnitude by only modifying the pore structure. For these applications it is therefore important to identify the optimal pore geometry and use this information to find similar materials. However, the mathematical language and tools to identify materials with similar pore structures, but different composition, has been lacking. Recently, we developed a pore recognition approach to quantify similarity of pore structures using topological data analysis. Barcodes generated with using this approach allow us to identify materials with similar pore geometries, and to screen for materials that are similar to given top-performing structures. This database has barcodes for zeolites, metal organic frameworks, and zeolitic imidazolate frameworks.",
    "group": "materialscloud",
    "groups": [
        {
            "name": "materialscloud"
        }
    ],
    "name": "0180b5cb-bc62-5021-bff4-59e62ca18efb",
    "notes": [
        "In most applications of nanoporous materials the pore structure is as important as the chemical composition as a determinant of performance. For example, one can alter performance in applications like carbon capture or methane storage by orders of magnitude by only modifying the pore structure. For these applications it is therefore important to identify the optimal pore geometry and use this information to find similar materials. However, the mathematical language and tools to identify materials with similar pore structures, but different composition, has been lacking. Recently, we developed a pore recognition approach to quantify similarity of pore structures using topological data analysis. Barcodes generated with using this approach allow us to identify materials with similar pore geometries, and to screen for materials that are similar to given top-performing structures. This database has barcodes for zeolites, metal organic frameworks, and zeolitic imidazolate frameworks."
    ],
    "oai_identifier": [
        "oai:materialscloud.org:2017.0001/v1"
    ],
    "oai_set": [
        "DOI"
    ],
    "state": "active",
    "tags": [
        {
            "name": "zeolites"
        },
        {
            "name": "metal organic frameworks"
        },
        {
            "name": "nanoporous materials"
        },
        {
            "name": "topological data analysis"
        },
        {
            "name": "persistence homology"
        },
        {
            "name": "MARVEL"
        }
    ],
    "title": [
        "Barcodes for nanoporous materials"
    ],
    "url": "https://archive.materialscloud.org/2017.0001/v1"
}