{
    "Contact": [
        "Materials Cloud"
    ],
    "DOI": "http://dx.doi.org/doi:10.24435/materialscloud:2019.0015/v1",
    "DiscHierarchy": [
        "5.3",
        "Engineering Sciences",
        "Materials Science and Engineeringy"
    ],
    "Discipline": "Materials Science And Engineering",
    "Language": [
        "English"
    ],
    "MetaDataAccess": "https://archive.materialscloud.org/xml?verb=GetRecord&metadataPrefix=oai_dc&identifier=oai:materialscloud.org:2019.0015/v1",
    "MetadataAccess": [
        "oai:materialscloud.org:2019.0015/v1"
    ],
    "OpenAccess": "true",
    "PublicationTimestamp": "2019-05-01T11:59:59Z",
    "PublicationYear": [
        "2019"
    ],
    "Publisher": [
        "Materials Cloud"
    ],
    "ResourceType": [
        "Dataset"
    ],
    "Rights": [
        "Creative Commons Attribution 4.0 International https://creativecommons.org/licenses/by/4.0/legalcode",
        "info:eu-repo/semantics/openAccess"
    ],
    "author": [
        "Mamun, Osman",
        "Winther, Kirsten",
        "Boes, Jacob",
        "Bligaard, Thomas"
    ],
    "fulltext": "oai:materialscloud.org:2019.0015/v1;2019-06-12Z;DOI;Dataset;Mamun, Osman;Winther, Kirsten;Boes, Jacob;Bligaard, Thomas;High-throughput calculations of catalytic properties of bimetallic alloy surfaces;Materials Cloud;2019-05-01;Creative Commons Attribution 4.0 International https://creativecommons.org/licenses/by/4.0/legalcode;info:eu-repo/semantics/openAccess;DFT;Heterogeneous catalysis;Chemisorption;surfaces;doi:10.24435/materialscloud:2019.0015/v1;https://archive.materialscloud.org/2019.0015/v1;en;We present a large dataset of adsorption of H, C, N, O and S onto more than 2,000 metallic and bimetallic alloy surfaces, consisting of approximately 90,000 DFT calculations performed in Quantum Espresso. The alloys are constructed from all possible combinations of 37 metals into AB and A3B stoichiometries, in the L1_0 and L1_2 structures respectively, where the 37 metals in the A1 structure are included as well. Slabs are cleaved along the 111 facet for A1 and L1_2 and along the 101 facet for L1_0, and all possible adsorption sites are sampled. In addition to the monoatomic adsorbates, adsorption of CH, CH2, CH3, NH, NH2, OH, H2O and SH  is sampled for a smaller subset of alloys.",
    "group": "materialscloud",
    "groups": [
        {
            "name": "materialscloud"
        }
    ],
    "name": "0916e202-dba7-51ff-bdf4-313236feec32",
    "notes": [
        "We present a large dataset of adsorption of H, C, N, O and S onto more than 2,000 metallic and bimetallic alloy surfaces, consisting of approximately 90,000 DFT calculations performed in Quantum Espresso. The alloys are constructed from all possible combinations of 37 metals into AB and A3B stoichiometries, in the L1_0 and L1_2 structures respectively, where the 37 metals in the A1 structure are included as well. Slabs are cleaved along the 111 facet for A1 and L1_2 and along the 101 facet for L1_0, and all possible adsorption sites are sampled. In addition to the monoatomic adsorbates, adsorption of CH, CH2, CH3, NH, NH2, OH, H2O and SH  is sampled for a smaller subset of alloys."
    ],
    "oai_identifier": [
        "oai:materialscloud.org:2019.0015/v1"
    ],
    "oai_set": [
        "DOI"
    ],
    "state": "active",
    "tags": [
        {
            "name": "DFT"
        },
        {
            "name": "Heterogeneous catalysis"
        },
        {
            "name": "Chemisorption"
        },
        {
            "name": "surfaces"
        }
    ],
    "title": [
        "High-throughput calculations of catalytic properties of bimetallic alloy surfaces"
    ],
    "url": "https://archive.materialscloud.org/2019.0015/v1"
}