{
    "Contact": [
        "Materials Cloud"
    ],
    "DOI": "http://dx.doi.org/doi:10.24435/materialscloud:2018.0021/v1",
    "DiscHierarchy": [
        "5.3",
        "Engineering Sciences",
        "Materials Science and Engineeringy"
    ],
    "Discipline": "Materials Science And Engineering",
    "Language": [
        "English"
    ],
    "MetaDataAccess": "https://archive.materialscloud.org/xml?verb=GetRecord&metadataPrefix=oai_dc&identifier=oai:materialscloud.org:2018.0021/v1",
    "MetadataAccess": [
        "oai:materialscloud.org:2018.0021/v1"
    ],
    "OpenAccess": "true",
    "PublicationTimestamp": "2018-12-11T11:59:59Z",
    "PublicationYear": [
        "2018"
    ],
    "Publisher": [
        "Materials Cloud"
    ],
    "ResourceType": [
        "Dataset"
    ],
    "Rights": [
        "Creative Commons Attribution 4.0 International https://creativecommons.org/licenses/by/4.0/legalcode",
        "info:eu-repo/semantics/openAccess"
    ],
    "author": [
        "Steinr\u00fcck, Hans-Peter ",
        "Hirsch, Andreas ",
        "Wild, Stefan ",
        "Vidal\u2013Moya, Jos\u00e9 Alejandro ",
        "Hauke, Frank ",
        " Maier, Florian",
        "Dom\u00e9nech\u2013Carb\u00f3, Antonio ",
        "Abell\u00e1n, Gonzalo ",
        "Shin, Sunghwan ",
        "Leyva\u2013P\u00e9rez, Antonio ",
        "Varela, Maria ",
        "J. Heller, Bettina S.",
        "Lloret, Vicent ",
        "Rivero\u2013Crespo, Miguel \u00c1ngel "
    ],
    "fulltext": "oai:materialscloud.org:2018.0021/v1;2019-06-12Z;DOI;Dataset;Lloret, Vicent ;Rivero\u2013Crespo, Miguel \u00c1ngel ;Vidal\u2013Moya, Jos\u00e9 Alejandro ;Wild, Stefan ;Dom\u00e9nech\u2013Carb\u00f3, Antonio ;J. Heller, Bettina S.;Shin, Sunghwan ;Steinr\u00fcck, Hans-Peter ; Maier, Florian;Hauke, Frank ;Varela, Maria ;Hirsch, Andreas ;Leyva\u2013P\u00e9rez, Antonio ;Abell\u00e1n, Gonzalo ;Few layer 2D pnictogens catalyze the alkylation of soft nucleophiles with esters.   ;Materials Cloud;2018-12-11;Creative Commons Attribution 4.0 International https://creativecommons.org/licenses/by/4.0/legalcode;info:eu-repo/semantics/openAccess;antimonene;Black phosphorous;alkylation;esters;ionic liquids;doi:10.24435/materialscloud:2018.0021/v1;https://archive.materialscloud.org/2018.0021/v1;en;Group 15 elements in zero oxidation state (P, As, Sb and Bi), also called pnictogens, are rarely used in catalysis due to the difficulties associated in preparing well\u2013structured and stable materials. Here, we report on the synthesis of highly exfoliated, few layer 2D phosphorene and antimonene in zero oxidation state, suspended in an ionic liquid, with the native atoms ready to interact with external reagents while avoiding aerobic or aqueous decomposition pathways, and on their use as efficient catalysts for the alkylation of nucleophiles with esters. The few layer pnictogen material circumvents the extremely harsh reaction conditions associated to previous superacid\u2013catalyzed alkylations, by enabling an alternative mechanism on surface, protected from the water and air by the ionic liquid. These 2D catalysts allow the alkylation of a variety of acid\u2013sensitive organic molecules and giving synthetic relevancy to the use of simple esters as alkylating agents. ",
    "group": "materialscloud",
    "groups": [
        {
            "name": "materialscloud"
        }
    ],
    "name": "509d4f47-ddeb-5980-898a-680ac17e3668",
    "notes": [
        "Group 15 elements in zero oxidation state (P, As, Sb and Bi), also called pnictogens, are rarely used in catalysis due to the difficulties associated in preparing well\u2013structured and stable materials. Here, we report on the synthesis of highly exfoliated, few layer 2D phosphorene and antimonene in zero oxidation state, suspended in an ionic liquid, with the native atoms ready to interact with external reagents while avoiding aerobic or aqueous decomposition pathways, and on their use as efficient catalysts for the alkylation of nucleophiles with esters. The few layer pnictogen material circumvents the extremely harsh reaction conditions associated to previous superacid\u2013catalyzed alkylations, by enabling an alternative mechanism on surface, protected from the water and air by the ionic liquid. These 2D catalysts allow the alkylation of a variety of acid\u2013sensitive organic molecules and giving synthetic relevancy to the use of simple esters as alkylating agents. "
    ],
    "oai_identifier": [
        "oai:materialscloud.org:2018.0021/v1"
    ],
    "oai_set": [
        "DOI"
    ],
    "state": "active",
    "tags": [
        {
            "name": "antimonene"
        },
        {
            "name": "Black phosphorous"
        },
        {
            "name": "alkylation"
        },
        {
            "name": "esters"
        },
        {
            "name": "ionic liquids"
        }
    ],
    "title": [
        "Few layer 2D pnictogens catalyze the alkylation of soft nucleophiles with esters.   "
    ],
    "url": "https://archive.materialscloud.org/2018.0021/v1"
}