{
    "Contact": [
        "Materials Cloud"
    ],
    "DOI": "http://dx.doi.org/doi:10.24435/materialscloud:2019.0008/v1",
    "DiscHierarchy": [
        "5.3",
        "Engineering Sciences",
        "Materials Science and Engineeringy"
    ],
    "Discipline": "Materials Science And Engineering",
    "Language": [
        "English"
    ],
    "MetaDataAccess": "https://archive.materialscloud.org/xml?verb=GetRecord&metadataPrefix=oai_dc&identifier=oai:materialscloud.org:2019.0008/v1",
    "MetadataAccess": [
        "oai:materialscloud.org:2019.0008/v1"
    ],
    "OpenAccess": "true",
    "PublicationTimestamp": "2019-02-12T11:59:59Z",
    "PublicationYear": [
        "2019"
    ],
    "Publisher": [
        "Materials Cloud"
    ],
    "ResourceType": [
        "Dataset"
    ],
    "Rights": [
        "Creative Commons Attribution 4.0 International https://creativecommons.org/licenses/by/4.0/legalcode",
        "info:eu-repo/semantics/openAccess"
    ],
    "author": [
        "Kozinsky, Boris",
        "Marzari, Nicola",
        "Musaelian, Albert",
        "Kahle, Leonid"
    ],
    "fulltext": "oai:materialscloud.org:2019.0008/v1;2019-06-12Z;DOI;Dataset;Kahle, Leonid;Musaelian, Albert;Marzari, Nicola;Kozinsky, Boris;Unsupervised landmark analysis for jump detection in molecular dynamics simulations;Materials Cloud;2019-02-12;Creative Commons Attribution 4.0 International https://creativecommons.org/licenses/by/4.0/legalcode;info:eu-repo/semantics/openAccess;molecular dynamics;site analysis;tracer diffusion;doi:10.24435/materialscloud:2019.0008/v1;https://archive.materialscloud.org/2019.0008/v1;en;Molecular dynamics is a versatile and powerful method to study diffusion in solid-state ionic conductors, requiring minimal prior knowledge of equilibrium or transition states of the system&#39;s free energy surface. However, the analysis of trajectories for relevant but rare events, such as a jump of the diffusing mobile ion, is still rather cumbersome, requiring prior knowledge of the diffusive process in order to get meaningful results. In this work we present a novel approach to detect the relevant events in a diffusive system without assuming prior information regarding the underlying process. We start from a projection of the atomic coordinates into a landmark basis to identify the dominant features in a mobile ion&#39;s environment. Subsequent clustering in landmark space enables a discretization of any trajectory into a sequence of distinct states. As a final step, the use of the Smooth Overlap of Atomic Positions descriptor allows distinguishing between different environments in a straightforward way. We apply this algorithm to ten Li-ionic systems and conduct in-depth analyses of cubic Li7La3Zr2O12, tetragonal Li10GeP2S12, and the \u03b2-eucryptite LiAlSiO4. We compare our results to existing methods, underscoring strong points, weaknesses, and insights into the diffusive behavior of the ionic conduction in the materials investigated. ",
    "group": "materialscloud",
    "groups": [
        {
            "name": "materialscloud"
        }
    ],
    "name": "8c320f3d-cd5a-5bbb-85c7-fb8117a1b80f",
    "notes": [
        "Molecular dynamics is a versatile and powerful method to study diffusion in solid-state ionic conductors, requiring minimal prior knowledge of equilibrium or transition states of the system&#39;s free energy surface. However, the analysis of trajectories for relevant but rare events, such as a jump of the diffusing mobile ion, is still rather cumbersome, requiring prior knowledge of the diffusive process in order to get meaningful results. In this work we present a novel approach to detect the relevant events in a diffusive system without assuming prior information regarding the underlying process. We start from a projection of the atomic coordinates into a landmark basis to identify the dominant features in a mobile ion&#39;s environment. Subsequent clustering in landmark space enables a discretization of any trajectory into a sequence of distinct states. As a final step, the use of the Smooth Overlap of Atomic Positions descriptor allows distinguishing between different environments in a straightforward way. We apply this algorithm to ten Li-ionic systems and conduct in-depth analyses of cubic Li7La3Zr2O12, tetragonal Li10GeP2S12, and the \u03b2-eucryptite LiAlSiO4. We compare our results to existing methods, underscoring strong points, weaknesses, and insights into the diffusive behavior of the ionic conduction in the materials investigated. "
    ],
    "oai_identifier": [
        "oai:materialscloud.org:2019.0008/v1"
    ],
    "oai_set": [
        "DOI"
    ],
    "state": "active",
    "tags": [
        {
            "name": "molecular dynamics"
        },
        {
            "name": "site analysis"
        },
        {
            "name": "tracer diffusion"
        }
    ],
    "title": [
        "Unsupervised landmark analysis for jump detection in molecular dynamics simulations"
    ],
    "url": "https://archive.materialscloud.org/2019.0008/v1"
}