{
    "Contact": [
        "Materials Cloud"
    ],
    "DOI": "http://dx.doi.org/doi:10.24435/materialscloud:2018.0016/v1",
    "DiscHierarchy": [
        "5.3",
        "Engineering Sciences",
        "Materials Science and Engineeringy"
    ],
    "Discipline": "Materials Science And Engineering",
    "Language": [
        "English"
    ],
    "MetaDataAccess": "https://archive.materialscloud.org/xml?verb=GetRecord&metadataPrefix=oai_dc&identifier=oai:materialscloud.org:2018.0016/v1",
    "MetadataAccess": [
        "oai:materialscloud.org:2018.0016/v1"
    ],
    "OpenAccess": "true",
    "PublicationTimestamp": "2018-10-10T11:59:59Z",
    "PublicationYear": [
        "2018"
    ],
    "Publisher": [
        "Materials Cloud"
    ],
    "RelatedIdentifier": [
        "https://www.materialscloud.org/discover/mofs"
    ],
    "ResourceType": [
        "Dataset"
    ],
    "Rights": [
        "Creative Commons Attribution 4.0 International https://creativecommons.org/licenses/by/4.0/legalcode",
        "info:eu-repo/semantics/openAccess"
    ],
    "author": [
        "Daff, Thomas D.",
        "G\u0142adysiak, Andrzej",
        "Chidambaram, Arunraj",
        "Navarro, Jorge A. R.",
        "Bounds, Richard",
        "Smit, Berend",
        "Woo, Tom K.",
        "Boyd, Peter George",
        "Schouwink, Pascal",
        "Reimer, Jeffrey A.",
        "Stylianou, Kyriakos C.",
        "Moosavi, Seyed Mohamad"
    ],
    "fulltext": "oai:materialscloud.org:2018.0016/v1;2019-06-12Z;DOI;Dataset;Boyd, Peter George;Chidambaram, Arunraj;Daff, Thomas D.;Bounds, Richard;G\u0142adysiak, Andrzej;Schouwink, Pascal;Moosavi, Seyed Mohamad;Reimer, Jeffrey A.;Navarro, Jorge A. R.;Woo, Tom K.;Smit, Berend;Stylianou, Kyriakos C.;Rational design and synthesis of metal-organic frameworks for carbon capture using adsorbaphore identification;Materials Cloud;2018-10-10;Creative Commons Attribution 4.0 International https://creativecommons.org/licenses/by/4.0/legalcode;info:eu-repo/semantics/openAccess;nanoporous materials;high throughput screening;gas adsorption;co2 capture;adsorbaphore;doi:10.24435/materialscloud:2018.0016/v1;https://archive.materialscloud.org/2018.0016/v1;en;https://www.materialscloud.org/discover/mofs;In this entry is a database of 324,426 hypothetical Metal-Organic Frameworks (MOFs) that were used in a study to screen potential carbon dioxide scrubbers.  Using a method to assemble these materials with topological blueprints, we only selected materials that could be accurately represented with the MEPO-QEq charge generation method. By ensuring that the electrostatic potential is accurately represented in these materials, screening for CO2 adsorption properties would result very few false positives/negatives. The atom-centered charges reported in the CIF file for each MOF were derived from the MEPO-QEq method, which can be found under the &#39;_atom_type_partial_charge&#39; column in each CIF file.\n<br/>\n\n<br/>\nThe relevant data for each MOF is reported in accompanying .csv files. Post-combustion flue gas was simulated at a temperature of both 298K and 0.15 bar CO2, and 313K and 0.15 bar CO2. Mixture adsorption was simulated with the conditions 298K and 0.15:0.85 CO2/N2 with a total pressure of 1 bar. The data file reports working capacities, which is the difference of adsorption of CO2 between two thermodynamic state points. The adsorption state point(s) are mentioned above, and two desorption values were simulated; 0.1 bar CO2 at 363K (vacuum swing adsorption) and 0.7 bar CO2 at 413K (temperature swing adsorption). The data presented in the main manuscript correspond to vacuum swing conditions.\n<br/>\n\n<br/>\nOver 8,000 materials were selected for more refined simulations, including re-defining partial atomic charges with the REPEAT method, and more detailed simulations to obtain common chemical patterns surrounding CO2 binding sites (adsorbaphores). There is an additional .csv file with these refined calculations that accompany this entry titled &#39;top_MOFs_screening_data.csv&#39;.",
    "group": "materialscloud",
    "groups": [
        {
            "name": "materialscloud"
        }
    ],
    "name": "983c7895-2ca8-5986-85e2-7317ac602eb5",
    "notes": [
        "In this entry is a database of 324,426 hypothetical Metal-Organic Frameworks (MOFs) that were used in a study to screen potential carbon dioxide scrubbers.  Using a method to assemble these materials with topological blueprints, we only selected materials that could be accurately represented with the MEPO-QEq charge generation method. By ensuring that the electrostatic potential is accurately represented in these materials, screening for CO2 adsorption properties would result very few false positives/negatives. The atom-centered charges reported in the CIF file for each MOF were derived from the MEPO-QEq method, which can be found under the &#39;_atom_type_partial_charge&#39; column in each CIF file.\n<br/>\n\n<br/>\nThe relevant data for each MOF is reported in accompanying .csv files. Post-combustion flue gas was simulated at a temperature of both 298K and 0.15 bar CO2, and 313K and 0.15 bar CO2. Mixture adsorption was simulated with the conditions 298K and 0.15:0.85 CO2/N2 with a total pressure of 1 bar. The data file reports working capacities, which is the difference of adsorption of CO2 between two thermodynamic state points. The adsorption state point(s) are mentioned above, and two desorption values were simulated; 0.1 bar CO2 at 363K (vacuum swing adsorption) and 0.7 bar CO2 at 413K (temperature swing adsorption). The data presented in the main manuscript correspond to vacuum swing conditions.\n<br/>\n\n<br/>\nOver 8,000 materials were selected for more refined simulations, including re-defining partial atomic charges with the REPEAT method, and more detailed simulations to obtain common chemical patterns surrounding CO2 binding sites (adsorbaphores). There is an additional .csv file with these refined calculations that accompany this entry titled &#39;top_MOFs_screening_data.csv&#39;."
    ],
    "oai_identifier": [
        "oai:materialscloud.org:2018.0016/v1"
    ],
    "oai_set": [
        "DOI"
    ],
    "state": "active",
    "tags": [
        {
            "name": "nanoporous materials"
        },
        {
            "name": "high throughput screening"
        },
        {
            "name": "gas adsorption"
        },
        {
            "name": "co capture"
        },
        {
            "name": "adsorbaphore"
        }
    ],
    "title": [
        "Rational design and synthesis of metal-organic frameworks for carbon capture using adsorbaphore identification"
    ],
    "url": "https://archive.materialscloud.org/2018.0016/v1"
}