{
    "Contact": [
        "Materials Cloud"
    ],
    "DOI": "http://dx.doi.org/doi:10.24435/materialscloud:2019.0009/v1",
    "DiscHierarchy": [
        "5.3",
        "Engineering Sciences",
        "Materials Science and Engineeringy"
    ],
    "Discipline": "Materials Science And Engineering",
    "Language": [
        "English"
    ],
    "MetaDataAccess": "https://archive.materialscloud.org/xml?verb=GetRecord&metadataPrefix=oai_dc&identifier=oai:materialscloud.org:2019.0009/v1",
    "MetadataAccess": [
        "oai:materialscloud.org:2019.0009/v1"
    ],
    "OpenAccess": "true",
    "PublicationTimestamp": "2019-02-21T11:59:59Z",
    "PublicationYear": [
        "2019"
    ],
    "Publisher": [
        "Materials Cloud"
    ],
    "ResourceType": [
        "Dataset"
    ],
    "Rights": [
        "Creative Commons Attribution 4.0 International https://creativecommons.org/licenses/by/4.0/legalcode",
        "info:eu-repo/semantics/openAccess"
    ],
    "author": [
        "Hampel, Alexander",
        "Franchini, Cesare",
        "Liu, Peitao",
        "Ederer, Claude"
    ],
    "fulltext": "oai:materialscloud.org:2019.0009/v1;2019-06-12Z;DOI;Dataset;Hampel, Alexander;Ederer, Claude;Liu, Peitao;Franchini, Cesare;Energetics of the coupled electronic\u2013structural transition in the rare-earth nickelates;Materials Cloud;2019-02-21;Creative Commons Attribution 4.0 International https://creativecommons.org/licenses/by/4.0/legalcode;info:eu-repo/semantics/openAccess;MARVEL;Electronic properties and materials;Quantum Materials;Dynamical Mean Field Theory;correlated systems structural prediction ;doi:10.24435/materialscloud:2019.0009/v1;https://archive.materialscloud.org/2019.0009/v1;en;Rare-earth nickelates exhibit a metal\u2013insulator transition accompanied by a structural distortion that breaks the symmetry between formerly equivalent Ni sites. The quantitative theoretical description of this coupled electronic\u2013structural instability is extremely challenging. Here, we address this issue by simultaneously taking into account both structural and electronic degrees of freedom using a charge self-consistent combination of density functional theory and dynamical mean-field theory, together with screened interaction parameters obtained from the constrained random phase approximation. Our total energy calculations show that the coupling to an electronic instability toward a charge disproportionated insulating state is crucial to stabilize the structural distortion, leading to a clear first order character of the coupled transition. The decreasing octahedral rotations across the series suppress this electronic instability and simultaneously increase the screening of the effective Coulomb interaction, thus weakening the correlation effects responsible for the metal\u2013insulator transition. Our approach allows to obtain accurate values for the structural distortion and thus facilitates a comprehensive understanding, both qualitatively and quantitatively, of the complex interplay between structural properties and electronic correlation effects across the nickelate series.",
    "group": "materialscloud",
    "groups": [
        {
            "name": "materialscloud"
        }
    ],
    "name": "aecd23e4-af20-5bd7-a35a-ab6c1a3e1818",
    "notes": [
        "Rare-earth nickelates exhibit a metal\u2013insulator transition accompanied by a structural distortion that breaks the symmetry between formerly equivalent Ni sites. The quantitative theoretical description of this coupled electronic\u2013structural instability is extremely challenging. Here, we address this issue by simultaneously taking into account both structural and electronic degrees of freedom using a charge self-consistent combination of density functional theory and dynamical mean-field theory, together with screened interaction parameters obtained from the constrained random phase approximation. Our total energy calculations show that the coupling to an electronic instability toward a charge disproportionated insulating state is crucial to stabilize the structural distortion, leading to a clear first order character of the coupled transition. The decreasing octahedral rotations across the series suppress this electronic instability and simultaneously increase the screening of the effective Coulomb interaction, thus weakening the correlation effects responsible for the metal\u2013insulator transition. Our approach allows to obtain accurate values for the structural distortion and thus facilitates a comprehensive understanding, both qualitatively and quantitatively, of the complex interplay between structural properties and electronic correlation effects across the nickelate series."
    ],
    "oai_identifier": [
        "oai:materialscloud.org:2019.0009/v1"
    ],
    "oai_set": [
        "DOI"
    ],
    "state": "active",
    "tags": [
        {
            "name": "MARVEL"
        },
        {
            "name": "Electronic properties materials"
        },
        {
            "name": "Quantum Materials"
        },
        {
            "name": "Dynamical Mean Field Theory"
        },
        {
            "name": "correlated systems structural prediction"
        }
    ],
    "title": [
        "Energetics of the coupled electronic\u2013structural transition in the rare-earth nickelates"
    ],
    "url": "https://archive.materialscloud.org/2019.0009/v1"
}