{
    "Contact": [
        "Materials Cloud"
    ],
    "DOI": "http://dx.doi.org/doi:10.24435/materialscloud:2019.0025/v1",
    "DiscHierarchy": [
        "5.3",
        "Engineering Sciences",
        "Materials Science and Engineeringy"
    ],
    "Discipline": "Materials Science And Engineering",
    "Language": [
        "English"
    ],
    "MetaDataAccess": "https://archive.materialscloud.org/xml?verb=GetRecord&metadataPrefix=oai_dc&identifier=oai:materialscloud.org:2019.0025/v1",
    "MetadataAccess": [
        "oai:materialscloud.org:2019.0025/v1"
    ],
    "OpenAccess": "true",
    "PublicationTimestamp": "2019-05-31T11:59:59Z",
    "PublicationYear": [
        "2019"
    ],
    "Publisher": [
        "Materials Cloud"
    ],
    "ResourceType": [
        "Dataset"
    ],
    "Rights": [
        "Creative Commons Attribution 4.0 International https://creativecommons.org/licenses/by/4.0/legalcode",
        "info:eu-repo/semantics/openAccess"
    ],
    "author": [
        "MacManus-Driscoll, Judith L.",
        "Lu, Ping",
        "Zhu, Bonan",
        "Schusteritsch, Georg",
        "Pickard, Chris J."
    ],
    "fulltext": "oai:materialscloud.org:2019.0025/v1;2019-06-12Z;DOI;Dataset;Zhu, Bonan;Schusteritsch, Georg;Lu, Ping;MacManus-Driscoll, Judith L.;Pickard, Chris J.;Determining interface structures in vertically aligned nanocomposite films;Materials Cloud;2019-05-31;Creative Commons Attribution 4.0 International https://creativecommons.org/licenses/by/4.0/legalcode;info:eu-repo/semantics/openAccess;density functional theory;structure prediction;solid-solid interface;doi:10.24435/materialscloud:2019.0025/v1;https://archive.materialscloud.org/2019.0025/v1;en;Vertically aligned nanocomposites (VANs) films have self-assembled pillar-matrix nanostructures. Owing to their large area-to-volume ratios,  interfaces in VAN films are expected to play key roles in inducing functional properties, but our understanding is hindered by limited knowledge about their structures. Motivated by the lack of definitive explanation for the experimentally-found enhanced ionic conductivity in Sm-doped-CeO2/SrTiO3 VAN films, we determine the structure at vertical interfaces using random structure searching and explore how it can affect ionic conduction. This record contains the candidate structures and provenance of the DFT validation calculations. Previously unknown interface structures are found, with lower energy than that of an optimized hand-built model. We find a strongly distorted oxygen sub-lattice which gives a complex landscape of vacancy energies. The cation lattice remains similar to the bulk phase but has a localized strain field. The excess energy of the interface is similar to that of high angle grain boundaries in SrTiO3.",
    "group": "materialscloud",
    "groups": [
        {
            "name": "materialscloud"
        }
    ],
    "name": "d298732a-71fe-575c-bf8d-783f75a12b89",
    "notes": [
        "Vertically aligned nanocomposites (VANs) films have self-assembled pillar-matrix nanostructures. Owing to their large area-to-volume ratios,  interfaces in VAN films are expected to play key roles in inducing functional properties, but our understanding is hindered by limited knowledge about their structures. Motivated by the lack of definitive explanation for the experimentally-found enhanced ionic conductivity in Sm-doped-CeO2/SrTiO3 VAN films, we determine the structure at vertical interfaces using random structure searching and explore how it can affect ionic conduction. This record contains the candidate structures and provenance of the DFT validation calculations. Previously unknown interface structures are found, with lower energy than that of an optimized hand-built model. We find a strongly distorted oxygen sub-lattice which gives a complex landscape of vacancy energies. The cation lattice remains similar to the bulk phase but has a localized strain field. The excess energy of the interface is similar to that of high angle grain boundaries in SrTiO3."
    ],
    "oai_identifier": [
        "oai:materialscloud.org:2019.0025/v1"
    ],
    "oai_set": [
        "DOI"
    ],
    "state": "active",
    "tags": [
        {
            "name": "density functional theory"
        },
        {
            "name": "structure prediction"
        },
        {
            "name": "solid-solid interface"
        }
    ],
    "title": [
        "Determining interface structures in vertically aligned nanocomposite films"
    ],
    "url": "https://archive.materialscloud.org/2019.0025/v1"
}