{
    "Contact": [
        "https://www.humanbrainproject.eu/"
    ],
    "Contributor": [
        "Poupon, Cyril",
        "Mangin, Jean-Fran\u00e7ois",
        "Duclap, Delphine",
        "Rom\u00e1n, Claudio",
        "Guevara, Pamela",
        "Guevara, Miguel",
        "Houenou, Josselin"
    ],
    "DOI": "http://dx.doi.org/10.25493/GFT3-W4M",
    "DiscHierarchy": [
        "3.2.1.5",
        "Microbiology, Virology and Immunology",
        "Immunology"
    ],
    "Discipline": "Neuroscience",
    "Format": [
        "NIFTI"
    ],
    "Language": [
        "English"
    ],
    "MetaDataAccess": "https://148.187.98.42:8443/oai/provider?verb=GetRecord&metadataPrefix=oai_dc&identifier=10.25493_GFT3-W4M",
    "MetadataAccess": [
        "10.25493_GFT3-W4M"
    ],
    "PublicationTimestamp": "2019-05-23T11:59:59Z",
    "PublicationYear": [
        "2019"
    ],
    "Publisher": [
        "The Human Brain Project"
    ],
    "RelatedIdentifier": [
        "https://doi.org/10.1016/j.neuroimage.2016.11.066"
    ],
    "ResourceType": [
        "dataset"
    ],
    "Rights": [
        "Creative Commons Attribution-NonCommercial-ShareAlike 4.0 International"
    ],
    "author": [
        "Mangin, Jean-Fran\u00e7ois"
    ],
    "fulltext": "10.25493_GFT3-W4M;2019-12-10T12:41:56Z;https://doi.org/10.25493/GFT3-W4M;Probability map of bundle lh_PoCi-PrCu_0 (atlas of superficial white matter fibre bundles, version 2018);2019-05-23T14:01:08.131Z;This data contains the probability map of a short fibre bundle connecting the left hemisphere Posterior Cingulate and Precuneus regions of the Desikan-Killiany atlas, in the MNI ICBM152 reference brain. This bundle was identified using a hybrid approach, incorporating anatomical information (from cortical regions of interest) and fibre shape (fibre clustering), from the tractography datasets of 78 subjects in the Neurospin\u2019s ARCHI database. The map shows the probability of finding a fibre belonging to the bundle in each voxel of the reference brain. The maximum probability corresponds to the voxels with the highest number of putative fibres going through.;neuroscience;brain mapping;imaging;english;dataset;The Human Brain Project;Guevara, Miguel;Rom\u00e1n, Claudio;Houenou, Josselin;Duclap, Delphine;Poupon, Cyril;Mangin, Jean-Fran\u00e7ois;Guevara, Pamela;Mangin, Jean-Fran\u00e7ois;NIFTI;Creative Commons Attribution-NonCommercial-ShareAlike 4.0 International;https://doi.org/10.1016/j.neuroimage.2016.11.066",
    "group": "hbp",
    "groups": [
        {
            "name": "hbp"
        }
    ],
    "name": "01ea8d08-ecad-5202-8bd2-22e3180cbbdb",
    "notes": [
        "This data contains the probability map of a short fibre bundle connecting the left hemisphere Posterior Cingulate and Precuneus regions of the Desikan-Killiany atlas, in the MNI ICBM152 reference brain. This bundle was identified using a hybrid approach, incorporating anatomical information (from cortical regions of interest) and fibre shape (fibre clustering), from the tractography datasets of 78 subjects in the Neurospin\u2019s ARCHI database. The map shows the probability of finding a fibre belonging to the bundle in each voxel of the reference brain. The maximum probability corresponds to the voxels with the highest number of putative fibres going through."
    ],
    "oai_identifier": [
        "10.25493_GFT3-W4M"
    ],
    "oai_set": "",
    "state": "active",
    "tags": [
        {
            "name": "neuroscience"
        },
        {
            "name": "brain mapping"
        },
        {
            "name": "imaging"
        }
    ],
    "title": [
        "Probability map of bundle lh_PoCi-PrCu_0 (atlas of superficial white matter fibre bundles, version 2018)"
    ],
    "url": ""
}