{
    "Contact": [
        "https://www.humanbrainproject.eu/"
    ],
    "Contributor": [
        "Zilles, Karl",
        "Kedo, O.",
        "Palomero-Gallagher, Nicola",
        "Bludau, Sebastian",
        "Amunts, Katrin"
    ],
    "DOI": "http://dx.doi.org/10.25493/DW5A-YMD",
    "DiscHierarchy": [
        "3.2",
        "Life Sciences",
        "Medicine"
    ],
    "Discipline": "Neuroscience",
    "Language": [
        "English"
    ],
    "MetaDataAccess": "https://148.187.98.42:8443/oai/provider?verb=GetRecord&metadataPrefix=oai_dc&identifier=10.25493_DW5A-YMD",
    "MetadataAccess": [
        "10.25493_DW5A-YMD"
    ],
    "PublicationTimestamp": "2019-08-28T11:59:59Z",
    "PublicationYear": [
        "2019"
    ],
    "Publisher": [
        "The Human Brain Project"
    ],
    "ResourceType": [
        "dataset"
    ],
    "Rights": [
        "Creative Commons Attribution-NonCommercial-ShareAlike 4.0 International"
    ],
    "author": [
        "Amunts, Katrin"
    ],
    "fulltext": "10.25493_DW5A-YMD;2019-12-10T12:41:50Z;https://doi.org/10.25493/DW5A-YMD;Reference delineations of area HATA (Hippocampus) in individual sections of the BigBrain;2019-08-28T10:41:13.497Z;This dataset contains cytoarchitectonic delineations of area HATA (Hippocampus) in the BigBrain dataset [Amunts et al. 2013]. The delineations were created after identification of the area in the histological, cell-stained sections based on the cytoarchitectonic criteria. Mappings are available on every 15th to 60th section of the HATA in both hemispheres. They were then transformed to the sections of the 3D reconstructed BigBrain space using the transformations used in Amunts et al. 2013, which were provided by Claude Lepage (McGill).;neuroscience;imaging;histology;brain mapping;english;dataset;The Human Brain Project;Kedo, O.;Zilles, Karl;Palomero-Gallagher, Nicola;Bludau, Sebastian;Amunts, Katrin;Amunts, Katrin;Creative Commons Attribution-NonCommercial-ShareAlike 4.0 International",
    "group": "hbp",
    "groups": [
        {
            "name": "hbp"
        }
    ],
    "name": "1ae4430c-4f24-55a1-9e06-c9ad84fbbb22",
    "notes": [
        "This dataset contains cytoarchitectonic delineations of area HATA (Hippocampus) in the BigBrain dataset [Amunts et al. 2013]. The delineations were created after identification of the area in the histological, cell-stained sections based on the cytoarchitectonic criteria. Mappings are available on every 15th to 60th section of the HATA in both hemispheres. They were then transformed to the sections of the 3D reconstructed BigBrain space using the transformations used in Amunts et al. 2013, which were provided by Claude Lepage (McGill)."
    ],
    "oai_identifier": [
        "10.25493_DW5A-YMD"
    ],
    "oai_set": "",
    "state": "active",
    "tags": [
        {
            "name": "neuroscience"
        },
        {
            "name": "imaging"
        },
        {
            "name": "histology"
        },
        {
            "name": "brain mapping"
        }
    ],
    "title": [
        "Reference delineations of area HATA (Hippocampus) in individual sections of the BigBrain"
    ],
    "url": ""
}