{
    "Contact": [
        "IDDS Archeologie"
    ],
    "Contributor": [
        "IDDS Archeologie"
    ],
    "DOI": "http://dx.doi.org/doi:10.17026/dans-x5p-jrfz",
    "DiscHierarchy": [],
    "Discipline": "Not stated",
    "Format": [
        "application/pdf"
    ],
    "Language": [
        "Dutch"
    ],
    "MetaDataAccess": "https://easy.dans.knaw.nl/oai?verb=GetRecord&metadataPrefix=oai_datacite&identifier=oai:easy.dans.knaw.nl:easy-dataset:60746",
    "MetadataAccess": [
        "oai:easy.dans.knaw.nl:easy-dataset:60746"
    ],
    "PublicationTimestamp": "2016-07-01T11:59:59Z",
    "PublicationYear": [
        "2016"
    ],
    "Publisher": [
        "IDDS Archeologie"
    ],
    "ResourceType": [
        "Dataset"
    ],
    "Rights": [
        "info:eu-repo/semantics/restrictedAccess"
    ],
    "SpatialCoverage": [
        "\n            "
    ],
    "TemporalCoverage": [
        "2015-02-11",
        "2014-12-08",
        "2015-02-11",
        "2016-02-11"
    ],
    "author": [
        "Koekkelkoren, A.M.H.C."
    ],
    "fulltext": "oai:easy.dans.knaw.nl:easy-dataset:60746;2018-09-18T17:08:16Z;D30000:D37000;10.17026/dans-x5p-jrfz;Koekkelkoren, A.M.H.C.;N203, Gemeenten Castricum & Uitgeest;Archeologisch bureauonderzoek;IDDS Archeologie;2016;Archaeology;Archeologisch: bureauonderzoek;IDDS Archeologie;2015-02-11;2014-12-08;2015-02-11;2016-02-11;nl;Dataset;urn:nbn:nl:ui:13-ywu4-0r;easy-dataset:60746;application/pdf;info:eu-repo/semantics/restrictedAccess;In opdracht van Advin BV heeft IDDS Archeologie in december 2014 een archeologisch bureauonderzoek uitgevoerd voor de N203 Castricum en Uitgeest, gemeenten Castricum & Uitgeest. De aanleiding voor dit onderzoek is het geplande groot onderhoud aan de N203 tussen de aansluiting met de N513 Zeeweg en de oprit naar de A9.\n\nHet bureauonderzoek heeft uitgewezen dat de N203 is aangelegd in de jaren 30 van de 20e eeuw. Daarvoor bestond het plangebied uit weilanden met enkele slootjes en op enkele plaatsen een dijk. Voor de aanleg van de N203 is het oude landschap ge\u00ebgaliseerd en opgehoogd. Het ophoogpakket bestaat voornamelijk uit zand, maar kan tevens puinresten en andere verharding bevatten. Het pakket is gemiddeld een meter dik, maar dit kan plaatselijk vari\u00ebren.\n\nDe geplande werkzaamheden zijn overwegend beperkt tot het reeds bestaande wegtrac\u00e9 en het opgebrachte pakket. Indien graafwerkzaamheden plaats vinden die dieper reiken dan het opgebrachte pakket of daarbuiten plaats vinden, is het mogelijk dat archeologische resten worden verstoord. Daarom is een verwachtingsmodel gemaakt van de oorspronkelijke ondergrond van het plangebied. Deze verwachting is opgesteld op basis van het gemeentelijke beleid van de gemeenten Castricum en Uitgeest, de natuurlijke ondergrond en bekende archeologische resten. Met de gecombineerde resultaten zijn een verwachtingskaart (bijlage 5a en 5b) en een advieskaart (bijlage 6a en 6b) opgesteld.\n\nMet de gegevens die ten tijde van het bureauonderzoek beschikbaar zijn gesteld, wordt aangenomen dat vrijwel alle geplande werkzaamheden binnen het opgebrachte pakket plaats vinden.;19C;N203;Uitgeest & Castricum;Uitgeest & Castricum;Noord-Holland;52.5434845;4.69437237",
    "group": "danseasy",
    "groups": [
        {
            "name": "danseasy"
        }
    ],
    "name": "0a7f1ab6-291f-5192-abbd-6a547e9b3a98",
    "notes": [
        "In opdracht van Advin BV heeft IDDS Archeologie in december 2014 een archeologisch bureauonderzoek uitgevoerd voor de N203 Castricum en Uitgeest, gemeenten Castricum & Uitgeest. De aanleiding voor dit onderzoek is het geplande groot onderhoud aan de N203 tussen de aansluiting met de N513 Zeeweg en de oprit naar de A9.\n\nHet bureauonderzoek heeft uitgewezen dat de N203 is aangelegd in de jaren 30 van de 20e eeuw. Daarvoor bestond het plangebied uit weilanden met enkele slootjes en op enkele plaatsen een dijk. Voor de aanleg van de N203 is het oude landschap ge\u00ebgaliseerd en opgehoogd. Het ophoogpakket bestaat voornamelijk uit zand, maar kan tevens puinresten en andere verharding bevatten. Het pakket is gemiddeld een meter dik, maar dit kan plaatselijk vari\u00ebren.\n\nDe geplande werkzaamheden zijn overwegend beperkt tot het reeds bestaande wegtrac\u00e9 en het opgebrachte pakket. Indien graafwerkzaamheden plaats vinden die dieper reiken dan het opgebrachte pakket of daarbuiten plaats vinden, is het mogelijk dat archeologische resten worden verstoord. Daarom is een verwachtingsmodel gemaakt van de oorspronkelijke ondergrond van het plangebied. Deze verwachting is opgesteld op basis van het gemeentelijke beleid van de gemeenten Castricum en Uitgeest, de natuurlijke ondergrond en bekende archeologische resten. Met de gecombineerde resultaten zijn een verwachtingskaart (bijlage 5a en 5b) en een advieskaart (bijlage 6a en 6b) opgesteld.\n\nMet de gegevens die ten tijde van het bureauonderzoek beschikbaar zijn gesteld, wordt aangenomen dat vrijwel alle geplande werkzaamheden binnen het opgebrachte pakket plaats vinden."
    ],
    "oai_identifier": [
        "oai:easy.dans.knaw.nl:easy-dataset:60746"
    ],
    "oai_set": [
        "D30000:D37000"
    ],
    "state": "active",
    "tags": [
        {
            "name": "Archaeology"
        },
        {
            "name": "Archeologisch bureauonderzoek"
        }
    ],
    "title": [
        "N203, Gemeenten Castricum & Uitgeest",
        "Archeologisch bureauonderzoek"
    ],
    "url": ""
}