{
    "Contact": [
        "ROB, Amersfoort",
        "Zijverden, W.K. van",
        "Haaster, H. van",
        "Robeerst, J.M.M."
    ],
    "Contributor": [
        "ROB, Amersfoort",
        "Zijverden, W.K. van",
        "Haaster, H. van",
        "Robeerst, J.M.M."
    ],
    "DOI": "http://dx.doi.org/doi:10.17026/dans-223-vxtu",
    "DiscHierarchy": [],
    "Discipline": "Not stated",
    "Format": [
        "QuarkXpress",
        "application/postscript"
    ],
    "Language": [
        "Dutch"
    ],
    "MetaDataAccess": "https://easy.dans.knaw.nl/oai?verb=GetRecord&metadataPrefix=oai_datacite&identifier=oai:easy.dans.knaw.nl:easy-dataset:38739",
    "MetadataAccess": [
        "oai:easy.dans.knaw.nl:easy-dataset:38739"
    ],
    "PublicationTimestamp": "2011-07-01T11:59:59Z",
    "PublicationYear": [
        "2011"
    ],
    "Publisher": [
        "ROB, Amersfoort"
    ],
    "ResourceType": [
        "Dataset"
    ],
    "Rights": [
        "info:eu-repo/semantics/openAccess"
    ],
    "SpatialCoverage": [
        "\n            "
    ],
    "TemporalCoverage": [
        "2011-05-24",
        "1998",
        "2011-05-24"
    ],
    "author": [
        "Anscher, T.J. ten",
        "Jongste, P.F.B."
    ],
    "fulltext": "oai:easy.dans.knaw.nl:easy-dataset:38739;2018-09-18T16:55:05Z;D30000:D37000;driver;easy-collection:4;10.17026/dans-223-vxtu;Jongste, P.F.B.;Anscher, T.J. ten;Aanvullend Archeologisch Onderzoek in het trac\u00e9 van de Betuweroute, vindplaats 22, Valburg/Zettensche Plas;RAM 19;ROB, Amersfoort;2011;Archaeology;aanvullend archeologisch onderzoek (AAO);Neolithicum laat: 2850 - 2000 vC (NEOL);Bronstijd midden: 1800 - 1100 vC (BRONSM);Haaster, H. van;Robeerst, J.M.M.;Zijverden, W.K. van;ROB, Amersfoort;2011-05-24;1998;2011-05-24;nl;Dataset;urn:nbn:nl:ui:13-w84-mj5;easy-dataset:38739;twips.dans.knaw.nl--3005317610224733491-1306227028444;QuarkXpress;application/postscript;info:eu-repo/semantics/openAccess;Op verzoek van de Nederlandse Spoorwegen Railinfrabeheer Managementgroep Betuweroute heeft de Rijksdienst voor het Oudheidkundig Bodemonderzoek (ROB) een Aanvullend Archeologisch Onderzoek (AAO) uitgevoerd in de gemeente Valburg. Object van het onderzoek was een vindplaats (toponiem 'Zettensche Plas') bij Zetten, direct ten noorden van rijksweg A15 en ten oosten van de Zettensche plas. Deze vindplaats is in 1994 tijdens een boorcampagne ontdekt door de Stichting Regionaal Archeologisch Archiverings Project.\nDe vindplaats ligt in het trac\u00e9 van de Betuweroute en wordt door de aanleg van het cunet bedreigd.\nHet doel van het AAO was inzicht te verkrijgen in de datering, de aard en de kwaliteit van deze vindplaats ten behoeve van een definitieve waardering. Daartoe zijn acht putten aangelegd (tezamen 124,16 m2). In totaal is van de vondstlaag 2,85 m3 schavenderwijs onderzocht en 0,33 m3 gezeefd.\nVindplaats 22 ligt op komafzettingen boven crevasseafzettingen. De vindplaats bestaat uit twee gave, kleine vondstconcentraties, opgevat als sites, omringd door een lichte vondstruis. Een klein deel van de vondsten van site 1 dateert uit het Laat-Neolithicum (KB of eventueel WKD). De meerderheid stamt uit de Midden-Bronstijd (HVS 1, misschien ook wel HVS 2-3). Site 2 dateert eveneens uit de Midden-Bronstijd (HVS 1-2, misschien ook wel HVS 3). De sites zijn ge\u00efnterpreteerd als kortstondig gebruikte, tijdelijke kampementen voor bijzondere activiteiten. In die activiteiten hebben vee en vuur een rol gespeeld. Het aardewerk is sterk verweerd en gefragmenteeerd. Ook het botmateriaal is sterk gefragmenteerd. Behalve verbrand bot is ook onverbrand bot aanwezig. Dat laatste is matig tot slecht geconserveerd. Er zijn maar heel weinig onverbrande zaden gevonden. Of zij van prehistorische datum zijn, is onduidelijk. Verkoolde zaden zijn in de monsters afwezig. Daarom zullen zij op de vindplaats als geheel op zijn best schaars zijn. Gezien de uitkomsten van het AAO zijn de mogelijkheden op ecologisch gebied bij verder onderzoek wel aanwezig, zij het in beperkte mate.\nVindplaats 22 is behoudenswaardig op grond van gaafheid, de zeldzaamheid van het site-type en de hoge archeologische contextwaarde.;Gelderland;Valburg;Zetten;Zettensche Plas;51.91700927;5.70494278",
    "group": "danseasy",
    "groups": [
        {
            "name": "danseasy"
        }
    ],
    "name": "0a9b0f04-6ad8-59c2-97bf-df225d737f12",
    "notes": [
        "Op verzoek van de Nederlandse Spoorwegen Railinfrabeheer Managementgroep Betuweroute heeft de Rijksdienst voor het Oudheidkundig Bodemonderzoek (ROB) een Aanvullend Archeologisch Onderzoek (AAO) uitgevoerd in de gemeente Valburg. Object van het onderzoek was een vindplaats (toponiem 'Zettensche Plas') bij Zetten, direct ten noorden van rijksweg A15 en ten oosten van de Zettensche plas. Deze vindplaats is in 1994 tijdens een boorcampagne ontdekt door de Stichting Regionaal Archeologisch Archiverings Project.\nDe vindplaats ligt in het trac\u00e9 van de Betuweroute en wordt door de aanleg van het cunet bedreigd.\nHet doel van het AAO was inzicht te verkrijgen in de datering, de aard en de kwaliteit van deze vindplaats ten behoeve van een definitieve waardering. Daartoe zijn acht putten aangelegd (tezamen 124,16 m2). In totaal is van de vondstlaag 2,85 m3 schavenderwijs onderzocht en 0,33 m3 gezeefd.\nVindplaats 22 ligt op komafzettingen boven crevasseafzettingen. De vindplaats bestaat uit twee gave, kleine vondstconcentraties, opgevat als sites, omringd door een lichte vondstruis. Een klein deel van de vondsten van site 1 dateert uit het Laat-Neolithicum (KB of eventueel WKD). De meerderheid stamt uit de Midden-Bronstijd (HVS 1, misschien ook wel HVS 2-3). Site 2 dateert eveneens uit de Midden-Bronstijd (HVS 1-2, misschien ook wel HVS 3). De sites zijn ge\u00efnterpreteerd als kortstondig gebruikte, tijdelijke kampementen voor bijzondere activiteiten. In die activiteiten hebben vee en vuur een rol gespeeld. Het aardewerk is sterk verweerd en gefragmenteeerd. Ook het botmateriaal is sterk gefragmenteerd. Behalve verbrand bot is ook onverbrand bot aanwezig. Dat laatste is matig tot slecht geconserveerd. Er zijn maar heel weinig onverbrande zaden gevonden. Of zij van prehistorische datum zijn, is onduidelijk. Verkoolde zaden zijn in de monsters afwezig. Daarom zullen zij op de vindplaats als geheel op zijn best schaars zijn. Gezien de uitkomsten van het AAO zijn de mogelijkheden op ecologisch gebied bij verder onderzoek wel aanwezig, zij het in beperkte mate.\nVindplaats 22 is behoudenswaardig op grond van gaafheid, de zeldzaamheid van het site-type en de hoge archeologische contextwaarde."
    ],
    "oai_identifier": [
        "oai:easy.dans.knaw.nl:easy-dataset:38739"
    ],
    "oai_set": [
        "D30000:D37000",
        "driver",
        "easy-collection:4"
    ],
    "state": "active",
    "tags": [
        {
            "name": "Archaeology"
        },
        {
            "name": "aanvullend archeologisch onderzoek AAO"
        },
        {
            "name": "Neolithicum laat - vC NEOL"
        },
        {
            "name": "Bronstijd midden - vC BRONSM"
        }
    ],
    "title": [
        "Aanvullend Archeologisch Onderzoek in het trac\u00e9 van de Betuweroute, vindplaats 22, Valburg/Zettensche Plas",
        "RAM 19"
    ],
    "url": ""
}