{
    "Contact": [
        "De Steekproef"
    ],
    "Contributor": [
        "De Steekproef"
    ],
    "DOI": "http://dx.doi.org/doi:10.17026/dans-xc2-ancx",
    "DiscHierarchy": [],
    "Discipline": "Not stated",
    "Format": [
        "14 p."
    ],
    "Language": [
        "Dutch"
    ],
    "MetaDataAccess": "https://easy.dans.knaw.nl/oai?verb=GetRecord&metadataPrefix=oai_datacite&identifier=oai:easy.dans.knaw.nl:easy-dataset:17373",
    "MetadataAccess": [
        "oai:easy.dans.knaw.nl:easy-dataset:17373"
    ],
    "PublicationTimestamp": "2009-07-01T11:59:59Z",
    "PublicationYear": [
        "2009"
    ],
    "Publisher": [
        "De Steekproef"
    ],
    "ResourceType": [
        "Dataset"
    ],
    "Rights": [
        "info:eu-repo/semantics/openAccess"
    ],
    "SpatialCoverage": [
        "\n            "
    ],
    "TemporalCoverage": [
        "2009-11-05",
        "2007-02",
        "2009-11-05"
    ],
    "author": [
        "Neef, W. De"
    ],
    "fulltext": "oai:easy.dans.knaw.nl:easy-dataset:17373;2018-09-18T16:43:08Z;D30000:D37000;driver;easy-collection:4;10.17026/dans-xc2-ancx;Neef, W. De;Wapserveen: Van Helomaweg (Dr.);Een Inventariserend Archeologisch Veldonderzoek;De Steekproef;2009;Archaeology;inventariserend veldonderzoek;De Steekproef;2009-11-05;2007-02;2009-11-05;nl;Dataset;urn:nbn:nl:ui:13-c86-84o;easy-dataset:17373;twips.dans.knaw.nl--7260220477179627179-1257439192886;14 p.;info:eu-repo/semantics/openAccess;Aan de Van Helomaweg te Wapserveen (Drenthe) heeft op 13 februari 2007 een inventariserend archeologisch veldonderzoek plaatsgevonden. Aanleiding voor het onderzoek was de voorgenomen bouw van een agrarisch bedrijf op het perceel. Hierbij zal de bodem verstoord worden. Doel van het onderzoek was te bepalen of mogelijke archeologische waarden in het plangebied aanwezig zijn en in hoeverre deze door de voorgenomen bodemingrepen worden bedreigd. Om de bodemopbouw te bepalen en archeologische indicatoren op te sporen zijn 15 edelmanboringen geplaatst met een diameter van 10 cm tot een diepte van tenminste 30 cm in de onverstoorde C-horizont. In vier van de 15 boringen is een BC-horizont aangetroffen, waarvan drie onder een verstoorde laag. In twee boringen werd een laag veraard veen gevonden. In negen van de 15 boringen werd een Chorizont waargenomen onder een verstoorde laag. Het bodemprofiel is dermate verstoord dat archeologisch vervolgonderzoek niet noodzakelijk wordt geacht.;16E (kaartblad);Drenthe; Westerveld; Wapserveen; Van Helomaweg;52.82480617;6.19213197",
    "group": "danseasy",
    "groups": [
        {
            "name": "danseasy"
        }
    ],
    "name": "0b792e1e-b735-5e46-8a24-82e57c8bfdcf",
    "notes": [
        "Aan de Van Helomaweg te Wapserveen (Drenthe) heeft op 13 februari 2007 een inventariserend archeologisch veldonderzoek plaatsgevonden. Aanleiding voor het onderzoek was de voorgenomen bouw van een agrarisch bedrijf op het perceel. Hierbij zal de bodem verstoord worden. Doel van het onderzoek was te bepalen of mogelijke archeologische waarden in het plangebied aanwezig zijn en in hoeverre deze door de voorgenomen bodemingrepen worden bedreigd. Om de bodemopbouw te bepalen en archeologische indicatoren op te sporen zijn 15 edelmanboringen geplaatst met een diameter van 10 cm tot een diepte van tenminste 30 cm in de onverstoorde C-horizont. In vier van de 15 boringen is een BC-horizont aangetroffen, waarvan drie onder een verstoorde laag. In twee boringen werd een laag veraard veen gevonden. In negen van de 15 boringen werd een Chorizont waargenomen onder een verstoorde laag. Het bodemprofiel is dermate verstoord dat archeologisch vervolgonderzoek niet noodzakelijk wordt geacht."
    ],
    "oai_identifier": [
        "oai:easy.dans.knaw.nl:easy-dataset:17373"
    ],
    "oai_set": [
        "D30000:D37000",
        "driver",
        "easy-collection:4"
    ],
    "state": "active",
    "tags": [
        {
            "name": "Archaeology"
        },
        {
            "name": "inventariserend veldonderzoek"
        }
    ],
    "title": [
        "Wapserveen: Van Helomaweg (Dr.)",
        "Een Inventariserend Archeologisch Veldonderzoek"
    ],
    "url": ""
}