{
    "Contact": [
        "Voorst, J.F. van",
        "Bureau Archeologie, gemeente Almere"
    ],
    "Contributor": [
        "Voorst, J.F. van",
        "Bureau Archeologie, gemeente Almere"
    ],
    "DOI": "http://dx.doi.org/doi:10.17026/dans-22c-uwew",
    "DiscHierarchy": [],
    "Discipline": "Not stated",
    "Format": [
        "application/pdf"
    ],
    "Language": [
        "Dutch"
    ],
    "MetaDataAccess": "https://easy.dans.knaw.nl/oai?verb=GetRecord&metadataPrefix=oai_datacite&identifier=oai:easy.dans.knaw.nl:easy-dataset:31693",
    "MetadataAccess": [
        "oai:easy.dans.knaw.nl:easy-dataset:31693"
    ],
    "PublicationTimestamp": "2010-07-01T11:59:59Z",
    "PublicationYear": [
        "2010"
    ],
    "Publisher": [
        "Bureau Archeologie, gemeente Almere"
    ],
    "ResourceType": [
        "Dataset"
    ],
    "Rights": [
        "info:eu-repo/semantics/openAccess"
    ],
    "SpatialCoverage": [
        "\n            "
    ],
    "TemporalCoverage": [
        "2010-09-08",
        "2009-10-01",
        "2010-09-08"
    ],
    "author": [
        "Hogestijn, W.J.H."
    ],
    "fulltext": "oai:easy.dans.knaw.nl:easy-dataset:31693;2018-09-18T16:50:08Z;D30000:D37000;driver;easy-collection:4;10.17026/dans-22c-uwew;Hogestijn, W.J.H.;ARCHEOLOGISCHE RAPPORTEN ALMERE 64;Basisrapportage Bureauonderzoek. Plangebied 3G/3H/3V Buitenhoutsedreef (Almere Buiten);Bureau Archeologie, gemeente Almere;2010;Archaeology;Nederzetting, onbepaald (NX);Neolithicum: 5300 - 2000 vC (NEO);Voorst, J.F. van;Bureau Archeologie, gemeente Almere;2010-09-08;2009-10-01;2010-09-08;nl;Dataset;urn:nbn:nl:ui:13-s41-gt9;easy-dataset:31693;twips.dans.knaw.nl--9077970224482643223-1283939769180;application/pdf;info:eu-repo/semantics/openAccess;In het plangebied 3G/3H/3V Buitenhoutsedreef (Almere Buiten) vindt onderzoek plaats naar de voorgenomen verbreding van de Buitenhoutsedreef. Tevens zal een kruispunt heringericht worden. De exacte lokatie van de verbreding is momenteel nog niet bekend. Er moet rekening gehouden worden met een verbreding met 7 meter (asfalt op puingranulaat). Het oppervlak van het plangebied is circa 1,25 ha. groot.\nHet doel van het bureauonderzoek is een gespecificeerd archeologisch verwachtingsmodel voor het plangebied op te stellen door bekende en te verwachten archeologische waarden en andere voor het onderzoek relevante gegevens te inventariseren. Aan de hand hiervan wordt bepaald of en wat voor soort archeologisch vervolgonderzoek noodzakelijk is.\nHiertoe is de Archeologische Beleidskaart Almere (ABA) d.d. 0890792009 (ook wel Selectiekaart) geraadpleegd. Uit de ABA blijkt dat direct grenzend aan het plangebied bekende archeologische waarden liggen (vindplaats 3V_1) en dat circa 95% van het te verbreden wegtrac\u00e9 binnen een Selectiegebied is gelegen.\nOp basis van het voorliggende bureauonderzoek kan worden gesteld dat in het hele plangebied prehistorische nederzettingsresten aanwezig kunnen zijn op plaatsen waar de top van het dekzand intact is. Gezien de hoogteligging van het dekzand van 7 tot 10 meter min NAP en de relatieve zeespiegelstijging zullen eventueel aanwezige archeologische resten ouder zijn dan circa 8.100 9 6.300 v.Chr. Dit betekent dat zij zullen dateren uit de Midden Steentijd (Mesolithicum / circa 8.800 \u2013 5.300 voor Chr.). Daarnaast kunnen in het plangebied in de jongere afzettingen, zoals detritus, Sloef/Almere en Zuiderzeeafzettingen scheepswrakken, scheepsonderdelen en scheepsladingen of delen hiervan verwacht worden. Ook kunnen archeologische waarden uit de laatste fase van de Oude9Steentijd, het Jong Paleolithicum (circa 18.00099.600 v.Chr.), worden verwacht. Dergelijke vindplaatsen zijn te verwachten in bodemlagen die verband houden met de B\u00f8lling en Aller\u00f8d interstadialen, zoals veen (sterk samengedrukt) en de \u2018Laag van Usselo\u2019. Ook in het Jong Dekzand 1 (Vroege Dryas stadiaal) en Jong Dekzand 2 (Late Dryas stadiaal) kunnen dergelijke vindplaatsen worden verwacht.;Almere;Almere Buiten;3G/3H/3V (gebiedscode);52.37770405;5.27621122",
    "group": "danseasy",
    "groups": [
        {
            "name": "danseasy"
        }
    ],
    "name": "0d667705-210f-5428-9754-0186f01de346",
    "notes": [
        "In het plangebied 3G/3H/3V Buitenhoutsedreef (Almere Buiten) vindt onderzoek plaats naar de voorgenomen verbreding van de Buitenhoutsedreef. Tevens zal een kruispunt heringericht worden. De exacte lokatie van de verbreding is momenteel nog niet bekend. Er moet rekening gehouden worden met een verbreding met 7 meter (asfalt op puingranulaat). Het oppervlak van het plangebied is circa 1,25 ha. groot.\nHet doel van het bureauonderzoek is een gespecificeerd archeologisch verwachtingsmodel voor het plangebied op te stellen door bekende en te verwachten archeologische waarden en andere voor het onderzoek relevante gegevens te inventariseren. Aan de hand hiervan wordt bepaald of en wat voor soort archeologisch vervolgonderzoek noodzakelijk is.\nHiertoe is de Archeologische Beleidskaart Almere (ABA) d.d. 0890792009 (ook wel Selectiekaart) geraadpleegd. Uit de ABA blijkt dat direct grenzend aan het plangebied bekende archeologische waarden liggen (vindplaats 3V_1) en dat circa 95% van het te verbreden wegtrac\u00e9 binnen een Selectiegebied is gelegen.\nOp basis van het voorliggende bureauonderzoek kan worden gesteld dat in het hele plangebied prehistorische nederzettingsresten aanwezig kunnen zijn op plaatsen waar de top van het dekzand intact is. Gezien de hoogteligging van het dekzand van 7 tot 10 meter min NAP en de relatieve zeespiegelstijging zullen eventueel aanwezige archeologische resten ouder zijn dan circa 8.100 9 6.300 v.Chr. Dit betekent dat zij zullen dateren uit de Midden Steentijd (Mesolithicum / circa 8.800 \u2013 5.300 voor Chr.). Daarnaast kunnen in het plangebied in de jongere afzettingen, zoals detritus, Sloef/Almere en Zuiderzeeafzettingen scheepswrakken, scheepsonderdelen en scheepsladingen of delen hiervan verwacht worden. Ook kunnen archeologische waarden uit de laatste fase van de Oude9Steentijd, het Jong Paleolithicum (circa 18.00099.600 v.Chr.), worden verwacht. Dergelijke vindplaatsen zijn te verwachten in bodemlagen die verband houden met de B\u00f8lling en Aller\u00f8d interstadialen, zoals veen (sterk samengedrukt) en de \u2018Laag van Usselo\u2019. Ook in het Jong Dekzand 1 (Vroege Dryas stadiaal) en Jong Dekzand 2 (Late Dryas stadiaal) kunnen dergelijke vindplaatsen worden verwacht."
    ],
    "oai_identifier": [
        "oai:easy.dans.knaw.nl:easy-dataset:31693"
    ],
    "oai_set": [
        "D30000:D37000",
        "driver",
        "easy-collection:4"
    ],
    "state": "active",
    "tags": [
        {
            "name": "Archaeology"
        },
        {
            "name": "Nederzetting"
        },
        {
            "name": "onbepaald NX"
        },
        {
            "name": "Neolithicum - vC NEO"
        }
    ],
    "title": [
        "ARCHEOLOGISCHE RAPPORTEN ALMERE 64",
        "Basisrapportage Bureauonderzoek. Plangebied 3G/3H/3V Buitenhoutsedreef (Almere Buiten)"
    ],
    "url": ""
}