{
    "Contact": [
        "Lohof, E. ",
        "Veer, R.H. van 't",
        "ADC ArcheoProjecten"
    ],
    "Contributor": [
        "Lohof, E. ",
        "Veer, R.H. van 't",
        "ADC ArcheoProjecten"
    ],
    "DOI": "http://dx.doi.org/doi:10.17026/dans-x3t-asd2",
    "DiscHierarchy": [],
    "Discipline": "Not stated",
    "Format": [
        "application/pdf"
    ],
    "Language": [
        "Dutch"
    ],
    "MetaDataAccess": "https://easy.dans.knaw.nl/oai?verb=GetRecord&metadataPrefix=oai_datacite&identifier=oai:easy.dans.knaw.nl:easy-dataset:35475",
    "MetadataAccess": [
        "oai:easy.dans.knaw.nl:easy-dataset:35475"
    ],
    "PublicationTimestamp": "2010-07-01T11:59:59Z",
    "PublicationYear": [
        "2010"
    ],
    "Publisher": [
        "ADC ArcheoProjecten"
    ],
    "ResourceType": [
        "Dataset"
    ],
    "Rights": [
        "info:eu-repo/semantics/openAccess"
    ],
    "SpatialCoverage": [
        "\n            ",
        "\n            "
    ],
    "TemporalCoverage": [
        "2010-05-28",
        "2010-05-28",
        "2010-10-05"
    ],
    "author": [
        "Zee, R.M. van der ",
        "ADC ArcheoProjecten"
    ],
    "fulltext": "oai:easy.dans.knaw.nl:easy-dataset:35475;2018-09-18T16:53:08Z;D30000:D37000;easy-collection:4;10.17026/dans-x3t-asd2;ADC ArcheoProjecten;Zee, R.M. van der ;Bodegraven Nieuwerbrug aan den Rijn Endelkade 2 Booronderzoek;Endelkade 2 te Nieuwerbrug aan den Rijn (gemeente Bodegraven);Een Bureauonderzoek en Inventariserend Veldonderzoek in de vorm van een verkennend en karterend booronderzoek;ADC ArcheoProjecten;2010;Archaeology;Archeologisch: booronderzoek;Lohof, E. ;Veer, R.H. van 't;ADC ArcheoProjecten;2010-05-28;2010-05-28;2010-10-05;nl;Dataset;urn:nbn:nl:ui:13-bif-rko;easy-dataset:35475;twips.dans.knaw.nl--2636177154615364937-1275033621684;application/pdf;info:eu-repo/semantics/openAccess;In opdracht van Invepro B.V. te Lopik heeft ADC ArcheoProjecten een bureauonderzoek en een inventariserend veldonderzoek uitgevoerd voor het plangebied Endelkade 2 in Nieuwerbrug aan den Rijn (gemeente Bodegraven). In het plangebied zal de uitbreiding van een veestal gerealiseerd worden. Het onderzoek is uitgevoerd in het kader van een aanvraag van een bouwvergunning en was noodzakelijk om te bepalen of bij de voorgenomen activiteiten de kans bestaat dat archeologische resten in de ondergrond worden aangetast. \n\nHoewel deze tot op heden in het gebied niet zijn aangetoond, kunnen in de diepere ondergrond oeveren beddingafzettingen van de Blokland-Snelrewaard meandergordel aanwezig zijn. Op of in de top van deze afzettingen kunnen, gezien de ouderdom van de meandergordel, archeologische resten voorkomen uit het Laat Neolithicum. De resten zullen zich naar verwachting manifesteren als een archeologische laag, bestaande uit een vermenging van onder meer kleine fragmenten aardewerk, houtskool en bot met het oorspronkelijke substraat. De meeste typen archeologische resten (bot, houtskool, aardewerk, metaal) zullen door de natte en zuurstofloze condities goed zijn geconserveerd. Bovendien zullen eventuele resten door afdekking met veen en latere komafzettingen van de Oude Rijn niet door (sub)recente bodemingrepen zijn aangetast.\n\nVanwege de hoge grondwaterspiegel en de moeilijk bewerkbare gronden werden rivierkommen tot aan de grootschalige ontginningen in de Late Middeleeuwen niet uitgekozen voor bewoning en/of landbouw.\n\nDe kans op archeologische resten in het veen en de komklei wordt daarom gering geacht. Het komgebied van de Oude Rijn wordt evenwel doorsneden door crevasses. Op basis van het AHN kan ter plaatse een dergelijke geul verwacht worden. Hoewel tot op heden op de hieraan gerelateerde afzettingen nog geen archeologische resten zijn aangetroffen, moet hier toch rekening mee worden gehouden. Eventuele resten kunnen uit de Bronstijd, IJzertijd en Romeinse tijd dateren. Ook deze resten zullen zich naar verwachting manifesteren als een archeologische laag. Echter, vanwege de ondiepe ligging moet rekening worden gehouden met een verstoring door (sub)recente bodemingrepen.\n\nIn de Middeleeuwen werden de komgebieden op grote schaal ontgonnen. Het plangebied maakt geen deel uit van een ontginningsas en was op oude kaarten onbebouwd. De huidige boerderij is gebouwd in 1996 na een ruilverkaveling. Archeologische resten uit de Middeleeuwen en Nieuwe tijd worden daarom niet verwacht.\n\nTeneinde deze verwachting te toetsen werd in het plangebied een booronderzoek (specificatie VS03) uitgevoerd. Hierbij zijn in het plangebied geen aanwijzingen voor een verstoring van de natuurlijke bodem vastgesteld. Het booronderzoek wijst uit, dat de bodem bestaat uit komafzettingen en veen (respectievelijk Formatie van Echteld en Formatie van Nieuwkoop), afgedekt door een pakket crevasseafzettingen (Formatie van Echteld) van de Oude Rijn. Archeologische resten zijn niet waargenomen. Op basis van het bureauonderzoek werden afzettingen van de stroomgordel van Blokland-Snelrewaard verwacht. Deze zijn tijdens het booronderzoek niet aangetroffen.\n\nADC ArcheoProjecten adviseert om het terrein vrij te geven voor de voorgenomen ontwikkeling. Het is echter niet volledig uit te sluiten dat binnen het onderzochte gebied toch nog archeologische resten voorkomen. Het verdient daarom aanbeveling om de uitvoerder van het grondwerk te wijzen op de plicht archeologische vondsten te melden bij het bevoegde overheid, zoals aangegeven in artikel 53 van de Monumentenwet.;Zuid-Holland;Bodegraven;Nieuwerbrug aan den Rijn;Endelkade 2;31D;52.06765382;4.80406075;52.06765382;4.80406075",
    "group": "danseasy",
    "groups": [
        {
            "name": "danseasy"
        }
    ],
    "name": "0da94acf-4017-5b19-b329-4bcc0a5a7561",
    "notes": [
        "In opdracht van Invepro B.V. te Lopik heeft ADC ArcheoProjecten een bureauonderzoek en een inventariserend veldonderzoek uitgevoerd voor het plangebied Endelkade 2 in Nieuwerbrug aan den Rijn (gemeente Bodegraven). In het plangebied zal de uitbreiding van een veestal gerealiseerd worden. Het onderzoek is uitgevoerd in het kader van een aanvraag van een bouwvergunning en was noodzakelijk om te bepalen of bij de voorgenomen activiteiten de kans bestaat dat archeologische resten in de ondergrond worden aangetast. \n\nHoewel deze tot op heden in het gebied niet zijn aangetoond, kunnen in de diepere ondergrond oeveren beddingafzettingen van de Blokland-Snelrewaard meandergordel aanwezig zijn. Op of in de top van deze afzettingen kunnen, gezien de ouderdom van de meandergordel, archeologische resten voorkomen uit het Laat Neolithicum. De resten zullen zich naar verwachting manifesteren als een archeologische laag, bestaande uit een vermenging van onder meer kleine fragmenten aardewerk, houtskool en bot met het oorspronkelijke substraat. De meeste typen archeologische resten (bot, houtskool, aardewerk, metaal) zullen door de natte en zuurstofloze condities goed zijn geconserveerd. Bovendien zullen eventuele resten door afdekking met veen en latere komafzettingen van de Oude Rijn niet door (sub)recente bodemingrepen zijn aangetast.\n\nVanwege de hoge grondwaterspiegel en de moeilijk bewerkbare gronden werden rivierkommen tot aan de grootschalige ontginningen in de Late Middeleeuwen niet uitgekozen voor bewoning en/of landbouw.\n\nDe kans op archeologische resten in het veen en de komklei wordt daarom gering geacht. Het komgebied van de Oude Rijn wordt evenwel doorsneden door crevasses. Op basis van het AHN kan ter plaatse een dergelijke geul verwacht worden. Hoewel tot op heden op de hieraan gerelateerde afzettingen nog geen archeologische resten zijn aangetroffen, moet hier toch rekening mee worden gehouden. Eventuele resten kunnen uit de Bronstijd, IJzertijd en Romeinse tijd dateren. Ook deze resten zullen zich naar verwachting manifesteren als een archeologische laag. Echter, vanwege de ondiepe ligging moet rekening worden gehouden met een verstoring door (sub)recente bodemingrepen.\n\nIn de Middeleeuwen werden de komgebieden op grote schaal ontgonnen. Het plangebied maakt geen deel uit van een ontginningsas en was op oude kaarten onbebouwd. De huidige boerderij is gebouwd in 1996 na een ruilverkaveling. Archeologische resten uit de Middeleeuwen en Nieuwe tijd worden daarom niet verwacht.\n\nTeneinde deze verwachting te toetsen werd in het plangebied een booronderzoek (specificatie VS03) uitgevoerd. Hierbij zijn in het plangebied geen aanwijzingen voor een verstoring van de natuurlijke bodem vastgesteld. Het booronderzoek wijst uit, dat de bodem bestaat uit komafzettingen en veen (respectievelijk Formatie van Echteld en Formatie van Nieuwkoop), afgedekt door een pakket crevasseafzettingen (Formatie van Echteld) van de Oude Rijn. Archeologische resten zijn niet waargenomen. Op basis van het bureauonderzoek werden afzettingen van de stroomgordel van Blokland-Snelrewaard verwacht. Deze zijn tijdens het booronderzoek niet aangetroffen.\n\nADC ArcheoProjecten adviseert om het terrein vrij te geven voor de voorgenomen ontwikkeling. Het is echter niet volledig uit te sluiten dat binnen het onderzochte gebied toch nog archeologische resten voorkomen. Het verdient daarom aanbeveling om de uitvoerder van het grondwerk te wijzen op de plicht archeologische vondsten te melden bij het bevoegde overheid, zoals aangegeven in artikel 53 van de Monumentenwet."
    ],
    "oai_identifier": [
        "oai:easy.dans.knaw.nl:easy-dataset:35475"
    ],
    "oai_set": [
        "D30000:D37000",
        "easy-collection:4"
    ],
    "state": "active",
    "tags": [
        {
            "name": "Archaeology"
        },
        {
            "name": "Archeologisch booronderzoek"
        }
    ],
    "title": [
        "Bodegraven Nieuwerbrug aan den Rijn Endelkade 2 Booronderzoek",
        "Endelkade 2 te Nieuwerbrug aan den Rijn (gemeente Bodegraven)",
        "Een Bureauonderzoek en Inventariserend Veldonderzoek in de vorm van een verkennend en karterend booronderzoek"
    ],
    "url": ""
}