{
    "Contact": [
        "ernesto.trujillo@epfl.ch"
    ],
    "Contributor": [
        "EnviDat"
    ],
    "DiscHierarchy": [],
    "Discipline": "Not stated",
    "Format": [
        "DAT",
        "DOC",
        "ZIP"
    ],
    "MetaDataAccess": "https://www.envidat.ch/oai?verb=GetRecord&metadataPrefix=iso19139&identifier=doi:10.16904/9",
    "PublicationTimestamp": "2016-12-31T11:59:59Z",
    "PublicationYear": [
        "2016"
    ],
    "Publisher": [
        "EPFL, SLF"
    ],
    "Rights": [
        "Open Data Commons Open Database License (ODbL)"
    ],
    "author": [
        "Ernesto Trujillo"
    ],
    "fulltext": "oai:envidat.ch:10.16904/9;2018-07-07T00:08:12Z;doi:10.16904/9;Eng;MD_CharacterSetCode_utf8;Ernesto Trujillo;EPFL, SLF;ernesto.trujillo@epfl.ch;2016-10-16T21:56:52;ISO 19115:2003/19139;1.0;EPSG:4326;High resolution sea ice surface topography from the SIPEX-2 expedition, East Antarctica, 2012;2016-12-31;This dataset comprises of a post-processed set of terrestrial laser scans (TLS\u2019s) of Antarctic sea ice obtained during the Sea Ice Physics and Ecosystem Experiment-2 (SIPEX-2, http://seaice.acecrc.org.au/sipex2012/) in September-November 2012. The post-processing steps include the registration of the individual scans into a single 3-dimensional point cloud, the removal of unwanted noise caused by particles in the air (i.e., snow crystals), and the final generation of surface grids based on the cleaned individual point returns. The final product includes the \u2018xyz\u2019 coordinates of the individual point measurements, and gridded surfaces covering study areas of 100m x 100 m, and at resolutions of 0.01 m, 0.1 m, 0.25 m, 0.5 m and 1 m for each of the survey dates. Additionally, subgrid statistics that include the mean elevation, standard deviation, minimum and maximum elevations, range, and number of point returns in each gridcell are generated. The final product is provided in space-delimited text files, with the surface grids provided in Digital Terrain Model (DTM) format ready for visualization in any GIS software.    ###How to cite:  Please also cite the original publication when using this data set.: Trujillo, E., K. Leonard, T. Maksym, and M. Lehning (2016), Changes in snow distribution and surface topography following a snowstorm on Antarctic sea ice, J. Geophys. Res. Earth Surf., 121, doi:[10.1002/2016JF003893](https://dx.doi.org/10.1002/2016JF003893).;Ernesto Trujillo;EPFL, SLF;ernesto.trujillo@epfl.ch;POLAR;SEA ICE;SEA ICE ELEVATION;Open Data Commons Open Database License (ODbL);Eng;MD_CharacterSetCode_utf8;114 -66;122 -66;122 -63;114 -63;114 -66;DOC;DAT;ZIP;https://www.envidat.ch/dataset/10-16904-9;HTTPS;DATASET METADATA;information;https://www.envidat.ch/dataset/c88b82ed-d54e-43e6-b4e4-7ae1ee06a014/resource/bb51210c-6738-41d4-b4a4-31dd08f4725e/download/tlssipex-2metadata.doc;HTTPS;DATA PROCESSING DOCUMENTATION;download;ftp://ftp.wsl.ch/pub/smm/sipex2_dat.zip;FTP;LINK TO POST-PROCESSED TLS\u2019S OF ANTARCTIC SEA ICE;download;https://www.envidat.ch/dataset/c88b82ed-d54e-43e6-b4e4-7ae1ee06a014/resource/2557ecb5-e65d-4d60-97ce-fd6696ee2d00/download/10-16904-9sipex2dat.zip;HTTPS;POST PROCESSED TLS'S;download",
    "group": "envidat",
    "groups": [
        {
            "name": "envidat"
        }
    ],
    "name": "f2ca7dea-9bf9-5530-8c3b-34c30043883b",
    "notes": [
        "This dataset comprises of a post-processed set of terrestrial laser scans (TLS\u2019s) of Antarctic sea ice obtained during the Sea Ice Physics and Ecosystem Experiment-2 (SIPEX-2, http://seaice.acecrc.org.au/sipex2012/) in September-November 2012. The post-processing steps include the registration of the individual scans into a single 3-dimensional point cloud, the removal of unwanted noise caused by particles in the air (i.e., snow crystals), and the final generation of surface grids based on the cleaned individual point returns. The final product includes the \u2018xyz\u2019 coordinates of the individual point measurements, and gridded surfaces covering study areas of 100m x 100 m, and at resolutions of 0.01 m, 0.1 m, 0.25 m, 0.5 m and 1 m for each of the survey dates. Additionally, subgrid statistics that include the mean elevation, standard deviation, minimum and maximum elevations, range, and number of point returns in each gridcell are generated. The final product is provided in space-delimited text files, with the surface grids provided in Digital Terrain Model (DTM) format ready for visualization in any GIS software.    ###How to cite:  Please also cite the original publication when using this data set.: Trujillo, E., K. Leonard, T. Maksym, and M. Lehning (2016), Changes in snow distribution and surface topography following a snowstorm on Antarctic sea ice, J. Geophys. Res. Earth Surf., 121, doi:[10.1002/2016JF003893](https://dx.doi.org/10.1002/2016JF003893)."
    ],
    "oai_identifier": [
        "doi:10.16904/9",
        "oai:envidat.ch:10.16904/9"
    ],
    "oai_set": "",
    "state": "active",
    "tags": [
        {
            "name": "POLAR"
        },
        {
            "name": "SEA ICE"
        },
        {
            "name": "SEA ICE ELEVATION"
        }
    ],
    "title": [
        "High resolution sea ice surface topography from the SIPEX-2 expedition, East Antarctica, 2012"
    ],
    "url": "https://www.envidat.ch/dataset/c88b82ed-d54e-43e6-b4e4-7ae1ee06a014/resource/2557ecb5-e65d-4d60-97ce-fd6696ee2d00/download/10-16904-9sipex2dat.zip"
}