{
    "Contact": [
        "SEANOE"
    ],
    "DOI": "http://dx.doi.org/10.17882/61186",
    "DiscHierarchy": [
        "4.4.4",
        "Geosciences",
        "Oceanography/Marine Science"
    ],
    "Discipline": "Oceanography/Marine Science",
    "MetaDataAccess": "http://www.seanoe.org/oai/OAIHandler?verb=GetRecord&metadataPrefix=oai_dc&identifier=0f11c3ac-c68a-5b91-ab3b-ed09dba38f9c",
    "PublicationTimestamp": "2019-06-04T11:59:59Z",
    "PublicationYear": [
        "2019"
    ],
    "Publisher": [
        "SEANOE"
    ],
    "ResourceType": [
        "dataset"
    ],
    "Rights": [
        "CC-BY-NC"
    ],
    "SpatialCoverage": "(62S-54S,48W-72W)",
    "TemporalCoverage": " point in time : None",
    "author": [
        "Provost, Christine",
        "Lee, Jae Hak",
        "Ferrari, Ramiro",
        "Artana, Camila",
        "Durand, Isabelle",
        "Senn\u00e9chael, Nathalie",
        "Kartavtseff, Annie",
        "Koenig, Zo\u00e9",
        "Lanoisell\u00e9, Jacky"
    ],
    "fulltext": "oai:seanoe.org:61186;2019-06-06;Drake current-meter mooring velocity data (2006-2008);Provost, Christine;Kartavtseff, Annie;Lee, Jae Hak;Senn\u00e9chael, Nathalie;Lanoisell\u00e9, Jacky;Ferrari, Ramiro;Koenig, Zo\u00e9;Artana, Camila;Durand, Isabelle;Drake Passage;Current meter moorings;Antarctic Circumpolar Current;Ten current meter moorings (M1 through M10) were deployed in the Drake Passage in January 2006 (DRAKE 2006, ANT-XIII/3) from RV Polarstern on her way south from Punta Arenas to Jubany station (King-George Island) and Bernardo O Higgins Station (Antarctic Peninsula). The moorings were placed along ground track #104 of Jason altimetry satellite. Recovery took place in April 2008 (Drake 2008, ANT-XXIV/3) from RV Polarstern on her way from Bellingshausen station (King George Island) to Punta Arenas. Moorings M2 and M8 could not be recovered (flotation issues). This data set is made of the velocity time series from 8 moorings.\n;SEANOE;2019-06-04;dataset;DOI:10.17882/61186;http://dx.doi.org/10.17882/61186;North -54.0, South -62.0, East -72.0, West -48.0;https://www.seanoe.org/data/00500/61186/illustration.gif;-62.0 -48.0 -54.0 -72.0;CC-BY-NC",
    "group": "seanoe",
    "groups": [
        {
            "name": "seanoe"
        }
    ],
    "name": "0f11c3ac-c68a-5b91-ab3b-ed09dba38f9c",
    "notes": [
        "Ten current meter moorings (M1 through M10) were deployed in the Drake Passage in January 2006 (DRAKE 2006, ANT-XIII/3) from RV Polarstern on her way south from Punta Arenas to Jubany station (King-George Island) and Bernardo O Higgins Station (Antarctic Peninsula). The moorings were placed along ground track #104 of Jason altimetry satellite. Recovery took place in April 2008 (Drake 2008, ANT-XXIV/3) from RV Polarstern on her way from Bellingshausen station (King George Island) to Punta Arenas. Moorings M2 and M8 could not be recovered (flotation issues). This data set is made of the velocity time series from 8 moorings.\n"
    ],
    "oai_identifier": [
        "0f11c3ac-c68a-5b91-ab3b-ed09dba38f9c"
    ],
    "oai_set": "",
    "spatial": "{\"type\":\"Polygon\",\"coordinates\":[[[-48.0,-62.0],[-48.0,-54.0],[-72.0,-54.0],[-72.0,-62.0],[-48.0,-62.0]]]}",
    "state": "active",
    "tags": [
        {
            "name": "Drake Passage"
        },
        {
            "name": "Current meter moorings"
        },
        {
            "name": "Antarctic Circumpolar Current"
        }
    ],
    "title": [
        "Drake current-meter mooring velocity data (2006-2008)"
    ],
    "url": ""
}