{
    "DOI": "http://dx.doi.org/doi:10.15479/AT:ISTA:53",
    "DiscHierarchy": [],
    "Discipline": "Not stated",
    "Format": [
        "archive"
    ],
    "MetaDataAccess": "http://datarep.app.ist.ac.at/cgi/oai2?verb=GetRecord&metadataPrefix=oai_dc&identifier=oai:datarep.app.ist.ac.at:53",
    "RelatedIdentifier": [
        "https://datarep.app.ist.ac.at/53/"
    ],
    "ResourceType": [
        "Data Collection"
    ],
    "author": [
        "Balleza, Enrique",
        "Guet, Calin C",
        "Tomasek, Kathrin",
        "Hauschild, Robert",
        "Andersson, Anna MC",
        "Tkacik, Gasper",
        "Kiviet, Daniel J",
        "Bergmiller, Tobias"
    ],
    "fulltext": "oai:datarep.app.ist.ac.at:53;2017-04-12T08:05:52Z;Biased partitioning of the multi-drug efflux pump AcrAB-TolC underlies long-lived phenotypic heterogeneity;Bergmiller, Tobias;Andersson, Anna MC;Tomasek, Kathrin;Balleza, Enrique;Kiviet, Daniel J;Hauschild, Robert;Tkacik, Gasper;Guet, Calin C;571 Physiology;579 Microorganisms, fungi, algae;This repository contains the data collected for the manuscript \"Biased partitioning of the multi-drug efflux pump AcrAB-TolC underlies long-lived phenotypic heterogeneity\".\r\nThe data is compressed into a single archive. Within the archive, different folders correspond to figures of the main text and the SI of the related publication.\r\nData is saved as plain text, with each folder containing a separate readme file describing the format. Typically, the data is from fluorescence microscopy measurements of single cells growing in a microfluidic \"mother machine\" device, and consists of relevant values (primarily arbitrary unit or normalized fluorescence measurements, and division times / growth rates) after raw microscopy images have been processed, segmented, and their features extracted, as described in the methods section of the related publication.;Data Collection;NonPeerReviewed;archive;https://datarep.app.ist.ac.at/53/;https://datarep.app.ist.ac.at/53/1/Data_MDE.zip;  Bergmiller, Tobias and Andersson, Anna MC and Tomasek, Kathrin and Balleza, Enrique and Kiviet, Daniel J and Hauschild, Robert and Tkacik, Gasper and Guet, Calin C   Biased partitioning of the multi-drug efflux pump AcrAB-TolC underlies long-lived phenotypic heterogeneity.  [Data Collection]    (In Press)  ;doi:10.15479/AT:ISTA:53",
    "group": "ist",
    "groups": [
        {
            "name": "ist"
        }
    ],
    "name": "426c836c-f451-5da3-9a66-26d075fcd221",
    "notes": [
        "This repository contains the data collected for the manuscript \"Biased partitioning of the multi-drug efflux pump AcrAB-TolC underlies long-lived phenotypic heterogeneity\".\r\nThe data is compressed into a single archive. Within the archive, different folders correspond to figures of the main text and the SI of the related publication.\r\nData is saved as plain text, with each folder containing a separate readme file describing the format. Typically, the data is from fluorescence microscopy measurements of single cells growing in a microfluidic \"mother machine\" device, and consists of relevant values (primarily arbitrary unit or normalized fluorescence measurements, and division times / growth rates) after raw microscopy images have been processed, segmented, and their features extracted, as described in the methods section of the related publication."
    ],
    "oai_identifier": [
        "oai:datarep.app.ist.ac.at:53"
    ],
    "oai_set": "",
    "state": "active",
    "tags": [
        {
            "name": "Physiology"
        },
        {
            "name": "Microorganisms"
        },
        {
            "name": "fungi"
        },
        {
            "name": "algae"
        }
    ],
    "title": [
        "Biased partitioning of the multi-drug efflux pump AcrAB-TolC underlies long-lived phenotypic heterogeneity"
    ],
    "url": "https://datarep.app.ist.ac.at/53/1/Data_MDE.zip"
}