{
    "DOI": "http://dx.doi.org/doi:10.15479/AT:ISTA:34 ",
    "DiscHierarchy": [],
    "Discipline": "Not stated",
    "Format": [
        "dataset"
    ],
    "MetaDataAccess": "http://datarep.app.ist.ac.at/cgi/oai2?verb=GetRecord&metadataPrefix=oai_dc&identifier=oai:datarep.app.ist.ac.at:34",
    "RelatedIdentifier": [
        "https://datarep.app.ist.ac.at/34/"
    ],
    "ResourceType": [
        "Data Collection"
    ],
    "author": [
        "Ellis, Thomas",
        "Field, David"
    ],
    "fulltext": "oai:datarep.app.ist.ac.at:34;2017-03-31T07:55:18Z;Flower colour data and phylogeny (NEXUS) files;Ellis, Thomas;Field, David;576 Genetics and evolution;We collected flower colour information on species in the tribe Antirrhineae from taxonomic literature. We also retreived molecular data from GenBank for as many of these species as possible to estimate phylogenetic relationships among these taxa. We then used the R package 'diversitree' to examine patterns of evolutionary transitions between anthocyanin and yellow pigmentation across the phylogeny.\r\n\r\nFor full details of the methods see:\r\nEllis TJ and Field DL \"Repeated gains in yellow and anthocyanin pigmentation in flower colour transitions in the Antirrhineae\u201d, Annals of Botany (in press);Data Collection;NonPeerReviewed;dataset;https://datarep.app.ist.ac.at/34/;https://datarep.app.ist.ac.at/34/1/tellis_flower_colour_data.zip;  Ellis, Thomas and Field, David   Flower colour data and phylogeny (NEXUS) files.  [Data Collection]     ;10.15479/AT:ISTA:34 ",
    "group": "ist",
    "groups": [
        {
            "name": "ist"
        }
    ],
    "name": "56fab68b-5168-546b-9818-3a0443f06376",
    "notes": [
        "We collected flower colour information on species in the tribe Antirrhineae from taxonomic literature. We also retreived molecular data from GenBank for as many of these species as possible to estimate phylogenetic relationships among these taxa. We then used the R package 'diversitree' to examine patterns of evolutionary transitions between anthocyanin and yellow pigmentation across the phylogeny.\r\n\r\nFor full details of the methods see:\r\nEllis TJ and Field DL \"Repeated gains in yellow and anthocyanin pigmentation in flower colour transitions in the Antirrhineae\u201d, Annals of Botany (in press)"
    ],
    "oai_identifier": [
        "oai:datarep.app.ist.ac.at:34"
    ],
    "oai_set": "",
    "state": "active",
    "tags": [
        {
            "name": "Genetics evolution"
        }
    ],
    "title": [
        "Flower colour data and phylogeny (NEXUS) files"
    ],
    "url": "https://datarep.app.ist.ac.at/34/1/tellis_flower_colour_data.zip"
}