{
    "Contact": [
        "Tilastokeskus",
        "CSC, Tieteen tietotekniikan keskus"
    ],
    "DiscHierarchy": [],
    "Discipline": "Not stated",
    "Language": [
        "Finnish"
    ],
    "MetaDataAccess": "https://etsin.avointiede.fi/oai?verb=GetRecord&metadataPrefix=oai_dc&identifier=00aa115d-cf02-5df4-bb1b-60df0f4b4bab",
    "PublicationTimestamp": "2016-02-08T11:59:59Z",
    "PublicationYear": [
        "2016"
    ],
    "Publisher": [
        "Tilastokeskus",
        "CSC, Tieteen tietotekniikan keskus"
    ],
    "ResourceType": [
        "dataset"
    ],
    "Rights": [
        "Other (Open)"
    ],
    "SpatialCoverage": [
        "Suomi",
        "2014/2014"
    ],
    "TemporalCoverage": " period : ( None - 2014-07-01T11:59:59Z ) ",
    "author": [
        "Tilastokeskus, Official Statistics of Finland",
        "Kylli Ek"
    ],
    "fulltext": "urn:nbn:fi:csc-kata00001000000000000559;2016-02-08T15:29:19Z;ilmatieteen-laitos-finnish-meteorological-institute;Tieliikenneonnettomuudet 2014;Road traffic accidents 2014;Tilastokeskus, Official Statistics of Finland;Kylli Ek;Paituli;http://www.yso.fi/onto/koko/p36051;http://www.yso.fi/onto/koko/p71582;Aineisto sis\u00e4lt\u00e4\u00e4 Suomessa poliisin tietoon tulleet ja Tilastokeskukselle ilmoittamat henkil\u00f6vahinkoon johtaneet tieliikenteen onnettomuudet, joilla on koordinaattitiedot. \r\n\r\nAineisto sis\u00e4lt\u00e4\u00e4 seuraavat muuttujat:\r\nonnettomuuden tapahtumavuosi (VVONN)  \r\nonnettomuuden tapahtumakuukausi (KKONN)  \r\nonnettomuuden kellonaika (KELLO)  \r\nonnettomuuden vakavuus (VAKAV):  \r\n1=kuolemaan johtanut onnettomuus  \r\n2=loukkaantumiseen johtanut onnettomuus  \r\nonnettomuustyyppi (ONNTYYPPI):  \r\n0=Samat ajosuunnat (ajo suoraan)  \r\n1=Samat ajosuunnat (ajo k\u00e4\u00e4ntyen)  \r\n2= Vastakkaiset ajosuunnat (ajo suoraan)  \r\n3=Vastakkaiset ajosuunnat (ajo k\u00e4\u00e4ntyen)  \r\n4=Riste\u00e4v\u00e4t ajosuunnat (ajo suoraan)  \r\n5=Riste\u00e4v\u00e4t ajosuunnat (ajo k\u00e4\u00e4ntyen)  \r\n6=Jalankulkijaonnettomuus (suojatiell\u00e4)  \r\n7=Jalankulkijaonnettomuus (muualla)  \r\n8=Tielt\u00e4 suistuminen  \r\n9=Muu onnettomuus,  \r\nhenkil\u00f6autojen ja pakettiautojen lukum\u00e4\u00e4r\u00e4 onnettomuudessa (LKMHAPA)  \r\nlinja-autojen ja kuorma-autojen lukum\u00e4\u00e4r\u00e4 onnettomuudessa (LKMLAKA)  \r\njalankulkijoiden lukum\u00e4\u00e4r\u00e4 onnettomuudessa (LKMJK)  \r\npolkupy\u00f6r\u00e4ilij\u00f6iden lukum\u00e4\u00e4r\u00e4 onnettomuudessa (LKMPP)  \r\nmopojen lukum\u00e4\u00e4r\u00e4 onnettomuudessa (LKMMO)  \r\nmoottoripy\u00f6rien lukum\u00e4\u00e4r\u00e4 onnettomuudessa (LKMMP)  \r\nmuiden kulkuneuvojen lukum\u00e4\u00e4r\u00e4 onnettomuudessa (LKMMUUKULK)  \r\nonnettomuuden koordinaattitiedot (ETRS-TM35FIN)\r\n\r\nLis\u00e4tietoja: [Tilastokeskus, Tieliikenneonnettomuudet](http://www.stat.fi/tup/rajapintapalvelut/tieliikenneonnettomuudet.html)\r\n\r\nMuunnos Shape formaattiin on tehty CSC:ll\u00e4.  \r\nKoordinaattij\u00e4rjestelm\u00e4: ETRS-TM35FIN (EPSG:3067);Road traffic accidents involving personal injury known to the police in Finland and reported to Statistics Finland, which have co-ordinate data. \r\n\r\nThe data cover the following information:  \r\nvvonn= year of the accident  \r\nkkonn= month of the accident  \r\nkello= time of the accident  \r\nvakav= seriousness of the accident:  \r\n    1=accident resulting in death  \r\n    2= accident resulting in injury  \r\nonntyyppi= type of accident:  \r\n    0=Same direction of travel (going straight)  \r\n    1=Same direction of travel (turning)  \r\n    2=Opposite direction of travel (going straight)  \r\n    3=Opposite direction of travel (turning)  \r\n    4=Intersecting direction of travel (going straight)  \r\n    5=Intersecting direction of travel (turning)  \r\n    6=Pedestrian accident (on pedestrian crossing)  \r\n    7=Pedestrian accident (elsewhere)  \r\n    8=Running off the road  \r\n    9=Other accident  \r\nlkmhapa= number of passenger cars and vans in the accident  \r\nlkmlaka= number of buses and lorries in the accident  \r\nlkmjk= number of pedestrians in the accident  \r\nlkmpp= number of cyclists in the accident  \r\nlkmmo= number of mopeds in the accident  \r\nlkmmp= number of motor cycles in the accident  \r\nlkmmuukulk= number of other vehicles in the accident  \r\nx= x coordinate of the accident  \r\ny= y coordinate of the accident  \r\n\r\nAdditional information: [Statistics Finland, Road traffic accidents](http://www.stat.fi/tup/rajapintapalvelut/tieliikenneonnettomuudet.html)\r\n\r\nThe data format has been changed to Shape at CSC.  \r\nCoordinate Reference System: ETRS89 / ETRS-TM35FIN (EPSG:3067);CSC, Tieteen tietotekniikan keskus;Tilastokeskus;2016-02-08;dataset;urn:nbn:fi:csc-kata00001000000000000558;urn:nbn:fi:csc-kata00001000000000000560;urn:nbn:fi:csc-kata00001000000000000559;http://etsin.avointiede.fi/dataset/urn-nbn-fi-csc-kata00001000000000000559;fin;Suomi;2014/2014;Other (Open)",
    "group": "etsin",
    "groups": [
        {
            "name": "etsin"
        }
    ],
    "name": "00aa115d-cf02-5df4-bb1b-60df0f4b4bab",
    "notes": [
        "Aineisto sis\u00e4lt\u00e4\u00e4 Suomessa poliisin tietoon tulleet ja Tilastokeskukselle ilmoittamat henkil\u00f6vahinkoon johtaneet tieliikenteen onnettomuudet, joilla on koordinaattitiedot. \r\n\r\nAineisto sis\u00e4lt\u00e4\u00e4 seuraavat muuttujat:\r\nonnettomuuden tapahtumavuosi (VVONN)  \r\nonnettomuuden tapahtumakuukausi (KKONN)  \r\nonnettomuuden kellonaika (KELLO)  \r\nonnettomuuden vakavuus (VAKAV):  \r\n1=kuolemaan johtanut onnettomuus  \r\n2=loukkaantumiseen johtanut onnettomuus  \r\nonnettomuustyyppi (ONNTYYPPI):  \r\n0=Samat ajosuunnat (ajo suoraan)  \r\n1=Samat ajosuunnat (ajo k\u00e4\u00e4ntyen)  \r\n2= Vastakkaiset ajosuunnat (ajo suoraan)  \r\n3=Vastakkaiset ajosuunnat (ajo k\u00e4\u00e4ntyen)  \r\n4=Riste\u00e4v\u00e4t ajosuunnat (ajo suoraan)  \r\n5=Riste\u00e4v\u00e4t ajosuunnat (ajo k\u00e4\u00e4ntyen)  \r\n6=Jalankulkijaonnettomuus (suojatiell\u00e4)  \r\n7=Jalankulkijaonnettomuus (muualla)  \r\n8=Tielt\u00e4 suistuminen  \r\n9=Muu onnettomuus,  \r\nhenkil\u00f6autojen ja pakettiautojen lukum\u00e4\u00e4r\u00e4 onnettomuudessa (LKMHAPA)  \r\nlinja-autojen ja kuorma-autojen lukum\u00e4\u00e4r\u00e4 onnettomuudessa (LKMLAKA)  \r\njalankulkijoiden lukum\u00e4\u00e4r\u00e4 onnettomuudessa (LKMJK)  \r\npolkupy\u00f6r\u00e4ilij\u00f6iden lukum\u00e4\u00e4r\u00e4 onnettomuudessa (LKMPP)  \r\nmopojen lukum\u00e4\u00e4r\u00e4 onnettomuudessa (LKMMO)  \r\nmoottoripy\u00f6rien lukum\u00e4\u00e4r\u00e4 onnettomuudessa (LKMMP)  \r\nmuiden kulkuneuvojen lukum\u00e4\u00e4r\u00e4 onnettomuudessa (LKMMUUKULK)  \r\nonnettomuuden koordinaattitiedot (ETRS-TM35FIN)\r\n\r\nLis\u00e4tietoja: [Tilastokeskus, Tieliikenneonnettomuudet](http://www.stat.fi/tup/rajapintapalvelut/tieliikenneonnettomuudet.html)\r\n\r\nMuunnos Shape formaattiin on tehty CSC:ll\u00e4.  \r\nKoordinaattij\u00e4rjestelm\u00e4: ETRS-TM35FIN (EPSG:3067)",
        "Road traffic accidents involving personal injury known to the police in Finland and reported to Statistics Finland, which have co-ordinate data. \r\n\r\nThe data cover the following information:  \r\nvvonn= year of the accident  \r\nkkonn= month of the accident  \r\nkello= time of the accident  \r\nvakav= seriousness of the accident:  \r\n    1=accident resulting in death  \r\n    2= accident resulting in injury  \r\nonntyyppi= type of accident:  \r\n    0=Same direction of travel (going straight)  \r\n    1=Same direction of travel (turning)  \r\n    2=Opposite direction of travel (going straight)  \r\n    3=Opposite direction of travel (turning)  \r\n    4=Intersecting direction of travel (going straight)  \r\n    5=Intersecting direction of travel (turning)  \r\n    6=Pedestrian accident (on pedestrian crossing)  \r\n    7=Pedestrian accident (elsewhere)  \r\n    8=Running off the road  \r\n    9=Other accident  \r\nlkmhapa= number of passenger cars and vans in the accident  \r\nlkmlaka= number of buses and lorries in the accident  \r\nlkmjk= number of pedestrians in the accident  \r\nlkmpp= number of cyclists in the accident  \r\nlkmmo= number of mopeds in the accident  \r\nlkmmp= number of motor cycles in the accident  \r\nlkmmuukulk= number of other vehicles in the accident  \r\nx= x coordinate of the accident  \r\ny= y coordinate of the accident  \r\n\r\nAdditional information: [Statistics Finland, Road traffic accidents](http://www.stat.fi/tup/rajapintapalvelut/tieliikenneonnettomuudet.html)\r\n\r\nThe data format has been changed to Shape at CSC.  \r\nCoordinate Reference System: ETRS89 / ETRS-TM35FIN (EPSG:3067)"
    ],
    "oai_identifier": [
        "00aa115d-cf02-5df4-bb1b-60df0f4b4bab"
    ],
    "oai_set": "",
    "state": "active",
    "tags": [
        {
            "name": "Paituli"
        },
        {
            "name": "http www.yso.fi onto koko p"
        },
        {
            "name": "http www.yso.fi onto koko p"
        }
    ],
    "title": [
        "Tieliikenneonnettomuudet 2014",
        "Road traffic accidents 2014"
    ],
    "url": "http://etsin.avointiede.fi/dataset/urn-nbn-fi-csc-kata00001000000000000559"
}