{
    "Contact": [
        "Wroc\u0142aw University of Technology"
    ],
    "DiscHierarchy": [
        "1.4",
        "Humanities",
        "Linguistics"
    ],
    "Discipline": "Linguistics",
    "Format": [
        "downloadable_files_count: 0"
    ],
    "Language": [
        "Polish"
    ],
    "MetaDataAccess": "https://clarin-pl.eu/oai/request?verb=GetRecord&metadataPrefix=oai_dc&identifier=oai:clarin-pl.eu:11321/31",
    "MetadataAccess": [
        "oai:clarin-pl.eu:11321/31"
    ],
    "PID": "http://hdl.handle.net/11321/31",
    "PublicationTimestamp": "2014-07-01T11:59:59Z",
    "PublicationYear": [
        "2014"
    ],
    "Publisher": [
        "Wroc\u0142aw University of Technology"
    ],
    "ResourceType": [
        "toolService"
    ],
    "author": [
        "Godlewski, Grzegorz",
        "Piasecki, Maciej",
        "Broda, Bartosz",
        "Wardy\u0144ski, Adam",
        "Radziszewski, Adam"
    ],
    "fulltext": "oai:clarin-pl.eu:11321/31;2016-01-21T14:37:02Z;hdl_11321_3;hdl_11321_4;TaKIPI;Piasecki, Maciej;Radziszewski, Adam;Godlewski, Grzegorz;Broda, Bartosz;Wardy\u0144ski, Adam;TaKIPI is a tagger of Polish language that is a tool which assigns morpho-syntactic markers to words in the text.\r\n\r\nThe tagger assumes a morpho-syntactic description of IPI PAN corpus tagset. Contextual disambiguation is carried out via a small set of hand-written rules and via a bigger number of rules automatically extracted by means of the algorithm of the induction of decision trees C4.5. During the process of tagger's learning and functioning, the context of each word's occurence in the text is represented as a feature vector of a constant length. Such vector is obtained by means of hand-written functional expressions of JOSKIPI formalism, which refer to morpho-syntactic properties of the context.;2014;toolService;http://hdl.handle.net/11321/31;pol;downloadable_files_count: 0;Wroc\u0142aw University of Technology;http://nlp.pwr.wroc.pl/takipi/",
    "group": "clarin",
    "groups": [
        {
            "name": "clarin"
        }
    ],
    "name": "06036765-333f-5a39-bff8-83fdd1ea61b6",
    "notes": [
        "TaKIPI is a tagger of Polish language that is a tool which assigns morpho-syntactic markers to words in the text.\r\n\r\nThe tagger assumes a morpho-syntactic description of IPI PAN corpus tagset. Contextual disambiguation is carried out via a small set of hand-written rules and via a bigger number of rules automatically extracted by means of the algorithm of the induction of decision trees C4.5. During the process of tagger's learning and functioning, the context of each word's occurence in the text is represented as a feature vector of a constant length. Such vector is obtained by means of hand-written functional expressions of JOSKIPI formalism, which refer to morpho-syntactic properties of the context."
    ],
    "oai_identifier": [
        "oai:clarin-pl.eu:11321/31"
    ],
    "oai_set": [
        "hdl_11321_3",
        "hdl_11321_4"
    ],
    "state": "active",
    "title": [
        "TaKIPI"
    ],
    "url": ""
}