{
    "Contact": [
        "Universit\u00e4t des Saarlandes"
    ],
    "Contributor": [
        "Alla Mishchenko"
    ],
    "DiscHierarchy": [
        "1.4",
        "Humanities",
        "Linguistics"
    ],
    "Discipline": "Linguistics",
    "Format": [
        "text/xml"
    ],
    "Language": [
        "Georgian",
        "Ukrainian",
        "Russian",
        "German"
    ],
    "MetaDataAccess": "https://clarin-pl.eu/oai/request?verb=GetRecord&metadataPrefix=oai_dc&identifier=oai:fedora.clarin-d.uni-saarland.de:clarind-uds:grug",
    "MetadataAccess": [
        "oai:fedora.clarin-d.uni-saarland.de:clarind-uds:grug"
    ],
    "PID": "http://hdl.handle.net/11858/00-246C-0000-0006-C150-9",
    "PublicationTimestamp": "2012-07-01T11:59:59Z",
    "PublicationYear": [
        "2012"
    ],
    "Publisher": [
        "Universit\u00e4t des Saarlandes"
    ],
    "RelatedIdentifier": [
        "Research report \"Building Parallel Treebanks for the Lesser-Resourced Languages\"",
        "Slides \"A German-Georgian Treebank Project\"",
        "XEROX Finite-State Tool: http://www.cis.upenn.edu/~cis639/docs/xfst.html",
        "TIGER-XML format: http://www.ims.uni-stuttgart.de/projekte/TIGER/TIGERSearch/doc/html/TigerXML.html",
        "Synpathy, tool for manual syntactical annotation: http://tla.mpi.nl/tools/tla-tools/older-tools/synpathy/",
        "TIGERSearch tool to explore linguistically annotated texts: http://www.ims.uni-stuttgart.de/projekte/TIGER/TIGERSearch/oldindex.shtml",
        "Stockholm Treealigner, a tool for aligning and searching parallel treebanks: http://www.ling.su.se/datorlingvistik/stockholm-treealigner-1.14019"
    ],
    "ResourceType": [
        "Dataset"
    ],
    "Rights": [
        "Creative Commons Attribution 3.0 Unported (CC BY 3.0) http://creativecommons.org/licenses/by/3.0/"
    ],
    "SpatialCoverage": [
        "Georgia",
        "Ukraine",
        "Russia",
        "Germany"
    ],
    "TemporalCoverage": [
        "Georgia",
        "Ukraine",
        "Russia",
        "Germany"
    ],
    "author": [
        "Oleg Kapanadze"
    ],
    "fulltext": "oai:fedora.clarin-d.uni-saarland.de:clarind-uds:grug;2014-06-03T12:59:07Z;GRUG Parallel Treebank;Oleg Kapanadze;corpus linguistics;linguistics;computational linguistics;treebank;syntactic annotation;lesser-resourced languages;This dataset is made of two types of resources: four monolingual Treebanks (German, Georgian, Russian and Ukrainian), and four parallel Treebanks (German-Georgian, German-Russian, German-Ukrainian, Georgian-Ukrainian).\nThe parallel texts used for the outlined experiment comprises German sentences and their translations into Georgian and Russian languages compiled for the GREG NLP lexicon\nproject. The GREG itself contains valency data with the manually aligned Georgian, Russian, English and German verbs (ca. 1250) augmented with the examples of sentences considered as translation equivalents. Each subcorpus used for the study has a size of roughly 2600 sentence pairs that correspond to different syntactic subcategorization frames considered as German-Georgian translation equivalents. For the Russian and Ukrainian languages translation equivalents were provided by Dr. Alla Mishchenko.\n\nMorphological analysis\nFor the Georgian text analyses has been applied a finitestate morphological transducer using the XEROX FST tools.\nFor the rest of languages, German, Russian and Ukrainian, involved in the experiment, morphological features, including POS tags, were assigned manually drawing on the TIGER guidelines for the German language with the necessary changes relevant to the Russian and Ukrainian grammar formal description.\n\nSyntactic parsing\nThe syntactical annotation was done manually with Synpathy. The annotation followed the TIGER guidelines and the outcome follows the TIGER-XML format.\n\nAlignment of  monolingual Treebanks into parallel bilingual Treebanks\nThe alignment of the monolingual (GO, RU, UK, GE) Treebanks into the bilingual (GE-GO, GE-RU, GE-UK, GO-UK) ones was done manually with Stockholm TreeAligner. The issue was performed at sentence, phrase and word level. Two types of translations are aligned: \"exact\" and \"fuzzy\" translation equivalents.;Universit\u00e4t des Saarlandes;Alla Mishchenko;2012;Dataset;text/xml;clarind-uds:grug;hdl:11858/00-246C-0000-0006-C150-9;GREG NLP lexicon, A Georgian, Russian, English and German Valency Lexicon for Natural Language Processing: http://www2.informatik.uni-stuttgart.de/ivi/is/greg-index.html;kat;ukr;rus;deu;Research report \"Building Parallel Treebanks for the Lesser-Resourced Languages\";Slides \"A German-Georgian Treebank Project\";XEROX Finite-State Tool: http://www.cis.upenn.edu/~cis639/docs/xfst.html;TIGER-XML format: http://www.ims.uni-stuttgart.de/projekte/TIGER/TIGERSearch/doc/html/TigerXML.html;Synpathy, tool for manual syntactical annotation: http://tla.mpi.nl/tools/tla-tools/older-tools/synpathy/;TIGERSearch tool to explore linguistically annotated texts: http://www.ims.uni-stuttgart.de/projekte/TIGER/TIGERSearch/oldindex.shtml;Stockholm Treealigner, a tool for aligning and searching parallel treebanks: http://www.ling.su.se/datorlingvistik/stockholm-treealigner-1.14019;Georgia;Ukraine;Russia;Germany;Creative Commons Attribution 3.0 Unported (CC BY 3.0) http://creativecommons.org/licenses/by/3.0/",
    "group": "clarin",
    "groups": [
        {
            "name": "clarin"
        }
    ],
    "name": "0a84a124-9ecf-502f-b2e4-8df135ca2ffb",
    "notes": [
        "This dataset is made of two types of resources: four monolingual Treebanks (German, Georgian, Russian and Ukrainian), and four parallel Treebanks (German-Georgian, German-Russian, German-Ukrainian, Georgian-Ukrainian).\nThe parallel texts used for the outlined experiment comprises German sentences and their translations into Georgian and Russian languages compiled for the GREG NLP lexicon\nproject. The GREG itself contains valency data with the manually aligned Georgian, Russian, English and German verbs (ca. 1250) augmented with the examples of sentences considered as translation equivalents. Each subcorpus used for the study has a size of roughly 2600 sentence pairs that correspond to different syntactic subcategorization frames considered as German-Georgian translation equivalents. For the Russian and Ukrainian languages translation equivalents were provided by Dr. Alla Mishchenko.\n\nMorphological analysis\nFor the Georgian text analyses has been applied a finitestate morphological transducer using the XEROX FST tools.\nFor the rest of languages, German, Russian and Ukrainian, involved in the experiment, morphological features, including POS tags, were assigned manually drawing on the TIGER guidelines for the German language with the necessary changes relevant to the Russian and Ukrainian grammar formal description.\n\nSyntactic parsing\nThe syntactical annotation was done manually with Synpathy. The annotation followed the TIGER guidelines and the outcome follows the TIGER-XML format.\n\nAlignment of  monolingual Treebanks into parallel bilingual Treebanks\nThe alignment of the monolingual (GO, RU, UK, GE) Treebanks into the bilingual (GE-GO, GE-RU, GE-UK, GO-UK) ones was done manually with Stockholm TreeAligner. The issue was performed at sentence, phrase and word level. Two types of translations are aligned: \"exact\" and \"fuzzy\" translation equivalents."
    ],
    "oai_identifier": [
        "oai:fedora.clarin-d.uni-saarland.de:clarind-uds:grug"
    ],
    "oai_set": "",
    "state": "active",
    "tags": [
        {
            "name": "corpus linguistics"
        },
        {
            "name": "linguistics"
        },
        {
            "name": "computational linguistics"
        },
        {
            "name": "treebank"
        },
        {
            "name": "syntactic annotation"
        },
        {
            "name": "lesser-resourced languages"
        }
    ],
    "title": [
        "GRUG Parallel Treebank"
    ],
    "url": ""
}