{
    "Contact": [
        "University of Bergen"
    ],
    "DiscHierarchy": [
        "1.4",
        "Humanities",
        "Linguistics"
    ],
    "Discipline": "Linguistics",
    "Format": [
        "text/xml",
        "downloadable_files_count: 1",
        "text/plain"
    ],
    "Language": [
        "English",
        "Latin"
    ],
    "MetaDataAccess": "https://clarin-pl.eu/oai/request?verb=GetRecord&metadataPrefix=oai_dc&identifier=oai:repo.clarino.uib.no:11509/87",
    "MetadataAccess": [
        "oai:repo.clarino.uib.no:11509/87"
    ],
    "PID": "http://hdl.handle.net/11509/87",
    "PublicationTimestamp": "2004-07-01T11:59:59Z",
    "PublicationYear": [
        "2004"
    ],
    "Publisher": [
        "University of Bergen"
    ],
    "ResourceType": [
        "corpus"
    ],
    "Rights": [
        "gunns-license",
        "www.dummy.org",
        "RES"
    ],
    "author": [
        "Ommundsen, \u00c5slaug"
    ],
    "fulltext": "oai:repo.clarino.uib.no:11509/87;2017-01-13T08:40:22Z;hdl_11509_1;hdl_11509_2;The Botulph Breviary fragments;Ommundsen, \u00c5slaug;Fragment;Liturgy;13th Century;Transcription of UBB MS 1549, 1b.\n\nThe so-called Botulph Breviary fragments is a group of four fragments from the same Breviary, written in England in the late thirteenth century. One of the fragments contains the readings six to nine for the Matins of St Botulph's day (17 June, in Scotland 25 June). Nine readings constitute the highest degree of a saint's feast. St Botulph was a popular saint in Eastern England and Scotland, and the Botulph breviary was therefore perhaps written in Eastern England. The lessons six to nine, more or less extant in our fragment a, describe Botulph's discovery of Ikanho (possibly the present Iken in Suffolk, east of Ipswich), the exorcism of the area's demons, the building of the monastery (in 654), and, finally, to the great lament of his fellow brothers, Botulph's death (in 680). Apart from the readings of St Botulph's day, the fragments contain parts of the liturgy of the feast days of the Annunciation (25 March) and of the Saints Philip and Jacob (1 May).;2004;corpus;http://hdl.handle.net/11509/87;eng;lat;gunns-license;www.dummy.org;RES;text/xml;text/plain;downloadable_files_count: 1;University of Bergen;http://ub.uib.no/fragment/transcriptions/UBB%20MS%201549,%201b-transkr.html",
    "group": "clarin",
    "groups": [
        {
            "name": "clarin"
        }
    ],
    "name": "0ab86989-f89e-55ef-93da-d8ec8e59977f",
    "notes": [
        "Transcription of UBB MS 1549, 1b.\n\nThe so-called Botulph Breviary fragments is a group of four fragments from the same Breviary, written in England in the late thirteenth century. One of the fragments contains the readings six to nine for the Matins of St Botulph's day (17 June, in Scotland 25 June). Nine readings constitute the highest degree of a saint's feast. St Botulph was a popular saint in Eastern England and Scotland, and the Botulph breviary was therefore perhaps written in Eastern England. The lessons six to nine, more or less extant in our fragment a, describe Botulph's discovery of Ikanho (possibly the present Iken in Suffolk, east of Ipswich), the exorcism of the area's demons, the building of the monastery (in 654), and, finally, to the great lament of his fellow brothers, Botulph's death (in 680). Apart from the readings of St Botulph's day, the fragments contain parts of the liturgy of the feast days of the Annunciation (25 March) and of the Saints Philip and Jacob (1 May)."
    ],
    "oai_identifier": [
        "oai:repo.clarino.uib.no:11509/87"
    ],
    "oai_set": [
        "hdl_11509_1",
        "hdl_11509_2"
    ],
    "state": "active",
    "tags": [
        {
            "name": "Fragment"
        },
        {
            "name": "Liturgy"
        },
        {
            "name": "th Century"
        }
    ],
    "title": [
        "The Botulph Breviary fragments"
    ],
    "url": ""
}