{
    "Contact": [
        "Oxford Text Archive, University of Oxford"
    ],
    "Contributor": [
        "Francis, Louis"
    ],
    "DiscHierarchy": [
        "1.4",
        "Humanities",
        "Linguistics"
    ],
    "Discipline": "Linguistics",
    "Format": [
        "(9 files : total of ca. 388 KB)"
    ],
    "Language": [
        "English",
        "Latin"
    ],
    "MetaDataAccess": "https://clarin-pl.eu/oai/request?verb=GetRecord&metadataPrefix=oai_dc&identifier=oai:ota:oucs:2420",
    "MetadataAccess": [
        "oai:ota:oucs:2420"
    ],
    "PublicationTimestamp": "1997-06-01T11:59:59Z",
    "PublicationYear": [
        "1997"
    ],
    "Publisher": [
        "Oxford Text Archive, University of Oxford"
    ],
    "ResourceType": [
        "Text",
        "Commentaries"
    ],
    "Rights": [
        "Distributed by the University of Oxford under a Creative Commons Attribution-NonCommercial-ShareAlike 3.0 Unported License.",
        "http://www.ota.ox.ac.uk/documents/user_agreement.xml"
    ],
    "author": [
        "Horace"
    ],
    "fulltext": "oai:ota:oucs:2420;2018-06-18T12:25:58Z;http://ota.ox.ac.uk/headers/2420.xml;Carmina. Liber 4. English & Latin;Verba ambigua Horati : the enigma of Book IV;Horace;1997-06-01;text_and_corpus_linguistics;Academic dissertations;Latin poetry;Translations;eng;lat;This text seeks to explore Book IV of Horace's Odes not as isolated works of adulatory verse, but as a collection of subliminal vignettes on Roman society in the early days of the Principate. That they were written as individual items over a period of time, ranging from 13 BC. to 8 BC., is not disputed. That they were really intended by Horace as a complete entity in their own right is the primary argument of this work and is supported by a full translation, commentary and analysis of the Latin text in which the order of the odes has been reconstituted ;Oxford Text Archive, University of Oxford;Francis, Louis;Francis, Louis;(9 files : total of ca. 388 KB);Text;Commentaries;Distributed by the University of Oxford under a Creative Commons Attribution-NonCommercial-ShareAlike 3.0 Unported License.;http://www.ota.ox.ac.uk/documents/user_agreement.xml",
    "group": "clarin",
    "groups": [
        {
            "name": "clarin"
        }
    ],
    "name": "0c3a314f-9724-5cb3-8f47-388709dd3c31",
    "notes": [
        "This text seeks to explore Book IV of Horace's Odes not as isolated works of adulatory verse, but as a collection of subliminal vignettes on Roman society in the early days of the Principate. That they were written as individual items over a period of time, ranging from 13 BC. to 8 BC., is not disputed. That they were really intended by Horace as a complete entity in their own right is the primary argument of this work and is supported by a full translation, commentary and analysis of the Latin text in which the order of the odes has been reconstituted "
    ],
    "oai_identifier": [
        "oai:ota:oucs:2420"
    ],
    "oai_set": "",
    "state": "active",
    "tags": [
        {
            "name": "text_and_corpus_linguistics"
        },
        {
            "name": "Academic dissertations"
        },
        {
            "name": "Latin poetry"
        },
        {
            "name": "Translations"
        }
    ],
    "title": [
        "Carmina. Liber 4. English & Latin",
        "Verba ambigua Horati : the enigma of Book IV"
    ],
    "url": "http://ota.ox.ac.uk/headers/2420.xml"
}