{
    "Contact": [
        "Institute of Czech Language, Czech Academy of Sciences",
        "Masaryk University, NLP Centre"
    ],
    "DiscHierarchy": [
        "1.4",
        "Humanities",
        "Linguistics"
    ],
    "Discipline": "Linguistics",
    "Format": [
        "downloadable_files_count: 0"
    ],
    "Language": [
        "Czech",
        "English"
    ],
    "MetaDataAccess": "https://clarin-pl.eu/oai/request?verb=GetRecord&metadataPrefix=oai_dc&identifier=oai:lindat.mff.cuni.cz:11858/00-097C-0000-0023-8BD2-2",
    "MetadataAccess": [
        "oai:lindat.mff.cuni.cz:11858/00-097C-0000-0023-8BD2-2"
    ],
    "PID": "http://hdl.handle.net/11858/00-097C-0000-0023-8BD2-2",
    "PublicationTimestamp": "2009-01-14T11:59:59Z",
    "PublicationYear": [
        "2009"
    ],
    "Publisher": [
        "Institute of Czech Language, Czech Academy of Sciences",
        "Masaryk University, NLP Centre"
    ],
    "ResourceType": [
        "toolService"
    ],
    "author": [
        "Svobodov\u00e1, Ivana",
        "Pro\u0161ek, Martin",
        "Kopeck\u00fd, Jakub",
        "M\u017eourkov\u00e1, Hana",
        "Pala, Karel",
        "Smejkalov\u00e1, Kamila",
        "Pravdov\u00e1, Mark\u00e9ta",
        "\u010cern\u00e1, Anna",
        "Hlav\u00e1\u010dkov\u00e1, Dana",
        "Chrom\u00fd, Jan",
        "Bene\u0161, Martin",
        "Uhl\u00ed\u0159ov\u00e1, Ludmila",
        "Prok\u0161ov\u00e1, Hana",
        "Kone\u010dn\u00e1, Hana",
        "\u0160merk, Pavel"
    ],
    "fulltext": "oai:lindat.mff.cuni.cz:11858/00-097C-0000-0023-8BD2-2;2016-04-06T16:39:49Z;hdl_11858_00-097C-0000-0007-710A-A;hdl_11858_00-097C-0000-0007-710B-8;The Internet Language Reference Book;\u0160merk, Pavel;Pravdov\u00e1, Mark\u00e9ta;Bene\u0161, Martin;\u010cern\u00e1, Anna;Hlav\u00e1\u010dkov\u00e1, Dana;Chrom\u00fd, Jan;Kone\u010dn\u00e1, Hana;Kopeck\u00fd, Jakub;M\u017eourkov\u00e1, Hana;Pala, Karel;Prok\u0161ov\u00e1, Hana;Pro\u0161ek, Martin;Smejkalov\u00e1, Kamila;Svobodov\u00e1, Ivana;Uhl\u00ed\u0159ov\u00e1, Ludmila;literature;The ILRB has been created by two cooperating teams - by the team of the Institute of Czech Language, Czech Academy of Sciences and the team of the NLP Centre at the Faculty of Informatics, Masaryk University (2004-2008).\r\n\r\nThe tool consists of two sections: wordlist and reference (explanatory) one. Comments and remarks are welcome and should be send to the address poradna@ujc.cas.cz.\r\n\r\n1. Wordlist section\r\nIt contains more than 60 000 dictionary entries and is based on the glossary of the School Rules of Czech Orthography, the Dictionary of the Literary Czech and selected entries from the New Dictionary of Words of Foreign Origin and Dictionary of Neologisms. The entries typically include information that is asked about frequently by the users. Also inflectional forms of the particular words forms are offered in the form of tables thanks to the morphological analyzer ajka created at the Faculty of Informatics, MU. The dictionary part is linked to the explanatory one through the hypertext links.\r\n\r\n2. Reference section\r\nIt comprises the explanations about linguistic phenomena described in the Rules of Czech Orthography and contemporary Czech grammars, frequently and repeatedly asked by the users turning to the Linguistic Advisory Line in the Institute of Czech Language. In the offered explanations some typical spelling problems are dealt with including the appropriate recommendations. The ILRB is regularly updated and completed, new expressions are added and made more precise.;2009-01-14;toolService;http://hdl.handle.net/11858/00-097C-0000-0023-8BD2-2;ces;eng;downloadable_files_count: 0;Institute of Czech Language, Czech Academy of Sciences;Masaryk University, NLP Centre;http://prirucka.ujc.cas.cz/l/en/",
    "group": "clarin",
    "groups": [
        {
            "name": "clarin"
        }
    ],
    "name": "0c730a8f-c319-5fc7-be7b-a0d5716ed400",
    "notes": [
        "The ILRB has been created by two cooperating teams - by the team of the Institute of Czech Language, Czech Academy of Sciences and the team of the NLP Centre at the Faculty of Informatics, Masaryk University (2004-2008).\r\n\r\nThe tool consists of two sections: wordlist and reference (explanatory) one. Comments and remarks are welcome and should be send to the address poradna@ujc.cas.cz.\r\n\r\n1. Wordlist section\r\nIt contains more than 60 000 dictionary entries and is based on the glossary of the School Rules of Czech Orthography, the Dictionary of the Literary Czech and selected entries from the New Dictionary of Words of Foreign Origin and Dictionary of Neologisms. The entries typically include information that is asked about frequently by the users. Also inflectional forms of the particular words forms are offered in the form of tables thanks to the morphological analyzer ajka created at the Faculty of Informatics, MU. The dictionary part is linked to the explanatory one through the hypertext links.\r\n\r\n2. Reference section\r\nIt comprises the explanations about linguistic phenomena described in the Rules of Czech Orthography and contemporary Czech grammars, frequently and repeatedly asked by the users turning to the Linguistic Advisory Line in the Institute of Czech Language. In the offered explanations some typical spelling problems are dealt with including the appropriate recommendations. The ILRB is regularly updated and completed, new expressions are added and made more precise."
    ],
    "oai_identifier": [
        "oai:lindat.mff.cuni.cz:11858/00-097C-0000-0023-8BD2-2"
    ],
    "oai_set": [
        "hdl_11858_00-097C-0000-0007-710A-A",
        "hdl_11858_00-097C-0000-0007-710B-8"
    ],
    "state": "active",
    "tags": [
        {
            "name": "literature"
        }
    ],
    "title": [
        "The Internet Language Reference Book"
    ],
    "url": ""
}