{
    "Contact": [
        "Charles University, Faculty of Mathematics and Physics, Institute of Formal and Applied Linguistics (UFAL)"
    ],
    "DiscHierarchy": [
        "1.4",
        "Humanities",
        "Linguistics"
    ],
    "Discipline": "Linguistics",
    "Format": [
        "application/zip",
        "downloadable_files_count: 1",
        "text/plain; charset=utf-8"
    ],
    "Language": [
        "English",
        "Czech",
        "Russian"
    ],
    "MetaDataAccess": "https://clarin-pl.eu/oai/request?verb=GetRecord&metadataPrefix=oai_dc&identifier=oai:lindat.mff.cuni.cz:11234/1-1791",
    "MetadataAccess": [
        "oai:lindat.mff.cuni.cz:11234/1-1791"
    ],
    "PID": "http://hdl.handle.net/11234/1-1791",
    "PublicationTimestamp": "2016-09-30T11:59:59Z",
    "PublicationYear": [
        "2016"
    ],
    "Publisher": [
        "Charles University, Faculty of Mathematics and Physics, Institute of Formal and Applied Linguistics (UFAL)"
    ],
    "ResourceType": [
        "corpus"
    ],
    "Rights": [
        "CC-BY-NC-SA + LDC99T42",
        "https://lindat.mff.cuni.cz/repository/xmlui/page/license-pcedt2",
        "RES"
    ],
    "author": [
        "Nov\u00e1k, Michal",
        "Nedoluzhko, Anna",
        "Schwarz (Khoroshkina), Anna"
    ],
    "fulltext": "oai:lindat.mff.cuni.cz:11234/1-1791;2018-07-02T22:05:52Z;hdl_11858_00-097C-0000-0001-486F-D;hdl_11858_00-097C-0000-0001-4877-A;Prague Czech-English Dependency Treebank 2.0 - Russian translation;Nov\u00e1k, Michal;Nedoluzhko, Anna;Schwarz (Khoroshkina), Anna;multilingual;coreference;Prague Czech-English Dependency Treebank - Russian translation (PCEDT-R) is a project of translating a subset of Prague Czech-English Dependency Treebank 2.0 (PCEDT 2.0) to Russian and linguistically annotating the Russian translations with emphasis on coreference and cross-lingual alignment of coreferential expressions. Cross-lingual comparison of coreference means is currently the purpose that drives development of this corpus.\r\n\r\nThe current version 0.5 is a preliminary version, which contains (+ denotes new features):\r\n  * complete PCEDT 2.0 documents \"wsj_1900\"-\"wsj_1949\"\r\n  * Czech-English word alignment of coreferential expressions annotated manually mainly on the t-layer\r\n  + Russian translations of the original English sentences\r\n  + automatic tokenization, part-of-speech tagging and morphological analysis for Russian\r\n  + automatic word alignment between all Czech and Russian words\r\n  + manual alignment between Russian and the other two languages on possessive pronouns;2016-09-30;corpus;http://hdl.handle.net/11234/1-1791;eng;ces;rus;CC-BY-NC-SA + LDC99T42;https://lindat.mff.cuni.cz/repository/xmlui/page/license-pcedt2;RES;application/zip;text/plain; charset=utf-8;downloadable_files_count: 1;Charles University, Faculty of Mathematics and Physics, Institute of Formal and Applied Linguistics (UFAL)",
    "group": "clarin",
    "groups": [
        {
            "name": "clarin"
        }
    ],
    "name": "0fd68d7e-37ac-5f3f-a6e3-d4c3f701dd37",
    "notes": [
        "Prague Czech-English Dependency Treebank - Russian translation (PCEDT-R) is a project of translating a subset of Prague Czech-English Dependency Treebank 2.0 (PCEDT 2.0) to Russian and linguistically annotating the Russian translations with emphasis on coreference and cross-lingual alignment of coreferential expressions. Cross-lingual comparison of coreference means is currently the purpose that drives development of this corpus.\r\n\r\nThe current version 0.5 is a preliminary version, which contains (+ denotes new features):\r\n  * complete PCEDT 2.0 documents \"wsj_1900\"-\"wsj_1949\"\r\n  * Czech-English word alignment of coreferential expressions annotated manually mainly on the t-layer\r\n  + Russian translations of the original English sentences\r\n  + automatic tokenization, part-of-speech tagging and morphological analysis for Russian\r\n  + automatic word alignment between all Czech and Russian words\r\n  + manual alignment between Russian and the other two languages on possessive pronouns"
    ],
    "oai_identifier": [
        "oai:lindat.mff.cuni.cz:11234/1-1791"
    ],
    "oai_set": [
        "hdl_11858_00-097C-0000-0001-486F-D",
        "hdl_11858_00-097C-0000-0001-4877-A"
    ],
    "state": "active",
    "tags": [
        {
            "name": "multilingual"
        },
        {
            "name": "coreference"
        }
    ],
    "title": [
        "Prague Czech-English Dependency Treebank 2.0 - Russian translation"
    ],
    "url": ""
}