{
    "Contact": [
        "University of Sheffield"
    ],
    "Contributor": [
        "Funk, Adam",
        "Peters, Wim"
    ],
    "DiscHierarchy": [
        "1.4",
        "Humanities",
        "Linguistics"
    ],
    "Discipline": "Linguistics",
    "Format": [
        "downloadable_files_count: 0"
    ],
    "MetaDataAccess": "https://clarin-pl.eu/oai/request?verb=GetRecord&metadataPrefix=oai_dc&identifier=oai:lindat.mff.cuni.cz:11372/LRT-1396",
    "MetadataAccess": [
        "oai:lindat.mff.cuni.cz:11372/LRT-1396"
    ],
    "PID": "http://hdl.handle.net/11372/LRT-1396",
    "PublicationTimestamp": "2014-07-30T11:59:59Z",
    "PublicationYear": [
        "2014"
    ],
    "Publisher": [
        "University of Sheffield"
    ],
    "ResourceType": [
        "toolService"
    ],
    "SpatialCoverage": [
        "United Kingdom"
    ],
    "TemporalCoverage": " point in time : None",
    "fulltext": "oai:lindat.mff.cuni.cz:11372/LRT-1396;2016-04-06T16:39:50Z;hdl_11858_00-097C-0000-0007-710A-A;hdl_11858_00-097C-0000-0007-710B-8;GATE-ANNIE;Funk, Adam;Peters, Wim;GATE-ANNIE, developed by the GATE group at the University of Sheffield (http;//www.gate.ac.uk; Cunningham et al., 2002,) is an Information Extraction (IE) web service for English. It consists of the following main language processing tools: tokeniser, sentence splitter, POS tagger, coreference resolver and named entity recogniser. \r\nThe named entity recogniser identifies and categorizes entity names (such as persons, organizations, and location names), temporal expressions (dates and times), and certain types of numerical expressions (monetary values and percentages). \r\nGATE-ANNIE returns the fully annotated document in GATE XML format. The file saved by the client contains ANNIE's output in the default AnnotationSet and\r\nthe input document's HTML or XML mark-up in the \"Original markups\" AnnotationSet.\r\n\r\n\r\nH. Cunningham, D. Maynard, K. Bontcheva, and V. Tablan. 2002. GATE: A Framework and Graphical Development Environment for Robust NLP Tools and Applications. In Proceedings of the 40th Anniversary Meeting of the Association for Computational Linguistics (ACL-02).;2014-07-30;toolService;http://hdl.handle.net/11372/LRT-1396;downloadable_files_count: 0;United Kingdom;University of Sheffield",
    "group": "clarin",
    "groups": [
        {
            "name": "clarin"
        }
    ],
    "name": "107d6355-97d7-5549-9e7a-1cfaa5ddf121",
    "notes": [
        "GATE-ANNIE, developed by the GATE group at the University of Sheffield (http;//www.gate.ac.uk; Cunningham et al., 2002,) is an Information Extraction (IE) web service for English. It consists of the following main language processing tools: tokeniser, sentence splitter, POS tagger, coreference resolver and named entity recogniser. \r\nThe named entity recogniser identifies and categorizes entity names (such as persons, organizations, and location names), temporal expressions (dates and times), and certain types of numerical expressions (monetary values and percentages). \r\nGATE-ANNIE returns the fully annotated document in GATE XML format. The file saved by the client contains ANNIE's output in the default AnnotationSet and\r\nthe input document's HTML or XML mark-up in the \"Original markups\" AnnotationSet.\r\n\r\n\r\nH. Cunningham, D. Maynard, K. Bontcheva, and V. Tablan. 2002. GATE: A Framework and Graphical Development Environment for Robust NLP Tools and Applications. In Proceedings of the 40th Anniversary Meeting of the Association for Computational Linguistics (ACL-02)."
    ],
    "oai_identifier": [
        "oai:lindat.mff.cuni.cz:11372/LRT-1396"
    ],
    "oai_set": [
        "hdl_11858_00-097C-0000-0007-710A-A",
        "hdl_11858_00-097C-0000-0007-710B-8"
    ],
    "state": "active",
    "title": [
        "GATE-ANNIE"
    ],
    "url": ""
}