{
    "Contact": [
        "Wroc\u0142aw University of Technology"
    ],
    "DiscHierarchy": [
        "1.4",
        "Humanities",
        "Linguistics"
    ],
    "Discipline": "Linguistics",
    "Format": [
        "downloadable_files_count: 0"
    ],
    "Language": [
        "Polish"
    ],
    "MetaDataAccess": "https://clarin-pl.eu/oai/request?verb=GetRecord&metadataPrefix=oai_dc&identifier=oai:clarin-pl.eu:11321/34",
    "MetadataAccess": [
        "oai:clarin-pl.eu:11321/34"
    ],
    "PID": "http://hdl.handle.net/11321/34",
    "PublicationTimestamp": "2011-06-14T11:59:59Z",
    "PublicationYear": [
        "2011"
    ],
    "Publisher": [
        "Wroc\u0142aw University of Technology"
    ],
    "ResourceType": [
        "toolService"
    ],
    "author": [
        "\u015aniatowski, Tomasz",
        "Wardy\u0144ski, Adam",
        "Radziszewski, Adam"
    ],
    "fulltext": "oai:clarin-pl.eu:11321/34;2016-01-21T14:35:40Z;hdl_11321_3;hdl_11321_4;WCCL;Radziszewski, Adam;Wardy\u0144ski, Adam;\u015aniatowski, Tomasz;WCCL (Wroc\u0142aw Corpus Constraint Language) is a formalism for writing functional expressions evaluated on morpho-syntactically annotated text. These expressions may be used directly as features for Machine Learning classification.\r\n\r\nImplementation-wise, WCCL is a set of simple command-line utils, as well as the underlying C++ library with Python wrappers, suitable for rapid development of taggers, chunkers, etc.\r\n\r\nWCCL is targeted at Polish, although the only obstacle to processing other inflectional languages is probably the assumed string representation of tags and corpus I/O formats.;2011-06-14;toolService;http://hdl.handle.net/11321/34;pol;downloadable_files_count: 0;Wroc\u0142aw University of Technology;http://nlp.pwr.wroc.pl/redmine/projects/joskipi/wiki/Install",
    "group": "clarin",
    "groups": [
        {
            "name": "clarin"
        }
    ],
    "name": "1bfb53f1-022b-5b2e-8929-45c66e4d3a83",
    "notes": [
        "WCCL (Wroc\u0142aw Corpus Constraint Language) is a formalism for writing functional expressions evaluated on morpho-syntactically annotated text. These expressions may be used directly as features for Machine Learning classification.\r\n\r\nImplementation-wise, WCCL is a set of simple command-line utils, as well as the underlying C++ library with Python wrappers, suitable for rapid development of taggers, chunkers, etc.\r\n\r\nWCCL is targeted at Polish, although the only obstacle to processing other inflectional languages is probably the assumed string representation of tags and corpus I/O formats."
    ],
    "oai_identifier": [
        "oai:clarin-pl.eu:11321/34"
    ],
    "oai_set": [
        "hdl_11321_3",
        "hdl_11321_4"
    ],
    "state": "active",
    "title": [
        "WCCL"
    ],
    "url": ""
}