{
    "Contact": [
        "Department of Information Technology, Gauhati University, Assam, India"
    ],
    "DiscHierarchy": [
        "1.4",
        "Humanities",
        "Linguistics"
    ],
    "Discipline": "Linguistics",
    "Format": [
        "downloadable_files_count: 0"
    ],
    "Language": [
        "Assamese"
    ],
    "MetaDataAccess": "https://clarin-pl.eu/oai/request?verb=GetRecord&metadataPrefix=oai_dc&identifier=oai:clarin-pl.eu:11321/620",
    "MetadataAccess": [
        "oai:clarin-pl.eu:11321/620"
    ],
    "PID": "http://hdl.handle.net/11321/620",
    "PublicationTimestamp": "2019-01-08T11:59:59Z",
    "PublicationYear": [
        "2019"
    ],
    "Publisher": [
        "Department of Information Technology, Gauhati University, Assam, India"
    ],
    "ResourceType": [
        "toolService"
    ],
    "author": [
        "Sarma, Prof. Shikhar Kr."
    ],
    "fulltext": "oai:clarin-pl.eu:11321/620;2019-01-08T11:13:55Z;hdl_11321_3;hdl_11321_610;Assamese POS Tagger;Sarma, Prof. Shikhar Kr.;Assamese NLP;Assamese POS Tagger;Assamese Part of Speech;Assamese CRF++;Gauhati University;Assamese POS tagger is a CRF++ based POS Tagger. CRF++ is a customizable open source Conditional Random Fields for tagging/labeling continuos text. CRF++ is implemented for generic purpose and can be applied to any natural language provided the tagset. CRF++ tool is designed in C++ language.\r\n\r\n-------\r\n1. These Assamese NLP resources including the Tools and Applications are developed\r\nduring Research and Development Projects as well as Masters and Ph.D. thesis\r\nworks.\r\n2. These are mainly developed or generated at Gauhati University Department of\r\nComputer Science and Department of Information Technology.\r\n3. These resources are used by students and researchers for further studies, researches, as\r\nwell as for design and development of tools and applications.\r\n4. Computational Linguistics in Assamese is not rich, and Natural Language Processing\r\nworks have mainly started during last two decades, and most of the resources are first\r\ngeneration resources, and with ample scope for upgrading, enriching, and purifying.\r\n5. These are very good and essential resources for all the researchers in Assamese NLP, as\r\nthe language requires more and more NLP works to make Assamese a rich media for\r\nthe digital world.\r\n6. Anyone interested, or in need of such resources may express their interest for the\r\nrequired resources, and the way of availability will be advised/informed accordingly.\r\n7. These are purely research materials and could only be used for further research only.\r\n8. Researchers may visit the NLP Lab of Department of Information Technology, Gauhati\r\nUniversity, Guwahati, India or contact us.\r\n9. Researchers interested in collaborative works, and also students for project works, are\r\nwelcome.\r\n10. Contact person is Professor Shikhar Kr. Sarma, Department of Information\r\nTechnology, Gauhati University, Guwahati 781014, Assam, India. Email-\r\nsks@gauhati.ac.in;2019-01-08;toolService;http://hdl.handle.net/11321/620;asm;downloadable_files_count: 0;Department of Information Technology, Gauhati University, Assam, India",
    "group": "clarin",
    "groups": [
        {
            "name": "clarin"
        }
    ],
    "name": "1e7ecc8c-34d4-56b3-9efd-f33f9b59cbb0",
    "notes": [
        "Assamese POS tagger is a CRF++ based POS Tagger. CRF++ is a customizable open source Conditional Random Fields for tagging/labeling continuos text. CRF++ is implemented for generic purpose and can be applied to any natural language provided the tagset. CRF++ tool is designed in C++ language.\r\n\r\n-------\r\n1. These Assamese NLP resources including the Tools and Applications are developed\r\nduring Research and Development Projects as well as Masters and Ph.D. thesis\r\nworks.\r\n2. These are mainly developed or generated at Gauhati University Department of\r\nComputer Science and Department of Information Technology.\r\n3. These resources are used by students and researchers for further studies, researches, as\r\nwell as for design and development of tools and applications.\r\n4. Computational Linguistics in Assamese is not rich, and Natural Language Processing\r\nworks have mainly started during last two decades, and most of the resources are first\r\ngeneration resources, and with ample scope for upgrading, enriching, and purifying.\r\n5. These are very good and essential resources for all the researchers in Assamese NLP, as\r\nthe language requires more and more NLP works to make Assamese a rich media for\r\nthe digital world.\r\n6. Anyone interested, or in need of such resources may express their interest for the\r\nrequired resources, and the way of availability will be advised/informed accordingly.\r\n7. These are purely research materials and could only be used for further research only.\r\n8. Researchers may visit the NLP Lab of Department of Information Technology, Gauhati\r\nUniversity, Guwahati, India or contact us.\r\n9. Researchers interested in collaborative works, and also students for project works, are\r\nwelcome.\r\n10. Contact person is Professor Shikhar Kr. Sarma, Department of Information\r\nTechnology, Gauhati University, Guwahati 781014, Assam, India. Email-\r\nsks@gauhati.ac.in"
    ],
    "oai_identifier": [
        "oai:clarin-pl.eu:11321/620"
    ],
    "oai_set": [
        "hdl_11321_3",
        "hdl_11321_610"
    ],
    "state": "active",
    "tags": [
        {
            "name": "Assamese NLP"
        },
        {
            "name": "Assamese POS Tagger"
        },
        {
            "name": "Assamese Part Speech"
        },
        {
            "name": "Assamese CRF"
        },
        {
            "name": "Gauhati University"
        }
    ],
    "title": [
        "Assamese POS Tagger"
    ],
    "url": ""
}