{
    "Contact": [
        "Slovenian Academy of Sciences and Arts",
        "ZRC SAZU",
        "dr. Bruno Breschi Foundation"
    ],
    "DiscHierarchy": [
        "1.4",
        "Humanities",
        "Linguistics"
    ],
    "Discipline": "Linguistics",
    "Format": [
        "application/zip",
        "downloadable_files_count: 1",
        "text/plain; charset=utf-8"
    ],
    "Language": [
        "Slovenian"
    ],
    "MetaDataAccess": "https://clarin-pl.eu/oai/request?verb=GetRecord&metadataPrefix=oai_dc&identifier=oai:www.clarin.si:11356/1092",
    "MetadataAccess": [
        "oai:www.clarin.si:11356/1092"
    ],
    "PID": "http://hdl.handle.net/11356/1092",
    "PublicationTimestamp": "2006-07-01T11:59:59Z",
    "PublicationYear": [
        "2006"
    ],
    "Publisher": [
        "Slovenian Academy of Sciences and Arts",
        "ZRC SAZU",
        "dr. Bruno Breschi Foundation"
    ],
    "ResourceType": [
        "lexicalConceptualResource"
    ],
    "Rights": [
        "Creative Commons - Attribution 4.0 International (CC BY 4.0)",
        "https://creativecommons.org/licenses/by/4.0/",
        "PUB"
    ],
    "author": [
        "Snoj, Marko"
    ],
    "fulltext": "oai:www.clarin.si:11356/1092;2017-05-15T09:47:34Z;hdl_11356_1023;hdl_11356_1024;Dictionary of the Slovenian Language in the Works of Janez Svetokri\u0161ki;Snoj, Marko;dictionary;historical language;lexicography;The Dictionary of the Slovenian Language in the Works of Janez Svetokri\u0161ki (Slovar jezika Janeza Svetokri\u0161kega) presents and explains the lexis, including proper nouns, from 233 sermons published by Janez Svetokri\u0161ki in five volumes under the common title Sacrum promptuarium between 1691 and 1707. The dictionary contains 8,540 dictionary entries, which display and treat the entire Slovenian lexis, including proper nouns, used in the above-mentioned work. Each dictionary entry consists of 1. the headword, 2. the presentation of morphological characteristics, 3. the description of meaning and 4. examples of use. Entries containing loanwords additionally include etymologies. Some entries may here provide other philological or linguistic comments. Each entry describing a proper noun ends with the most basic encyclopaedic information. The Dictionary of the Slovenian Language in the Works of Janez Svetokri\u0161ki is the first dictionary to treat the lexis of a Slovenian author from a period before the introduction of Gaj's Latin alphabet. The dictionary is distinguished by a modern, but not too complex display of material, by comprehensive citations of all attested variants and by the inclusion of encyclopaedic information about proper nouns, all of which in many respects facilitates the reading of the original baroque text or makes it possible in the first place.\r\n\r\nThis dictionary was published as a printed book:\r\nSnoj, Marko. Slovar jezika Janeza Svetokri\u0161kega. Ljubljana : Zalo\u017eba ZRC, 2006. ISBN 961-6568-45-0.;2006;lexicalConceptualResource;http://hdl.handle.net/11356/1092;slv;Creative Commons - Attribution 4.0 International (CC BY 4.0);https://creativecommons.org/licenses/by/4.0/;PUB;application/zip;text/plain; charset=utf-8;downloadable_files_count: 1;Slovenian Academy of Sciences and Arts;dr. Bruno Breschi Foundation;ZRC SAZU;http://www.fran.si/139/slovar-jezika-janeza-svetokriskega",
    "group": "clarin",
    "groups": [
        {
            "name": "clarin"
        }
    ],
    "name": "1f177188-2cd1-5b92-93cd-5f7e90038cff",
    "notes": [
        "The Dictionary of the Slovenian Language in the Works of Janez Svetokri\u0161ki (Slovar jezika Janeza Svetokri\u0161kega) presents and explains the lexis, including proper nouns, from 233 sermons published by Janez Svetokri\u0161ki in five volumes under the common title Sacrum promptuarium between 1691 and 1707. The dictionary contains 8,540 dictionary entries, which display and treat the entire Slovenian lexis, including proper nouns, used in the above-mentioned work. Each dictionary entry consists of 1. the headword, 2. the presentation of morphological characteristics, 3. the description of meaning and 4. examples of use. Entries containing loanwords additionally include etymologies. Some entries may here provide other philological or linguistic comments. Each entry describing a proper noun ends with the most basic encyclopaedic information. The Dictionary of the Slovenian Language in the Works of Janez Svetokri\u0161ki is the first dictionary to treat the lexis of a Slovenian author from a period before the introduction of Gaj's Latin alphabet. The dictionary is distinguished by a modern, but not too complex display of material, by comprehensive citations of all attested variants and by the inclusion of encyclopaedic information about proper nouns, all of which in many respects facilitates the reading of the original baroque text or makes it possible in the first place.\r\n\r\nThis dictionary was published as a printed book:\r\nSnoj, Marko. Slovar jezika Janeza Svetokri\u0161kega. Ljubljana : Zalo\u017eba ZRC, 2006. ISBN 961-6568-45-0."
    ],
    "oai_identifier": [
        "oai:www.clarin.si:11356/1092"
    ],
    "oai_set": [
        "hdl_11356_1023",
        "hdl_11356_1024"
    ],
    "state": "active",
    "tags": [
        {
            "name": "dictionary"
        },
        {
            "name": "historical language"
        },
        {
            "name": "lexicography"
        }
    ],
    "title": [
        "Dictionary of the Slovenian Language in the Works of Janez Svetokri\u0161ki"
    ],
    "url": ""
}