{
    "Contact": [
        "Oxford Text Archive, University of Oxford"
    ],
    "Contributor": [
        "Ensslin, Astrid",
        "Bennett, Paul",
        "Durrell, Martin",
        "Economic and Social Research Council (ESRC)"
    ],
    "DiscHierarchy": [
        "1.4",
        "Humanities",
        "Linguistics"
    ],
    "Discipline": "Linguistics",
    "Format": [
        "text/xml",
        "154 files : ca. 5.54 MB"
    ],
    "Language": [
        "German"
    ],
    "MetaDataAccess": "https://clarin-pl.eu/oai/request?verb=GetRecord&metadataPrefix=oai_dc&identifier=oai:ota:oucs:2537",
    "MetadataAccess": [
        "oai:ota:oucs:2537"
    ],
    "PublicationTimestamp": "1650-07-01T11:59:59Z",
    "PublicationYear": [
        "1650"
    ],
    "Publisher": [
        "Oxford Text Archive, University of Oxford"
    ],
    "ResourceType": [
        "Text",
        "Linguistic corpora"
    ],
    "Rights": [
        "Distributed by the University of Oxford under a Creative Commons Attribution-NonCommercial-ShareAlike 3.0 Unported License. This is a very liberal license that grants certain rights for non-commercial use, especially your right to use GerManC for your own research, but also reserves certain rights for the original creators of GerManC.",
        "http://www.ota.ox.ac.uk/documents/user_agreement.xml"
    ],
    "fulltext": "oai:ota:oucs:2537;2018-10-15T09:04:33Z;http://ota.ox.ac.uk/headers/2537.xml;GerManC. A Historical Corpus of German Newspapers 1650-1800 (first version);GerManC 2007 Version;1650-1800;text_and_corpus_linguistics;Linguistic analysis (Linguistics);German language--Written German;deu;The corpus consists of 45 text samples of some 200 words each from German newspapers of the early modern period 1650-1800. There are three texts each from five German regions - North Germany, West Germany, East Central Germany, South-West Germany (including Switzerland) and South-East Germany (including Austria) - for each fifty year sub-period. The corpus consists first of a set of unannoted text files contained in sets of folders for each region and period, and also of files with each individual text, and secondly of a set of xml files each of which contains one fully annotated text, organised into folders according to sub-period and region. In addition there is a documentation file which provides a full account of each stage of the corpus construction and annotation, together with any necessary modification of TEI standards. This file also contains a complete reference list of all the names of places, organisations and historical personages occuring in the corpus. Finally, a source file provides full bibiographic details of the original texts ;Oxford Text Archive, University of Oxford;Durrell, Martin;Ensslin, Astrid;Bennett, Paul;Economic and Social Research Council (ESRC);Durrell, Martin;text/xml;154 files : ca. 5.54 MB;Text;Linguistic corpora;Distributed by the University of Oxford under a Creative Commons Attribution-NonCommercial-ShareAlike 3.0 Unported License. This is a very liberal license that grants certain rights for non-commercial use, especially your right to use GerManC for your own research, but also reserves certain rights for the original creators of GerManC.;http://www.ota.ox.ac.uk/documents/user_agreement.xml",
    "group": "clarin",
    "groups": [
        {
            "name": "clarin"
        }
    ],
    "name": "1fd87e44-01eb-554c-8da5-b67c13da7a69",
    "notes": [
        "The corpus consists of 45 text samples of some 200 words each from German newspapers of the early modern period 1650-1800. There are three texts each from five German regions - North Germany, West Germany, East Central Germany, South-West Germany (including Switzerland) and South-East Germany (including Austria) - for each fifty year sub-period. The corpus consists first of a set of unannoted text files contained in sets of folders for each region and period, and also of files with each individual text, and secondly of a set of xml files each of which contains one fully annotated text, organised into folders according to sub-period and region. In addition there is a documentation file which provides a full account of each stage of the corpus construction and annotation, together with any necessary modification of TEI standards. This file also contains a complete reference list of all the names of places, organisations and historical personages occuring in the corpus. Finally, a source file provides full bibiographic details of the original texts "
    ],
    "oai_identifier": [
        "oai:ota:oucs:2537"
    ],
    "oai_set": "",
    "state": "active",
    "tags": [
        {
            "name": "text_and_corpus_linguistics"
        },
        {
            "name": "Linguistic analysis Linguistics"
        },
        {
            "name": "German language--Written German"
        }
    ],
    "title": [
        "GerManC. A Historical Corpus of German Newspapers 1650-1800 (first version)",
        "GerManC 2007 Version"
    ],
    "url": "http://ota.ox.ac.uk/headers/2537.xml"
}