{
    "Contact": [
        "Oxford Text Archive, University of Oxford"
    ],
    "Contributor": [
        "Paterson, Kevin"
    ],
    "DiscHierarchy": [
        "1.4",
        "Humanities",
        "Linguistics"
    ],
    "Discipline": "Linguistics",
    "Format": [
        "4 files : ca. 411 KB"
    ],
    "Language": [
        "English"
    ],
    "MetaDataAccess": "https://clarin-pl.eu/oai/request?verb=GetRecord&metadataPrefix=oai_dc&identifier=oai:ota:oucs:2516",
    "MetadataAccess": [
        "oai:ota:oucs:2516"
    ],
    "PublicationTimestamp": "2005-07-01T11:59:59Z",
    "PublicationYear": [
        "2005"
    ],
    "Publisher": [
        "Oxford Text Archive, University of Oxford"
    ],
    "ResourceType": [
        "Text",
        "Databases"
    ],
    "Rights": [
        "Distributed by the University of Oxford under a Creative Commons Attribution-NonCommercial-ShareAlike 3.0 Unported License.",
        "http://www.ota.ox.ac.uk/documents/user_agreement.xml"
    ],
    "author": [
        "Paterson, Kevin"
    ],
    "fulltext": "oai:ota:oucs:2516;2018-05-24T15:55:34Z;http://ota.ox.ac.uk/headers/2516.xml;Discourse context and the processing of contrastive focus in silent reading (SPSS data files);Paterson, Kevin;2005-2006;text_and_corpus_linguistics;Comprehension;Psychology tests;Eye Movements;eng;Words such as \u00e2\u0080\u009conly\u00e2\u0080\u009d and \u00e2\u0080\u009ceven\u00e2\u0080\u009d indicate that a contrast is to be made between information that is given in a sentence and some alternatives. For example, a sentence such as \u00e2\u0080\u009cOnly Mary kissed John\u00e2\u0080\u009d means that Mary kissed John but no-one else did. However, sentences that contain these words often have more than one possible meaning, depending on which part of the sentence is used to form the contrast. We conducted three experiments in which we analysed eye movements during reading to investigate skilled readers\u00e2\u0080\u0099 understanding of sentences containing \u00e2\u0080\u009conly\u00e2\u0080\u009d. The results demonstrated that skilled readers make rapid use of grammatical and contextual knowledge to select the appropriate meaning of a sentence, but that grammatical knowledge has the more important role. Although these findings are directly informative about skilled reading, they may also provide insights into problems that might be encountered by beginning readers or people with reading difficulty. ;Oxford Text Archive, University of Oxford;Paterson, Kevin;4 files : ca. 411 KB;Text;Databases;Distributed by the University of Oxford under a Creative Commons Attribution-NonCommercial-ShareAlike 3.0 Unported License.;http://www.ota.ox.ac.uk/documents/user_agreement.xml",
    "group": "clarin",
    "groups": [
        {
            "name": "clarin"
        }
    ],
    "name": "20d4706c-7862-59e6-ae56-cd1d27ec7b58",
    "notes": [
        "Words such as \u00e2\u0080\u009conly\u00e2\u0080\u009d and \u00e2\u0080\u009ceven\u00e2\u0080\u009d indicate that a contrast is to be made between information that is given in a sentence and some alternatives. For example, a sentence such as \u00e2\u0080\u009cOnly Mary kissed John\u00e2\u0080\u009d means that Mary kissed John but no-one else did. However, sentences that contain these words often have more than one possible meaning, depending on which part of the sentence is used to form the contrast. We conducted three experiments in which we analysed eye movements during reading to investigate skilled readers\u00e2\u0080\u0099 understanding of sentences containing \u00e2\u0080\u009conly\u00e2\u0080\u009d. The results demonstrated that skilled readers make rapid use of grammatical and contextual knowledge to select the appropriate meaning of a sentence, but that grammatical knowledge has the more important role. Although these findings are directly informative about skilled reading, they may also provide insights into problems that might be encountered by beginning readers or people with reading difficulty. "
    ],
    "oai_identifier": [
        "oai:ota:oucs:2516"
    ],
    "oai_set": "",
    "state": "active",
    "tags": [
        {
            "name": "text_and_corpus_linguistics"
        },
        {
            "name": "Comprehension"
        },
        {
            "name": "Psychology tests"
        },
        {
            "name": "Eye Movements"
        }
    ],
    "title": [
        "Discourse context and the processing of contrastive focus in silent reading (SPSS data files)"
    ],
    "url": "http://ota.ox.ac.uk/headers/2516.xml"
}