{
    "Contact": [
        "Institut f\u00fcr Phonetik, Universit\u00e4t des Saarlandes"
    ],
    "Contributor": [
        "Tamara Hausmann",
        "Anja Moos",
        "Olga Trifsik",
        "William J. Barry",
        "Manfred Just",
        "Rossella Caradonna",
        "Markus Walz",
        "Christian Dressler",
        "Attilio Erriquez",
        "Manfred P\u00fctzer",
        "Bogdan Woldert-Jokisz",
        "Slavomir Tengowski",
        "Silke Jarmut"
    ],
    "DiscHierarchy": [
        "1.4",
        "Humanities",
        "Linguistics"
    ],
    "Discipline": "Linguistics",
    "Format": [
        "audio/x-wav",
        "audio/x-egg",
        "application/x-nsp",
        "text/plain"
    ],
    "Language": [
        "German"
    ],
    "MetaDataAccess": "https://clarin-pl.eu/oai/request?verb=GetRecord&metadataPrefix=oai_dc&identifier=oai:fedora.clarin-d.uni-saarland.de:clarind-uds:saarbrueckerstimmdatenbank",
    "MetadataAccess": [
        "oai:fedora.clarin-d.uni-saarland.de:clarind-uds:saarbrueckerstimmdatenbank"
    ],
    "PID": "http://hdl.handle.net/11858/00-246C-0000-0005-BD12-3",
    "PublicationTimestamp": "2004-07-01T11:59:59Z",
    "PublicationYear": [
        "2004"
    ],
    "Publisher": [
        "Institut f\u00fcr Phonetik, Universit\u00e4t des Saarlandes"
    ],
    "ResourceType": [
        "Collection"
    ],
    "Rights": [
        "Copyrighted"
    ],
    "SpatialCoverage": [
        "Germany",
        "1997/2004"
    ],
    "TemporalCoverage": " period : ( None - 1997-07-01T11:59:59Z ) ",
    "author": [
        "Database of healthy and pathological voices / Voice profiles DFG BA 737/9-6",
        "Institut f\u00fcr Phonetik, Universit\u00e4t des Saarlandes"
    ],
    "fulltext": "oai:fedora.clarin-d.uni-saarland.de:clarind-uds:saarbrueckerstimmdatenbank;2014-06-03T12:55:04Z;Saarbr\u00fccker Stimmdatenbank;Institut f\u00fcr Phonetik, Universit\u00e4t des Saarlandes;Database of healthy and pathological voices / Voice profiles DFG BA 737/9-6;voice database;healthy voice profile;pathological voice profile;acoustic signal;electroglottographic signal;The Saarbr\u00fccker Stimmdatenbank is a collection of voice recordings from more than 2000 persons. Recordings are classified according to healthy and pathological voice profiles on the basis of the acoustic and electroglottographic signals. \n    The speech signal and the EGG signal have been stored in separate files. Any comments about the recordings are contained in an associated text-file. \n    The material can be queried through a web search interface, and the selecte audio files can be exported.;Die Saarbr\u00fccker Stimmdatenbank ist eine Sammlung von Sprachaufnahmen von \u00fcber 2000 Personen. Die Aufnahmen wurden anhand der akustischen und elektroglottographischen Signale klassifiziert in gesunde und pathologische Sprachprofile. \n    Das Sprachsignal und das EGG Signal sind in separaten Dateien gespeichert. Eventuelle Kommentare sind in einer Textdatei gespeichert. \n    Die Datenbank kann \u00fcber ein Webinterface abgefragt werden, ausgew\u00e4hlte Audiodateien k\u00f6nnen exportiert werden.;Institut f\u00fcr Phonetik, Universit\u00e4t des Saarlandes;Bogdan Woldert-Jokisz;William J. Barry;Manfred P\u00fctzer;Manfred Just;Rossella Caradonna;Christian Dressler;Attilio Erriquez;Tamara Hausmann;Silke Jarmut;Anja Moos;Slavomir Tengowski;Olga Trifsik;Markus Walz;Bogdan Woldert-Jokisz;2004;Collection;text/plain;application/x-nsp;audio/x-egg;audio/x-wav;clarind-uds:saarbrueckerstimmdatenbank;hdl:11858/00-246C-0000-0005-BD12-3;deu;Germany;1997/2004;Copyrighted",
    "group": "clarin",
    "groups": [
        {
            "name": "clarin"
        }
    ],
    "name": "2400846d-ba42-5b5c-9b33-73effcbf85cd",
    "notes": [
        "The Saarbr\u00fccker Stimmdatenbank is a collection of voice recordings from more than 2000 persons. Recordings are classified according to healthy and pathological voice profiles on the basis of the acoustic and electroglottographic signals. \n    The speech signal and the EGG signal have been stored in separate files. Any comments about the recordings are contained in an associated text-file. \n    The material can be queried through a web search interface, and the selecte audio files can be exported.",
        "Die Saarbr\u00fccker Stimmdatenbank ist eine Sammlung von Sprachaufnahmen von \u00fcber 2000 Personen. Die Aufnahmen wurden anhand der akustischen und elektroglottographischen Signale klassifiziert in gesunde und pathologische Sprachprofile. \n    Das Sprachsignal und das EGG Signal sind in separaten Dateien gespeichert. Eventuelle Kommentare sind in einer Textdatei gespeichert. \n    Die Datenbank kann \u00fcber ein Webinterface abgefragt werden, ausgew\u00e4hlte Audiodateien k\u00f6nnen exportiert werden."
    ],
    "oai_identifier": [
        "oai:fedora.clarin-d.uni-saarland.de:clarind-uds:saarbrueckerstimmdatenbank"
    ],
    "oai_set": "",
    "state": "active",
    "tags": [
        {
            "name": "voice database"
        },
        {
            "name": "healthy voice profile"
        },
        {
            "name": "pathological voice profile"
        },
        {
            "name": "acoustic signal"
        },
        {
            "name": "electroglottographic signal"
        }
    ],
    "title": [
        "Saarbr\u00fccker Stimmdatenbank"
    ],
    "url": ""
}