{
    "Contact": [
        "Strindbergsprojektet"
    ],
    "DiscHierarchy": [
        "1.4",
        "Humanities",
        "Linguistics"
    ],
    "Discipline": "Linguistics",
    "Format": [
        "application/gzip",
        "downloadable_files_count: 2",
        "text/plain; charset=utf-8",
        "application/octet-stream"
    ],
    "Language": [
        "Swedish"
    ],
    "MetaDataAccess": "https://clarin-pl.eu/oai/request?verb=GetRecord&metadataPrefix=oai_dc&identifier=oai:repo.spraakbanken.gu.se:10794/79",
    "MetadataAccess": [
        "oai:repo.spraakbanken.gu.se:10794/79"
    ],
    "PID": "http://hdl.handle.net/10794/79",
    "PublicationTimestamp": "2012-05-30T11:59:59Z",
    "PublicationYear": [
        "2012"
    ],
    "Publisher": [
        "Strindbergsprojektet"
    ],
    "ResourceType": [
        "corpus"
    ],
    "Rights": [
        "Creative Commons - Attribution 4.0 International (CC BY 4.0)",
        "PUB",
        "http://creativecommons.org/licenses/by/4.0/"
    ],
    "author": [
        "n/a, n/a"
    ],
    "fulltext": "oai:repo.spraakbanken.gu.se:10794/79;2017-10-26T08:28:42Z;hdl_10794_1;hdl_10794_2;August Strindberg's novels (2017-10-16);August Strindbergs romaner (2017-10-16);n/a, n/a;Swedish;Novels;Part of the collected works of August Strindberg.\r\n\r\nAugust Strindberg's novels and dramas have been published as a national edition, Nationalupplagan av August Strindbergs samlade verk, by Stockholm University and Norstedts.\r\n\r\nThe material is not proofread by the editors, and may thus contain minor errors and deviations from the printed volumes. For more information about the publication of the Collected Works, see the homepage of the Strindberg project. See also the frequency and word explanation query.\r\n\r\nThe material is sentence scrambled.;Del av August Strindbergs samlade verk.\r\n\r\nAugust Strindbergs romaner och dramer har utgivits som Nationalupplagan av August Strindbergs samlade verk av Stockholms universitet och Norstedts.\r\n\r\nMaterialet i databaserna \u00e4r ej korrekturl\u00e4st av utgivarna, sm\u00e4rre felaktigheter och avvikelser fr\u00e5n de tryckta volymerna kan d\u00e4rf\u00f6r f\u00f6rekomma. F\u00f6r mer information om utgivningen av Samlade Verk, se Strindbergsprojektets hemsida. Se \u00e4ven frekvens- och ordf\u00f6rklaringss\u00f6kning.\r\n\r\nMaterialet \u00e4r meningsomkastat.;2012-05-30;corpus;http://hdl.handle.net/10794/79;swe;Creative Commons - Attribution 4.0 International (CC BY 4.0);PUB;http://creativecommons.org/licenses/by/4.0/;application/octet-stream;application/gzip;text/plain; charset=utf-8;downloadable_files_count: 2;Strindbergsprojektet;https://spraakbanken.gu.se/swe/resurs/strindbergromaner",
    "group": "clarin",
    "groups": [
        {
            "name": "clarin"
        }
    ],
    "name": "2729701f-93b6-5d10-a705-8d6c8a8049f0",
    "notes": [
        "Part of the collected works of August Strindberg.\r\n\r\nAugust Strindberg's novels and dramas have been published as a national edition, Nationalupplagan av August Strindbergs samlade verk, by Stockholm University and Norstedts.\r\n\r\nThe material is not proofread by the editors, and may thus contain minor errors and deviations from the printed volumes. For more information about the publication of the Collected Works, see the homepage of the Strindberg project. See also the frequency and word explanation query.\r\n\r\nThe material is sentence scrambled.",
        "Del av August Strindbergs samlade verk.\r\n\r\nAugust Strindbergs romaner och dramer har utgivits som Nationalupplagan av August Strindbergs samlade verk av Stockholms universitet och Norstedts.\r\n\r\nMaterialet i databaserna \u00e4r ej korrekturl\u00e4st av utgivarna, sm\u00e4rre felaktigheter och avvikelser fr\u00e5n de tryckta volymerna kan d\u00e4rf\u00f6r f\u00f6rekomma. F\u00f6r mer information om utgivningen av Samlade Verk, se Strindbergsprojektets hemsida. Se \u00e4ven frekvens- och ordf\u00f6rklaringss\u00f6kning.\r\n\r\nMaterialet \u00e4r meningsomkastat."
    ],
    "oai_identifier": [
        "oai:repo.spraakbanken.gu.se:10794/79"
    ],
    "oai_set": [
        "hdl_10794_1",
        "hdl_10794_2"
    ],
    "state": "active",
    "tags": [
        {
            "name": "Swedish"
        },
        {
            "name": "Novels"
        }
    ],
    "title": [
        "August Strindberg's novels (2017-10-16)",
        "August Strindbergs romaner (2017-10-16)"
    ],
    "url": ""
}