{
    "Contact": [
        "Charles University, Faculty of Mathematics and Physics, Institute of Formal and Applied Linguistics (UFAL)"
    ],
    "DiscHierarchy": [
        "1.4",
        "Humanities",
        "Linguistics"
    ],
    "Discipline": "Linguistics",
    "Format": [
        "application/zip",
        "downloadable_files_count: 2",
        "text/plain; charset=utf-8",
        "application/octet-stream"
    ],
    "Language": [
        "Czech"
    ],
    "MetaDataAccess": "https://clarin-pl.eu/oai/request?verb=GetRecord&metadataPrefix=oai_dc&identifier=oai:lindat.mff.cuni.cz:11858/00-097C-0000-0023-10B2-F",
    "MetadataAccess": [
        "oai:lindat.mff.cuni.cz:11858/00-097C-0000-0023-10B2-F"
    ],
    "PID": "http://hdl.handle.net/11858/00-097C-0000-0023-10B2-F",
    "PublicationTimestamp": "2013-09-01T11:59:59Z",
    "PublicationYear": [
        "2013"
    ],
    "Publisher": [
        "Charles University, Faculty of Mathematics and Physics, Institute of Formal and Applied Linguistics (UFAL)"
    ],
    "RelatedIdentifier": [
        "info:eu-repo/grantAgreement/EC/FP7/288487"
    ],
    "ResourceType": [
        "corpus"
    ],
    "Rights": [
        "Attribution-ShareAlike 3.0 Unported (CC BY-SA 3.0)",
        "http://creativecommons.org/licenses/by-sa/3.0/",
        "PUB"
    ],
    "author": [
        "Bojar, Ond\u0159ej",
        "Tamchyna, Ale\u0161",
        "Zeman, Daniel",
        "Mach\u00e1\u010dek, Matou\u0161"
    ],
    "fulltext": "oai:lindat.mff.cuni.cz:11858/00-097C-0000-0023-10B2-F;2018-07-02T22:05:52Z;hdl_11858_00-097C-0000-0001-486F-D;hdl_11858_00-097C-0000-0001-4877-A;Many Czech References for 50 Sentences Selected from WMT11 Data;Bojar, Ond\u0159ej;Mach\u00e1\u010dek, Matou\u0161;Tamchyna, Ale\u0161;Zeman, Daniel;machine translation;automatic machine translation evaluation;reference translation;This dataset contains the whole set of very many Czech translations for 50 English source sentences coming from WMT11 test set (http://www.statmt.org/wmt11).\r\n\r\nIn total, there are 15431447 Czech sentences, i.e. 300k reference translations per source English sentence on average, but the exact number greatly varies across sentences.\r\n\r\nYou can find more details in included README file.\r\n\r\nIf you use this dataset, please cite the following paper which describes the technique used to construct the Czech translations:\r\n\r\nBojar Ond\u0159ej, Mach\u00e1\u010dek Matou\u0161, Tamchyna Ale\u0161, Zeman Daniel:\r\nScratching the Surface of Possible Translations.\r\nLecture Notes in Computer Science, Vol. 8082, Text, Speech and Dialogue: 16th\r\nInternational Conference, TSD 2013. Proceedings, Copyright \u00a9 Springer Verlag,\r\nBerlin / Heidelberg, ISBN 978-3-642-40584-6, ISSN 0302-9743, pp. 465-474, 2013, DOI: 10.1007/978-3-642-40585-3_59;2013-09-01;corpus;http://hdl.handle.net/11858/00-097C-0000-0023-10B2-F;ces;info:eu-repo/grantAgreement/EC/FP7/288487;Attribution-ShareAlike 3.0 Unported (CC BY-SA 3.0);http://creativecommons.org/licenses/by-sa/3.0/;PUB;application/zip;application/octet-stream;text/plain; charset=utf-8;downloadable_files_count: 2;Charles University, Faculty of Mathematics and Physics, Institute of Formal and Applied Linguistics (UFAL)",
    "group": "clarin",
    "groups": [
        {
            "name": "clarin"
        }
    ],
    "name": "2837d743-e2b7-5659-8e2f-93a16a0b6886",
    "notes": [
        "This dataset contains the whole set of very many Czech translations for 50 English source sentences coming from WMT11 test set (http://www.statmt.org/wmt11).\r\n\r\nIn total, there are 15431447 Czech sentences, i.e. 300k reference translations per source English sentence on average, but the exact number greatly varies across sentences.\r\n\r\nYou can find more details in included README file.\r\n\r\nIf you use this dataset, please cite the following paper which describes the technique used to construct the Czech translations:\r\n\r\nBojar Ond\u0159ej, Mach\u00e1\u010dek Matou\u0161, Tamchyna Ale\u0161, Zeman Daniel:\r\nScratching the Surface of Possible Translations.\r\nLecture Notes in Computer Science, Vol. 8082, Text, Speech and Dialogue: 16th\r\nInternational Conference, TSD 2013. Proceedings, Copyright \u00a9 Springer Verlag,\r\nBerlin / Heidelberg, ISBN 978-3-642-40584-6, ISSN 0302-9743, pp. 465-474, 2013, DOI: 10.1007/978-3-642-40585-3_59"
    ],
    "oai_identifier": [
        "oai:lindat.mff.cuni.cz:11858/00-097C-0000-0023-10B2-F"
    ],
    "oai_set": [
        "hdl_11858_00-097C-0000-0001-486F-D",
        "hdl_11858_00-097C-0000-0001-4877-A"
    ],
    "state": "active",
    "tags": [
        {
            "name": "machine translation"
        },
        {
            "name": "automatic machine translation evaluation"
        },
        {
            "name": "reference translation"
        }
    ],
    "title": [
        "Many Czech References for 50 Sentences Selected from WMT11 Data"
    ],
    "url": ""
}