{
    "Contact": [
        "Faculty of Electrical Engineering and Computer Science, University of Maribor"
    ],
    "DiscHierarchy": [
        "1.4",
        "Humanities",
        "Linguistics"
    ],
    "Discipline": "Linguistics",
    "Format": [
        "application/zip",
        "downloadable_files_count: 3",
        "text/plain; charset=utf-8"
    ],
    "Language": [
        "Slovenian"
    ],
    "MetaDataAccess": "https://clarin-pl.eu/oai/request?verb=GetRecord&metadataPrefix=oai_dc&identifier=oai:www.clarin.si:11356/1069",
    "MetadataAccess": [
        "oai:www.clarin.si:11356/1069"
    ],
    "PID": "http://hdl.handle.net/11356/1069",
    "PublicationTimestamp": "2016-08-01T11:59:59Z",
    "PublicationYear": [
        "2016"
    ],
    "Publisher": [
        "Faculty of Electrical Engineering and Computer Science, University of Maribor"
    ],
    "RelatedIdentifier": [
        "http://hdl.handle.net/11356/1158"
    ],
    "ResourceType": [
        "corpus"
    ],
    "Rights": [
        "Creative Commons - Attribution-NonCommercial 4.0 International (CC BY-NC 4.0)",
        "PUB",
        "https://creativecommons.org/licenses/by-nc/4.0/"
    ],
    "author": [
        "Sepesy Mau\u010dec, Mirjam",
        "Erjavec, Toma\u017e",
        "Poto\u010dnik, Toma\u017e",
        "Verdonik, Darinka"
    ],
    "fulltext": "oai:www.clarin.si:11356/1069;2018-10-18T22:25:12Z;hdl_11356_1023;hdl_11356_1024;Spoken corpus Gos VideoLectures 1.0 (transcription);Verdonik, Darinka;Poto\u010dnik, Toma\u017e;Sepesy Mau\u010dec, Mirjam;Erjavec, Toma\u017e;speech database;spoken corpus;academic speech;speech transcription;speech recognition;TEI;Gos Videolectures is an add-on to the Gos reference speech corpus of Slovene (http://hdl.handle.net/11356/1040), and covers public academic speech. The Gos Videolectures recordings are a  selection of public lectures available through web-portal Videolectures.net provided by the Jo\u017eef Stefan Institute, and covers in its first release 4.5 hours of speech. \r\n\r\nThis resource contains only the transcriptions of the corpus - the audio recordings are avaiable at CLARIN.SI handle http://hdl.handle.net/11356/1070.\r\n\r\nAll transcriptions for Gos Videolectures were done manually and carefully checked. The main guidelines for transcription were those of the Gos corpus (http://www.korpus-gos.net/Support/About). The transcription tool Transcriber 1.5.1 (http://trans.sourceforge.net/en/presentation.php) was used for making transcriptions. It can be also used for reading or exporting transcriptions (.trs files) to different formats. \r\n\r\nThe transcriptions comprise the TRS files with tabular metadata, their conversion to TEI and to the CWB vertical file format. Each recording has two TRS files, one with the phonetic and the other with the normalised transcription. The TEI and CWB encodings join these two transcriptions at the token level, with the normalised words being also automatically PoS tagged and lemmatised. \r\n\r\nThe corpus can be used for training continuous speech recognition for Slovene language, for phonetic research or any other research of Slovene academic speech.;2016-08-01;corpus;http://hdl.handle.net/11356/1069;slv;http://hdl.handle.net/11356/1158;Creative Commons - Attribution-NonCommercial 4.0 International (CC BY-NC 4.0);PUB;https://creativecommons.org/licenses/by-nc/4.0/;application/zip;application/zip;application/zip;text/plain; charset=utf-8;downloadable_files_count: 3;Faculty of Electrical Engineering and Computer Science, University of Maribor",
    "group": "clarin",
    "groups": [
        {
            "name": "clarin"
        }
    ],
    "name": "2c98745b-6abc-50a7-93b3-4fcf3cf17dc4",
    "notes": [
        "Gos Videolectures is an add-on to the Gos reference speech corpus of Slovene (http://hdl.handle.net/11356/1040), and covers public academic speech. The Gos Videolectures recordings are a  selection of public lectures available through web-portal Videolectures.net provided by the Jo\u017eef Stefan Institute, and covers in its first release 4.5 hours of speech. \r\n\r\nThis resource contains only the transcriptions of the corpus - the audio recordings are avaiable at CLARIN.SI handle http://hdl.handle.net/11356/1070.\r\n\r\nAll transcriptions for Gos Videolectures were done manually and carefully checked. The main guidelines for transcription were those of the Gos corpus (http://www.korpus-gos.net/Support/About). The transcription tool Transcriber 1.5.1 (http://trans.sourceforge.net/en/presentation.php) was used for making transcriptions. It can be also used for reading or exporting transcriptions (.trs files) to different formats. \r\n\r\nThe transcriptions comprise the TRS files with tabular metadata, their conversion to TEI and to the CWB vertical file format. Each recording has two TRS files, one with the phonetic and the other with the normalised transcription. The TEI and CWB encodings join these two transcriptions at the token level, with the normalised words being also automatically PoS tagged and lemmatised. \r\n\r\nThe corpus can be used for training continuous speech recognition for Slovene language, for phonetic research or any other research of Slovene academic speech."
    ],
    "oai_identifier": [
        "oai:www.clarin.si:11356/1069"
    ],
    "oai_set": [
        "hdl_11356_1023",
        "hdl_11356_1024"
    ],
    "state": "active",
    "tags": [
        {
            "name": "speech database"
        },
        {
            "name": "spoken corpus"
        },
        {
            "name": "academic speech"
        },
        {
            "name": "speech transcription"
        },
        {
            "name": "speech recognition"
        },
        {
            "name": "TEI"
        }
    ],
    "title": [
        "Spoken corpus Gos VideoLectures 1.0 (transcription)"
    ],
    "url": ""
}