{
    "Contact": [
        "University of Helsinki"
    ],
    "DiscHierarchy": [
        "1.4",
        "Humanities",
        "Linguistics"
    ],
    "Discipline": "Linguistics",
    "Format": [
        "text/plain; charset=utf-8",
        "application/x-gzip",
        "downloadable_files_count: 1"
    ],
    "Language": [
        "Finnish"
    ],
    "MetaDataAccess": "https://clarin-pl.eu/oai/request?verb=GetRecord&metadataPrefix=oai_dc&identifier=oai:lindat.mff.cuni.cz:11372/LRT-1992",
    "MetadataAccess": [
        "oai:lindat.mff.cuni.cz:11372/LRT-1992"
    ],
    "PID": "http://hdl.handle.net/11372/LRT-1992",
    "PublicationTimestamp": "2017-03-22T11:59:59Z",
    "PublicationYear": [
        "2017"
    ],
    "Publisher": [
        "University of Helsinki"
    ],
    "ResourceType": [
        "toolService"
    ],
    "Rights": [
        "GNU General Public Licence, version 3",
        "http://opensource.org/licenses/GPL-3.0",
        "PUB"
    ],
    "author": [
        "Pirinen, Tommi A",
        "Johnson, Ryan",
        "Tyers, Francis M.",
        "Listenmaa, Inari",
        "Kuokkala, Juha"
    ],
    "fulltext": "oai:lindat.mff.cuni.cz:11372/LRT-1992;2017-03-30T15:15:15Z;hdl_11858_00-097C-0000-0007-710A-A;hdl_11858_00-097C-0000-0007-710B-8;Open morphology of Finnish;Pirinen, Tommi A;Listenmaa, Inari;Johnson, Ryan;Tyers, Francis M.;Kuokkala, Juha;morphological analysis;morphological dictionary;Omorfi is free and open source project containing various tools and data for handling Finnish texts in a linguistically motivated manner. The main components of this repository are:\r\n\r\n1) a lexical database containing hundreds of thousands of words (c.f. lexical statistics),\r\n2) a collection of scripts to convert lexical database into formats used by upstream NLP tools (c.f. lexical processing),\r\n3) an autotools setup to build and install (or package, or deploy): the scripts, the database, and simple APIs / convenience processing tools, and\r\n4) a collection of relatively simple APIs for a selection of languages and scripts to apply the NLP tools and access the database;2017-03-22;toolService;http://hdl.handle.net/11372/LRT-1992;fin;GNU General Public Licence, version 3;http://opensource.org/licenses/GPL-3.0;PUB;application/x-gzip;text/plain; charset=utf-8;downloadable_files_count: 1;University of Helsinki;https://github.com/flammie/omorfi",
    "group": "clarin",
    "groups": [
        {
            "name": "clarin"
        }
    ],
    "name": "30568f83-e09d-5065-b9f7-1f5c9e9ec9b6",
    "notes": [
        "Omorfi is free and open source project containing various tools and data for handling Finnish texts in a linguistically motivated manner. The main components of this repository are:\r\n\r\n1) a lexical database containing hundreds of thousands of words (c.f. lexical statistics),\r\n2) a collection of scripts to convert lexical database into formats used by upstream NLP tools (c.f. lexical processing),\r\n3) an autotools setup to build and install (or package, or deploy): the scripts, the database, and simple APIs / convenience processing tools, and\r\n4) a collection of relatively simple APIs for a selection of languages and scripts to apply the NLP tools and access the database"
    ],
    "oai_identifier": [
        "oai:lindat.mff.cuni.cz:11372/LRT-1992"
    ],
    "oai_set": [
        "hdl_11858_00-097C-0000-0007-710A-A",
        "hdl_11858_00-097C-0000-0007-710B-8"
    ],
    "state": "active",
    "tags": [
        {
            "name": "morphological analysis"
        },
        {
            "name": "morphological dictionary"
        }
    ],
    "title": [
        "Open morphology of Finnish"
    ],
    "url": ""
}