{
    "Contact": [
        "Universit\u00e0 di Parma"
    ],
    "DiscHierarchy": [
        "1.4",
        "Humanities",
        "Linguistics"
    ],
    "Discipline": "Linguistics",
    "Format": [
        "application/vnd.openxmlformats-officedocument.presentationml.presentation",
        "text/plain; charset=utf-8",
        "application/pdf",
        "downloadable_files_count: 2"
    ],
    "Language": [
        "Italian",
        "English",
        "Ancient Greek (to 1453)"
    ],
    "MetaDataAccess": "https://clarin-pl.eu/oai/request?verb=GetRecord&metadataPrefix=oai_dc&identifier=oai:dspace-clarin-it.ilc.cnr.it:20.500.11752/OPEN-83",
    "MetadataAccess": [
        "oai:dspace-clarin-it.ilc.cnr.it:20.500.11752/OPEN-83"
    ],
    "PID": "http://hdl.handle.net/20.500.11752/OPEN-83",
    "PublicationTimestamp": "2017-10-01T11:59:59Z",
    "PublicationYear": [
        "2017"
    ],
    "Publisher": [
        "Universit\u00e0 di Parma"
    ],
    "ResourceType": [
        "corpus"
    ],
    "Rights": [
        "Creative Commons - Attribution-NonCommercial-NoDerivatives 4.0 International (CC BY-NC-ND 4.0)",
        "http://creativecommons.org/licenses/by-nc-nd/4.0/",
        "PUB"
    ],
    "author": [
        "Stefanini, Alberto",
        "Monachini, Monica",
        "Nicolosi, Anika"
    ],
    "fulltext": "oai:dspace-clarin-it.ilc.cnr.it:20.500.11752/OPEN-83;2018-07-23T09:13:44Z;hdl_000-c0-111_39;hdl_000-c0-111_43;HT-Archilochus (Hyper-Text Archilochus);Nicolosi, Anika;Monachini, Monica;Stefanini, Alberto;Ancient Greek;Digital Edition;This data is a sample from a collection of fragments of a Greek poet, Archilochus, which is based on text, translations and commentary edited by Anika Nicolosi (2013). This data is being produced in the context of a project that overviews the requirements for a scholarly digital edition of Archilochus.  This data includes a few fragments of the Greek poet which are used to build and test a prototype (HT-Archilochus), in view of developing a full digital edition (DEA-Digital Edition and Archilochus). \r\n\r\nThis sample responds to the outcomes of a survey with several practitioners of Digital Classics and provides the learner with a set of resources and tools that ease a critical assessment of ancient text.\r\n\r\nThe survey (Current practice with Digital Classics tools: use practice of digital resources and tools for studies on Digital Classics), supplementary to a master degree thesis discussed at the University of Parma, was performed from May to September 2016 on a sample of Italian digital humanists with focus of interest on ancient Greek philology and it is now available on-line,and still open for participation, at http://www.clarin-it.it/it/content/sondaggio-current-practice-digital-classics-tools.\r\n\r\nThe survey is in line with the principles behind the recent user engagement strategy developed by CLARIN-ERIC (www.clarin.eu) and constitutes one of the national efforts undertaken by CLARIN-IT to contribute to the wider impact of CLARIN on Digital Classicists. News about the research\u2019s results was given at Clarin Conference 2107 (18-21 September 2017, Budapest): A Survey on the Use and the Needs for Digital Resources and related Tools by Ancient Greek Scholars In Italy (Poster)\r\n\r\nWarning: at this moment to better display the sample please use the font Hellenica;2017-10-01;corpus;http://hdl.handle.net/20.500.11752/OPEN-83;ita;eng;grc;Creative Commons - Attribution-NonCommercial-NoDerivatives 4.0 International (CC BY-NC-ND 4.0);http://creativecommons.org/licenses/by-nc-nd/4.0/;PUB;application/vnd.openxmlformats-officedocument.presentationml.presentation;application/pdf;text/plain; charset=utf-8;downloadable_files_count: 2;Universit\u00e0 di Parma;http://unipr.academia.edu/AnikaNicolosi",
    "group": "clarin",
    "groups": [
        {
            "name": "clarin"
        }
    ],
    "name": "35540440-d1b0-5c70-b1b2-e9cea1c98ee6",
    "notes": [
        "This data is a sample from a collection of fragments of a Greek poet, Archilochus, which is based on text, translations and commentary edited by Anika Nicolosi (2013). This data is being produced in the context of a project that overviews the requirements for a scholarly digital edition of Archilochus.  This data includes a few fragments of the Greek poet which are used to build and test a prototype (HT-Archilochus), in view of developing a full digital edition (DEA-Digital Edition and Archilochus). \r\n\r\nThis sample responds to the outcomes of a survey with several practitioners of Digital Classics and provides the learner with a set of resources and tools that ease a critical assessment of ancient text.\r\n\r\nThe survey (Current practice with Digital Classics tools: use practice of digital resources and tools for studies on Digital Classics), supplementary to a master degree thesis discussed at the University of Parma, was performed from May to September 2016 on a sample of Italian digital humanists with focus of interest on ancient Greek philology and it is now available on-line,and still open for participation, at http://www.clarin-it.it/it/content/sondaggio-current-practice-digital-classics-tools.\r\n\r\nThe survey is in line with the principles behind the recent user engagement strategy developed by CLARIN-ERIC (www.clarin.eu) and constitutes one of the national efforts undertaken by CLARIN-IT to contribute to the wider impact of CLARIN on Digital Classicists. News about the research\u2019s results was given at Clarin Conference 2107 (18-21 September 2017, Budapest): A Survey on the Use and the Needs for Digital Resources and related Tools by Ancient Greek Scholars In Italy (Poster)\r\n\r\nWarning: at this moment to better display the sample please use the font Hellenica"
    ],
    "oai_identifier": [
        "oai:dspace-clarin-it.ilc.cnr.it:20.500.11752/OPEN-83"
    ],
    "oai_set": [
        "hdl_000-c0-111_39",
        "hdl_000-c0-111_43"
    ],
    "state": "active",
    "tags": [
        {
            "name": "Ancient Greek"
        },
        {
            "name": "Digital Edition"
        }
    ],
    "title": [
        "HT-Archilochus (Hyper-Text Archilochus)"
    ],
    "url": ""
}