{
    "Contact": [
        "Universit\u00e4t des Saarlandes"
    ],
    "Contributor": [
        "Ekaterina Lapshinova-Koltunski",
        "Prof. Erich Steiner",
        "Katrin Menzel",
        "Kerstin Kunz",
        "Marilisa Amoia",
        "Jose Manuel Martinez Martinez"
    ],
    "DiscHierarchy": [
        "1.4",
        "Humanities",
        "Linguistics"
    ],
    "Discipline": "Linguistics",
    "Format": [
        "text/xml"
    ],
    "Language": [
        "German",
        "English"
    ],
    "MetaDataAccess": "https://clarin-pl.eu/oai/request?verb=GetRecord&metadataPrefix=oai_dc&identifier=oai:fedora.clarin-d.uni-saarland.de:clarind-uds:gecco",
    "MetadataAccess": [
        "oai:fedora.clarin-d.uni-saarland.de:clarind-uds:gecco"
    ],
    "PID": "http://hdl.handle.net/11858/00-246C-0000-0023-8CF7-A",
    "PublicationTimestamp": "2013-07-01T11:59:59Z",
    "PublicationYear": [
        "2013"
    ],
    "Publisher": [
        "Universit\u00e4t des Saarlandes"
    ],
    "RelatedIdentifier": [
        "Lapshinova-Koltunski, E., K. Kunz and M. Amoia (2012). Compiling a Multilingual Corpus. In Heliana Mello, Massimo Pettorino and Tommaso Raso (eds). Proceedings of the VIIth GSCP-2012 International Conference: Speech and Corpora. Firenze: Firenze University Press. pp. 29-34.",
        "Lapshinova-Koltunski, E. and K. Kunz (2014). Annotating Cohesion for Multillingual Analysis. In Proceedings of the 10th Joint ACL - ISO Workshop on Interoperable Semantic Annotation, Reykjavik, May 26, 2014",
        "Menzel, Katrin (2014): Guidelines for the manual annotation of ellipses, DFG-Projektbericht.",
        "Further publications: http://www.gecco.uni-saarland.de/GECCo/Publikationen.html"
    ],
    "ResourceType": [
        "Collection"
    ],
    "Rights": [
        "Copyrighted"
    ],
    "SpatialCoverage": [
        "Germany"
    ],
    "TemporalCoverage": " point in time : None",
    "author": [
        "GECCo Team, LS Steiner"
    ],
    "fulltext": "oai:fedora.clarin-d.uni-saarland.de:clarind-uds:gecco;2015-02-27T14:39:45Z;GECCo;GECCo Team, LS Steiner;corpus linguistics;linguistics;translation;spoken language;cohesion;language contrasts;discourse phenomena;offers a continuum of different text types (registers) from written to spoken discourse. More precisely, it includes English and German texts of 14 registers, eight of which represent written discourse and include fictional texts (FICTION), political essays (ESSAY), instruction manuals (INSTR), popular-scientific texts (POPSCI), letters to shareholders (SHARE), prepared political speeches (SPEECH), tourism leaflets (TOU) and corporate websites (WEB). This part was imported from the existing corpus CroCo described in (Hansen-Schirra et al., 2013). The written texts are saved in two subcorpora according to the language: English written texts (EO), German written texts\n(GO). The further registers are of spoken discourse and include recorded and transcribed interviews and academic speeches, see (Lapshinova-Koltunski et al., 2012).\nThe spoken texts are also stored in two further subcorpora classified according to the language of origin: English spoken texts (EO-SPOKEN) and German spoken texts (GO-SPOKEN).\nThe whole number of words contained in the corpus comprise ca. 1,4 Mio. The corpus is pre-annotated on several levels, which include information on tokens, lemmas, morpho-syntactic features (e.g. case, number, etc.), parts-of-speech, pharse chunks and their grammatical functions, as well as and sentence boundaries. The annotation of the written part was partly imported from CroCo, whereas for the spoken part, we use Stanford POS Tagger (Toutanova et al., 2003) and the Stanford Parser (Klein and Manning, 2003). \nThis corpus is also annotated for the information on cohesion (devices and relations), including coreference, conjunctive relations, substitution, ellipsis and lexical cohesion. The semi-automatic procedures were described in lapshinova and Kunz (2014). The annotation of ellipsis is manual and the scheme is described in Menzel (2014). The corpus is encoded in the CWB format (CWB, 2010) and can be queried with Corpus Query Processor (CQP) (Evert, 2005).;GECCo ist ein bilinguales Korpus (der Name ist vom Projekttitel 'German-English Contrasts in Cohesion' abgeleitet), das insgesamt ca. 1,44 Millionen Tokens enth\u00e4lt und sowohl parallele als auch vergleichbare Subkorpora f\u00fcr Englisch und Deutsch umfasst. GECCo beinhaltet gegenw\u00e4rtig 12 Register, zu denen sowohl gesprochensprachliche als auch geschriebene Textsorten geh\u00f6ren: ESSAY, FICTION, INSTR, POPSCI, SHARE, SPEECH, TOU, WEB, ACADEMIC, FORUM, INTERVIEW, TALKSHOW, MEDCONSULT, SERMON (je ca. 30.000 Tokens pro Register im jeweiligen Subkorpus). Die Texte der geschriebenen Register sind aus dem CroCo-Korpus \u00fcbernommen worden, vgl. Hansen-Schirra et al. (2012). Register gesprochener Sprache wurden im Rahmen des GECCo-Projekts gesammelt und annotiert. Probleme der Korpuskompilierung, Zusammenstellung und Annotation dieser Register wurden in Lapshinova et al. (2012) beschrieben. Beschaffung des gesprochensprachlichen Materials ist kompliziert, weil es viel manuellen Aufwand (Transkription) mit sich bringt. Zu beachten ist dabei, dass das Sprachmaterial in beiden Sprachen gesammelt wird und vergleichbar sein soll. Aus diesem Grund ist der geschriebene Teil von GECCo bisher gr\u00f6\u00dfer als\nder gesprochene. Das Korpus ist auf verschiedenen Ebenen annotiert und enth\u00e4lt Informationen \u00fcber Tokens, Lemmata, morpho-syntaktische Eigenschaften (z.B. Genus, Numerus, Kasus usw.) und Wortarten. Syntaktische Annotationen schlie\u00dfen Phrasen-(chunks) und Satzgrenzen ein. Phrasen sind zus\u00e4tzlich mit ihren grammatischen Funktionen markiert. Diese Annotationen der geschriebenen Korpusregister wurden aus CroCo importiert. F\u00fcr das gesprochene englische Subkorpus verwenden wir den Stanford POS Tagger (Toutanova et al., 2003) und den Stanford Parser (Klein and Manning, 2003). F\u00fcr das gesprochene Deutsch wurde MATE (Bohnet, 2010) verwendet. Das Korpus ist auch mit Informationen \u00fcber Koh\u00e4sionsmitteln annotiert: Koreferenz, Konjunktionen, Ellipsen, Substitution und lexikalische Koh\u00e4sion. Das semi-automatische Annotationsverfahren f\u00fcr Koreferenz, Konnektoren und Substitution ist in Lapshinova und Kunz (2014) detailliert beschrieben. Die Annotation von Ellipsen erfolgt zurzeit ausschlie\u00dflich manuell. Das Schema und die Kategorien sind in detaillierten projektinternen Richtlinien dokumentiert (Menzel 2014). Das Gesamtkorpus ist im CWB-Format gespeichert (CWB, 2010), welches Abfragen mit dem Corpus Query Processor (CQP; Evert, 2005) erm\u00f6glicht. Es gibt auch MMAX-Dateien.;Universit\u00e4t des Saarlandes;Ekaterina Lapshinova-Koltunski;Katrin Menzel;Kerstin Kunz;Marilisa Amoia;Prof. Erich Steiner;Jose Manuel Martinez Martinez;2013;Collection;text/xml;clarind-uds:gecco;hdl:11858/00-246C-0000-0023-8CF7-A;EO/GO/ETRANS/GTRANS-ESSAY/FICTION/INSTR/POPSCI/SHARE/SPEECH/TOU/WEB from CroCo (clarind-uds:croco);EO-INTERVIEW: from the BACKBONE project and ELISA corpus files, compiled at Englisches Seminar, Universit\u00e4t T\u00fcbingen, interviews about hobbies, work etc.;GO-INTERVIEW: from the BACKBONE project, compiled at Englisches Seminar, Universit\u00e4t T\u00fcbingen, interviews about hobbies, work etc.;EO-ACADEMIC: lectures from Michigan Corpus of Academic Spoken English;GO-ACADEMIC: lectures at UdS collected by within the Visual University project and transcribed by student assistants of GECCo team;EO/GO-FORUM: discussions in internet forums (travel, skin disorders, European politics, coffee, giving up smoking, roses, emotions and singing, depressions, crafting/DIY) collected by student assistants of GECCo team;EO-TALKSHOW: collected transcriptions of TV talkshows from the web (by GECCO team);GO-TALKSHOW: TV talkshows collected and transcribed by student assistants of GECCo team;EO-MEDONCULT:  medical consultations from BNC;GO-MEDONCULT:  medical consultation, Anamnese oder Aufkl\u00e4rungsgespr\u00e4chfrom the Dolmetschen im Krankenhaus Korpus;EO-SERMON: sermons from BNC;GO-SERMON: sermons from the Predigtarchiv Oberpfarr- und Domkirche zu Berlin;deu;eng;Lapshinova-Koltunski, E., K. Kunz and M. Amoia (2012). Compiling a Multilingual Corpus. In Heliana Mello, Massimo Pettorino and Tommaso Raso (eds). Proceedings of the VIIth GSCP-2012 International Conference: Speech and Corpora. Firenze: Firenze University Press. pp. 29-34.;Lapshinova-Koltunski, E. and K. Kunz (2014). Annotating Cohesion for Multillingual Analysis. In Proceedings of the 10th Joint ACL - ISO Workshop on Interoperable Semantic Annotation, Reykjavik, May 26, 2014;Menzel, Katrin (2014): Guidelines for the manual annotation of ellipses, DFG-Projektbericht.;Further publications: http://www.gecco.uni-saarland.de/GECCo/Publikationen.html;Germany;Copyrighted",
    "group": "clarin",
    "groups": [
        {
            "name": "clarin"
        }
    ],
    "name": "368f06af-d64f-56f5-b489-a7730c4fa76b",
    "notes": [
        "offers a continuum of different text types (registers) from written to spoken discourse. More precisely, it includes English and German texts of 14 registers, eight of which represent written discourse and include fictional texts (FICTION), political essays (ESSAY), instruction manuals (INSTR), popular-scientific texts (POPSCI), letters to shareholders (SHARE), prepared political speeches (SPEECH), tourism leaflets (TOU) and corporate websites (WEB). This part was imported from the existing corpus CroCo described in (Hansen-Schirra et al., 2013). The written texts are saved in two subcorpora according to the language: English written texts (EO), German written texts\n(GO). The further registers are of spoken discourse and include recorded and transcribed interviews and academic speeches, see (Lapshinova-Koltunski et al., 2012).\nThe spoken texts are also stored in two further subcorpora classified according to the language of origin: English spoken texts (EO-SPOKEN) and German spoken texts (GO-SPOKEN).\nThe whole number of words contained in the corpus comprise ca. 1,4 Mio. The corpus is pre-annotated on several levels, which include information on tokens, lemmas, morpho-syntactic features (e.g. case, number, etc.), parts-of-speech, pharse chunks and their grammatical functions, as well as and sentence boundaries. The annotation of the written part was partly imported from CroCo, whereas for the spoken part, we use Stanford POS Tagger (Toutanova et al., 2003) and the Stanford Parser (Klein and Manning, 2003). \nThis corpus is also annotated for the information on cohesion (devices and relations), including coreference, conjunctive relations, substitution, ellipsis and lexical cohesion. The semi-automatic procedures were described in lapshinova and Kunz (2014). The annotation of ellipsis is manual and the scheme is described in Menzel (2014). The corpus is encoded in the CWB format (CWB, 2010) and can be queried with Corpus Query Processor (CQP) (Evert, 2005).",
        "GECCo ist ein bilinguales Korpus (der Name ist vom Projekttitel 'German-English Contrasts in Cohesion' abgeleitet), das insgesamt ca. 1,44 Millionen Tokens enth\u00e4lt und sowohl parallele als auch vergleichbare Subkorpora f\u00fcr Englisch und Deutsch umfasst. GECCo beinhaltet gegenw\u00e4rtig 12 Register, zu denen sowohl gesprochensprachliche als auch geschriebene Textsorten geh\u00f6ren: ESSAY, FICTION, INSTR, POPSCI, SHARE, SPEECH, TOU, WEB, ACADEMIC, FORUM, INTERVIEW, TALKSHOW, MEDCONSULT, SERMON (je ca. 30.000 Tokens pro Register im jeweiligen Subkorpus). Die Texte der geschriebenen Register sind aus dem CroCo-Korpus \u00fcbernommen worden, vgl. Hansen-Schirra et al. (2012). Register gesprochener Sprache wurden im Rahmen des GECCo-Projekts gesammelt und annotiert. Probleme der Korpuskompilierung, Zusammenstellung und Annotation dieser Register wurden in Lapshinova et al. (2012) beschrieben. Beschaffung des gesprochensprachlichen Materials ist kompliziert, weil es viel manuellen Aufwand (Transkription) mit sich bringt. Zu beachten ist dabei, dass das Sprachmaterial in beiden Sprachen gesammelt wird und vergleichbar sein soll. Aus diesem Grund ist der geschriebene Teil von GECCo bisher gr\u00f6\u00dfer als\nder gesprochene. Das Korpus ist auf verschiedenen Ebenen annotiert und enth\u00e4lt Informationen \u00fcber Tokens, Lemmata, morpho-syntaktische Eigenschaften (z.B. Genus, Numerus, Kasus usw.) und Wortarten. Syntaktische Annotationen schlie\u00dfen Phrasen-(chunks) und Satzgrenzen ein. Phrasen sind zus\u00e4tzlich mit ihren grammatischen Funktionen markiert. Diese Annotationen der geschriebenen Korpusregister wurden aus CroCo importiert. F\u00fcr das gesprochene englische Subkorpus verwenden wir den Stanford POS Tagger (Toutanova et al., 2003) und den Stanford Parser (Klein and Manning, 2003). F\u00fcr das gesprochene Deutsch wurde MATE (Bohnet, 2010) verwendet. Das Korpus ist auch mit Informationen \u00fcber Koh\u00e4sionsmitteln annotiert: Koreferenz, Konjunktionen, Ellipsen, Substitution und lexikalische Koh\u00e4sion. Das semi-automatische Annotationsverfahren f\u00fcr Koreferenz, Konnektoren und Substitution ist in Lapshinova und Kunz (2014) detailliert beschrieben. Die Annotation von Ellipsen erfolgt zurzeit ausschlie\u00dflich manuell. Das Schema und die Kategorien sind in detaillierten projektinternen Richtlinien dokumentiert (Menzel 2014). Das Gesamtkorpus ist im CWB-Format gespeichert (CWB, 2010), welches Abfragen mit dem Corpus Query Processor (CQP; Evert, 2005) erm\u00f6glicht. Es gibt auch MMAX-Dateien."
    ],
    "oai_identifier": [
        "oai:fedora.clarin-d.uni-saarland.de:clarind-uds:gecco"
    ],
    "oai_set": "",
    "state": "active",
    "tags": [
        {
            "name": "corpus linguistics"
        },
        {
            "name": "linguistics"
        },
        {
            "name": "translation"
        },
        {
            "name": "spoken language"
        },
        {
            "name": "cohesion"
        },
        {
            "name": "language contrasts"
        },
        {
            "name": "discourse phenomena"
        }
    ],
    "title": [
        "GECCo"
    ],
    "url": ""
}