{
    "Contact": [
        "Charles University, Faculty of Mathematics and Physics, Institute of Formal and Applied Linguistics (UFAL)"
    ],
    "DiscHierarchy": [
        "1.4",
        "Humanities",
        "Linguistics"
    ],
    "Discipline": "Linguistics",
    "Format": [
        "downloadable_files_count: 0"
    ],
    "MetaDataAccess": "https://clarin-pl.eu/oai/request?verb=GetRecord&metadataPrefix=oai_dc&identifier=oai:lindat.mff.cuni.cz:11234/1-2812",
    "MetadataAccess": [
        "oai:lindat.mff.cuni.cz:11234/1-2812"
    ],
    "PID": "http://hdl.handle.net/11234/1-2812",
    "PublicationTimestamp": "2016-07-01T11:59:59Z",
    "PublicationYear": [
        "2016"
    ],
    "Publisher": [
        "Charles University, Faculty of Mathematics and Physics, Institute of Formal and Applied Linguistics (UFAL)"
    ],
    "RelatedIdentifier": [
        "https://ufal.mff.cuni.cz/pbml/107/art-vicic-kubon-homola.pdf"
    ],
    "ResourceType": [
        "toolService"
    ],
    "author": [
        "Homola, Petr",
        "Vi\u010di\u010d, Jernej",
        "Kubo\u0148, Vladislav"
    ],
    "fulltext": "oai:lindat.mff.cuni.cz:11234/1-2812;2018-07-02T22:05:54Z;hdl_11858_00-097C-0000-0001-486F-D;hdl_11858_00-097C-0000-0001-4877-A;\u010ces\u00edlko 2.0 Shallow Transfer RBMT framework (opensource version);Vi\u010di\u010d, Jernej;Kubo\u0148, Vladislav;Homola, Petr;Shallow Parse;Shallow Transfer Rule-Based Machine Translation;stochastic ranker;related languages;toolbox;The system \u010ces\u00edlko (language data and software tools) was first developed as an answer to a growing need of translation and localisation from one source language to many target languages. The starting system belonged to the Shallow Parse, Shallow Transfer Rule-Based Machine Translation \u2013 (RBMT) paradigm and it was designed primarily for translation of related languages. The latest implementation of the system uses a stochastic ranker; so technically it belongs to the hybrid machine translation paradigm, using stochastic methods combined with the traditional Shallow Transfer RBMT methods. The system has been stripped of the accompanying language resources due to copyright restrictions. The data that is available is just for demonstrative purposes.;2016;toolService;http://hdl.handle.net/11234/1-2812;https://ufal.mff.cuni.cz/pbml/107/art-vicic-kubon-homola.pdf;downloadable_files_count: 0;Charles University, Faculty of Mathematics and Physics, Institute of Formal and Applied Linguistics (UFAL);https://github.com/cesilko/cesilko",
    "group": "clarin",
    "groups": [
        {
            "name": "clarin"
        }
    ],
    "name": "36dd0373-66e7-5f38-b2c4-3b48a454fddc",
    "notes": [
        "The system \u010ces\u00edlko (language data and software tools) was first developed as an answer to a growing need of translation and localisation from one source language to many target languages. The starting system belonged to the Shallow Parse, Shallow Transfer Rule-Based Machine Translation \u2013 (RBMT) paradigm and it was designed primarily for translation of related languages. The latest implementation of the system uses a stochastic ranker; so technically it belongs to the hybrid machine translation paradigm, using stochastic methods combined with the traditional Shallow Transfer RBMT methods. The system has been stripped of the accompanying language resources due to copyright restrictions. The data that is available is just for demonstrative purposes."
    ],
    "oai_identifier": [
        "oai:lindat.mff.cuni.cz:11234/1-2812"
    ],
    "oai_set": [
        "hdl_11858_00-097C-0000-0001-486F-D",
        "hdl_11858_00-097C-0000-0001-4877-A"
    ],
    "state": "active",
    "tags": [
        {
            "name": "Shallow Parse"
        },
        {
            "name": "Shallow Transfer Rule-Based Machine Translation"
        },
        {
            "name": "stochastic ranker"
        },
        {
            "name": "related languages"
        },
        {
            "name": "toolbox"
        }
    ],
    "title": [
        "\u010ces\u00edlko 2.0 Shallow Transfer RBMT framework (opensource version)"
    ],
    "url": ""
}