{
    "Contact": [
        "Faculty of Electrical Engineering, University of Ljubljana"
    ],
    "DiscHierarchy": [
        "1.4",
        "Humanities",
        "Linguistics"
    ],
    "Discipline": "Linguistics",
    "Format": [
        "text/plain; charset=utf-8",
        "downloadable_files_count: 3",
        "application/pdf",
        "application/zip"
    ],
    "Language": [
        "Slovenian"
    ],
    "MetaDataAccess": "https://clarin-pl.eu/oai/request?verb=GetRecord&metadataPrefix=oai_dc&identifier=oai:www.clarin.si:11356/1125",
    "MetadataAccess": [
        "oai:www.clarin.si:11356/1125"
    ],
    "PID": "http://hdl.handle.net/11356/1125",
    "PublicationTimestamp": "2017-06-17T11:59:59Z",
    "PublicationYear": [
        "2017"
    ],
    "Publisher": [
        "Faculty of Electrical Engineering, University of Ljubljana"
    ],
    "RelatedIdentifier": [
        "info:eu-repo/grantAgreement/EC/FP7/201634",
        "http://dx.doi.org/10.1023/A:1023462002932"
    ],
    "ResourceType": [
        "corpus"
    ],
    "Rights": [
        "Creative Commons - Attribution-NonCommercial-ShareAlike 4.0 International (CC BY-NC-SA 4.0)",
        "https://creativecommons.org/licenses/by-nc-sa/4.0/",
        "PUB"
    ],
    "author": [
        "Dobri\u0161ek, Simon",
        "Pave\u0161i\u0107, Nikola",
        "\u017dganec Gros, Jerneja",
        "\u017dibert, Janez",
        "Miheli\u010d, France"
    ],
    "fulltext": "oai:www.clarin.si:11356/1125;2017-09-29T14:19:38Z;hdl_11356_1023;hdl_11356_1024;Speech Database of Spoken Flight Information Enquiries SOFES 1.0;Dobri\u0161ek, Simon;\u017dganec Gros, Jerneja;\u017dibert, Janez;Miheli\u010d, France;Pave\u0161i\u0107, Nikola;speech database;speech recognition;spoken corpus;speech transcription;TEI;The SOFES speech database (Spoken Flight Enquiries in Slovene) is a collection of transcribed and segmented audio recordings of spoken flight-information enquiries in Slovene. SOFES is built on the basis of the GOPOLIS speech database, which was acquired and compiled by the members of LUKS at the Faculty of Electrical Engineering, University of Ljubljana in the period 1996\u20131998. The main purpose of the GOPOLIS speech database was the development of an automatic spoken-dialogue system for users who are enquiring about flight information over the telephone. The content of SOFES is, however, sufficiently diverse to allow for the development of more generalized acoustic models of spoken Slovene, which are the key components of various speech technologies, such as speech recognizers and speech synthesizers, as well as biometric speaker-recognition systems, etc.;2017-06-17;corpus;http://hdl.handle.net/11356/1125;slv;info:eu-repo/grantAgreement/EC/FP7/201634;http://dx.doi.org/10.1023/A:1023462002932;Creative Commons - Attribution-NonCommercial-ShareAlike 4.0 International (CC BY-NC-SA 4.0);https://creativecommons.org/licenses/by-nc-sa/4.0/;PUB;text/plain; charset=utf-8;application/pdf;application/pdf;application/zip;downloadable_files_count: 3;Faculty of Electrical Engineering, University of Ljubljana",
    "group": "clarin",
    "groups": [
        {
            "name": "clarin"
        }
    ],
    "name": "3dcc4701-1fba-5b64-9974-c15bbcca64b8",
    "notes": [
        "The SOFES speech database (Spoken Flight Enquiries in Slovene) is a collection of transcribed and segmented audio recordings of spoken flight-information enquiries in Slovene. SOFES is built on the basis of the GOPOLIS speech database, which was acquired and compiled by the members of LUKS at the Faculty of Electrical Engineering, University of Ljubljana in the period 1996\u20131998. The main purpose of the GOPOLIS speech database was the development of an automatic spoken-dialogue system for users who are enquiring about flight information over the telephone. The content of SOFES is, however, sufficiently diverse to allow for the development of more generalized acoustic models of spoken Slovene, which are the key components of various speech technologies, such as speech recognizers and speech synthesizers, as well as biometric speaker-recognition systems, etc."
    ],
    "oai_identifier": [
        "oai:www.clarin.si:11356/1125"
    ],
    "oai_set": [
        "hdl_11356_1023",
        "hdl_11356_1024"
    ],
    "state": "active",
    "tags": [
        {
            "name": "speech database"
        },
        {
            "name": "speech recognition"
        },
        {
            "name": "spoken corpus"
        },
        {
            "name": "speech transcription"
        },
        {
            "name": "TEI"
        }
    ],
    "title": [
        "Speech Database of Spoken Flight Information Enquiries SOFES 1.0"
    ],
    "url": ""
}