{
    "Contact": [
        "Wroc\u0142aw University of Technology"
    ],
    "DiscHierarchy": [
        "1.4",
        "Humanities",
        "Linguistics"
    ],
    "Discipline": "Linguistics",
    "Format": [
        "downloadable_files_count: 0"
    ],
    "Language": [
        "Polish"
    ],
    "MetaDataAccess": "https://clarin-pl.eu/oai/request?verb=GetRecord&metadataPrefix=oai_dc&identifier=oai:clarin-pl.eu:11321/26",
    "MetadataAccess": [
        "oai:clarin-pl.eu:11321/26"
    ],
    "PID": "http://hdl.handle.net/11321/26",
    "PublicationTimestamp": "2011-07-21T11:59:59Z",
    "PublicationYear": [
        "2011"
    ],
    "Publisher": [
        "Wroc\u0142aw University of Technology"
    ],
    "ResourceType": [
        "toolService"
    ],
    "author": [
        "Radziszewski, Adam"
    ],
    "fulltext": "oai:clarin-pl.eu:11321/26;2016-01-21T14:29:12Z;hdl_11321_3;hdl_11321_4;WMBT;Radziszewski, Adam;WMBT (Wroc\u0142aw Memory-Based Tagger) is a simple morpho-syntactic tagger for Polish producing state-of-the-art results. WMBT uses TiMBL API as the underlying Memory-Based Learning implementation. The features for classification are generated by using WCCL.\r\n\r\nWMBT uses a tiered tagging approach. Grammatical class is disambiguated first, then subsequent attributes (as defined in a config file) are taken care of. Each attribute may be supplied a different set of features.\r\n\r\nThe software package comes with default configurations for KIPI/IPIC and NKJP tagsets (kipi-guess.ini and nkjp-guess.ini).;2011-07-21;toolService;http://hdl.handle.net/11321/26;pol;downloadable_files_count: 0;Wroc\u0142aw University of Technology;http://nlp.pwr.wroc.pl/redmine/projects/wmbt/wiki",
    "group": "clarin",
    "groups": [
        {
            "name": "clarin"
        }
    ],
    "name": "3e58020d-3791-53bb-a928-7491e33ce218",
    "notes": [
        "WMBT (Wroc\u0142aw Memory-Based Tagger) is a simple morpho-syntactic tagger for Polish producing state-of-the-art results. WMBT uses TiMBL API as the underlying Memory-Based Learning implementation. The features for classification are generated by using WCCL.\r\n\r\nWMBT uses a tiered tagging approach. Grammatical class is disambiguated first, then subsequent attributes (as defined in a config file) are taken care of. Each attribute may be supplied a different set of features.\r\n\r\nThe software package comes with default configurations for KIPI/IPIC and NKJP tagsets (kipi-guess.ini and nkjp-guess.ini)."
    ],
    "oai_identifier": [
        "oai:clarin-pl.eu:11321/26"
    ],
    "oai_set": [
        "hdl_11321_3",
        "hdl_11321_4"
    ],
    "state": "active",
    "title": [
        "WMBT"
    ],
    "url": ""
}