{
    "Contact": [
        "Institute of Computer Science, Polish Academy of Sciences"
    ],
    "DiscHierarchy": [
        "1.4",
        "Humanities",
        "Linguistics"
    ],
    "Discipline": "Linguistics",
    "Format": [
        "downloadable_files_count: 0",
        "application/octet-stream"
    ],
    "Language": [
        "Polish"
    ],
    "MetaDataAccess": "https://clarin-pl.eu/oai/request?verb=GetRecord&metadataPrefix=oai_dc&identifier=oai:clarin-pl.eu:11321/267",
    "MetadataAccess": [
        "oai:clarin-pl.eu:11321/267"
    ],
    "PID": "http://hdl.handle.net/11321/267",
    "PublicationTimestamp": "2016-02-29T11:59:59Z",
    "PublicationYear": [
        "2016"
    ],
    "Publisher": [
        "Institute of Computer Science, Polish Academy of Sciences"
    ],
    "ResourceType": [
        "toolService"
    ],
    "author": [
        "Aceda\u0144ski, Szymon"
    ],
    "fulltext": "oai:clarin-pl.eu:11321/267;2016-05-31T05:34:48Z;hdl_11321_3;hdl_11321_4;Krokodyl: A hybrid depencency parser of Polish;Aceda\u0144ski, Szymon;syntax;Polish;dependency parsing;Krokodyl is an experimental hybrid deep depencency parser of Polish.\r\n\r\nKrokodyl has been developed at the Institute of Computer Science, Polish Academy\r\nof Sciences (IPI PAN) within the CLARIN-PL project. It was create to evaluate\r\na hybrid approach to parsing: combining syntactic, lexical and semantic\r\nfeatures for dependency parsing.\r\n\r\nIt uses a number of tools as components of the feature generation chain, namely\r\nthe Spejd Grammar, MALT parsing engine, MATE, the Polish Wordnet, the Skladnica\r\ntreebank.;2016-02-29;toolService;http://hdl.handle.net/11321/267;pol;application/octet-stream;application/octet-stream;downloadable_files_count: 0;Institute of Computer Science, Polish Academy of Sciences",
    "group": "clarin",
    "groups": [
        {
            "name": "clarin"
        }
    ],
    "name": "3ea9be7d-6983-5880-a705-b4bde94823ff",
    "notes": [
        "Krokodyl is an experimental hybrid deep depencency parser of Polish.\r\n\r\nKrokodyl has been developed at the Institute of Computer Science, Polish Academy\r\nof Sciences (IPI PAN) within the CLARIN-PL project. It was create to evaluate\r\na hybrid approach to parsing: combining syntactic, lexical and semantic\r\nfeatures for dependency parsing.\r\n\r\nIt uses a number of tools as components of the feature generation chain, namely\r\nthe Spejd Grammar, MALT parsing engine, MATE, the Polish Wordnet, the Skladnica\r\ntreebank."
    ],
    "oai_identifier": [
        "oai:clarin-pl.eu:11321/267"
    ],
    "oai_set": [
        "hdl_11321_3",
        "hdl_11321_4"
    ],
    "state": "active",
    "tags": [
        {
            "name": "syntax"
        },
        {
            "name": "Polish"
        },
        {
            "name": "dependency parsing"
        }
    ],
    "title": [
        "Krokodyl: A hybrid depencency parser of Polish"
    ],
    "url": ""
}