{
    "Contact": [
        "Wroc\u0142aw University of Technology"
    ],
    "DiscHierarchy": [
        "1.4",
        "Humanities",
        "Linguistics"
    ],
    "Discipline": "Linguistics",
    "Format": [
        "text/plain; charset=utf-8",
        "downloadable_files_count: 1",
        "application/octet-stream"
    ],
    "Language": [],
    "MetaDataAccess": "https://clarin-pl.eu/oai/request?verb=GetRecord&metadataPrefix=oai_dc&identifier=oai:clarin-pl.eu:11321/320",
    "MetadataAccess": [
        "oai:clarin-pl.eu:11321/320"
    ],
    "PID": "http://hdl.handle.net/11321/320",
    "PublicationTimestamp": "2016-07-01T11:59:59Z",
    "PublicationYear": [
        "2016"
    ],
    "Publisher": [
        "Wroc\u0142aw University of Technology"
    ],
    "ResourceType": [
        "lexicalConceptualResource"
    ],
    "Rights": [
        "Creative Commons - Attribution 4.0 International (CC BY 4.0)",
        "https://creativecommons.org/licenses/by/4.0/",
        "CC"
    ],
    "author": [
        "Maziarz, Marek",
        "Wendelberger, Micha\u0142"
    ],
    "fulltext": "oai:clarin-pl.eu:11321/320;2016-10-14T14:28:07Z;hdl_11321_3;hdl_11321_4;S\u0142ownik kolokacji rzeczownikowo-przymiotnikowych z uzgodnieniem;Wendelberger, Micha\u0142;Maziarz, Marek;kolokacja;S\u0142ownik zawiera uzgodnione kolokacje rzeczownikowo-przymiotnikowe z korpusu S\u0142owosieci wraz z informacj\u0105 o frekwencji poszczeg\u00f3lnych wyst\u0105pie\u0144 (w szyku NA i AN, z wyrazem pomi\u0119dzy cz\u0142onami i bez oraz z informacj\u0105 o liczbie). Nag\u0142\u00f3wek tego pliku jest nast\u0119puj\u0105cy:\r\n\r\npunktacja\tkrotka\tsuma wystapien\tab sg\tba sg\ta_b sg\tb_a sg\tab pl\tba pl\ta_b pl\tb_a pl\tformy napotkane...\r\n\r\nPrzyk\u0142adowo dla po\u0142\u0105czenia \"link zewn\u0119trzny\" mamy nast\u0119puj\u0105cy opis w S\u0142owniku.\r\n0.006348\tsubst:link adj:zewn\u0119trzny\t247849\t2592 (1.045798%)\t7 (0.002824%)\t0 (0.000000%)\t1 (0.000403%)\t245191 (98.927573%)\t57 (0.022998%)\t0 (0.000000%)\t1 (0.000403%)\t\t242812 Linki zewn\u0119trzne\t2081 Link zewn\u0119trzny\t1321 linki zewn\u0119trzne\t616 link\u00f3w zewn\u0119trznych\t349 link zewn\u0119trzny\t226 Linki Zewn\u0119trzne\t141 linkach zewn\u0119trznych\t80 linku zewn\u0119trznego\t42 linku zewn\u0119trznym\t40 linkami zewn\u0119trznymi\t39 Zewn\u0119trzne linki\t31 linkiem zewn\u0119trznym\t14 Linkach zewn\u0119trznych\t10 Link\u00f3w zewn\u0119trznych\t8 zewn\u0119trznych link\u00f3w\t7 Link Zewn\u0119trzny\t6 LInki zewn\u0119trzne\t6 zewn\u0119trzne linki\t4 zewn\u0119trzny link\t3 LINKI ZEWN\u0118TRZNE\t3 zewn\u0119trzne Linki\t1 Link\u00f3w Zewn\u0119trznych\t1 Linkami Zewn\u0119trznymi\t1 zewn\u0119trzne linki\t1 zewn\u0119trzny link\t1 zewn\u0119trznym linku\t1 zewn\u0119trzny Link\t1 zewn\u0119trznego linku\t1 zewn\u0119trznych linkach\t1 linkowi zewn\u0119trznemu\t1 Linkiem zewn\u0119trznym;2016;lexicalConceptualResource;http://hdl.handle.net/11321/320;polski;Creative Commons - Attribution 4.0 International (CC BY 4.0);https://creativecommons.org/licenses/by/4.0/;CC;text/plain; charset=utf-8;application/octet-stream;downloadable_files_count: 1;Wroc\u0142aw University of Technology;http://clarin-pl.eu",
    "group": "clarin",
    "groups": [
        {
            "name": "clarin"
        }
    ],
    "name": "4019ecd0-1f91-5f6a-be46-8a675e2be443",
    "notes": [
        "S\u0142ownik zawiera uzgodnione kolokacje rzeczownikowo-przymiotnikowe z korpusu S\u0142owosieci wraz z informacj\u0105 o frekwencji poszczeg\u00f3lnych wyst\u0105pie\u0144 (w szyku NA i AN, z wyrazem pomi\u0119dzy cz\u0142onami i bez oraz z informacj\u0105 o liczbie). Nag\u0142\u00f3wek tego pliku jest nast\u0119puj\u0105cy:\r\n\r\npunktacja\tkrotka\tsuma wystapien\tab sg\tba sg\ta_b sg\tb_a sg\tab pl\tba pl\ta_b pl\tb_a pl\tformy napotkane...\r\n\r\nPrzyk\u0142adowo dla po\u0142\u0105czenia \"link zewn\u0119trzny\" mamy nast\u0119puj\u0105cy opis w S\u0142owniku.\r\n0.006348\tsubst:link adj:zewn\u0119trzny\t247849\t2592 (1.045798%)\t7 (0.002824%)\t0 (0.000000%)\t1 (0.000403%)\t245191 (98.927573%)\t57 (0.022998%)\t0 (0.000000%)\t1 (0.000403%)\t\t242812 Linki zewn\u0119trzne\t2081 Link zewn\u0119trzny\t1321 linki zewn\u0119trzne\t616 link\u00f3w zewn\u0119trznych\t349 link zewn\u0119trzny\t226 Linki Zewn\u0119trzne\t141 linkach zewn\u0119trznych\t80 linku zewn\u0119trznego\t42 linku zewn\u0119trznym\t40 linkami zewn\u0119trznymi\t39 Zewn\u0119trzne linki\t31 linkiem zewn\u0119trznym\t14 Linkach zewn\u0119trznych\t10 Link\u00f3w zewn\u0119trznych\t8 zewn\u0119trznych link\u00f3w\t7 Link Zewn\u0119trzny\t6 LInki zewn\u0119trzne\t6 zewn\u0119trzne linki\t4 zewn\u0119trzny link\t3 LINKI ZEWN\u0118TRZNE\t3 zewn\u0119trzne Linki\t1 Link\u00f3w Zewn\u0119trznych\t1 Linkami Zewn\u0119trznymi\t1 zewn\u0119trzne linki\t1 zewn\u0119trzny link\t1 zewn\u0119trznym linku\t1 zewn\u0119trzny Link\t1 zewn\u0119trznego linku\t1 zewn\u0119trznych linkach\t1 linkowi zewn\u0119trznemu\t1 Linkiem zewn\u0119trznym"
    ],
    "oai_identifier": [
        "oai:clarin-pl.eu:11321/320"
    ],
    "oai_set": [
        "hdl_11321_3",
        "hdl_11321_4"
    ],
    "state": "active",
    "tags": [
        {
            "name": "kolokacja"
        }
    ],
    "title": [
        "S\u0142ownik kolokacji rzeczownikowo-przymiotnikowych z uzgodnieniem"
    ],
    "url": ""
}