{
    "Contact": [
        "Giellatekno - Saami Language Technology"
    ],
    "DiscHierarchy": [
        "1.4",
        "Humanities",
        "Linguistics"
    ],
    "Discipline": "Linguistics",
    "Format": [
        "application/zip",
        "text/xml",
        "downloadable_files_count: 1",
        "text/plain; charset=utf-8"
    ],
    "Language": [
        "Northern Sami"
    ],
    "MetaDataAccess": "https://clarin-pl.eu/oai/request?verb=GetRecord&metadataPrefix=oai_dc&identifier=oai:repo.clarino.uib.no:11509/106",
    "MetadataAccess": [
        "oai:repo.clarino.uib.no:11509/106"
    ],
    "PID": "http://hdl.handle.net/11509/106",
    "PublicationTimestamp": "2015-10-10T11:59:59Z",
    "PublicationYear": [
        "2015"
    ],
    "Publisher": [
        "Giellatekno - Saami Language Technology"
    ],
    "ResourceType": [
        "corpus"
    ],
    "Rights": [
        "Creative Commons - Attribution 3.0 Unported (CC BY 3.0)",
        "http://creativecommons.org/licenses/by/3.0/",
        "CC"
    ],
    "author": [
        "The Divvun group at UiT The Arctic University of Norway",
        "Giellatekno - Saami Language Technology, UiT The Arctic University of Norway"
    ],
    "fulltext": "oai:repo.clarino.uib.no:11509/106;2016-09-06T13:03:01Z;hdl_11509_1;hdl_11509_2;North Saami lemma frequency list;Giellatekno - Saami Language Technology, UiT The Arctic University of Norway;The Divvun group at UiT The Arctic University of Norway;The Divvun group at UiT The Arctic University of Norway;Lemma Frequencies;North Saami;The North Saami lemma frequency list is work done by the Giellatekno and Divvun research groups, Department of Linguistics, UiT The Arctic University of Norway, as well as by members of the language community. In particular, Ciprian-Virgil Gerstenberger compiled the list from the entire SIKOR North Saami corpus version 2015-10-10. The data is in an one-lemma-per-line format with the following values: <ABS_FREQ> <LEMMA> <POS>. Since the list has been derived automatically, it may contain wrong values. In case you find any errors the creators would appreciate your feedback sent to giellatekno@uit.no and feedback@divvun.no. Please note that the Giellatekno resources are dynamic in nature. To ensure that you have a completely updated version, please contact Giellatekno (see Contact Info in metadata).;2015-10-10;corpus;http://hdl.handle.net/11509/106;sme;Creative Commons - Attribution 3.0 Unported (CC BY 3.0);http://creativecommons.org/licenses/by/3.0/;CC;text/xml;application/zip;text/plain; charset=utf-8;downloadable_files_count: 1;Giellatekno - Saami Language Technology;http://giellatekno.uit.no/index.eng.html",
    "group": "clarin",
    "groups": [
        {
            "name": "clarin"
        }
    ],
    "name": "42c1852b-fe22-5e22-94b7-5e8c3609f893",
    "notes": [
        "The North Saami lemma frequency list is work done by the Giellatekno and Divvun research groups, Department of Linguistics, UiT The Arctic University of Norway, as well as by members of the language community. In particular, Ciprian-Virgil Gerstenberger compiled the list from the entire SIKOR North Saami corpus version 2015-10-10. The data is in an one-lemma-per-line format with the following values: <ABS_FREQ> <LEMMA> <POS>. Since the list has been derived automatically, it may contain wrong values. In case you find any errors the creators would appreciate your feedback sent to giellatekno@uit.no and feedback@divvun.no. Please note that the Giellatekno resources are dynamic in nature. To ensure that you have a completely updated version, please contact Giellatekno (see Contact Info in metadata)."
    ],
    "oai_identifier": [
        "oai:repo.clarino.uib.no:11509/106"
    ],
    "oai_set": [
        "hdl_11509_1",
        "hdl_11509_2"
    ],
    "state": "active",
    "tags": [
        {
            "name": "Lemma Frequencies"
        },
        {
            "name": "North Saami"
        }
    ],
    "title": [
        "North Saami lemma frequency list"
    ],
    "url": ""
}