{
    "Contact": [
        "Oxford Text Archive, University of Oxford"
    ],
    "DiscHierarchy": [
        "1.4",
        "Humanities",
        "Linguistics"
    ],
    "Discipline": "Linguistics",
    "Format": [
        "(1 file : ca. 87.9 KB)",
        "text/plain"
    ],
    "Language": [
        "English"
    ],
    "MetaDataAccess": "https://clarin-pl.eu/oai/request?verb=GetRecord&metadataPrefix=oai_dc&identifier=oai:ota:oucs:0083",
    "MetadataAccess": [
        "oai:ota:oucs:0083"
    ],
    "PublicationTimestamp": "1597-07-01T11:59:59Z",
    "PublicationYear": [
        "1597"
    ],
    "Publisher": [
        "Oxford Text Archive, University of Oxford"
    ],
    "ResourceType": [
        "Text"
    ],
    "Rights": [
        "Distributed by the University of Oxford under a Creative Commons Attribution-NonCommercial-ShareAlike 3.0 Unported License.",
        "http://www.ota.ox.ac.uk/documents/user_agreement.xml"
    ],
    "author": [
        "Petau de Maulette, Genevi\u00c3\u00a8ve"
    ],
    "fulltext": "oai:ota:oucs:0083;2018-07-27T14:11:31Z;http://ota.ox.ac.uk/headers/0083.xml;Virtue's tears for the loss of the most christian King Henry Third of the name, King of France, and the untimely death of the most noble and heroic gentleman, Walter Devoreux, who was slain before Rouen in France / first written in French by the most excellent learned gentlewoman, Madam Genevieve [sic], Petau Maulette ; and paraphrastically translated into English by Gervase Markham;Devoreux, or, Virtue's tears;Petau de Maulette, Genevi\u00c3\u00a8ve;1597;text_and_corpus_linguistics;Poems -- France -- 16th century;eng;Oxford Text Archive, University of Oxford;text/plain;(1 file : ca. 87.9 KB);Text;Distributed by the University of Oxford under a Creative Commons Attribution-NonCommercial-ShareAlike 3.0 Unported License.;http://www.ota.ox.ac.uk/documents/user_agreement.xml",
    "group": "clarin",
    "groups": [
        {
            "name": "clarin"
        }
    ],
    "name": "50f0df43-6fba-5b4f-afbf-8ac2826a6227",
    "oai_identifier": [
        "oai:ota:oucs:0083"
    ],
    "oai_set": "",
    "state": "active",
    "tags": [
        {
            "name": "text_and_corpus_linguistics"
        },
        {
            "name": "Poems -- France -- th century"
        }
    ],
    "title": [
        "Virtue's tears for the loss of the most christian King Henry Third of the name, King of France, and the untimely death of the most noble and heroic gentleman, Walter Devoreux, who was slain before Rouen in France / first written in French by the most excellent learned gentlewoman, Madam Genevieve [sic], Petau Maulette ; and paraphrastically translated into English by Gervase Markham",
        "Devoreux, or, Virtue's tears"
    ],
    "url": "http://ota.ox.ac.uk/headers/0083.xml"
}