{
    "Contact": [
        "Oxford Text Archive, University of Oxford"
    ],
    "Contributor": [
        "McDonald, Peter"
    ],
    "DiscHierarchy": [
        "1.4",
        "Humanities",
        "Linguistics"
    ],
    "Discipline": "Linguistics",
    "Format": [
        "(1 file : ca. 327 KB)",
        "text/plain"
    ],
    "Language": [
        "English"
    ],
    "MetaDataAccess": "https://clarin-pl.eu/oai/request?verb=GetRecord&metadataPrefix=oai_dc&identifier=oai:ota:oucs:0595",
    "MetadataAccess": [
        "oai:ota:oucs:0595"
    ],
    "PublicationTimestamp": "1250-07-01T11:59:59Z",
    "PublicationYear": [
        "1250"
    ],
    "Publisher": [
        "Oxford Text Archive, University of Oxford"
    ],
    "ResourceType": [
        "Text",
        "Ancient religious texts"
    ],
    "Rights": [
        "Distributed by the University of Oxford under a Creative Commons Attribution-NonCommercial-ShareAlike 3.0 Unported License.",
        "http://www.ota.ox.ac.uk/documents/user_agreement.xml"
    ],
    "fulltext": "oai:ota:oucs:0595;2018-07-27T14:11:31Z;http://ota.ox.ac.uk/headers/0595.xml;Book of the dead;The book of the dead;1250 BCE;text_and_corpus_linguistics;Fiction;Myths and legends;eng;Books of the dead are Egyptian funerary texts and consist of spells, charms, and formulas to be said by the deceased during their journey to the Underworld. Such texts were originally inscribed in stone but later were written on papyrus and often contained illustrations. They were commissioned by the deceased before their death ;Oxford Text Archive, University of Oxford;McDonald, Peter;text/plain;(1 file : ca. 327 KB);Text;Ancient religious texts;Distributed by the University of Oxford under a Creative Commons Attribution-NonCommercial-ShareAlike 3.0 Unported License.;http://www.ota.ox.ac.uk/documents/user_agreement.xml",
    "group": "clarin",
    "groups": [
        {
            "name": "clarin"
        }
    ],
    "name": "539d155b-b914-5280-9400-7769fbd264f2",
    "notes": [
        "Books of the dead are Egyptian funerary texts and consist of spells, charms, and formulas to be said by the deceased during their journey to the Underworld. Such texts were originally inscribed in stone but later were written on papyrus and often contained illustrations. They were commissioned by the deceased before their death "
    ],
    "oai_identifier": [
        "oai:ota:oucs:0595"
    ],
    "oai_set": "",
    "state": "active",
    "tags": [
        {
            "name": "text_and_corpus_linguistics"
        },
        {
            "name": "Fiction"
        },
        {
            "name": "Myths legends"
        }
    ],
    "title": [
        "Book of the dead",
        "The book of the dead"
    ],
    "url": "http://ota.ox.ac.uk/headers/0595.xml"
}