{
    "Contact": [
        "CLARIN-D",
        "Universit\u00e4t des Saarlandes",
        "Justus Liebig University Giessen",
        "Tim Hitchcock",
        "Robert Shoemaker"
    ],
    "Contributor": [
        "Sumithra Velupillai",
        "Schneider, Ulrike",
        "Justus Liebig University Giessen. Faculty 05 Language, Literature, Culture. \nDepartment of English. English Linguistics and History of English",
        "Langbein, Sven",
        "Wunderlich, Julie",
        "Nissel, Magnus",
        "Kr\u00e4mer, Christina",
        "Widlitzki, Bianca",
        "El Basiouni, Sina",
        "Halpap, Melanie",
        "Hartmann, Carina",
        "Reeh, Elisabeth",
        "Petri, Sonja",
        "Molke, Veronika",
        "Werner, Janina",
        "Bundesministerium f\u00fcr Bildung und Forschung",
        "Maiwald, Patrick",
        "Brunner, Christine",
        "Puga, Karin",
        "Batt, Oleg",
        "Deutsche Forschungsgemeinschaft",
        "Schunert, Nora",
        "Breitenbach, Daniela",
        "Salomon, Saskia",
        "Huber, Magnus",
        "Kircili, Kathrin"
    ],
    "DiscHierarchy": [
        "1.4",
        "Humanities",
        "Linguistics"
    ],
    "Discipline": "Linguistics",
    "Format": [
        "text/xml"
    ],
    "Language": [
        "English"
    ],
    "MetaDataAccess": "https://clarin-pl.eu/oai/request?verb=GetRecord&metadataPrefix=oai_dc&identifier=oai:fedora.clarin-d.uni-saarland.de:clarind-uds:oldbailey",
    "MetadataAccess": [
        "oai:fedora.clarin-d.uni-saarland.de:clarind-uds:oldbailey"
    ],
    "PID": "http://hdl.handle.net/11858/00-246C-0000-0023-8CFB-2",
    "Publisher": [
        "CLARIN-D",
        "Universit\u00e4t des Saarlandes",
        "Justus Liebig University Giessen",
        "Tim Hitchcock",
        "Robert Shoemaker"
    ],
    "RelatedIdentifier": [
        "uni-giessen.de/oldbaileycorpus/search.html",
        "uni-giessen.de/oldbaileycorpus/download.html"
    ],
    "ResourceType": [
        "Dataset",
        "spoken text"
    ],
    "Rights": [
        "You are free to: Share - copy and redistribute the material in any medium or format; Adapt - remix, transform, and build upon the material. Under the following terms: Attribution - You must give appropriate credit, provide a link to the license, and indicate if changes were made. You may do so in any reasonable manner, but not in any way that suggests the licensor endorses you or your use. NonCommercial - You may not use the material for commercial purposes. ShareAlike - If you remix, transform, or build upon the material, you must distribute your contributions under the same license as the original. No additional restrictions - You may not apply legal terms or technological measures that legally restrict others from doing anything the license permits."
    ],
    "fulltext": "oai:fedora.clarin-d.uni-saarland.de:clarind-uds:oldbailey;2016-07-22T16:17:59Z;The Old Bailey Corpus;historical linguistics;morphology;syntax;pragmatics;semantics;text and corpus linguistics;historical sociolinguistics;historical corpus;courtroom language;Late Modern English;British English;The Old Bailey Corpus is a sociolinguistically, pragmatically and textually annotated selection of the Proceedings of the Old Bailey. These speech-related texts document Late Modern English in London's Central Criminal Court from 1720 to 1913;Robert Shoemaker;Tim Hitchcock;Justus Liebig University Giessen;Universit\u00e4t des Saarlandes;CLARIN-D;Justus Liebig University Giessen. Faculty 05 Language, Literature, Culture. \nDepartment of English. English Linguistics and History of English;Huber, Magnus;Huber, Magnus;Nissel, Magnus;Nissel, Magnus;Maiwald, Patrick;Maiwald, Patrick;Puga, Karin;Puga, Karin;Werner, Janina;Werner, Janina;Widlitzki, Bianca;Widlitzki, Bianca;El Basiouni, Sina;Hartmann, Carina;Kircili, Kathrin;Reeh, Elisabeth;Salomon, Saskia;Breitenbach, Daniela;Wunderlich, Julie;Batt, Oleg;Schunert, Nora;Petri, Sonja;Brunner, Christine;Kr\u00e4mer, Christina;Schneider, Ulrike;Langbein, Sven;Halpap, Melanie;Molke, Veronika;Sumithra Velupillai;Deutsche Forschungsgemeinschaft;Bundesministerium f\u00fcr Bildung und Forschung;Dataset;spoken text;text/xml;clarind-uds:oldbailey;hdl:11858/00-246C-0000-0023-8CFB-2;eng;uni-giessen.de/oldbaileycorpus/search.html;uni-giessen.de/oldbaileycorpus/download.html;You are free to: Share - copy and redistribute the material in any medium or format; Adapt - remix, transform, and build upon the material. Under the following terms: Attribution - You must give appropriate credit, provide a link to the license, and indicate if changes were made. You may do so in any reasonable manner, but not in any way that suggests the licensor endorses you or your use. NonCommercial - You may not use the material for commercial purposes. ShareAlike - If you remix, transform, or build upon the material, you must distribute your contributions under the same license as the original. No additional restrictions - You may not apply legal terms or technological measures that legally restrict others from doing anything the license permits.",
    "group": "clarin",
    "groups": [
        {
            "name": "clarin"
        }
    ],
    "name": "58152879-293a-5c1c-a8a0-a3b081955d92",
    "notes": [
        "The Old Bailey Corpus is a sociolinguistically, pragmatically and textually annotated selection of the Proceedings of the Old Bailey. These speech-related texts document Late Modern English in London's Central Criminal Court from 1720 to 1913"
    ],
    "oai_identifier": [
        "oai:fedora.clarin-d.uni-saarland.de:clarind-uds:oldbailey"
    ],
    "oai_set": "",
    "state": "active",
    "tags": [
        {
            "name": "historical linguistics"
        },
        {
            "name": "morphology"
        },
        {
            "name": "syntax"
        },
        {
            "name": "pragmatics"
        },
        {
            "name": "semantics"
        },
        {
            "name": "text corpus linguistics"
        },
        {
            "name": "historical sociolinguistics"
        },
        {
            "name": "historical corpus"
        },
        {
            "name": "courtroom language"
        },
        {
            "name": "Late Modern English"
        },
        {
            "name": "British English"
        }
    ],
    "title": [
        "The Old Bailey Corpus"
    ],
    "url": ""
}