{
    "Contact": [
        "University of Bergen"
    ],
    "DiscHierarchy": [
        "1.4",
        "Humanities",
        "Linguistics"
    ],
    "Discipline": "Linguistics",
    "Format": [
        "application/zip",
        "text/xml",
        "downloadable_files_count: 1",
        "text/plain",
        "application/octet-stream"
    ],
    "Language": [
        "German",
        "Spanish"
    ],
    "MetaDataAccess": "https://clarin-pl.eu/oai/request?verb=GetRecord&metadataPrefix=oai_dc&identifier=oai:repo.clarino.uib.no:11509/79",
    "MetadataAccess": [
        "oai:repo.clarino.uib.no:11509/79"
    ],
    "PID": "http://hdl.handle.net/11509/79",
    "PublicationTimestamp": "2012-04-18T11:59:59Z",
    "PublicationYear": [
        "2012"
    ],
    "Publisher": [
        "University of Bergen"
    ],
    "ResourceType": [
        "corpus"
    ],
    "Rights": [
        "Attribution-NonCommercial-ShareAlike 3.0 Unported (CC BY-NC-SA 3.0)",
        "http://creativecommons.org/licenses/by-nc-sa/3.0/",
        "CC"
    ],
    "author": [
        "Parra Escart\u00edn, Carla"
    ],
    "fulltext": "oai:repo.clarino.uib.no:11509/79;2016-04-15T05:59:20Z;hdl_11509_1;hdl_11509_2;Parallel Corpus of documents from the Technical Regulations Information System for German-Spanish (v0.3);Parra Escart\u00edn, Carla;Corpus;TRIS Spanish-German parallel corpus (v0.3)\r\n\r\nSpecialized parallel corpus Spanish-German (ES-ES, DE-AT and DE-DE), texts from the European Commission between 1997-2010. \r\nThe texts are technical regulations in a variety of domains. This third version is sentence aligned and is in TMX and TEI format. \r\nTMX files are sentence aligned while TEI encoded files have the information about sentence alignment in stand-off annotation. \r\nEvery sentence includes information about the domain, the year and the file it belongs to as well as the sentence number. It contains files written in Austria and translated into European Spanish from three different domains: \r\n- B00: Construction (205 files; 70,648 sentences; 1,563,000 words; time frame: 1999-2010) \r\n- C00A: Agriculture, Fishing and Foodstuffs (12 files; 4879 sentences; 137,354 words; time frame: 1999-2001) \r\n- H00: Domestic and Leisure Equipment (12 files; 1229 sentences; 58328 words; time frame: 2005-2010) \r\n\r\nAdditionally the corpus has also been Part-Of-Speech tagged using the TreeTagger POS tagger and the POS tagged files are also available. \r\n\r\nVersions 0.1 and 0.2 are kept as individual records because they are (currently) intended to be downloaded individually. \r\n\r\nVersion 0.3 is encoded in TEI P5 and includes files from two new domains not included in versions 0.1 and 0.2: C00A (Agriculture, Fishing and Foodstuffs), which is currently under alignment and H00 (Domestic and Leisure Equipment), which includes all files available in the database up to 2010.;2012-04-18;corpus;http://hdl.handle.net/11509/79;deu;spa;Attribution-NonCommercial-ShareAlike 3.0 Unported (CC BY-NC-SA 3.0);http://creativecommons.org/licenses/by-nc-sa/3.0/;CC;application/zip;text/plain;text/xml;application/octet-stream;downloadable_files_count: 1;University of Bergen;http://clara.b.uib.no/fellows/carla-parra-escartin/tris/",
    "group": "clarin",
    "groups": [
        {
            "name": "clarin"
        }
    ],
    "name": "59ad7931-d3a1-5ffa-87c4-460fa6752b0a",
    "notes": [
        "TRIS Spanish-German parallel corpus (v0.3)\r\n\r\nSpecialized parallel corpus Spanish-German (ES-ES, DE-AT and DE-DE), texts from the European Commission between 1997-2010. \r\nThe texts are technical regulations in a variety of domains. This third version is sentence aligned and is in TMX and TEI format. \r\nTMX files are sentence aligned while TEI encoded files have the information about sentence alignment in stand-off annotation. \r\nEvery sentence includes information about the domain, the year and the file it belongs to as well as the sentence number. It contains files written in Austria and translated into European Spanish from three different domains: \r\n- B00: Construction (205 files; 70,648 sentences; 1,563,000 words; time frame: 1999-2010) \r\n- C00A: Agriculture, Fishing and Foodstuffs (12 files; 4879 sentences; 137,354 words; time frame: 1999-2001) \r\n- H00: Domestic and Leisure Equipment (12 files; 1229 sentences; 58328 words; time frame: 2005-2010) \r\n\r\nAdditionally the corpus has also been Part-Of-Speech tagged using the TreeTagger POS tagger and the POS tagged files are also available. \r\n\r\nVersions 0.1 and 0.2 are kept as individual records because they are (currently) intended to be downloaded individually. \r\n\r\nVersion 0.3 is encoded in TEI P5 and includes files from two new domains not included in versions 0.1 and 0.2: C00A (Agriculture, Fishing and Foodstuffs), which is currently under alignment and H00 (Domestic and Leisure Equipment), which includes all files available in the database up to 2010."
    ],
    "oai_identifier": [
        "oai:repo.clarino.uib.no:11509/79"
    ],
    "oai_set": [
        "hdl_11509_1",
        "hdl_11509_2"
    ],
    "state": "active",
    "tags": [
        {
            "name": "Corpus"
        }
    ],
    "title": [
        "Parallel Corpus of documents from the Technical Regulations Information System for German-Spanish (v0.3)"
    ],
    "url": ""
}