{
    "Contact": [
        "Max Planck Institute for Psycholinguistics"
    ],
    "DiscHierarchy": [
        "1.4",
        "Humanities",
        "Linguistics"
    ],
    "Discipline": "Linguistics",
    "Format": [
        "downloadable_files_count: 0"
    ],
    "MetaDataAccess": "https://clarin-pl.eu/oai/request?verb=GetRecord&metadataPrefix=oai_dc&identifier=oai:lindat.mff.cuni.cz:11372/LRT-1323",
    "MetadataAccess": [
        "oai:lindat.mff.cuni.cz:11372/LRT-1323"
    ],
    "PID": "http://hdl.handle.net/11372/LRT-1323",
    "PublicationTimestamp": "2014-07-30T11:59:59Z",
    "PublicationYear": [
        "2014"
    ],
    "Publisher": [
        "Max Planck Institute for Psycholinguistics"
    ],
    "ResourceType": [
        "toolService"
    ],
    "SpatialCoverage": [
        "Netherlands (the)"
    ],
    "TemporalCoverage": " point in time : None",
    "fulltext": "oai:lindat.mff.cuni.cz:11372/LRT-1323;2016-04-06T16:39:51Z;hdl_11858_00-097C-0000-0007-710A-A;hdl_11858_00-097C-0000-0007-710B-8;Synpathy;annotation tool;Synpathy is a tool for annotating, analyzing, and graphically editing the syntactical structure of sentences (e.g. linguisticly annotated text corpora), developed at the Max Planck Institute for Psycholinguistics, Nijmegen, the Netherlands. The application is based on the SyntaxViewer from the TIGER search project developed by the IMS (Institute f\u00fcr Maschinelle Sprachverarbeitung, University of Stuttgart).\r\n\r\nSince all (non) terminal node features values are user definable a wide range of linguistic descriptions like syntax trees, functional structures, dependency-style structures or predicate-argument structures can be accommodated. The annotated text together with its treebank graph information is stored separately from the list of labels used in the graph (features). Output formats are in persistent TIGER-XML. This facilitates the further processing of the data by other linguistic applications (like ELAN and ANNEX).;2014-07-30;toolService;http://hdl.handle.net/11372/LRT-1323;downloadable_files_count: 0;Netherlands (the);Max Planck Institute for Psycholinguistics;https://tla.mpi.nl/tools/tla-tools/older-tools/synpathy/",
    "group": "clarin",
    "groups": [
        {
            "name": "clarin"
        }
    ],
    "name": "5f52f903-d5c9-5567-aca9-65830449fa42",
    "notes": [
        "Synpathy is a tool for annotating, analyzing, and graphically editing the syntactical structure of sentences (e.g. linguisticly annotated text corpora), developed at the Max Planck Institute for Psycholinguistics, Nijmegen, the Netherlands. The application is based on the SyntaxViewer from the TIGER search project developed by the IMS (Institute f\u00fcr Maschinelle Sprachverarbeitung, University of Stuttgart).\r\n\r\nSince all (non) terminal node features values are user definable a wide range of linguistic descriptions like syntax trees, functional structures, dependency-style structures or predicate-argument structures can be accommodated. The annotated text together with its treebank graph information is stored separately from the list of labels used in the graph (features). Output formats are in persistent TIGER-XML. This facilitates the further processing of the data by other linguistic applications (like ELAN and ANNEX)."
    ],
    "oai_identifier": [
        "oai:lindat.mff.cuni.cz:11372/LRT-1323"
    ],
    "oai_set": [
        "hdl_11858_00-097C-0000-0007-710A-A",
        "hdl_11858_00-097C-0000-0007-710B-8"
    ],
    "state": "active",
    "tags": [
        {
            "name": "annotation tool"
        }
    ],
    "title": [
        "Synpathy"
    ],
    "url": ""
}