{
    "Contact": [
        "Oxford Text Archive, University of Oxford"
    ],
    "Contributor": [
        "Ule, Louis"
    ],
    "DiscHierarchy": [
        "1.4",
        "Humanities",
        "Linguistics"
    ],
    "Discipline": "Linguistics",
    "Format": [
        "text/sgml",
        "(1 file : ca. 135 KB)"
    ],
    "MetaDataAccess": "https://clarin-pl.eu/oai/request?verb=GetRecord&metadataPrefix=oai_dc&identifier=oai:ota:oucs:1618",
    "MetadataAccess": [
        "oai:ota:oucs:1618"
    ],
    "Publisher": [
        "Oxford Text Archive, University of Oxford"
    ],
    "ResourceType": [
        "Text",
        "Plays"
    ],
    "Rights": [
        "Use of this resource is restricted in some manner. Usually this means that it is available for non-commercial use only with prior permission of the depositor and on condition that this header is included in its entirety with any copy distributed.",
        "http://www.ota.ox.ac.uk/documents/user_agreement.xml"
    ],
    "author": [
        "Marlowe, Christopher, 1564-1593"
    ],
    "fulltext": "oai:ota:oucs:1618;2018-02-16T10:42:06Z;http://ota.ox.ac.uk/headers/1618.xml;Edward the Second : the troublesome reign and lamentable death of Edward the Second, King of England, with the tragical fall of proud Mortimer / Christopher Marlowe;Marlowe, Christopher, 1564-1593;text_and_corpus_linguistics;English drama -- Early modern and Elizabethan, 1500-1600;Oxford Text Archive, University of Oxford;Ule, Louis;text/sgml;(1 file : ca. 135 KB);Text;Plays;Use of this resource is restricted in some manner. Usually this means that it is available for non-commercial use only with prior permission of the depositor and on condition that this header is included in its entirety with any copy distributed.;http://www.ota.ox.ac.uk/documents/user_agreement.xml",
    "group": "clarin",
    "groups": [
        {
            "name": "clarin"
        }
    ],
    "name": "63ac79b3-d111-5f98-9d05-7a51d7a861ab",
    "oai_identifier": [
        "oai:ota:oucs:1618"
    ],
    "oai_set": "",
    "state": "active",
    "tags": [
        {
            "name": "text_and_corpus_linguistics"
        },
        {
            "name": "English drama -- Early modern Elizabethan"
        }
    ],
    "title": [
        "Edward the Second : the troublesome reign and lamentable death of Edward the Second, King of England, with the tragical fall of proud Mortimer / Christopher Marlowe"
    ],
    "url": "http://ota.ox.ac.uk/headers/1618.xml"
}