{
    "Contact": [
        "J.K.Mci. i Rzeczypospolitey"
    ],
    "DiscHierarchy": [
        "1.4",
        "Humanities",
        "Linguistics"
    ],
    "Discipline": "Linguistics",
    "Format": [
        "application/xml"
    ],
    "Language": [
        "Polish",
        "Latin"
    ],
    "MetaDataAccess": "https://clarin-pl.eu/oai/request?verb=GetRecord&metadataPrefix=oai_dc&identifier=oai:fedora.clarin-d.uni-saarland.de:clarind-uds:poldilemma-5973",
    "MetadataAccess": [
        "oai:fedora.clarin-d.uni-saarland.de:clarind-uds:poldilemma-5973"
    ],
    "PID": "http://hdl.handle.net/11858/00-246C-0000-0023-8D2C-C",
    "PublicationTimestamp": "1781-07-01T11:59:59Z",
    "PublicationYear": [
        "1781"
    ],
    "Publisher": [
        "J.K.Mci. i Rzeczypospolitey"
    ],
    "RelatedIdentifier": [
        "http://dlibra.bibliotekaelblaska.pl/Content/5973",
        "oai:dlibra.bibliotekaelblaska.pl:publication:6370"
    ],
    "ResourceType": [
        "starodruk",
        "alter Druck"
    ],
    "Rights": [
        "https://creativecommons.org/licenses/by-nc-sa/4.0/",
        "CC-BY-NC-SA-4.0"
    ],
    "fulltext": "oai:fedora.clarin-d.uni-saarland.de:clarind-uds:poldilemma-5973;2019-03-01T16:02:07Z;Dworskie nabozenstwo ktore kazdy nabozny oboiey p\u0142ci cz\u0142owiek kazdego czasu odprawowac mo\u017ce przez iednego \u2026;Dworskie nabozenstwo ktore kazdy nabozny oboiey p\u0142ci cz\u0142owiek kazdego czasu odprawowac mo\u017ce przez iednego \u2026;modlitewnik;Towarzystwo Jezusowe;Gebetbuch;Gesellschaft Jesu;Jezuici (pe\u0142na nazwa: Towarzystwo Jezusowe ) \u2013 m\u0119ski papieski zakon apostolski Ko\u015bcio\u0142a rzymskokatolickiego, zatwierdzony przez papie\u017ca Paw\u0142a III 27 wrze\u015bnia 1540 r. Towarzystwo Jezusowe zosta\u0142o za\u0142o\u017cone w g\u0142\u00f3wnej mierze do walki z reformacj\u0105, by broni\u0107 i rozszerza\u0107 wiar\u0119 oraz nauk\u0119 Ko\u015bcio\u0142a rzymskokatolickiego, przede wszystkim przez publiczne nauczanie, \u0107wiczenia duchowne, edukacj\u0119 i udzielanie sakrament\u00f3w. Od samego pocz\u0105tku podstawowymi zasadami jezuit\u00f3w, odr\u00f3\u017cniaj\u0105cymi go od innych zakon\u00f3w, by\u0142y: akcentowanie pos\u0142usze\u0144stwa wobec papie\u017ca i prze\u0142o\u017conych, sta\u0142e edukowanie w\u0142asnych cz\u0142onk\u00f3w - tak aby posiadali oni mo\u017cliwie jak najlepsze wykszta\u0142cenie, nie ograniczaj\u0105ce si\u0119 tylko do wykszta\u0142cenia czysto religijnego- aby byli zdolni dobrze rozumie\u0107 aktualnie panuj\u0105cego \"ducha wsp\u00f3\u0142czesno\u015bci\". Modlitewnik w j\u0119zyku polskim, wydany w drukarni J.K.Mci. i Rzeczypospolitey, w formacie 4\u00b0. Ka\u017cda modlitwa zamieszczona jest w tabelach na ka\u017cdej stronie ( ka\u017cda tabela podzielona na 15 rubryk). Starodruk nie posiada oprawy.;Jesuitenorden (die Gesellschaft Jesu) ist ein m\u00e4nnlicher Orden, der 1540 vom Papst Paul den III. anerkannt wurde. Seine Hauptvoraussetzungen waren Kampf mit der Reformation, Verteidigung und Verbreitung der katholischen Glaube durch Predigen, Exerzitien, Erziehung und Erteilung der Sakramente. Vom Anfang an waren der Gehorsam gegen\u00fcber dem Generaloberen und dem Papst und st\u00e4ndige (nicht nur religi\u00f6se) Selbstbildung zwecks des guten Verst\u00e4ndnisses des Gegenwartsgeistes Hauptprinzipien des Ordens. Das Gebetbuch im Polnischen, wurde in der k\u00f6niglichen Buchdruckerei, im 4\u00ba Format herausgegeben. Jedes Gebet wurde in einer Tabelle enthalten. Einband fehlt.;J.K.Mci. i Rzeczypospolitey;J.K.Mci. i Rzeczypospolitey;1781;1781;starodruk;alter Druck;application/xml;clarind-uds:poldilemma-5973;hdl:11858/00-246C-0000-0023-8D2C-C;XVIII. 140;XVIII. 140;pol;lat;http://dlibra.bibliotekaelblaska.pl/Content/5973;oai:dlibra.bibliotekaelblaska.pl:publication:6370;https://creativecommons.org/licenses/by-nc-sa/4.0/;CC-BY-NC-SA-4.0",
    "group": "clarin",
    "groups": [
        {
            "name": "clarin"
        }
    ],
    "name": "64c28d50-031d-595a-8946-de23585711ba",
    "notes": [
        "Jezuici (pe\u0142na nazwa: Towarzystwo Jezusowe ) \u2013 m\u0119ski papieski zakon apostolski Ko\u015bcio\u0142a rzymskokatolickiego, zatwierdzony przez papie\u017ca Paw\u0142a III 27 wrze\u015bnia 1540 r. Towarzystwo Jezusowe zosta\u0142o za\u0142o\u017cone w g\u0142\u00f3wnej mierze do walki z reformacj\u0105, by broni\u0107 i rozszerza\u0107 wiar\u0119 oraz nauk\u0119 Ko\u015bcio\u0142a rzymskokatolickiego, przede wszystkim przez publiczne nauczanie, \u0107wiczenia duchowne, edukacj\u0119 i udzielanie sakrament\u00f3w. Od samego pocz\u0105tku podstawowymi zasadami jezuit\u00f3w, odr\u00f3\u017cniaj\u0105cymi go od innych zakon\u00f3w, by\u0142y: akcentowanie pos\u0142usze\u0144stwa wobec papie\u017ca i prze\u0142o\u017conych, sta\u0142e edukowanie w\u0142asnych cz\u0142onk\u00f3w - tak aby posiadali oni mo\u017cliwie jak najlepsze wykszta\u0142cenie, nie ograniczaj\u0105ce si\u0119 tylko do wykszta\u0142cenia czysto religijnego- aby byli zdolni dobrze rozumie\u0107 aktualnie panuj\u0105cego \"ducha wsp\u00f3\u0142czesno\u015bci\". Modlitewnik w j\u0119zyku polskim, wydany w drukarni J.K.Mci. i Rzeczypospolitey, w formacie 4\u00b0. Ka\u017cda modlitwa zamieszczona jest w tabelach na ka\u017cdej stronie ( ka\u017cda tabela podzielona na 15 rubryk). Starodruk nie posiada oprawy.",
        "Jesuitenorden (die Gesellschaft Jesu) ist ein m\u00e4nnlicher Orden, der 1540 vom Papst Paul den III. anerkannt wurde. Seine Hauptvoraussetzungen waren Kampf mit der Reformation, Verteidigung und Verbreitung der katholischen Glaube durch Predigen, Exerzitien, Erziehung und Erteilung der Sakramente. Vom Anfang an waren der Gehorsam gegen\u00fcber dem Generaloberen und dem Papst und st\u00e4ndige (nicht nur religi\u00f6se) Selbstbildung zwecks des guten Verst\u00e4ndnisses des Gegenwartsgeistes Hauptprinzipien des Ordens. Das Gebetbuch im Polnischen, wurde in der k\u00f6niglichen Buchdruckerei, im 4\u00ba Format herausgegeben. Jedes Gebet wurde in einer Tabelle enthalten. Einband fehlt."
    ],
    "oai_identifier": [
        "oai:fedora.clarin-d.uni-saarland.de:clarind-uds:poldilemma-5973"
    ],
    "oai_set": "",
    "state": "active",
    "tags": [
        {
            "name": "modlitewnik"
        },
        {
            "name": "Towarzystwo Jezusowe"
        },
        {
            "name": "Gebetbuch"
        },
        {
            "name": "Gesellschaft Jesu"
        }
    ],
    "title": [
        "Dworskie nabozenstwo ktore kazdy nabozny oboiey p\u0142ci cz\u0142owiek kazdego czasu odprawowac mo\u017ce przez iednego \u2026",
        "Dworskie nabozenstwo ktore kazdy nabozny oboiey p\u0142ci cz\u0142owiek kazdego czasu odprawowac mo\u017ce przez iednego \u2026"
    ],
    "url": ""
}