{
    "Contact": [
        "Charles University, Faculty of Mathematics and Physics, Institute of Formal and Applied Linguistics (UFAL)"
    ],
    "DiscHierarchy": [
        "1.4",
        "Humanities",
        "Linguistics"
    ],
    "Discipline": "Linguistics",
    "Format": [
        "text/plain; charset=utf-8",
        "application/x-gzip",
        "downloadable_files_count: 1"
    ],
    "MetaDataAccess": "https://clarin-pl.eu/oai/request?verb=GetRecord&metadataPrefix=oai_dc&identifier=oai:lindat.mff.cuni.cz:11234/1-1850",
    "MetadataAccess": [
        "oai:lindat.mff.cuni.cz:11234/1-1850"
    ],
    "PID": "http://hdl.handle.net/11234/1-1850",
    "PublicationTimestamp": "2016-12-05T11:59:59Z",
    "PublicationYear": [
        "2016"
    ],
    "Publisher": [
        "Charles University, Faculty of Mathematics and Physics, Institute of Formal and Applied Linguistics (UFAL)"
    ],
    "ResourceType": [
        "toolService"
    ],
    "Rights": [
        "Apache License 2.0",
        "http://opensource.org/licenses/Apache-2.0",
        "PUB"
    ],
    "author": [
        "Haji\u010d, Jan Jr"
    ],
    "fulltext": "oai:lindat.mff.cuni.cz:11234/1-1850;2018-07-02T22:05:52Z;hdl_11858_00-097C-0000-0001-486F-D;hdl_11858_00-097C-0000-0001-4877-A;MUSCIMarker;Haji\u010d, Jan Jr;image annotation;Python;music notation;MUSCIMarker is an open-source tool for annotating visual objects and their relationships in binary images. It is implemented in Python, known to run on Windows, Linux and OS X, and supports working offline. MUSCIMarker is being used for creating a dataset of musical notation symbols, but can support any object set.\r\n\r\n\r\nThe user documentation online is currently (12.2016) incomplete, as it is continually changing to reflect annotators' comments and incorporate new features. This version of the software is *not* the final one, and it is under continuous development (we're currently working on adding grayscale image support with auto-binarization, and Android support for touch-based annotation). However, the current version (1.1) has already been used to annotate more than 100 pages of sheet music, over all the major desktop OSes, and I believe it is already in a state where it can be useful beyond my immediate music notation data gathering use case.;2016-12-05;toolService;http://hdl.handle.net/11234/1-1850;Apache License 2.0;http://opensource.org/licenses/Apache-2.0;PUB;application/x-gzip;text/plain; charset=utf-8;downloadable_files_count: 1;Charles University, Faculty of Mathematics and Physics, Institute of Formal and Applied Linguistics (UFAL);http://muscimarker.readthedocs.io",
    "group": "clarin",
    "groups": [
        {
            "name": "clarin"
        }
    ],
    "name": "6550cce7-f890-595a-9f72-8a2cec573f75",
    "notes": [
        "MUSCIMarker is an open-source tool for annotating visual objects and their relationships in binary images. It is implemented in Python, known to run on Windows, Linux and OS X, and supports working offline. MUSCIMarker is being used for creating a dataset of musical notation symbols, but can support any object set.\r\n\r\n\r\nThe user documentation online is currently (12.2016) incomplete, as it is continually changing to reflect annotators' comments and incorporate new features. This version of the software is *not* the final one, and it is under continuous development (we're currently working on adding grayscale image support with auto-binarization, and Android support for touch-based annotation). However, the current version (1.1) has already been used to annotate more than 100 pages of sheet music, over all the major desktop OSes, and I believe it is already in a state where it can be useful beyond my immediate music notation data gathering use case."
    ],
    "oai_identifier": [
        "oai:lindat.mff.cuni.cz:11234/1-1850"
    ],
    "oai_set": [
        "hdl_11858_00-097C-0000-0001-486F-D",
        "hdl_11858_00-097C-0000-0001-4877-A"
    ],
    "state": "active",
    "tags": [
        {
            "name": "image annotation"
        },
        {
            "name": "Python"
        },
        {
            "name": "music notation"
        }
    ],
    "title": [
        "MUSCIMarker"
    ],
    "url": ""
}