{
    "Contact": [
        "Giellatekno - Saami Language Technology"
    ],
    "DiscHierarchy": [
        "1.4",
        "Humanities",
        "Linguistics"
    ],
    "Discipline": "Linguistics",
    "Format": [
        "application/zip",
        "text/xml",
        "downloadable_files_count: 1",
        "text/plain; charset=utf-8"
    ],
    "Language": [],
    "MetaDataAccess": "https://clarin-pl.eu/oai/request?verb=GetRecord&metadataPrefix=oai_dc&identifier=oai:repo.clarino.uib.no:11509/103",
    "MetadataAccess": [
        "oai:repo.clarino.uib.no:11509/103"
    ],
    "PID": "http://hdl.handle.net/11509/103",
    "PublicationTimestamp": "2015-08-03T11:59:59Z",
    "PublicationYear": [
        "2015"
    ],
    "Publisher": [
        "Giellatekno - Saami Language Technology"
    ],
    "ResourceType": [
        "corpus"
    ],
    "Rights": [
        "Creative Commons - Attribution 3.0 Unported (CC BY 3.0)",
        "http://creativecommons.org/licenses/by/3.0/",
        "CC"
    ],
    "author": [
        "The Divvun group at UiT The Arctic University of Norway",
        "Giellatekno - Saami Language Technology, UiT The Arctic University of Norway"
    ],
    "fulltext": "oai:repo.clarino.uib.no:11509/103;2016-09-06T12:50:26Z;hdl_11509_1;hdl_11509_2;SIKOR Kven free corpus;Giellatekno - Saami Language Technology, UiT The Arctic University of Norway;The Divvun group at UiT The Arctic University of Norway;Monolingual Corpus;Text Corpus;Kven Finnish;The SIKOR Kven free corpus is a monolingual text corpus of Kven that contains administrative, law, religious, non-fiction, fiction, and news texts. It is work done by the Giellatekno and Divvun research groups, Department of Linguistics, UiT The Arctic University of Norway, as well as by members of the language community. In particular, the following colleagues have contributed to the creation of the ressource: Ciprian Gerstenberger, B\u00f8rre Gaup, Sindre Trosterud, Leena Niiranen, Kaisa Maliniemi, Paula Paksuniemi, Mervi Haavisto, Trond Trosterud, and Anne-Kaisa R\u00e4is\u00e4nen. Linguistically, the data set (21,024 sentences; 182,697 tokens) features word form, lemma, and morphosyntactic analysis. The corpus has been automatically processed and linguistically analyzed with the Giellatekno/Divvun tools. Therefore, it may contain wrong annotations. In case you find any errors the creators would appreciate your feedback sent to giellatekno@uit.no and feedback@divvun.no.\r\nPlease note that the Giellatekno resources are dynamic in nature. To ensure that you have a completely updated version, please contact Giellatekno (see Contact Info in metadata).;2015-08-03;corpus;http://hdl.handle.net/11509/103;fkv;Creative Commons - Attribution 3.0 Unported (CC BY 3.0);http://creativecommons.org/licenses/by/3.0/;CC;application/zip;text/plain; charset=utf-8;text/xml;downloadable_files_count: 1;Giellatekno - Saami Language Technology;http://giellatekno.uit.no/index.eng.html",
    "group": "clarin",
    "groups": [
        {
            "name": "clarin"
        }
    ],
    "name": "6953964e-6479-59a8-9c80-4279397013f5",
    "notes": [
        "The SIKOR Kven free corpus is a monolingual text corpus of Kven that contains administrative, law, religious, non-fiction, fiction, and news texts. It is work done by the Giellatekno and Divvun research groups, Department of Linguistics, UiT The Arctic University of Norway, as well as by members of the language community. In particular, the following colleagues have contributed to the creation of the ressource: Ciprian Gerstenberger, B\u00f8rre Gaup, Sindre Trosterud, Leena Niiranen, Kaisa Maliniemi, Paula Paksuniemi, Mervi Haavisto, Trond Trosterud, and Anne-Kaisa R\u00e4is\u00e4nen. Linguistically, the data set (21,024 sentences; 182,697 tokens) features word form, lemma, and morphosyntactic analysis. The corpus has been automatically processed and linguistically analyzed with the Giellatekno/Divvun tools. Therefore, it may contain wrong annotations. In case you find any errors the creators would appreciate your feedback sent to giellatekno@uit.no and feedback@divvun.no.\r\nPlease note that the Giellatekno resources are dynamic in nature. To ensure that you have a completely updated version, please contact Giellatekno (see Contact Info in metadata)."
    ],
    "oai_identifier": [
        "oai:repo.clarino.uib.no:11509/103"
    ],
    "oai_set": [
        "hdl_11509_1",
        "hdl_11509_2"
    ],
    "state": "active",
    "tags": [
        {
            "name": "Monolingual Corpus"
        },
        {
            "name": "Text Corpus"
        },
        {
            "name": "Kven Finnish"
        }
    ],
    "title": [
        "SIKOR Kven free corpus"
    ],
    "url": ""
}