{
    "Contact": [
        "University of Bergen, Department of Linguistic, Literary and Aesthetic Studies"
    ],
    "DiscHierarchy": [
        "1.4",
        "Humanities",
        "Linguistics"
    ],
    "Discipline": "Linguistics",
    "Format": [
        "audio/x-wav",
        "downloadable_files_count: 7",
        "text/plain; charset=utf-8",
        "application/pdf",
        "application/octet-stream"
    ],
    "Language": [
        "Swedish",
        "Norwegian"
    ],
    "MetaDataAccess": "https://clarin-pl.eu/oai/request?verb=GetRecord&metadataPrefix=oai_dc&identifier=oai:repo.clarino.uib.no:11509/126",
    "MetadataAccess": [
        "oai:repo.clarino.uib.no:11509/126"
    ],
    "PID": "http://hdl.handle.net/11509/126",
    "PublicationTimestamp": "2019-02-25T11:59:59Z",
    "PublicationYear": [
        "2019"
    ],
    "Publisher": [
        "University of Bergen, Department of Linguistic, Literary and Aesthetic Studies"
    ],
    "ResourceType": [
        "corpus"
    ],
    "Rights": [
        "CLARIN_ACA",
        "https://kitwiki.csc.fi/twiki/bin/view/FinCLARIN/ClarinEulaAca?ID=1&AFFIL=EDU&BY=1&NORED=1",
        "ACA"
    ],
    "author": [
        "Kristoffersen, Gjert"
    ],
    "fulltext": "oai:repo.clarino.uib.no:11509/126;2019-02-25T14:34:17Z;hdl_11509_1;hdl_11509_2;The Level Stress recordings: \u00c4lvdalen_90;Kristoffersen, Gjert;Phonology;Recording equipment\r\nThe recordings were done by means of a cassette recorder (Sony TC-D5M) and Sony\r\nlavaliere microphones. They were digitized in the 1990s.\r\nThe set consists of two speakers, father and grown-up daughter. The original full recordings\r\nhave been lost, and they are therefore reconstructed from a series of single files saved into one\r\nwav file.\r\n\r\nThe speakers\r\nThe two speakers, born in 1921 and 1944, were recruited with the help of the Swedish linguist\r\nGunnar Nystr\u00f6m, who has a thorough knowledge of Dalarna and the Dalarna dialects. At the\r\ntime of recording, they lived in the villages of Karlsarvet and Brunnsberg. A third speaker\r\nwas also recorded, a man born in 1921, but due to his weak voice, extremely non-fluent\r\nreading and background noise generated by some technical failure, this recording has not been\r\nincluded in the collection.\r\n\r\nFor the full background description of this item, see the file \"\u00c4lvdalen_90: Background.pdf\".\r\n\r\nFor the full description of the whole project, see these files:\r\n     The Level Stress recordings.pdf\r\n     LevelStress_Glossary.pdf\r\n     Level Stress_Speaker and Sound File Codes.pdf\r\n\r\nThe data should be used only for research and development purposes.;2019-02-25;corpus;http://hdl.handle.net/11509/126;swe;nor;CLARIN_ACA;https://kitwiki.csc.fi/twiki/bin/view/FinCLARIN/ClarinEulaAca?ID=1&AFFIL=EDU&BY=1&NORED=1;ACA;audio/x-wav;audio/x-wav;application/pdf;application/pdf;application/pdf;application/pdf;application/octet-stream;text/plain; charset=utf-8;downloadable_files_count: 7;University of Bergen, Department of Linguistic, Literary and Aesthetic Studies;http://terminologi.no",
    "group": "clarin",
    "groups": [
        {
            "name": "clarin"
        }
    ],
    "name": "6bb95132-dee5-524e-9f3d-ce30d5ececcc",
    "notes": [
        "Recording equipment\r\nThe recordings were done by means of a cassette recorder (Sony TC-D5M) and Sony\r\nlavaliere microphones. They were digitized in the 1990s.\r\nThe set consists of two speakers, father and grown-up daughter. The original full recordings\r\nhave been lost, and they are therefore reconstructed from a series of single files saved into one\r\nwav file.\r\n\r\nThe speakers\r\nThe two speakers, born in 1921 and 1944, were recruited with the help of the Swedish linguist\r\nGunnar Nystr\u00f6m, who has a thorough knowledge of Dalarna and the Dalarna dialects. At the\r\ntime of recording, they lived in the villages of Karlsarvet and Brunnsberg. A third speaker\r\nwas also recorded, a man born in 1921, but due to his weak voice, extremely non-fluent\r\nreading and background noise generated by some technical failure, this recording has not been\r\nincluded in the collection.\r\n\r\nFor the full background description of this item, see the file \"\u00c4lvdalen_90: Background.pdf\".\r\n\r\nFor the full description of the whole project, see these files:\r\n     The Level Stress recordings.pdf\r\n     LevelStress_Glossary.pdf\r\n     Level Stress_Speaker and Sound File Codes.pdf\r\n\r\nThe data should be used only for research and development purposes."
    ],
    "oai_identifier": [
        "oai:repo.clarino.uib.no:11509/126"
    ],
    "oai_set": [
        "hdl_11509_1",
        "hdl_11509_2"
    ],
    "state": "active",
    "tags": [
        {
            "name": "Phonology"
        }
    ],
    "title": [
        "The Level Stress recordings: \u00c4lvdalen_90"
    ],
    "url": ""
}