{
    "Contact": [
        "Charles University, Faculty of Mathematics and Physics, Institute of Formal and Applied Linguistics (UFAL)"
    ],
    "DiscHierarchy": [
        "1.4",
        "Humanities",
        "Linguistics"
    ],
    "Discipline": "Linguistics",
    "Format": [
        "application/zip",
        "downloadable_files_count: 1",
        "text/plain; charset=utf-8"
    ],
    "Language": [
        "English"
    ],
    "MetaDataAccess": "https://clarin-pl.eu/oai/request?verb=GetRecord&metadataPrefix=oai_dc&identifier=oai:lindat.mff.cuni.cz:11234/1-1730",
    "MetadataAccess": [
        "oai:lindat.mff.cuni.cz:11234/1-1730"
    ],
    "PID": "http://hdl.handle.net/11234/1-1730",
    "PublicationTimestamp": "2016-05-30T11:59:59Z",
    "PublicationYear": [
        "2016"
    ],
    "Publisher": [
        "Charles University, Faculty of Mathematics and Physics, Institute of Formal and Applied Linguistics (UFAL)"
    ],
    "ResourceType": [
        "lexicalConceptualResource"
    ],
    "Rights": [
        "Creative Commons - Attribution-ShareAlike 4.0 International (CC BY-SA 4.0)",
        "http://creativecommons.org/licenses/by-sa/4.0/",
        "PUB"
    ],
    "author": [
        "Bojar, Ond\u0159ej",
        "Kocmi, Tom"
    ],
    "fulltext": "oai:lindat.mff.cuni.cz:11234/1-1730;2018-07-02T22:05:50Z;hdl_11858_00-097C-0000-0001-486F-D;hdl_11858_00-097C-0000-0001-4877-A;Extended Morphosyntactic Testset for Word2Vec;Kocmi, Tom;Bojar, Ond\u0159ej;syntactic questions;We have created test set for syntactic questions presented in the paper [1] which is more general than Mikolov's [2]. Since we were interested in morphosyntactic relations, we extended only the questions of the syntactic type with exception of nationality adjectives which is already covered completely in Mikolov's test set.\r\n\r\nWe constructed the pairs more or less manually, taking inspiration in the Czech side of the CzEng corpus [3], where explicit morphological annotation allows to identify various pairs of Czech words (different grades of adjectives, words and their negations, etc.). The word-aligned English words often shared the same properties. Another sources of pairs were acquired from various webpages usually written for learners of English. For example for verb tense, we relied on a freely available list of English verbs and their morphological variations.\r\n\r\nWe have included 100-1000 different pairs for each question set. The questions were constructed from the pairs similarly as by Mikolov: generating all possible pairs of pairs. This leads to millions of questions, so we randomly selected 1000 instances per question set, to keep the test set in the same order of magnitude. Additionally, we decided to extend set of questions on opposites to cover not only opposites of adjectives but also of nouns and verbs.;2016-05-30;lexicalConceptualResource;http://hdl.handle.net/11234/1-1730;eng;Creative Commons - Attribution-ShareAlike 4.0 International (CC BY-SA 4.0);http://creativecommons.org/licenses/by-sa/4.0/;PUB;application/zip;text/plain; charset=utf-8;downloadable_files_count: 1;Charles University, Faculty of Mathematics and Physics, Institute of Formal and Applied Linguistics (UFAL)",
    "group": "clarin",
    "groups": [
        {
            "name": "clarin"
        }
    ],
    "name": "6bfb3833-68c9-504d-899a-a94fd891707d",
    "notes": [
        "We have created test set for syntactic questions presented in the paper [1] which is more general than Mikolov's [2]. Since we were interested in morphosyntactic relations, we extended only the questions of the syntactic type with exception of nationality adjectives which is already covered completely in Mikolov's test set.\r\n\r\nWe constructed the pairs more or less manually, taking inspiration in the Czech side of the CzEng corpus [3], where explicit morphological annotation allows to identify various pairs of Czech words (different grades of adjectives, words and their negations, etc.). The word-aligned English words often shared the same properties. Another sources of pairs were acquired from various webpages usually written for learners of English. For example for verb tense, we relied on a freely available list of English verbs and their morphological variations.\r\n\r\nWe have included 100-1000 different pairs for each question set. The questions were constructed from the pairs similarly as by Mikolov: generating all possible pairs of pairs. This leads to millions of questions, so we randomly selected 1000 instances per question set, to keep the test set in the same order of magnitude. Additionally, we decided to extend set of questions on opposites to cover not only opposites of adjectives but also of nouns and verbs."
    ],
    "oai_identifier": [
        "oai:lindat.mff.cuni.cz:11234/1-1730"
    ],
    "oai_set": [
        "hdl_11858_00-097C-0000-0001-486F-D",
        "hdl_11858_00-097C-0000-0001-4877-A"
    ],
    "state": "active",
    "tags": [
        {
            "name": "syntactic questions"
        }
    ],
    "title": [
        "Extended Morphosyntactic Testset for Word2Vec"
    ],
    "url": ""
}