{
    "Contact": [
        "Charles University, Faculty of Mathematics and Physics, Institute of Formal and Applied Linguistics (UFAL)"
    ],
    "DiscHierarchy": [
        "1.4",
        "Humanities",
        "Linguistics"
    ],
    "Discipline": "Linguistics",
    "Format": [
        "application/zip",
        "downloadable_files_count: 1",
        "text/plain; charset=utf-8"
    ],
    "Language": [
        "Czech",
        "English"
    ],
    "MetaDataAccess": "https://clarin-pl.eu/oai/request?verb=GetRecord&metadataPrefix=oai_dc&identifier=oai:lindat.mff.cuni.cz:11234/1-1679",
    "MetadataAccess": [
        "oai:lindat.mff.cuni.cz:11234/1-1679"
    ],
    "PID": "http://hdl.handle.net/11234/1-1679",
    "PublicationTimestamp": "2016-03-31T11:59:59Z",
    "PublicationYear": [
        "2016"
    ],
    "Publisher": [
        "Charles University, Faculty of Mathematics and Physics, Institute of Formal and Applied Linguistics (UFAL)"
    ],
    "RelatedIdentifier": [
        "info:eu-repo/grantAgreement/EC/H2020/645452"
    ],
    "ResourceType": [
        "corpus"
    ],
    "Rights": [
        "Creative Commons - Attribution-ShareAlike 4.0 International (CC BY-SA 4.0)",
        "http://creativecommons.org/licenses/by-sa/4.0/",
        "PUB"
    ],
    "author": [
        "Bojar, Ond\u0159ej",
        "Zelenina, Maria",
        "D\u011bcht\u011brenko, Filip"
    ],
    "fulltext": "oai:lindat.mff.cuni.cz:11234/1-1679;2018-07-02T22:05:54Z;hdl_11858_00-097C-0000-0001-486F-D;hdl_11858_00-097C-0000-0001-4877-A;Eye-Tracking Recordings from a Pilot Study of WMT-style MT Outputs Ranking;Bojar, Ond\u0159ej;D\u011bcht\u011brenko, Filip;Zelenina, Maria;eye-tracking;MT evaluation;This package contains the eye-tracker recordings of 8 subjects evaluating English-to-Czech machine translation quality using the WMT-style ranking of sentences.\r\n\r\nWe provide the set of sentences evaluated, the exact screens presented to the annotators (including bounding box information for every area of interest and even for individual letters in the text) and finally the raw EyeLink II files with gaze trajectories.\r\n\r\nThe description of the experiment can be found in the paper:\r\n\r\nOnd\u0159ej Bojar, Filip D\u011bcht\u011brenko, Maria Zelenina. A Pilot Eye-Tracking Study of WMT-Style Ranking Evaluation.\r\nProceedings of the LREC 2016 Workshop \u201cTranslation Evaluation \u2013 From Fragmented Tools\r\nand Data Sets to an Integrated Ecosystem\u201d, Georg Rehm, Aljoscha Burchardt et al. (eds.). pp. 20-26. May 2016, Portoro\u017e, Slovenia.\r\n\r\nThis work has received funding from the European Union's Horizon 2020 research\r\nand innovation programme under grant agreement no. 645452 (QT21). This work was\r\npartially financially supported by the Government of Russian Federation, Grant\r\n074-U01.\r\n\r\nThis work has been using language resources developed, stored and distributed\r\nby the LINDAT/CLARIN project of the Ministry of Education, Youth and Sports of\r\nthe Czech Republic (project LM2010013).;2016-03-31;corpus;http://hdl.handle.net/11234/1-1679;ces;eng;info:eu-repo/grantAgreement/EC/H2020/645452;Creative Commons - Attribution-ShareAlike 4.0 International (CC BY-SA 4.0);http://creativecommons.org/licenses/by-sa/4.0/;PUB;application/zip;text/plain; charset=utf-8;downloadable_files_count: 1;Charles University, Faculty of Mathematics and Physics, Institute of Formal and Applied Linguistics (UFAL)",
    "group": "clarin",
    "groups": [
        {
            "name": "clarin"
        }
    ],
    "name": "6df4b396-1685-583f-a4f8-1c83e17e93ef",
    "notes": [
        "This package contains the eye-tracker recordings of 8 subjects evaluating English-to-Czech machine translation quality using the WMT-style ranking of sentences.\r\n\r\nWe provide the set of sentences evaluated, the exact screens presented to the annotators (including bounding box information for every area of interest and even for individual letters in the text) and finally the raw EyeLink II files with gaze trajectories.\r\n\r\nThe description of the experiment can be found in the paper:\r\n\r\nOnd\u0159ej Bojar, Filip D\u011bcht\u011brenko, Maria Zelenina. A Pilot Eye-Tracking Study of WMT-Style Ranking Evaluation.\r\nProceedings of the LREC 2016 Workshop \u201cTranslation Evaluation \u2013 From Fragmented Tools\r\nand Data Sets to an Integrated Ecosystem\u201d, Georg Rehm, Aljoscha Burchardt et al. (eds.). pp. 20-26. May 2016, Portoro\u017e, Slovenia.\r\n\r\nThis work has received funding from the European Union's Horizon 2020 research\r\nand innovation programme under grant agreement no. 645452 (QT21). This work was\r\npartially financially supported by the Government of Russian Federation, Grant\r\n074-U01.\r\n\r\nThis work has been using language resources developed, stored and distributed\r\nby the LINDAT/CLARIN project of the Ministry of Education, Youth and Sports of\r\nthe Czech Republic (project LM2010013)."
    ],
    "oai_identifier": [
        "oai:lindat.mff.cuni.cz:11234/1-1679"
    ],
    "oai_set": [
        "hdl_11858_00-097C-0000-0001-486F-D",
        "hdl_11858_00-097C-0000-0001-4877-A"
    ],
    "state": "active",
    "tags": [
        {
            "name": "eye-tracking"
        },
        {
            "name": "MT evaluation"
        }
    ],
    "title": [
        "Eye-Tracking Recordings from a Pilot Study of WMT-style MT Outputs Ranking"
    ],
    "url": ""
}