{
    "Contact": [
        "Lehrstuhl Phonetik (Fachrichtung 4.7) und Lehrstuhl Slavistik (Fachrichtung 4.4) der Philosophischen Fakult\u00e4t II der Universit\u00e4t des Saarlandes"
    ],
    "Contributor": [
        "William Barry",
        "Marko Pallmann",
        "Juro Frahnow",
        "Holger von Rauch",
        "Roland Marti",
        "Bistra Andreeva",
        "Jutta Kaiser",
        "Helena Pallmann",
        "Olga Trifsik"
    ],
    "DiscHierarchy": [
        "1.4",
        "Humanities",
        "Linguistics"
    ],
    "Discipline": "Linguistics",
    "Format": [
        "audio/mpeg",
        "audio/x-wav"
    ],
    "Language": [
        "Lower Sorbian"
    ],
    "MetaDataAccess": "https://clarin-pl.eu/oai/request?verb=GetRecord&metadataPrefix=oai_dc&identifier=oai:fedora.clarin-d.uni-saarland.de:clarind-uds:genie",
    "MetadataAccess": [
        "oai:fedora.clarin-d.uni-saarland.de:clarind-uds:genie"
    ],
    "PID": "http://hdl.handle.net/11858/00-246C-0000-0005-BD10-7",
    "PublicationTimestamp": "2006-11-06T11:59:59Z",
    "PublicationYear": [
        "2006"
    ],
    "Publisher": [
        "Lehrstuhl Phonetik (Fachrichtung 4.7) und Lehrstuhl Slavistik (Fachrichtung 4.4) der Philosophischen Fakult\u00e4t II der Universit\u00e4t des Saarlandes"
    ],
    "ResourceType": [
        "Collection"
    ],
    "Rights": [
        "Copyrighted, Registration necessary",
        "License: http://genie.coli.uni-saarland.de/cgi-bin/benutzer.html"
    ],
    "SpatialCoverage": [
        "1951/2006",
        "Lausitz"
    ],
    "TemporalCoverage": " period : ( 1951-07-01T11:59:59Z - None ) ",
    "author": [
        "Roland Marti\nFR 4.4 Slavistik\nUniversit\u00e4t des Saarlandes\nPostfach 15 11 50\nD\u201366041 Saarbr\u00fccken"
    ],
    "fulltext": "oai:fedora.clarin-d.uni-saarland.de:clarind-uds:genie;2014-06-03T12:59:07Z;GENIE \u2013 GEsprochenes NIEdersorbisch/Wendisch;Roland Marti\nFR 4.4 Slavistik\nUniversit\u00e4t des Saarlandes\nPostfach 15 11 50\nD\u201366041 Saarbr\u00fccken;Lausitz;Spoken Language;Dialect;The corpus GENIE - spoken Niedersorbisch/Wendisch gives acces to the spoken Variants of these languages via a databases.  It presents one of the two only autochthone slavic minority languages in Germany, which is spoken in the Lausitz by less than 10,000 people in a native way, in acustic form. The language is endangered. It shows the development and changes due to the regional and temporal aspects of the language during the last decade. It provides spoken language material for scientific research especially in the area of phonetics. It includes 350 audio files with over 62 hours of selected niedersorbische speech recordings from different sources and eras. It provides detailed information for each recording, which makes it possible to search for recordings with specific characteristics The audio files are available uncompressed as .wav files and compressed as .mp3 files.;Das Korpus GENIE \u2013 GEsprochenes NIEdersorbisch/Wendisch macht das Niedersorbische/Wendische in seinen gesprochenen Variet\u00e4ten durch eine Datenbank mit Webanwendung im Netz zug\u00e4nglich.  Es pr\u00e4sentiert in akustischer Form eine der beiden einzigen autochthonen slawischen Minderheitssprachen in Deutschland, die in der Lausitz von weniger als 10.000 Personen auf muttersprachlichem Niveau gesprochen wird und in ihrer Existenz bedroht ist. Es zeigt die Entwicklung und die regional und zeitlich bedingten Ver\u00e4nderungen in dieser Sprache im letzten Jahrhundert auf. Es stellt sprachliches Material f\u00fcr wissenschaftliche Untersuchungen, insbesondere auf dem Gebiet der Phonetik, zur Verf\u00fcgung. Es enth\u00e4lt \u00fcber 62 Stunden ausgew\u00e4hlte niedersorbische Sprachaufnahmen aus verschiedenen Quellen und Epochen in knapp 350 Audiodateien. Es liefert zu allen Aufnahmen ausf\u00fchrliche Informationen, \u00fcber die gezielt nach Aufnahmen mit bestimmten Eigenschaften gesucht werden kann. Es h\u00e4lt alle Audiodateien sowohl unkompromiert als .wav-Dateien wie auch als komprimierte .mp3-Dateien zum Download bereit.;Lehrstuhl Phonetik (Fachrichtung 4.7) und Lehrstuhl Slavistik (Fachrichtung 4.4) der Philosophischen Fakult\u00e4t II der Universit\u00e4t des Saarlandes;Roland Marti;Holger von Rauch;Juro Frahnow;Jutta Kaiser;Helena Pallmann;Marko Pallmann;Olga Trifsik;Bistra Andreeva;William Barry;2006-11-06;Collection;audio/x-wav;audio/mpeg;clarind-uds:genie;hdl:11858/00-246C-0000-0005-BD10-7;Archiv des Sorbischen Rundfunks: http://www.rbb-online.de/radio/sorbisches_programm/sorbisches_programm.html;Best\u00e4nde des Sorbischen Kulturarchivs im Serbski institut z.t.: http://www.serbski-institut.de/;dsb;1951/2006;Lausitz;Copyrighted, Registration necessary;License: http://genie.coli.uni-saarland.de/cgi-bin/benutzer.html",
    "group": "clarin",
    "groups": [
        {
            "name": "clarin"
        }
    ],
    "name": "723e702f-0884-5eef-ac69-09f22bc206f7",
    "notes": [
        "The corpus GENIE - spoken Niedersorbisch/Wendisch gives acces to the spoken Variants of these languages via a databases.  It presents one of the two only autochthone slavic minority languages in Germany, which is spoken in the Lausitz by less than 10,000 people in a native way, in acustic form. The language is endangered. It shows the development and changes due to the regional and temporal aspects of the language during the last decade. It provides spoken language material for scientific research especially in the area of phonetics. It includes 350 audio files with over 62 hours of selected niedersorbische speech recordings from different sources and eras. It provides detailed information for each recording, which makes it possible to search for recordings with specific characteristics The audio files are available uncompressed as .wav files and compressed as .mp3 files.",
        "Das Korpus GENIE \u2013 GEsprochenes NIEdersorbisch/Wendisch macht das Niedersorbische/Wendische in seinen gesprochenen Variet\u00e4ten durch eine Datenbank mit Webanwendung im Netz zug\u00e4nglich.  Es pr\u00e4sentiert in akustischer Form eine der beiden einzigen autochthonen slawischen Minderheitssprachen in Deutschland, die in der Lausitz von weniger als 10.000 Personen auf muttersprachlichem Niveau gesprochen wird und in ihrer Existenz bedroht ist. Es zeigt die Entwicklung und die regional und zeitlich bedingten Ver\u00e4nderungen in dieser Sprache im letzten Jahrhundert auf. Es stellt sprachliches Material f\u00fcr wissenschaftliche Untersuchungen, insbesondere auf dem Gebiet der Phonetik, zur Verf\u00fcgung. Es enth\u00e4lt \u00fcber 62 Stunden ausgew\u00e4hlte niedersorbische Sprachaufnahmen aus verschiedenen Quellen und Epochen in knapp 350 Audiodateien. Es liefert zu allen Aufnahmen ausf\u00fchrliche Informationen, \u00fcber die gezielt nach Aufnahmen mit bestimmten Eigenschaften gesucht werden kann. Es h\u00e4lt alle Audiodateien sowohl unkompromiert als .wav-Dateien wie auch als komprimierte .mp3-Dateien zum Download bereit."
    ],
    "oai_identifier": [
        "oai:fedora.clarin-d.uni-saarland.de:clarind-uds:genie"
    ],
    "oai_set": "",
    "state": "active",
    "tags": [
        {
            "name": "Lausitz"
        },
        {
            "name": "Spoken Language"
        },
        {
            "name": "Dialect"
        }
    ],
    "title": [
        "GENIE \u2013 GEsprochenes NIEdersorbisch/Wendisch"
    ],
    "url": ""
}