{
    "Contact": [
        "Oxford Text Archive, University of Oxford"
    ],
    "Contributor": [
        "Triggs, Jeffery"
    ],
    "DiscHierarchy": [
        "1.4",
        "Humanities",
        "Linguistics"
    ],
    "Discipline": "Linguistics",
    "Language": [
        "English"
    ],
    "MetaDataAccess": "https://clarin-pl.eu/oai/request?verb=GetRecord&metadataPrefix=oai_dc&identifier=oai:ota:oucs:3125",
    "MetadataAccess": [
        "oai:ota:oucs:3125"
    ],
    "PublicationTimestamp": "1740-07-01T11:59:59Z",
    "PublicationYear": [
        "1740"
    ],
    "Publisher": [
        "Oxford Text Archive, University of Oxford"
    ],
    "ResourceType": [
        "Text"
    ],
    "Rights": [
        "http://www.ota.ox.ac.uk/documents/user_agreement.xml"
    ],
    "author": [
        "Law, William, 1686-1761"
    ],
    "fulltext": "oai:ota:oucs:3125;2018-07-02T14:44:52Z;http://ota.ox.ac.uk/headers/3125.xml;An appeal to all that doubt, or disbelieve the truths of the Gospel: whether they be Deists, Arians, Socinians, or nominal Christians, in which the true grounds and reasons of the whole Christian faith and life are plainly and fully demonstrated, to which are added, some animadversions upon Dr. Trapp's late reply;Law, William, 1686-1761;not after: 1740;text_and_corpus_linguistics;Theology -- Miscellaneous Christian texts -- English;eng;Oxford Text Archive, University of Oxford;Triggs, Jeffery;Text;http://www.ota.ox.ac.uk/documents/user_agreement.xml",
    "group": "clarin",
    "groups": [
        {
            "name": "clarin"
        }
    ],
    "name": "7323da55-e79e-57c9-b1b3-df50b02b4d54",
    "oai_identifier": [
        "oai:ota:oucs:3125"
    ],
    "oai_set": "",
    "state": "active",
    "tags": [
        {
            "name": "text_and_corpus_linguistics"
        },
        {
            "name": "Theology -- Miscellaneous Christian texts -- English"
        }
    ],
    "title": [
        "An appeal to all that doubt, or disbelieve the truths of the Gospel: whether they be Deists, Arians, Socinians, or nominal Christians, in which the true grounds and reasons of the whole Christian faith and life are plainly and fully demonstrated, to which are added, some animadversions upon Dr. Trapp's late reply"
    ],
    "url": "http://ota.ox.ac.uk/headers/3125.xml"
}