{
    "Contact": [
        "Giellatekno - Saami Language Technology"
    ],
    "DiscHierarchy": [
        "1.4",
        "Humanities",
        "Linguistics"
    ],
    "Discipline": "Linguistics",
    "Format": [
        "application/zip",
        "text/xml",
        "downloadable_files_count: 1",
        "text/plain; charset=utf-8"
    ],
    "Language": [
        "Norwegian Bokm\u00e5l",
        "Southern Sami"
    ],
    "MetaDataAccess": "https://clarin-pl.eu/oai/request?verb=GetRecord&metadataPrefix=oai_dc&identifier=oai:repo.clarino.uib.no:11509/93",
    "MetadataAccess": [
        "oai:repo.clarino.uib.no:11509/93"
    ],
    "PID": "http://hdl.handle.net/11509/93",
    "PublicationTimestamp": "2015-07-01T11:59:59Z",
    "PublicationYear": [
        "2015"
    ],
    "Publisher": [
        "Giellatekno - Saami Language Technology"
    ],
    "ResourceType": [
        "lexicalConceptualResource"
    ],
    "Rights": [
        "Creative Commons - Attribution 3.0 Unported (CC BY 3.0)",
        "http://creativecommons.org/licenses/by/3.0/",
        "CC"
    ],
    "author": [
        "The Divvun group at UiT The Arctic University of Norway",
        "Giellatekno - Saami Language Technology, UiT The Arctic University of Norway"
    ],
    "fulltext": "oai:repo.clarino.uib.no:11509/93;2016-09-06T12:55:52Z;hdl_11509_1;hdl_11509_2;Norwegian Bokm\u00e5l-South Saami dictionary;Giellatekno - Saami Language Technology, UiT The Arctic University of Norway;The Divvun group at UiT The Arctic University of Norway;Bilingual Lexicon;Norwegian;South Saami;Machine-readable Dictionary;The Norwegian Bokm\u00e5l-South Saami dictionary is the work done by Giellatekno and Divvun research groups, Department of Linguistics, UiT The Arctic University of Norway, as well as by members of the language communities. In particular, the following colleagues have contributed to the creation of the ressource: Tove Brustad, Albert J\u00e5ma, Lene Antonsen, Ciprian Gerstenberger, Trond Trosterud, Maja Kappfjell, Sissel J\u00e5ma, Toini Bergstr\u00f8m, Marit Fjellheim, Sjur Moshagen, and Thomas Omma. The dictionary contains 12951 entries in Giellatekno's dictionary xml format. In spite of the extensive quality control, it may contain entries with objectionable translations. If you find any errors or want to add more words, download the file, edit it, and send it back to giellatekno@uit.no and feedback@divvun.no.\r\nPlease note that the Giellatekno resources are dynamic in nature. To ensure that you have a completely updated version, please contact Giellatekno (see Contact Info in metadata).;2015;lexicalConceptualResource;http://hdl.handle.net/11509/93;nob;sma;Creative Commons - Attribution 3.0 Unported (CC BY 3.0);http://creativecommons.org/licenses/by/3.0/;CC;application/zip;text/plain; charset=utf-8;text/xml;downloadable_files_count: 1;Giellatekno - Saami Language Technology;http://giellatekno.uit.no/index.eng.html",
    "group": "clarin",
    "groups": [
        {
            "name": "clarin"
        }
    ],
    "name": "79256068-b875-557f-a1cf-e879fb59501a",
    "notes": [
        "The Norwegian Bokm\u00e5l-South Saami dictionary is the work done by Giellatekno and Divvun research groups, Department of Linguistics, UiT The Arctic University of Norway, as well as by members of the language communities. In particular, the following colleagues have contributed to the creation of the ressource: Tove Brustad, Albert J\u00e5ma, Lene Antonsen, Ciprian Gerstenberger, Trond Trosterud, Maja Kappfjell, Sissel J\u00e5ma, Toini Bergstr\u00f8m, Marit Fjellheim, Sjur Moshagen, and Thomas Omma. The dictionary contains 12951 entries in Giellatekno's dictionary xml format. In spite of the extensive quality control, it may contain entries with objectionable translations. If you find any errors or want to add more words, download the file, edit it, and send it back to giellatekno@uit.no and feedback@divvun.no.\r\nPlease note that the Giellatekno resources are dynamic in nature. To ensure that you have a completely updated version, please contact Giellatekno (see Contact Info in metadata)."
    ],
    "oai_identifier": [
        "oai:repo.clarino.uib.no:11509/93"
    ],
    "oai_set": [
        "hdl_11509_1",
        "hdl_11509_2"
    ],
    "state": "active",
    "tags": [
        {
            "name": "Bilingual Lexicon"
        },
        {
            "name": "Norwegian"
        },
        {
            "name": "South Saami"
        },
        {
            "name": "Machine-readable Dictionary"
        }
    ],
    "title": [
        "Norwegian Bokm\u00e5l-South Saami dictionary"
    ],
    "url": ""
}