{
    "Contact": [
        "Charles University, Faculty of Mathematics and Physics, Institute of Formal and Applied Linguistics (UFAL)"
    ],
    "DiscHierarchy": [
        "1.4",
        "Humanities",
        "Linguistics"
    ],
    "Discipline": "Linguistics",
    "Format": [
        "application/zip",
        "downloadable_files_count: 1",
        "text/plain; charset=utf-8"
    ],
    "MetaDataAccess": "https://clarin-pl.eu/oai/request?verb=GetRecord&metadataPrefix=oai_dc&identifier=oai:lindat.mff.cuni.cz:11858/00-097C-0000-0007-70FD-E",
    "MetadataAccess": [
        "oai:lindat.mff.cuni.cz:11858/00-097C-0000-0007-70FD-E"
    ],
    "PID": "http://hdl.handle.net/11858/00-097C-0000-0007-70FD-E",
    "PublicationTimestamp": "2006-07-01T11:59:59Z",
    "PublicationYear": [
        "2006"
    ],
    "Publisher": [
        "Charles University, Faculty of Mathematics and Physics, Institute of Formal and Applied Linguistics (UFAL)"
    ],
    "ResourceType": [
        "toolService"
    ],
    "Rights": [
        "GNU General Public License, version 2",
        "http://www.gnu.org/licenses/gpl-2.0.html",
        "PUB"
    ],
    "author": [
        "Zeman, Daniel"
    ],
    "fulltext": "oai:lindat.mff.cuni.cz:11858/00-097C-0000-0007-70FD-E;2018-07-02T22:05:49Z;hdl_11858_00-097C-0000-0001-486F-D;hdl_11858_00-097C-0000-0001-4877-A;DZ Interset;Zeman, Daniel;morphology;NLP;Perl;DZ Interset is a means of converting among various tag sets in natural language processing. The core idea is similar to interlingua-based machine translation. DZ Interset defines a set of features that are encoded by the various tag sets. The set of features should be as universal as possible. It does not need to encode everything that is encoded by any tag set but it should encode all information that people may want to access and/or port from one tag set to another.\r\n\r\nNew tag sets are attached by writing a driver for them. Once the driver is ready, you can easily convert tags between the new set and any other set for which you also have a driver. This reusability is an obvious advantage over writing a targeted conversion procedure each time you need to convert between a particular pair of tag sets.;2006-06;toolService;http://hdl.handle.net/11858/00-097C-0000-0007-70FD-E;GNU General Public License, version 2;http://www.gnu.org/licenses/gpl-2.0.html;PUB;application/zip;text/plain; charset=utf-8;downloadable_files_count: 1;Charles University, Faculty of Mathematics and Physics, Institute of Formal and Applied Linguistics (UFAL);https://wiki.ufal.ms.mff.cuni.cz/user:zeman:interset",
    "group": "clarin",
    "groups": [
        {
            "name": "clarin"
        }
    ],
    "name": "7b27d83a-4057-5d67-85b4-2780321c31b3",
    "notes": [
        "DZ Interset is a means of converting among various tag sets in natural language processing. The core idea is similar to interlingua-based machine translation. DZ Interset defines a set of features that are encoded by the various tag sets. The set of features should be as universal as possible. It does not need to encode everything that is encoded by any tag set but it should encode all information that people may want to access and/or port from one tag set to another.\r\n\r\nNew tag sets are attached by writing a driver for them. Once the driver is ready, you can easily convert tags between the new set and any other set for which you also have a driver. This reusability is an obvious advantage over writing a targeted conversion procedure each time you need to convert between a particular pair of tag sets."
    ],
    "oai_identifier": [
        "oai:lindat.mff.cuni.cz:11858/00-097C-0000-0007-70FD-E"
    ],
    "oai_set": [
        "hdl_11858_00-097C-0000-0001-486F-D",
        "hdl_11858_00-097C-0000-0001-4877-A"
    ],
    "state": "active",
    "tags": [
        {
            "name": "morphology"
        },
        {
            "name": "NLP"
        },
        {
            "name": "Perl"
        }
    ],
    "title": [
        "DZ Interset"
    ],
    "url": ""
}