{
    "Contact": [
        "Istituto di Linguistica Computazionale \u201cA. Zampolli\u201d - Consiglio Nazionale delle Ricerche (ILC-CNR)"
    ],
    "DiscHierarchy": [
        "1.4",
        "Humanities",
        "Linguistics"
    ],
    "Discipline": "Linguistics",
    "Format": [
        "downloadable_files_count: 0"
    ],
    "Language": [
        "Italian"
    ],
    "MetaDataAccess": "https://clarin-pl.eu/oai/request?verb=GetRecord&metadataPrefix=oai_dc&identifier=oai:dspace-clarin-it.ilc.cnr.it:20.500.11752/ILC-67",
    "MetadataAccess": [
        "oai:dspace-clarin-it.ilc.cnr.it:20.500.11752/ILC-67"
    ],
    "PID": "http://hdl.handle.net/20.500.11752/ILC-67",
    "PublicationTimestamp": "2016-11-16T11:59:59Z",
    "PublicationYear": [
        "2016"
    ],
    "Publisher": [
        "Istituto di Linguistica Computazionale \u201cA. Zampolli\u201d - Consiglio Nazionale delle Ricerche (ILC-CNR)"
    ],
    "ResourceType": [
        "corpus"
    ],
    "author": [
        "AA. VV., AA. VV."
    ],
    "fulltext": "oai:dspace-clarin-it.ilc.cnr.it:20.500.11752/ILC-67;2018-07-23T09:13:43Z;hdl_000-c0-111_38;hdl_000-c0-111_49;Dialoghi Italiani di Giordano Bruno;AA. VV., AA. VV.;Philosophy;Religion;Science;This collection of the works of Giordano Bruno was packaged in the 70s - 80s in cooperation with the Insitute for the European Intellectual Lexicon, then called Study Centre of the CNR, ILIESI today.\r\n\r\nThe first works in this collection were originally encoded on mechanographic punched cards around 1969, at the beginning of the humanities computing era.;2016-11-16;corpus;http://hdl.handle.net/20.500.11752/ILC-67;ita;downloadable_files_count: 0;Istituto di Linguistica Computazionale \u201cA. Zampolli\u201d - Consiglio Nazionale delle Ricerche (ILC-CNR)",
    "group": "clarin",
    "groups": [
        {
            "name": "clarin"
        }
    ],
    "name": "80ea454e-2e10-5885-93b9-c00042e93a09",
    "notes": [
        "This collection of the works of Giordano Bruno was packaged in the 70s - 80s in cooperation with the Insitute for the European Intellectual Lexicon, then called Study Centre of the CNR, ILIESI today.\r\n\r\nThe first works in this collection were originally encoded on mechanographic punched cards around 1969, at the beginning of the humanities computing era."
    ],
    "oai_identifier": [
        "oai:dspace-clarin-it.ilc.cnr.it:20.500.11752/ILC-67"
    ],
    "oai_set": [
        "hdl_000-c0-111_38",
        "hdl_000-c0-111_49"
    ],
    "state": "active",
    "tags": [
        {
            "name": "Philosophy"
        },
        {
            "name": "Religion"
        },
        {
            "name": "Science"
        }
    ],
    "title": [
        "Dialoghi Italiani di Giordano Bruno"
    ],
    "url": ""
}