{
    "Contact": [
        "Department of Information Technology, Gauhati University, Assam, India"
    ],
    "DiscHierarchy": [
        "1.4",
        "Humanities",
        "Linguistics"
    ],
    "Discipline": "Linguistics",
    "Format": [
        "downloadable_files_count: 0"
    ],
    "Language": [
        "Assamese"
    ],
    "MetaDataAccess": "https://clarin-pl.eu/oai/request?verb=GetRecord&metadataPrefix=oai_dc&identifier=oai:clarin-pl.eu:11321/613",
    "MetadataAccess": [
        "oai:clarin-pl.eu:11321/613"
    ],
    "PID": "http://hdl.handle.net/11321/613",
    "PublicationTimestamp": "2019-01-08T11:59:59Z",
    "PublicationYear": [
        "2019"
    ],
    "Publisher": [
        "Department of Information Technology, Gauhati University, Assam, India"
    ],
    "ResourceType": [
        "lexicalConceptualResource"
    ],
    "author": [
        "Sarma, Prof. Shikhar Kr."
    ],
    "fulltext": "oai:clarin-pl.eu:11321/613;2019-01-08T10:42:09Z;hdl_11321_3;hdl_11321_610;Assamese spell variation list;Sarma, Prof. Shikhar Kr.;Assamese NLP;Assamese spell variations;Gauhati University;A spelling variant of a word occurs when a word may not have only a single correct spelling. There are many different ways in which it can be spelled in linguistics. A spell variation list comprising 5000 words, mainly named entities was compiled for Assamese language.\r\n\r\n---\r\n\r\n1. These Assamese NLP resources including the Tools and Applications are developed\r\nduring Research and Development Projects as well as Masters and Ph.D. thesis\r\nworks.\r\n2. These are mainly developed or generated at Gauhati University Department of\r\nComputer Science and Department of Information Technology.\r\n3. These resources are used by students and researchers for further studies, researches, as\r\nwell as for design and development of tools and applications.\r\n4. Computational Linguistics in Assamese is not rich, and Natural Language Processing\r\nworks have mainly started during last two decades, and most of the resources are first\r\ngeneration resources, and with ample scope for upgrading, enriching, and purifying.\r\n5. These are very good and essential resources for all the researchers in Assamese NLP, as\r\nthe language requires more and more NLP works to make Assamese a rich media for\r\nthe digital world.\r\n6. Anyone interested, or in need of such resources may express their interest for the\r\nrequired resources, and the way of availability will be advised/informed accordingly.\r\n7. These are purely research materials and could only be used for further research only.\r\n8. Researchers may visit the NLP Lab of Department of Information Technology, Gauhati\r\nUniversity, Guwahati, India or contact us.\r\n9. Researchers interested in collaborative works, and also students for project works, are\r\nwelcome.\r\n10. Contact person is Professor Shikhar Kr. Sarma, Department of Information\r\nTechnology, Gauhati University, Guwahati 781014, Assam, India. Email-\r\nsks@gauhati.ac.in;2019-01-08;lexicalConceptualResource;http://hdl.handle.net/11321/613;asm;downloadable_files_count: 0;Department of Information Technology, Gauhati University, Assam, India",
    "group": "clarin",
    "groups": [
        {
            "name": "clarin"
        }
    ],
    "name": "842231af-0eb2-57c6-b20d-07e9e280a9f4",
    "notes": [
        "A spelling variant of a word occurs when a word may not have only a single correct spelling. There are many different ways in which it can be spelled in linguistics. A spell variation list comprising 5000 words, mainly named entities was compiled for Assamese language.\r\n\r\n---\r\n\r\n1. These Assamese NLP resources including the Tools and Applications are developed\r\nduring Research and Development Projects as well as Masters and Ph.D. thesis\r\nworks.\r\n2. These are mainly developed or generated at Gauhati University Department of\r\nComputer Science and Department of Information Technology.\r\n3. These resources are used by students and researchers for further studies, researches, as\r\nwell as for design and development of tools and applications.\r\n4. Computational Linguistics in Assamese is not rich, and Natural Language Processing\r\nworks have mainly started during last two decades, and most of the resources are first\r\ngeneration resources, and with ample scope for upgrading, enriching, and purifying.\r\n5. These are very good and essential resources for all the researchers in Assamese NLP, as\r\nthe language requires more and more NLP works to make Assamese a rich media for\r\nthe digital world.\r\n6. Anyone interested, or in need of such resources may express their interest for the\r\nrequired resources, and the way of availability will be advised/informed accordingly.\r\n7. These are purely research materials and could only be used for further research only.\r\n8. Researchers may visit the NLP Lab of Department of Information Technology, Gauhati\r\nUniversity, Guwahati, India or contact us.\r\n9. Researchers interested in collaborative works, and also students for project works, are\r\nwelcome.\r\n10. Contact person is Professor Shikhar Kr. Sarma, Department of Information\r\nTechnology, Gauhati University, Guwahati 781014, Assam, India. Email-\r\nsks@gauhati.ac.in"
    ],
    "oai_identifier": [
        "oai:clarin-pl.eu:11321/613"
    ],
    "oai_set": [
        "hdl_11321_3",
        "hdl_11321_610"
    ],
    "state": "active",
    "tags": [
        {
            "name": "Assamese NLP"
        },
        {
            "name": "Assamese spell variations"
        },
        {
            "name": "Gauhati University"
        }
    ],
    "title": [
        "Assamese spell variation list"
    ],
    "url": ""
}