{
    "Contact": [
        "Faculty of Electrical Engineering and Computing, University of Zagreb"
    ],
    "DiscHierarchy": [
        "1.4",
        "Humanities",
        "Linguistics"
    ],
    "Discipline": "Linguistics",
    "Format": [
        "application/zip",
        "downloadable_files_count: 1",
        "text/plain; charset=utf-8"
    ],
    "Language": [
        "Croatian"
    ],
    "MetaDataAccess": "https://clarin-pl.eu/oai/request?verb=GetRecord&metadataPrefix=oai_dc&identifier=oai:www.clarin.si:11356/1218",
    "MetadataAccess": [
        "oai:www.clarin.si:11356/1218"
    ],
    "PID": "http://hdl.handle.net/11356/1218",
    "PublicationTimestamp": "2018-12-14T11:59:59Z",
    "PublicationYear": [
        "2018"
    ],
    "Publisher": [
        "Faculty of Electrical Engineering and Computing, University of Zagreb"
    ],
    "ResourceType": [
        "lexicalConceptualResource"
    ],
    "Rights": [
        "Creative Commons - Attribution-ShareAlike 4.0 International (CC BY-SA 4.0)",
        "https://creativecommons.org/licenses/by-sa/4.0/",
        "PUB"
    ],
    "author": [
        "Alagi\u0107, Domagoj",
        "\u0160najder, Jan"
    ],
    "fulltext": "oai:www.clarin.si:11356/1218;2019-03-01T11:31:19Z;hdl_11356_1023;hdl_11356_1024;Croatian SenseGraph 1.0;\u0160najder, Jan;Alagi\u0107, Domagoj;lexical database;semantic lexicon;lexical substitutes;SenseGraph a graph-like structure of word senses of most common words of the standard Croatian language, obtained by relying on human-provided lexical substitutes for target words in context. SenseGraph is encoded in the Lexical Markup Framework (LMF; ISO 24613:2008) format.\r\n\r\nSenseGraphs consists of SenseCells, which are clusters of same-sense words obtained by grouping of words based on the similarity of their lexical substitution sets and the contexts they appear in. SenseCells can be thought of as Synsets in standard computational lexicographic terminology, albeit they exhibit more variability, which can be attributed to sense modulations in specific contexts. SenseCells are linked to each other based on loose semantic relatedness.\r\n\r\nIn total, the resource covers 649 Croatian words across three different part-of-speech tags: nouns, verbs, and adjectives. More specifically, the resource contains 4,172 sentences across 230 nouns, 3,288 sentences across 200 verbs, and 4,116 sentences across 219 adjectives.  Those sentences were then clustered using a lexical-substitution-based clustering method, yielding 2,877 synsets. The sentences were sampled from the SETimes.HR and hrWaC corpora.\r\n\r\nTotal number of sentences: 11,576\r\nTotal number of syncells: 2,877\r\nTotal number of words: 649;2018-12-14;lexicalConceptualResource;http://hdl.handle.net/11356/1218;hrv;Creative Commons - Attribution-ShareAlike 4.0 International (CC BY-SA 4.0);https://creativecommons.org/licenses/by-sa/4.0/;PUB;application/zip;text/plain; charset=utf-8;downloadable_files_count: 1;Faculty of Electrical Engineering and Computing, University of Zagreb;http://sensehive.org/",
    "group": "clarin",
    "groups": [
        {
            "name": "clarin"
        }
    ],
    "name": "85d2e6f6-330d-57d4-a13f-a46a1c8f519c",
    "notes": [
        "SenseGraph a graph-like structure of word senses of most common words of the standard Croatian language, obtained by relying on human-provided lexical substitutes for target words in context. SenseGraph is encoded in the Lexical Markup Framework (LMF; ISO 24613:2008) format.\r\n\r\nSenseGraphs consists of SenseCells, which are clusters of same-sense words obtained by grouping of words based on the similarity of their lexical substitution sets and the contexts they appear in. SenseCells can be thought of as Synsets in standard computational lexicographic terminology, albeit they exhibit more variability, which can be attributed to sense modulations in specific contexts. SenseCells are linked to each other based on loose semantic relatedness.\r\n\r\nIn total, the resource covers 649 Croatian words across three different part-of-speech tags: nouns, verbs, and adjectives. More specifically, the resource contains 4,172 sentences across 230 nouns, 3,288 sentences across 200 verbs, and 4,116 sentences across 219 adjectives.  Those sentences were then clustered using a lexical-substitution-based clustering method, yielding 2,877 synsets. The sentences were sampled from the SETimes.HR and hrWaC corpora.\r\n\r\nTotal number of sentences: 11,576\r\nTotal number of syncells: 2,877\r\nTotal number of words: 649"
    ],
    "oai_identifier": [
        "oai:www.clarin.si:11356/1218"
    ],
    "oai_set": [
        "hdl_11356_1023",
        "hdl_11356_1024"
    ],
    "state": "active",
    "tags": [
        {
            "name": "lexical database"
        },
        {
            "name": "semantic lexicon"
        },
        {
            "name": "lexical substitutes"
        }
    ],
    "title": [
        "Croatian SenseGraph 1.0"
    ],
    "url": ""
}