{
    "Contact": [
        "Centre for Language Resources and Technologies, University of Ljubljana"
    ],
    "DiscHierarchy": [
        "1.4",
        "Humanities",
        "Linguistics"
    ],
    "Discipline": "Linguistics",
    "Format": [
        "text/plain; charset=utf-8",
        "downloadable_files_count: 1",
        "application/zip"
    ],
    "Language": [
        "Slovenian"
    ],
    "MetaDataAccess": "https://clarin-pl.eu/oai/request?verb=GetRecord&metadataPrefix=oai_dc&identifier=oai:www.clarin.si:11356/1030",
    "MetadataAccess": [
        "oai:www.clarin.si:11356/1030"
    ],
    "PID": "http://hdl.handle.net/11356/1030",
    "PublicationTimestamp": "2013-09-30T11:59:59Z",
    "PublicationYear": [
        "2013"
    ],
    "Publisher": [
        "Centre for Language Resources and Technologies, University of Ljubljana"
    ],
    "ResourceType": [
        "lexicalConceptualResource"
    ],
    "Rights": [
        "Creative Commons - Attribution-NonCommercial-ShareAlike 4.0 International (CC BY-NC-SA 4.0)",
        "https://creativecommons.org/licenses/by-nc-sa/4.0/",
        "PUB"
    ],
    "author": [
        "Krek, Simon",
        "Zaran\u0161ek, Petra",
        "Drstven\u0161ek, Nina",
        "Yero\u0161ina, Olga",
        "\u0160orli, Mojca",
        "Kosem, Iztok",
        "Grabnar, Katja",
        "Kocjan\u010di\u010d, Polonca",
        "Gantar, Polona"
    ],
    "fulltext": "oai:www.clarin.si:11356/1030;2017-09-29T13:48:01Z;hdl_11356_1023;hdl_11356_1024;Slovene lexical database 1.0;Gantar, Polona;Krek, Simon;Kosem, Iztok;\u0160orli, Mojca;Kocjan\u010di\u010d, Polonca;Grabnar, Katja;Yero\u0161ina, Olga;Zaran\u0161ek, Petra;Drstven\u0161ek, Nina;lexical database;semantic description;syntactic description;collocations;Slovene Lexical Database was created between 2008 and 2012 and represents a comprehensive syntactic and semantic description of a selected set of Slovene words. The description was based exclusively on the analysis of reference corpora of Slovene.\r\nThe database is structured as a network of interrelated semantic and syntactic information about a particular word. Semantic level represents the top level in the hierarchy with the lexical unit as its core element. This includes all senses of the headwrd, multi-word expressions and phraseological units. Each sense is described with a short semantic indicator and/or whole-sentence definition which includes typical syntactic environment of the headword with the relevant number, form and semantic types in a valency frame (semantic frame). These are also reflected in a number of syntactic structures and corresponding collocations. All the higher types of information are confirmed by a selection of corpus examples. Multi-word expressions and phraseological units are treated independently from particular senses of the headword and have their own internal structure which requires the same types of information as single-word entries or senses.;2013-09-30;lexicalConceptualResource;http://hdl.handle.net/11356/1030;slv;Creative Commons - Attribution-NonCommercial-ShareAlike 4.0 International (CC BY-NC-SA 4.0);https://creativecommons.org/licenses/by-nc-sa/4.0/;PUB;text/plain; charset=utf-8;application/zip;downloadable_files_count: 1;Centre for Language Resources and Technologies, University of Ljubljana;http://eng.slovenscina.eu/spletni-slovar/leksikalna-baza",
    "group": "clarin",
    "groups": [
        {
            "name": "clarin"
        }
    ],
    "name": "86b76e02-89e7-5be8-baaa-2d5b4f2b9997",
    "notes": [
        "Slovene Lexical Database was created between 2008 and 2012 and represents a comprehensive syntactic and semantic description of a selected set of Slovene words. The description was based exclusively on the analysis of reference corpora of Slovene.\r\nThe database is structured as a network of interrelated semantic and syntactic information about a particular word. Semantic level represents the top level in the hierarchy with the lexical unit as its core element. This includes all senses of the headwrd, multi-word expressions and phraseological units. Each sense is described with a short semantic indicator and/or whole-sentence definition which includes typical syntactic environment of the headword with the relevant number, form and semantic types in a valency frame (semantic frame). These are also reflected in a number of syntactic structures and corresponding collocations. All the higher types of information are confirmed by a selection of corpus examples. Multi-word expressions and phraseological units are treated independently from particular senses of the headword and have their own internal structure which requires the same types of information as single-word entries or senses."
    ],
    "oai_identifier": [
        "oai:www.clarin.si:11356/1030"
    ],
    "oai_set": [
        "hdl_11356_1023",
        "hdl_11356_1024"
    ],
    "state": "active",
    "tags": [
        {
            "name": "lexical database"
        },
        {
            "name": "semantic description"
        },
        {
            "name": "syntactic description"
        },
        {
            "name": "collocations"
        }
    ],
    "title": [
        "Slovene lexical database 1.0"
    ],
    "url": ""
}