{
    "Contact": [
        "Charles University, Faculty of Mathematics and Physics, Institute of Formal and Applied Linguistics (UFAL)"
    ],
    "DiscHierarchy": [
        "1.4",
        "Humanities",
        "Linguistics"
    ],
    "Discipline": "Linguistics",
    "Format": [
        "text/plain; charset=utf-8",
        "downloadable_files_count: 4",
        "application/octet-stream"
    ],
    "Language": [
        "English",
        "Czech"
    ],
    "MetaDataAccess": "https://clarin-pl.eu/oai/request?verb=GetRecord&metadataPrefix=oai_dc&identifier=oai:lindat.mff.cuni.cz:11234/1-1449",
    "MetadataAccess": [
        "oai:lindat.mff.cuni.cz:11234/1-1449"
    ],
    "PID": "http://hdl.handle.net/11234/1-1449",
    "PublicationTimestamp": "2014-09-26T11:59:59Z",
    "PublicationYear": [
        "2014"
    ],
    "Publisher": [
        "Charles University, Faculty of Mathematics and Physics, Institute of Formal and Applied Linguistics (UFAL)"
    ],
    "RelatedIdentifier": [
        "http://hdl.handle.net/11234/1-161",
        "http://hdl.handle.net/11234/1-1450"
    ],
    "ResourceType": [
        "toolService"
    ],
    "Rights": [
        "GNU General Public License, version 2",
        "http://www.gnu.org/licenses/gpl-2.0.html",
        "PUB"
    ],
    "author": [
        "Rosa, Rudolf"
    ],
    "fulltext": "oai:lindat.mff.cuni.cz:11234/1-1449;2018-07-02T22:05:51Z;hdl_11858_00-097C-0000-0001-486F-D;hdl_11858_00-097C-0000-0001-4877-A;Fairytale child (2014-09-26);Rosa, Rudolf;dialogue system;morphological generation;Treex;morphological analysis;interactive;Fairytale Child is a simple chatbot trying to simulate a curious child. It asks the user to tell a fairy tale, often interrupting to ask for details and clarifications. However, it remembers what it was told and tries to show it if possible.\r\n\r\nThe chatbot can communicate in Czech and in English. It analyzes the morphology of each sentence produced by the user with natural language processing tools, tries to identify potential questions to ask, and then asks one. A morphological generator is employed to generate correctly inflected sentences in Czech, so that the resulting sentences sound as natural as possible.\r\n\r\nPoh\u00e1dkov\u00e9 d\u00edt\u011b je jednoduch\u00fd chatbot, simuluj\u00edc\u00ed zv\u00eddav\u00e9 d\u00edt\u011b. Po\u017e\u00e1d\u00e1 u\u017eivatele, aby mu vypr\u00e1v\u011bl poh\u00e1dku, ale \u010dasto ho p\u0159eru\u0161uje, aby se zeptal na detaily a vysv\u011btlen\u00ed. Pamatuje si ale, co mu u\u017eivatel \u0159ekl, a sna\u017e\u00ed se to pokud mo\u017eno d\u00e1t najevo.\r\n\r\nChatbot um\u00ed komunikovat \u010desky a anglicky. Analyzuje tvaroslov\u00ed ka\u017ed\u00e9 u\u017eivatelovy v\u011bty pomoc\u00ed NLP n\u00e1stroj\u016f, pokus\u00ed se nal\u00e9zt chodnou ot\u00e1zku, a tu pak polo\u017e\u00ed. Aby tvo\u0159en\u00e9 \u010desk\u00e9 v\u011bty zn\u011bly co nejp\u0159irozen\u011bji, vyu\u017e\u00edv\u00e1 se pro sklo\u0148ov\u00e1n\u00ed tvaroslovn\u00fd gener\u00e1tor.;2014-09-26;toolService;http://hdl.handle.net/11234/1-1449;eng;ces;http://hdl.handle.net/11234/1-161;http://hdl.handle.net/11234/1-1450;GNU General Public License, version 2;http://www.gnu.org/licenses/gpl-2.0.html;PUB;application/octet-stream;application/octet-stream;application/octet-stream;application/octet-stream;text/plain; charset=utf-8;downloadable_files_count: 4;Charles University, Faculty of Mathematics and Physics, Institute of Formal and Applied Linguistics (UFAL);https://ufal.mff.cuni.cz/dite",
    "group": "clarin",
    "groups": [
        {
            "name": "clarin"
        }
    ],
    "name": "882eac18-e7da-5ab8-a15f-b7a120679f94",
    "notes": [
        "Fairytale Child is a simple chatbot trying to simulate a curious child. It asks the user to tell a fairy tale, often interrupting to ask for details and clarifications. However, it remembers what it was told and tries to show it if possible.\r\n\r\nThe chatbot can communicate in Czech and in English. It analyzes the morphology of each sentence produced by the user with natural language processing tools, tries to identify potential questions to ask, and then asks one. A morphological generator is employed to generate correctly inflected sentences in Czech, so that the resulting sentences sound as natural as possible.\r\n\r\nPoh\u00e1dkov\u00e9 d\u00edt\u011b je jednoduch\u00fd chatbot, simuluj\u00edc\u00ed zv\u00eddav\u00e9 d\u00edt\u011b. Po\u017e\u00e1d\u00e1 u\u017eivatele, aby mu vypr\u00e1v\u011bl poh\u00e1dku, ale \u010dasto ho p\u0159eru\u0161uje, aby se zeptal na detaily a vysv\u011btlen\u00ed. Pamatuje si ale, co mu u\u017eivatel \u0159ekl, a sna\u017e\u00ed se to pokud mo\u017eno d\u00e1t najevo.\r\n\r\nChatbot um\u00ed komunikovat \u010desky a anglicky. Analyzuje tvaroslov\u00ed ka\u017ed\u00e9 u\u017eivatelovy v\u011bty pomoc\u00ed NLP n\u00e1stroj\u016f, pokus\u00ed se nal\u00e9zt chodnou ot\u00e1zku, a tu pak polo\u017e\u00ed. Aby tvo\u0159en\u00e9 \u010desk\u00e9 v\u011bty zn\u011bly co nejp\u0159irozen\u011bji, vyu\u017e\u00edv\u00e1 se pro sklo\u0148ov\u00e1n\u00ed tvaroslovn\u00fd gener\u00e1tor."
    ],
    "oai_identifier": [
        "oai:lindat.mff.cuni.cz:11234/1-1449"
    ],
    "oai_set": [
        "hdl_11858_00-097C-0000-0001-486F-D",
        "hdl_11858_00-097C-0000-0001-4877-A"
    ],
    "state": "active",
    "tags": [
        {
            "name": "dialogue system"
        },
        {
            "name": "morphological generation"
        },
        {
            "name": "Treex"
        },
        {
            "name": "morphological analysis"
        },
        {
            "name": "interactive"
        }
    ],
    "title": [
        "Fairytale child (2014-09-26)"
    ],
    "url": ""
}