{
    "Contact": [
        "Trojina, Institute for Applied Slovene Studies"
    ],
    "DiscHierarchy": [
        "1.4",
        "Humanities",
        "Linguistics"
    ],
    "Discipline": "Linguistics",
    "Format": [
        "text/plain; charset=utf-8",
        "downloadable_files_count: 1",
        "application/zip"
    ],
    "Language": [
        "Slovenian"
    ],
    "MetaDataAccess": "https://clarin-pl.eu/oai/request?verb=GetRecord&metadataPrefix=oai_dc&identifier=oai:www.clarin.si:11356/1150",
    "MetadataAccess": [
        "oai:www.clarin.si:11356/1150"
    ],
    "PID": "http://hdl.handle.net/11356/1150",
    "PublicationTimestamp": "2018-07-29T11:59:59Z",
    "PublicationYear": [
        "2018"
    ],
    "Publisher": [
        "Trojina, Institute for Applied Slovene Studies"
    ],
    "ResourceType": [
        "corpus"
    ],
    "Rights": [
        "Creative Commons - Attribution-NonCommercial-ShareAlike 4.0 International (CC BY-NC-SA 4.0)",
        "https://creativecommons.org/licenses/by-nc-sa/4.0/",
        "PUB"
    ],
    "author": [
        "Krek, Simon",
        "Laskowski, Cyprian",
        "Kosem, Iztok",
        "Stritar Ku\u010duk, Mojca",
        "Rozman, Tadeja",
        "Arhar Holdt, \u0160pela",
        "Klemenc, Bojan",
        "Stabej, Marko",
        "Krap\u0161 Vodopivec, Irena"
    ],
    "fulltext": "oai:www.clarin.si:11356/1150;2018-11-21T16:52:08Z;hdl_11356_1023;hdl_11356_1024;Developmental corpus of Slovene (without language corrections) \u0160olar-Clear;Rozman, Tadeja;Stritar Ku\u010duk, Mojca;Kosem, Iztok;Krek, Simon;Krap\u0161 Vodopivec, Irena;Arhar Holdt, \u0160pela;Stabej, Marko;Laskowski, Cyprian;Klemenc, Bojan;student writing;developmental corpus;\u0160olar-Clear is an adapted version of the \u0160olar 1.0 corpus, cf. http://hdl.handle.net/11356/1036. \r\n\r\nThe \u0160olar(-Clear) corpus consists of texts written by students in Slovene primary and secondary schools. School essays form the majority of the corpus (64.2%) while other material includes texts created during lessons, such as text recapitulations or descriptions, examples of formal applications etc.\r\n\r\nUnlike the original \u0160olar corpus, \u0160olar-Clear only includes student texts while language corrections and other types of feedback from the teachers are not included. The corpus can thus be used for processing tasks where the inclusion of corrections hinders or complicates the procedures (e.g. for comparative data extraction, training of language models etc).;2018-07-29;corpus;http://hdl.handle.net/11356/1150;slv;Creative Commons - Attribution-NonCommercial-ShareAlike 4.0 International (CC BY-NC-SA 4.0);https://creativecommons.org/licenses/by-nc-sa/4.0/;PUB;text/plain; charset=utf-8;application/zip;downloadable_files_count: 1;Trojina, Institute for Applied Slovene Studies;http://www.slovenscina.eu/korpusi/solar",
    "group": "clarin",
    "groups": [
        {
            "name": "clarin"
        }
    ],
    "name": "88d21685-ec64-57ce-b00c-4869e5d5e065",
    "notes": [
        "\u0160olar-Clear is an adapted version of the \u0160olar 1.0 corpus, cf. http://hdl.handle.net/11356/1036. \r\n\r\nThe \u0160olar(-Clear) corpus consists of texts written by students in Slovene primary and secondary schools. School essays form the majority of the corpus (64.2%) while other material includes texts created during lessons, such as text recapitulations or descriptions, examples of formal applications etc.\r\n\r\nUnlike the original \u0160olar corpus, \u0160olar-Clear only includes student texts while language corrections and other types of feedback from the teachers are not included. The corpus can thus be used for processing tasks where the inclusion of corrections hinders or complicates the procedures (e.g. for comparative data extraction, training of language models etc)."
    ],
    "oai_identifier": [
        "oai:www.clarin.si:11356/1150"
    ],
    "oai_set": [
        "hdl_11356_1023",
        "hdl_11356_1024"
    ],
    "state": "active",
    "tags": [
        {
            "name": "student writing"
        },
        {
            "name": "developmental corpus"
        }
    ],
    "title": [
        "Developmental corpus of Slovene (without language corrections) \u0160olar-Clear"
    ],
    "url": ""
}