{
    "Contact": [
        "Charles University, Faculty of Mathematics and Physics, Institute of Formal and Applied Linguistics (UFAL)"
    ],
    "DiscHierarchy": [
        "1.4",
        "Humanities",
        "Linguistics"
    ],
    "Discipline": "Linguistics",
    "Format": [
        "application/x-tar",
        "text/plain; charset=utf-8",
        "application/x-xz",
        "downloadable_files_count: 4"
    ],
    "Language": [
        "Multiple languages"
    ],
    "MetaDataAccess": "https://clarin-pl.eu/oai/request?verb=GetRecord&metadataPrefix=oai_dc&identifier=oai:lindat.mff.cuni.cz:11234/1-1990",
    "MetadataAccess": [
        "oai:lindat.mff.cuni.cz:11234/1-1990"
    ],
    "PID": "http://hdl.handle.net/11234/1-1990",
    "PublicationTimestamp": "2017-03-15T11:59:59Z",
    "PublicationYear": [
        "2017"
    ],
    "Publisher": [
        "Charles University, Faculty of Mathematics and Physics, Institute of Formal and Applied Linguistics (UFAL)"
    ],
    "ResourceType": [
        "languageDescription"
    ],
    "Rights": [
        "Licence Universal Dependencies v2.0",
        "https://lindat.mff.cuni.cz/repository/xmlui/page/licence-UD-2.0",
        "PUB"
    ],
    "author": [
        "Straka, Milan"
    ],
    "fulltext": "oai:lindat.mff.cuni.cz:11234/1-1990;2018-07-02T22:05:54Z;hdl_11858_00-097C-0000-0001-486F-D;hdl_11858_00-097C-0000-0001-4877-A;CoNLL 2017 Shared Task - UDPipe Baseline Models and Supplementary Materials;Straka, Milan;CoNLL 2017;tokenizer;POS tagger;lemmatization;tagger;parser;dependency parser;morphology;treebank;Baseline UDPipe models for CoNLL 2017 Shared Task in UD Parsing, and supplementary material.\r\n\r\nThe models require UDPipe version at least 1.1 and are evaluated using the official evaluation script.\r\n\r\nThe models are trained on a slightly different split of the official UD 2.0 CoNLL 2017 training data, so called baselinemodel split, in order to allow comparison of models even during the shared task. This baselinemodel split of UD 2.0 CoNLL 2017 training data is available for download.\r\n\r\nFurthermore, we also provide UD 2.0 CoNLL 2017 training data with automatically predicted morphology. We utilize the baseline models on development data and perform 10-fold jack-knifing (each fold is predicted with a model trained on the rest of the folds) on the training data.\r\n\r\nFinally, we supply all required data and hyperparameter values needed to replicate the baseline models.;2017-03-15;languageDescription;http://hdl.handle.net/11234/1-1990;mul;Licence Universal Dependencies v2.0;https://lindat.mff.cuni.cz/repository/xmlui/page/licence-UD-2.0;PUB;application/x-tar;application/x-xz;application/x-xz;application/x-xz;text/plain; charset=utf-8;downloadable_files_count: 4;Charles University, Faculty of Mathematics and Physics, Institute of Formal and Applied Linguistics (UFAL);http://ufal.mff.cuni.cz/udpipe",
    "group": "clarin",
    "groups": [
        {
            "name": "clarin"
        }
    ],
    "name": "8b87dade-02dd-5e59-9892-d1de552e7ac8",
    "notes": [
        "Baseline UDPipe models for CoNLL 2017 Shared Task in UD Parsing, and supplementary material.\r\n\r\nThe models require UDPipe version at least 1.1 and are evaluated using the official evaluation script.\r\n\r\nThe models are trained on a slightly different split of the official UD 2.0 CoNLL 2017 training data, so called baselinemodel split, in order to allow comparison of models even during the shared task. This baselinemodel split of UD 2.0 CoNLL 2017 training data is available for download.\r\n\r\nFurthermore, we also provide UD 2.0 CoNLL 2017 training data with automatically predicted morphology. We utilize the baseline models on development data and perform 10-fold jack-knifing (each fold is predicted with a model trained on the rest of the folds) on the training data.\r\n\r\nFinally, we supply all required data and hyperparameter values needed to replicate the baseline models."
    ],
    "oai_identifier": [
        "oai:lindat.mff.cuni.cz:11234/1-1990"
    ],
    "oai_set": [
        "hdl_11858_00-097C-0000-0001-486F-D",
        "hdl_11858_00-097C-0000-0001-4877-A"
    ],
    "state": "active",
    "tags": [
        {
            "name": "CoNLL"
        },
        {
            "name": "tokenizer"
        },
        {
            "name": "POS tagger"
        },
        {
            "name": "lemmatization"
        },
        {
            "name": "tagger"
        },
        {
            "name": "parser"
        },
        {
            "name": "dependency parser"
        },
        {
            "name": "morphology"
        },
        {
            "name": "treebank"
        }
    ],
    "title": [
        "CoNLL 2017 Shared Task - UDPipe Baseline Models and Supplementary Materials"
    ],
    "url": ""
}