{
    "Contact": [
        "Oxford Text Archive, University of Oxford"
    ],
    "Contributor": [
        "National Endowment for the Humanities",
        "di Paolo Healey, Antonette",
        "Social Sciences and Humanities Research Council of Canada"
    ],
    "DiscHierarchy": [
        "1.4",
        "Humanities",
        "Linguistics"
    ],
    "Discipline": "Linguistics",
    "Format": [
        "text/sgml",
        "(288 files : ca. 66.7 MB)"
    ],
    "Language": [
        "Old English (ca. 450-1100)",
        "Latin"
    ],
    "MetaDataAccess": "https://clarin-pl.eu/oai/request?verb=GetRecord&metadataPrefix=oai_dc&identifier=oai:ota:oucs:2488",
    "MetadataAccess": [
        "oai:ota:oucs:2488"
    ],
    "PublicationTimestamp": "1150-07-01T11:59:59Z",
    "PublicationYear": [
        "1150"
    ],
    "Publisher": [
        "Oxford Text Archive, University of Oxford"
    ],
    "ResourceType": [
        "Text",
        "Linguistic corpora"
    ],
    "Rights": [
        "Use of this resource is restricted in some manner. Usually this means that it is available for non-commercial use only with prior permission of the depositor and on condition that this header is included in its entirety with any copy distributed.",
        "http://www.ota.ox.ac.uk/documents/user_agreement.xml"
    ],
    "fulltext": "oai:ota:oucs:2488;2018-02-28T10:49:17Z;http://ota.ox.ac.uk/headers/2488.xml;Dictionary of Old English Corpus in Electronic Form (DOEC);Old English Corpus;600-1150;text_and_corpus_linguistics;English language--Old English, ca. 450-1100;English language--Old English, ca. 450-1100--Texts;Linguistic analysis (Linguistics);ang;lat;The Dictionary of Old English Corpus is a complete record of surviving Old English except for some variant manuscripts of individual texts. There are 3037 texts in the corpus, represented in two formats on the CD-ROM: Standard Generalized Markup Language (SGML) and Hyper Text Markup Language (HTML). ;Oxford Text Archive, University of Oxford;di Paolo Healey, Antonette;Social Sciences and Humanities Research Council of Canada;National Endowment for the Humanities;di Paolo Healey, Antonette;text/sgml;(288 files : ca. 66.7 MB);Text;Linguistic corpora;Use of this resource is restricted in some manner. Usually this means that it is available for non-commercial use only with prior permission of the depositor and on condition that this header is included in its entirety with any copy distributed.;http://www.ota.ox.ac.uk/documents/user_agreement.xml",
    "group": "clarin",
    "groups": [
        {
            "name": "clarin"
        }
    ],
    "name": "8f182706-134a-5cf5-a032-b6f59e6fbb0b",
    "notes": [
        "The Dictionary of Old English Corpus is a complete record of surviving Old English except for some variant manuscripts of individual texts. There are 3037 texts in the corpus, represented in two formats on the CD-ROM: Standard Generalized Markup Language (SGML) and Hyper Text Markup Language (HTML). "
    ],
    "oai_identifier": [
        "oai:ota:oucs:2488"
    ],
    "oai_set": "",
    "state": "active",
    "tags": [
        {
            "name": "text_and_corpus_linguistics"
        },
        {
            "name": "English language--Old English"
        },
        {
            "name": "ca. -"
        },
        {
            "name": "English language--Old English"
        },
        {
            "name": "ca. ---Texts"
        },
        {
            "name": "Linguistic analysis Linguistics"
        }
    ],
    "title": [
        "Dictionary of Old English Corpus in Electronic Form (DOEC)",
        "Old English Corpus"
    ],
    "url": "http://ota.ox.ac.uk/headers/2488.xml"
}