{
    "Contact": [
        "Giellatekno - Saami Language Technology"
    ],
    "DiscHierarchy": [
        "1.4",
        "Humanities",
        "Linguistics"
    ],
    "Discipline": "Linguistics",
    "Format": [
        "application/zip",
        "text/xml",
        "downloadable_files_count: 1",
        "text/plain; charset=utf-8"
    ],
    "Language": [
        "Northern Sami"
    ],
    "MetaDataAccess": "https://clarin-pl.eu/oai/request?verb=GetRecord&metadataPrefix=oai_dc&identifier=oai:repo.clarino.uib.no:11509/100",
    "MetadataAccess": [
        "oai:repo.clarino.uib.no:11509/100"
    ],
    "PID": "http://hdl.handle.net/11509/100",
    "PublicationTimestamp": "2015-10-10T11:59:59Z",
    "PublicationYear": [
        "2015"
    ],
    "Publisher": [
        "Giellatekno - Saami Language Technology"
    ],
    "ResourceType": [
        "corpus"
    ],
    "Rights": [
        "Creative Commons - Attribution 3.0 Unported (CC BY 3.0)",
        "CC",
        "http://creativecommons.org/licenses/by/3.0/"
    ],
    "author": [
        "The Divvun group at UiT The Arctic University of Norway",
        "Giellatekno - Saami Language Technology, UiT The Arctic University of Norway"
    ],
    "fulltext": "oai:repo.clarino.uib.no:11509/100;2016-09-06T12:49:24Z;hdl_11509_1;hdl_11509_2;SIKOR North Saami free corpus;Giellatekno - Saami Language Technology, UiT The Arctic University of Norway;The Divvun group at UiT The Arctic University of Norway;Monolingual Corpus;Text Corpus;North Saami;Dependency Tree Bank;The SIKOR North Saami free corpus is a monolingual text corpus of North Saami that contains administrative, law, religious, non-fiction, fiction, and science texts. It is work done by the Giellatekno and Divvun research groups, Department of Linguistics, UiT The Arctic University of Norway, as well as by members of the language community. In particular, the following colleagues have contributed to the creation of the ressource: Ciprian Gerstenberger, B\u00f8rre Gaup, Lene Antonsen, Thomas Omma, and Trond Trosterud. Linguistically, the data set (746,329 sentences; 8,936,437 tokens) features word form, lemma, morphosyntactic analysis, and dependency relations between tokens. The corpus has been automatically processed and linguistically analyzed with the Giellatekno/Divvun tools. Therefore, it may contain wrong annotations. In case you find any errors the creators would appreciate your feedback sent to giellatekno@uit.no and feedback@divvun.no.\r\nPlease note that the Giellatekno resources are dynamic in nature. To ensure that you have a completely updated version, please contact Giellatekno (see Contact Info in metadata).;2015-10-10;corpus;http://hdl.handle.net/11509/100;sme;Creative Commons - Attribution 3.0 Unported (CC BY 3.0);CC;http://creativecommons.org/licenses/by/3.0/;application/zip;text/plain; charset=utf-8;text/xml;downloadable_files_count: 1;Giellatekno - Saami Language Technology;http://giellatekno.uit.no/index.eng.html",
    "group": "clarin",
    "groups": [
        {
            "name": "clarin"
        }
    ],
    "name": "902800bb-a7d4-529a-a086-daff51bdb8c3",
    "notes": [
        "The SIKOR North Saami free corpus is a monolingual text corpus of North Saami that contains administrative, law, religious, non-fiction, fiction, and science texts. It is work done by the Giellatekno and Divvun research groups, Department of Linguistics, UiT The Arctic University of Norway, as well as by members of the language community. In particular, the following colleagues have contributed to the creation of the ressource: Ciprian Gerstenberger, B\u00f8rre Gaup, Lene Antonsen, Thomas Omma, and Trond Trosterud. Linguistically, the data set (746,329 sentences; 8,936,437 tokens) features word form, lemma, morphosyntactic analysis, and dependency relations between tokens. The corpus has been automatically processed and linguistically analyzed with the Giellatekno/Divvun tools. Therefore, it may contain wrong annotations. In case you find any errors the creators would appreciate your feedback sent to giellatekno@uit.no and feedback@divvun.no.\r\nPlease note that the Giellatekno resources are dynamic in nature. To ensure that you have a completely updated version, please contact Giellatekno (see Contact Info in metadata)."
    ],
    "oai_identifier": [
        "oai:repo.clarino.uib.no:11509/100"
    ],
    "oai_set": [
        "hdl_11509_1",
        "hdl_11509_2"
    ],
    "state": "active",
    "tags": [
        {
            "name": "Monolingual Corpus"
        },
        {
            "name": "Text Corpus"
        },
        {
            "name": "North Saami"
        },
        {
            "name": "Dependency Tree Bank"
        }
    ],
    "title": [
        "SIKOR North Saami free corpus"
    ],
    "url": ""
}