{
    "Contact": [
        "Charles University, Faculty of Mathematics and Physics, Institute of Formal and Applied Linguistics (UFAL)"
    ],
    "DiscHierarchy": [
        "1.4",
        "Humanities",
        "Linguistics"
    ],
    "Discipline": "Linguistics",
    "Format": [
        "application/zip",
        "downloadable_files_count: 1",
        "text/plain; charset=utf-8"
    ],
    "Language": [
        "No linguistic content"
    ],
    "MetaDataAccess": "https://clarin-pl.eu/oai/request?verb=GetRecord&metadataPrefix=oai_dc&identifier=oai:lindat.mff.cuni.cz:11372/LRT-2372",
    "MetadataAccess": [
        "oai:lindat.mff.cuni.cz:11372/LRT-2372"
    ],
    "PID": "http://hdl.handle.net/11372/LRT-2372",
    "PublicationTimestamp": "2017-08-25T11:59:59Z",
    "PublicationYear": [
        "2017"
    ],
    "Publisher": [
        "Charles University, Faculty of Mathematics and Physics, Institute of Formal and Applied Linguistics (UFAL)"
    ],
    "RelatedIdentifier": [
        "https://ufal.mff.cuni.cz/~hajicj/2017/docs/icdar2017_CAMERA.pdf"
    ],
    "ResourceType": [
        "corpus"
    ],
    "Rights": [
        "Creative Commons - Attribution-NonCommercial-ShareAlike 4.0 International (CC BY-NC-SA 4.0)",
        "http://creativecommons.org/licenses/by-nc-sa/4.0/",
        "PUB"
    ],
    "author": [
        "Haji\u010d jr., Jan"
    ],
    "fulltext": "oai:lindat.mff.cuni.cz:11372/LRT-2372;2018-04-03T17:20:02Z;hdl_11858_00-097C-0000-0007-710A-A;hdl_11858_00-097C-0000-0007-710B-8;MUSCIMA++;Haji\u010d jr., Jan;Optical Music Recognition;Music Notation;Graph-Based Representation;Symbol Detection;MUSCIMA++ is a dataset of handwritten music notation for musical symbol detection. It contains 91255 symbols, consisting of both notation primitives and higher-level notation objects, such as key signatures or time signatures. There are 23352 notes in the dataset, of which 21356 have a full notehead, 1648 have an empty notehead, and 348 are grace notes. For each annotated object in an image, we provide both the bounding box, and a pixel mask that defines exactly which pixels within the bounding box belong to the given object. Composite constructions, such as notes, are captured through explicitly annotated relationships of the notation primitives (noteheads, stems, beams...). This way, the annotation provides an explicit bridge between the low-level and high-level symbols described in Optical Music Recognition literature.\r\n\r\nMUSCIMA++ has annotations for 140 images from the CVC-MUSCIMA dataset [2], used for handwritten music notation writer identification and staff removal. CVC-MUSCIMA consists of 1000 binary images: 20 pages of music were each re-written by 50 musicians, binarized, and staves were removed. We had 7 different annotators marking musical symbols: each annotator marked one of each 20 CVC-MUSCIMA pages, with the writers selected so that the 140 images cover 2-3 images from each of the 50 CVC-MUSCIMA writers. This setup ensures maximal variability of handwriting, given the limitations in annotation resources.\r\n\r\nThe MUSCIMA++ dataset is intended for musical symbol detection and classification, and for music notation reconstruction. A thorough description of its design is published on arXiv [2]: https://arxiv.org/abs/1703.04824 The full definition of the ground truth is given in the form of annotator instructions.;2017-08-25;corpus;http://hdl.handle.net/11372/LRT-2372;zxx;https://ufal.mff.cuni.cz/~hajicj/2017/docs/icdar2017_CAMERA.pdf;Creative Commons - Attribution-NonCommercial-ShareAlike 4.0 International (CC BY-NC-SA 4.0);http://creativecommons.org/licenses/by-nc-sa/4.0/;PUB;application/zip;text/plain; charset=utf-8;downloadable_files_count: 1;Charles University, Faculty of Mathematics and Physics, Institute of Formal and Applied Linguistics (UFAL);https://ufal.mff.cuni.cz/muscima/",
    "group": "clarin",
    "groups": [
        {
            "name": "clarin"
        }
    ],
    "name": "906f467c-b50e-5381-af4e-32311d192323",
    "notes": [
        "MUSCIMA++ is a dataset of handwritten music notation for musical symbol detection. It contains 91255 symbols, consisting of both notation primitives and higher-level notation objects, such as key signatures or time signatures. There are 23352 notes in the dataset, of which 21356 have a full notehead, 1648 have an empty notehead, and 348 are grace notes. For each annotated object in an image, we provide both the bounding box, and a pixel mask that defines exactly which pixels within the bounding box belong to the given object. Composite constructions, such as notes, are captured through explicitly annotated relationships of the notation primitives (noteheads, stems, beams...). This way, the annotation provides an explicit bridge between the low-level and high-level symbols described in Optical Music Recognition literature.\r\n\r\nMUSCIMA++ has annotations for 140 images from the CVC-MUSCIMA dataset [2], used for handwritten music notation writer identification and staff removal. CVC-MUSCIMA consists of 1000 binary images: 20 pages of music were each re-written by 50 musicians, binarized, and staves were removed. We had 7 different annotators marking musical symbols: each annotator marked one of each 20 CVC-MUSCIMA pages, with the writers selected so that the 140 images cover 2-3 images from each of the 50 CVC-MUSCIMA writers. This setup ensures maximal variability of handwriting, given the limitations in annotation resources.\r\n\r\nThe MUSCIMA++ dataset is intended for musical symbol detection and classification, and for music notation reconstruction. A thorough description of its design is published on arXiv [2]: https://arxiv.org/abs/1703.04824 The full definition of the ground truth is given in the form of annotator instructions."
    ],
    "oai_identifier": [
        "oai:lindat.mff.cuni.cz:11372/LRT-2372"
    ],
    "oai_set": [
        "hdl_11858_00-097C-0000-0007-710A-A",
        "hdl_11858_00-097C-0000-0007-710B-8"
    ],
    "state": "active",
    "tags": [
        {
            "name": "Optical Music Recognition"
        },
        {
            "name": "Music Notation"
        },
        {
            "name": "Graph-Based Representation"
        },
        {
            "name": "Symbol Detection"
        }
    ],
    "title": [
        "MUSCIMA++"
    ],
    "url": ""
}