{
    "Contact": [
        "Giellatekno - Saami Language Technology"
    ],
    "DiscHierarchy": [
        "1.4",
        "Humanities",
        "Linguistics"
    ],
    "Discipline": "Linguistics",
    "Format": [
        "application/zip",
        "text/xml",
        "downloadable_files_count: 1",
        "text/plain; charset=utf-8"
    ],
    "Language": [
        "Southern Sami"
    ],
    "MetaDataAccess": "https://clarin-pl.eu/oai/request?verb=GetRecord&metadataPrefix=oai_dc&identifier=oai:repo.clarino.uib.no:11509/102",
    "MetadataAccess": [
        "oai:repo.clarino.uib.no:11509/102"
    ],
    "PID": "http://hdl.handle.net/11509/102",
    "PublicationTimestamp": "2015-10-10T11:59:59Z",
    "PublicationYear": [
        "2015"
    ],
    "Publisher": [
        "Giellatekno - Saami Language Technology"
    ],
    "ResourceType": [
        "corpus"
    ],
    "Rights": [
        "Creative Commons - Attribution 3.0 Unported (CC BY 3.0)",
        "CC",
        "http://creativecommons.org/licenses/by/3.0/"
    ],
    "author": [
        "The Divvun group at UiT The Arctic University of Norway",
        "Giellatekno - Saami Language Technology, UiT The Arctic University of Norway"
    ],
    "fulltext": "oai:repo.clarino.uib.no:11509/102;2016-09-06T12:34:54Z;hdl_11509_1;hdl_11509_2;SIKOR South Saami free corpus;Giellatekno - Saami Language Technology, UiT The Arctic University of Norway;The Divvun group at UiT The Arctic University of Norway;Monolingual Corpus;Text Corpus;South Saami;Dependency Tree Bank;The SIKOR South Saami free corpus is a monolingual text corpus of South Saami that contains administrative, law, religious, non-fiction, and fiction texts. It is work done by the Giellatekno and Divvun research groups, Department of Linguistics, UiT The Arctic University of Norway, as well as by members of the language community. In particular, the following colleagues have contributed to the creation of the ressource: Ciprian Gerstenberger, B\u00f8rre Gaup, Risten-Birje Steinfjell, Lene Antonsen, Trond Trosterud, and Maja Kappfjell. Linguistically, the data set (58,407 sentences; 646,273 tokens) features word form, lemma, morphosyntactic analysis, and dependency relations between tokens. The corpus has been automatically processed and linguistically analyzed with the Giellatekno/Divvun tools. Therefore, it may contain wrong annotations. In case you find any errors the creators would appreciate your feedback sent to giellatekno@uit.no and feedback@divvun.no.\r\nPlease note that the Giellatekno resources are dynamic in nature. To ensure that you have a completely updated version, please contact Giellatekno (see Contact Info in metadata).;2015-10-10;corpus;http://hdl.handle.net/11509/102;sma;Creative Commons - Attribution 3.0 Unported (CC BY 3.0);CC;http://creativecommons.org/licenses/by/3.0/;application/zip;text/plain; charset=utf-8;text/xml;downloadable_files_count: 1;Giellatekno - Saami Language Technology;http://giellatekno.uit.no/index.eng.html",
    "group": "clarin",
    "groups": [
        {
            "name": "clarin"
        }
    ],
    "name": "90b4e9ae-81a9-535c-922a-c9c54397a02a",
    "notes": [
        "The SIKOR South Saami free corpus is a monolingual text corpus of South Saami that contains administrative, law, religious, non-fiction, and fiction texts. It is work done by the Giellatekno and Divvun research groups, Department of Linguistics, UiT The Arctic University of Norway, as well as by members of the language community. In particular, the following colleagues have contributed to the creation of the ressource: Ciprian Gerstenberger, B\u00f8rre Gaup, Risten-Birje Steinfjell, Lene Antonsen, Trond Trosterud, and Maja Kappfjell. Linguistically, the data set (58,407 sentences; 646,273 tokens) features word form, lemma, morphosyntactic analysis, and dependency relations between tokens. The corpus has been automatically processed and linguistically analyzed with the Giellatekno/Divvun tools. Therefore, it may contain wrong annotations. In case you find any errors the creators would appreciate your feedback sent to giellatekno@uit.no and feedback@divvun.no.\r\nPlease note that the Giellatekno resources are dynamic in nature. To ensure that you have a completely updated version, please contact Giellatekno (see Contact Info in metadata)."
    ],
    "oai_identifier": [
        "oai:repo.clarino.uib.no:11509/102"
    ],
    "oai_set": [
        "hdl_11509_1",
        "hdl_11509_2"
    ],
    "state": "active",
    "tags": [
        {
            "name": "Monolingual Corpus"
        },
        {
            "name": "Text Corpus"
        },
        {
            "name": "South Saami"
        },
        {
            "name": "Dependency Tree Bank"
        }
    ],
    "title": [
        "SIKOR South Saami free corpus"
    ],
    "url": ""
}