{
    "Contact": [
        "Oxford Text Archive, University of Oxford"
    ],
    "Contributor": [
        "Jenkyns, Joy"
    ],
    "DiscHierarchy": [
        "1.4",
        "Humanities",
        "Linguistics"
    ],
    "Discipline": "Linguistics",
    "Format": [
        "625 files: ca. 24.4 MB"
    ],
    "Language": [
        "English",
        "Latin",
        "Old English (ca. 450-1100)"
    ],
    "MetaDataAccess": "https://clarin-pl.eu/oai/request?verb=GetRecord&metadataPrefix=oai_dc&identifier=oai:ota:oucs:2480",
    "MetadataAccess": [
        "oai:ota:oucs:2480"
    ],
    "PublicationTimestamp": "1988-07-01T11:59:59Z",
    "PublicationYear": [
        "1988"
    ],
    "Publisher": [
        "Oxford Text Archive, University of Oxford"
    ],
    "ResourceType": [
        "Text",
        "Electronic publications"
    ],
    "Rights": [
        "Use of this resource is restricted in some manner. Usually this means that it is available for non-commercial use only with prior permission of the depositor and on condition that this header is included in its entirety with any copy distributed.",
        "http://www.ota.ox.ac.uk/documents/user_agreement.xml"
    ],
    "author": [
        "Jenkyns, Joy"
    ],
    "fulltext": "oai:ota:oucs:2480;2018-02-16T10:42:05Z;http://ota.ox.ac.uk/headers/2480.xml;Anglo-Saxon Charter Boundaries material;Language of Landscape: Reading the Anglo-Saxon Countryside;Jenkyns, Joy;1988;text_and_corpus_linguistics;Great Britain--History--Anglo Saxon period, 449-1066;Boundaries;eng;lat;ang;The resource consists of files made at different times and on different machines during the time of compilation. It is useful from an historical perspective only, since the material is now being set up as the AHRB-funded 'Language of Landscape: Reading the Anglo-Saxon Countryside' project (started in October 2004), which will render all these archived materials obsolete. The materials do, however, show the development of the resource from the Oxford mainframe 2988, with Famulus and Search Text as database and concordancing programs, and Ecce, Edt and Spitbol as editors. This development is traced through the move to the Vax system and the use of Ingres, OCP, Gimms and SasGraph. ;Oxford Text Archive, University of Oxford;Jenkyns, Joy;625 files: ca. 24.4 MB;Text;Electronic publications;Use of this resource is restricted in some manner. Usually this means that it is available for non-commercial use only with prior permission of the depositor and on condition that this header is included in its entirety with any copy distributed.;http://www.ota.ox.ac.uk/documents/user_agreement.xml",
    "group": "clarin",
    "groups": [
        {
            "name": "clarin"
        }
    ],
    "name": "917fa228-bfe6-5e0b-b010-438bf1a840f8",
    "notes": [
        "The resource consists of files made at different times and on different machines during the time of compilation. It is useful from an historical perspective only, since the material is now being set up as the AHRB-funded 'Language of Landscape: Reading the Anglo-Saxon Countryside' project (started in October 2004), which will render all these archived materials obsolete. The materials do, however, show the development of the resource from the Oxford mainframe 2988, with Famulus and Search Text as database and concordancing programs, and Ecce, Edt and Spitbol as editors. This development is traced through the move to the Vax system and the use of Ingres, OCP, Gimms and SasGraph. "
    ],
    "oai_identifier": [
        "oai:ota:oucs:2480"
    ],
    "oai_set": "",
    "state": "active",
    "tags": [
        {
            "name": "text_and_corpus_linguistics"
        },
        {
            "name": "Great Britain--History--Anglo Saxon period"
        },
        {
            "name": "Boundaries"
        }
    ],
    "title": [
        "Anglo-Saxon Charter Boundaries material",
        "Language of Landscape: Reading the Anglo-Saxon Countryside"
    ],
    "url": "http://ota.ox.ac.uk/headers/2480.xml"
}