{
    "Contact": [
        "Institute of Contemporary History"
    ],
    "DiscHierarchy": [
        "1.4",
        "Humanities",
        "Linguistics"
    ],
    "Discipline": "Linguistics",
    "Format": [
        "application/zip",
        "downloadable_files_count: 3",
        "text/plain; charset=utf-8"
    ],
    "Language": [
        "Slovenian"
    ],
    "MetaDataAccess": "https://clarin-pl.eu/oai/request?verb=GetRecord&metadataPrefix=oai_dc&identifier=oai:www.clarin.si:11356/1075",
    "MetadataAccess": [
        "oai:www.clarin.si:11356/1075"
    ],
    "PID": "http://hdl.handle.net/11356/1075",
    "PublicationTimestamp": "2016-08-28T11:59:59Z",
    "PublicationYear": [
        "2016"
    ],
    "Publisher": [
        "Institute of Contemporary History"
    ],
    "RelatedIdentifier": [
        "http://hdl.handle.net/11356/1167"
    ],
    "ResourceType": [
        "corpus"
    ],
    "Rights": [
        "Creative Commons - Attribution 4.0 International (CC BY 4.0)",
        "https://creativecommons.org/licenses/by/4.0/",
        "PUB"
    ],
    "author": [
        "\u0160orn, Mojca",
        "Erjavec, Toma\u017e",
        "Pan\u010dur, Andrej"
    ],
    "fulltext": "oai:www.clarin.si:11356/1075;2017-11-24T20:43:50Z;hdl_11356_1023;hdl_11356_1024;Slovenian parliamentary corpus SlovParl 1.0;Pan\u010dur, Andrej;\u0160orn, Mojca;Erjavec, Toma\u017e;Slovenian Parliament;parliamentary debates;TEI;The SlovParl corpus contains minutes of the Chamber of Associated Labour of the Assembly of the Republic of Slovenia for the legislative period 1990-1992, i.e. it covers the period before, during, and after Slovenia became an independent country in 1991. The corpus comprises 54 sessions, 13,894 speeches and almost 2.7 million words. The corpus contains extensive meta-data about the speakers, a typology of sessions etc. and structural and editorial annotations.\r\n\r\nThis item comprises three datasets:\r\n- the corpus in TEI P5 (module Transcriptions of speech);\r\n- the corpus in TEI P5 with added automatic linguistic annotation: tokenisation, MSD tagging and lemmatisation; \r\n- the corpus in vertical format used by various concordancers, e.g. CWB and Sketch Engine; this format is simpler and smaller but does not contain all the information from the source TEI.\r\n\r\nThe SlovParl data originally come from https://github.com/SIstory/SlovParl, but have been converted to use TEI elements for speech. This version of the corpus corresponds to commit https://github.com/DARIAH-SI/CLARIN.SI/tree/5984661e7b19e054b3fb650f4d2d5d409b3d7e3d\r\n\r\nThe resource is presented in the paper:\r\nPan\u010dur, Andrej. \"Ozna\u010devanje zbirke zapisnikov sej slovenskega parlamenta s smernicami TEI.\" In the Proceedings of the Conference on Language Technologies & Digital Humanities (Toma\u017e Erjavec and Darja Fi\u0161er, eds.) 142-148. Ljubljana: Znanstvena zalo\u017eba Filozofske fakultete v Ljubljani, 2016. http://www.sdjt.si/wp/wp-content/uploads/2016/09/JTDH-2016_Pancur_Oznacevanje-zbirke-zapisnikov-sej-slovenskega-parlamenta.pdf;2016-08-28;corpus;http://hdl.handle.net/11356/1075;slv;http://hdl.handle.net/11356/1167;Creative Commons - Attribution 4.0 International (CC BY 4.0);https://creativecommons.org/licenses/by/4.0/;PUB;application/zip;application/zip;application/zip;text/plain; charset=utf-8;downloadable_files_count: 3;Institute of Contemporary History;https://github.com/DARIAH-SI/CLARIN.SI/tree/master/SlovParl",
    "group": "clarin",
    "groups": [
        {
            "name": "clarin"
        }
    ],
    "name": "9422f969-1e75-53ce-bd34-f5c9178f6256",
    "notes": [
        "The SlovParl corpus contains minutes of the Chamber of Associated Labour of the Assembly of the Republic of Slovenia for the legislative period 1990-1992, i.e. it covers the period before, during, and after Slovenia became an independent country in 1991. The corpus comprises 54 sessions, 13,894 speeches and almost 2.7 million words. The corpus contains extensive meta-data about the speakers, a typology of sessions etc. and structural and editorial annotations.\r\n\r\nThis item comprises three datasets:\r\n- the corpus in TEI P5 (module Transcriptions of speech);\r\n- the corpus in TEI P5 with added automatic linguistic annotation: tokenisation, MSD tagging and lemmatisation; \r\n- the corpus in vertical format used by various concordancers, e.g. CWB and Sketch Engine; this format is simpler and smaller but does not contain all the information from the source TEI.\r\n\r\nThe SlovParl data originally come from https://github.com/SIstory/SlovParl, but have been converted to use TEI elements for speech. This version of the corpus corresponds to commit https://github.com/DARIAH-SI/CLARIN.SI/tree/5984661e7b19e054b3fb650f4d2d5d409b3d7e3d\r\n\r\nThe resource is presented in the paper:\r\nPan\u010dur, Andrej. \"Ozna\u010devanje zbirke zapisnikov sej slovenskega parlamenta s smernicami TEI.\" In the Proceedings of the Conference on Language Technologies & Digital Humanities (Toma\u017e Erjavec and Darja Fi\u0161er, eds.) 142-148. Ljubljana: Znanstvena zalo\u017eba Filozofske fakultete v Ljubljani, 2016. http://www.sdjt.si/wp/wp-content/uploads/2016/09/JTDH-2016_Pancur_Oznacevanje-zbirke-zapisnikov-sej-slovenskega-parlamenta.pdf"
    ],
    "oai_identifier": [
        "oai:www.clarin.si:11356/1075"
    ],
    "oai_set": [
        "hdl_11356_1023",
        "hdl_11356_1024"
    ],
    "state": "active",
    "tags": [
        {
            "name": "Slovenian Parliament"
        },
        {
            "name": "parliamentary debates"
        },
        {
            "name": "TEI"
        }
    ],
    "title": [
        "Slovenian parliamentary corpus SlovParl 1.0"
    ],
    "url": ""
}