{
    "Contact": [
        "Istituto di Linguistica Computazionale \u201cA. Zampolli\u201d - Consiglio Nazionale delle Ricerche (ILC-CNR)"
    ],
    "DiscHierarchy": [
        "1.4",
        "Humanities",
        "Linguistics"
    ],
    "Discipline": "Linguistics",
    "Format": [
        "text/plain; charset=utf-8",
        "downloadable_files_count: 2",
        "application/octet-stream"
    ],
    "Language": [
        "Ancient Greek (to 1453)"
    ],
    "MetaDataAccess": "https://clarin-pl.eu/oai/request?verb=GetRecord&metadataPrefix=oai_dc&identifier=oai:dspace-clarin-it.ilc.cnr.it:20.500.11752/ILC-56",
    "MetadataAccess": [
        "oai:dspace-clarin-it.ilc.cnr.it:20.500.11752/ILC-56"
    ],
    "PID": "http://hdl.handle.net/20.500.11752/ILC-56",
    "PublicationTimestamp": "2016-05-30T11:59:59Z",
    "PublicationYear": [
        "2016"
    ],
    "Publisher": [
        "Istituto di Linguistica Computazionale \u201cA. Zampolli\u201d - Consiglio Nazionale delle Ricerche (ILC-CNR)"
    ],
    "ResourceType": [
        "lexicalConceptualResource"
    ],
    "Rights": [
        "Creative Commons - Attribution-ShareAlike 4.0 International (CC BY-SA 4.0)",
        "http://creativecommons.org/licenses/by-sa/4.0/",
        "PUB"
    ],
    "author": [
        "Diakoff, Harry",
        "Del Gratta, Riccardo",
        "Boschetti, Federico"
    ],
    "fulltext": "oai:dspace-clarin-it.ilc.cnr.it:20.500.11752/ILC-56;2018-07-23T09:13:44Z;hdl_000-c0-111_38;hdl_000-c0-111_49;Open Ancient Greek WordNet 0.5;Boschetti, Federico;Del Gratta, Riccardo;Diakoff, Harry;WordNet;Ancient Greek;Ancient Greek WordNet is a lexico-semantic resource mapped on Princeton WordNet 3.0.\r\nThe synsets provided by the current version 0.5 are filtered through Minozzi's Latin WordNet synset IDs.\r\n\r\nOpen Ancient Greek WordNet  0.5 contains \r\n7447 synsets (all of them are mapped on Minozzi\u2019s Latin WordNet);\r\n22420 lemmas (coverage based on LSJ\u2019s 120k lemmas: ~18%);\r\n76620 senses (unsupervised; estimated precision: ~56%).\r\n\r\nDISCLAIMER\r\nThis resource has been bootstrapped from Greek-English dictionaries available online (Liddell-Scott-Jones, Middle Liddell, Autenrieth) and filtered by Stefano Minozzi\u2019s Latin WordNet synset IDs (http://multiwordnet.fbk.eu).\r\nThe current version 0.5 has not yet been manually corrected; the estimated precision is low.;2016-05-30;lexicalConceptualResource;http://hdl.handle.net/20.500.11752/ILC-56;grc;Creative Commons - Attribution-ShareAlike 4.0 International (CC BY-SA 4.0);http://creativecommons.org/licenses/by-sa/4.0/;PUB;application/octet-stream;application/octet-stream;text/plain; charset=utf-8;downloadable_files_count: 2;Istituto di Linguistica Computazionale \u201cA. Zampolli\u201d - Consiglio Nazionale delle Ricerche (ILC-CNR)",
    "group": "clarin",
    "groups": [
        {
            "name": "clarin"
        }
    ],
    "name": "96ea5a05-6553-5ce0-bb70-0b7e6b91e97f",
    "notes": [
        "Ancient Greek WordNet is a lexico-semantic resource mapped on Princeton WordNet 3.0.\r\nThe synsets provided by the current version 0.5 are filtered through Minozzi's Latin WordNet synset IDs.\r\n\r\nOpen Ancient Greek WordNet  0.5 contains \r\n7447 synsets (all of them are mapped on Minozzi\u2019s Latin WordNet);\r\n22420 lemmas (coverage based on LSJ\u2019s 120k lemmas: ~18%);\r\n76620 senses (unsupervised; estimated precision: ~56%).\r\n\r\nDISCLAIMER\r\nThis resource has been bootstrapped from Greek-English dictionaries available online (Liddell-Scott-Jones, Middle Liddell, Autenrieth) and filtered by Stefano Minozzi\u2019s Latin WordNet synset IDs (http://multiwordnet.fbk.eu).\r\nThe current version 0.5 has not yet been manually corrected; the estimated precision is low."
    ],
    "oai_identifier": [
        "oai:dspace-clarin-it.ilc.cnr.it:20.500.11752/ILC-56"
    ],
    "oai_set": [
        "hdl_000-c0-111_38",
        "hdl_000-c0-111_49"
    ],
    "state": "active",
    "tags": [
        {
            "name": "WordNet"
        },
        {
            "name": "Ancient Greek"
        }
    ],
    "title": [
        "Open Ancient Greek WordNet 0.5"
    ],
    "url": ""
}