{
    "Contact": [
        "Center of Computational Linguistics, Vytautas Magnus University"
    ],
    "Contributor": [
        "Utka, dr. Andrius"
    ],
    "DiscHierarchy": [
        "1.4",
        "Humanities",
        "Linguistics"
    ],
    "Discipline": "Linguistics",
    "Format": [
        "downloadable_files_count: 0",
        "application/octet-stream"
    ],
    "Language": [
        "Lithuanian"
    ],
    "MetaDataAccess": "https://clarin-pl.eu/oai/request?verb=GetRecord&metadataPrefix=oai_dc&identifier=oai:lindat.mff.cuni.cz:11372/LRT-363",
    "MetadataAccess": [
        "oai:lindat.mff.cuni.cz:11372/LRT-363"
    ],
    "PID": "http://hdl.handle.net/11372/LRT-363",
    "PublicationTimestamp": "2014-07-30T11:59:59Z",
    "PublicationYear": [
        "2014"
    ],
    "Publisher": [
        "Center of Computational Linguistics, Vytautas Magnus University"
    ],
    "ResourceType": [
        "corpus"
    ],
    "SpatialCoverage": [
        "Lithuania"
    ],
    "TemporalCoverage": " point in time : None",
    "fulltext": "oai:lindat.mff.cuni.cz:11372/LRT-363;2016-04-06T16:39:54Z;hdl_11858_00-097C-0000-0007-710A-A;hdl_11858_00-097C-0000-0007-710B-8;Corpus of the Contemporary Lithuanian Language;Utka, dr. Andrius;140 million words; Corpus of the Contemporary Lithuanian Language which comprises 160 million words is a collection of texts designed to represent current Lithuanian. The corpus is compiled  from printed material during Lithuania's independence period (since 1990). The corpus is designed to represent as wide a range of contemporary written Lithuanian as possible. The largest part of the corpus is comprised of General Press (texts from regional and national newspapers), Popular Press, and Special Press (specialized newspapers and magazines). These texts have been intended for general readers, as well as specialists. The rest of the corpus consists of Fiction, Memoirs, other literature (scientific and popular), and various official texts. The larger part of the corpus is freely accessible for online search at http://donelaitis.vdu.lt.;2014-07-30;corpus;http://hdl.handle.net/11372/LRT-363;lit;application/octet-stream;downloadable_files_count: 0;Lithuania;Center of Computational Linguistics, Vytautas Magnus University;http://tekstynas.vdu.lt/tekstynas/",
    "group": "clarin",
    "groups": [
        {
            "name": "clarin"
        }
    ],
    "name": "9c80ab66-6e1b-5303-b3dc-c6487b854ec7",
    "notes": [
        "140 million words; Corpus of the Contemporary Lithuanian Language which comprises 160 million words is a collection of texts designed to represent current Lithuanian. The corpus is compiled  from printed material during Lithuania's independence period (since 1990). The corpus is designed to represent as wide a range of contemporary written Lithuanian as possible. The largest part of the corpus is comprised of General Press (texts from regional and national newspapers), Popular Press, and Special Press (specialized newspapers and magazines). These texts have been intended for general readers, as well as specialists. The rest of the corpus consists of Fiction, Memoirs, other literature (scientific and popular), and various official texts. The larger part of the corpus is freely accessible for online search at http://donelaitis.vdu.lt."
    ],
    "oai_identifier": [
        "oai:lindat.mff.cuni.cz:11372/LRT-363"
    ],
    "oai_set": [
        "hdl_11858_00-097C-0000-0007-710A-A",
        "hdl_11858_00-097C-0000-0007-710B-8"
    ],
    "state": "active",
    "title": [
        "Corpus of the Contemporary Lithuanian Language"
    ],
    "url": ""
}