{
    "Contact": [
        "Lehrstuhl Englische Sprach- und \u00dcbersetzungswissenschaft, Fakult\u00e4t P, Fachrichtung Sprachwissenschaft und Sprachtechnologie, Universit\u00e4t des Saarlandes, Campus A2.2, 66123 Saarbr\u00fccken, Germany"
    ],
    "Contributor": [
        "Alina Karakanta",
        "Elke Teich",
        "Mihaela Vela"
    ],
    "DiscHierarchy": [
        "1.4",
        "Humanities",
        "Linguistics"
    ],
    "Discipline": "Linguistics",
    "Format": [
        "text/plain"
    ],
    "Language": [
        "English"
    ],
    "MetaDataAccess": "https://clarin-pl.eu/oai/request?verb=GetRecord&metadataPrefix=oai_dc&identifier=oai:fedora.clarin-d.uni-saarland.de:clarind-uds:europarl-uds",
    "MetadataAccess": [
        "oai:fedora.clarin-d.uni-saarland.de:clarind-uds:europarl-uds"
    ],
    "PID": "http://hdl.handle.net/21.11119/0000-0000-D5EE-4",
    "PublicationTimestamp": "2018-07-01T11:59:59Z",
    "PublicationYear": [
        "2018"
    ],
    "Publisher": [
        "Lehrstuhl Englische Sprach- und \u00dcbersetzungswissenschaft, Fakult\u00e4t P, Fachrichtung Sprachwissenschaft und Sprachtechnologie, Universit\u00e4t des Saarlandes, Campus A2.2, 66123 Saarbr\u00fccken, Germany"
    ],
    "RelatedIdentifier": [
        "Alina Karakanta, Mihaela Vela, and Elke Teich. 2018. \u201cEuroParl-Uds: Preserving and Extending Metadata in Parliamentary Debates\u201d. Proceedings of the LREC 2018. Miyazaki, Japan."
    ],
    "ResourceType": [
        "Text collection",
        "Written Corpus",
        "Corpus of Proceedings of the European Parliament"
    ],
    "Rights": [
        "CC-BY-SA-NC-4.0"
    ],
    "SpatialCoverage": [
        "1999/2016",
        "European Union",
        "Parliamentary Debates"
    ],
    "TemporalCoverage": [
        "1999/2016",
        "European Union",
        "Parliamentary Debates"
    ],
    "author": [
        "Elke Teich, Lehrstuhl Englische Sprach- und \u00dcbersetzungswissenschaft, Fakult\u00e4t P, Fachrichtung Sprachwissenschaft und Sprachtechnologie, Universit\u00e4t des Saarlandes, Campus A2.2, 66123 Saarbr\u00fccken, Germany"
    ],
    "fulltext": "oai:fedora.clarin-d.uni-saarland.de:clarind-uds:europarl-uds;2018-07-13T09:47:07Z;EuroParl-Uds;Elke Teich, Lehrstuhl Englische Sprach- und \u00dcbersetzungswissenschaft, Fakult\u00e4t P, Fachrichtung Sprachwissenschaft und Sprachtechnologie, Universit\u00e4t des Saarlandes, Campus A2.2, 66123 Saarbr\u00fccken, Germany;Parliamentary debates;Proceedings of the European Parliament;Parallel corpus;Properties of translations;Monolingual comparable corpora;Translationese;The **EuroParl-UdS** corpus is a parallel corpus consisting of parliamentary debates of the European Parliament containing texts filtered based of native speakers. It is presently available for English, German and Spanish and the data is in plain text format. It contains texts of the European Parliament that were produced between 1999-2017. More specifically it consists of parallel (sentence-aligned) corpora for English into German and English into Spanish, where the source side contains texts only by native English speakers, and comparable monolingual corpora for English, German and Spanish, containing texts only by native speakers of each language.;Lehrstuhl Englische Sprach- und \u00dcbersetzungswissenschaft, Fakult\u00e4t P, Fachrichtung Sprachwissenschaft und Sprachtechnologie, Universit\u00e4t des Saarlandes, Campus A2.2, 66123 Saarbr\u00fccken, Germany;Alina Karakanta;Mihaela Vela;Elke Teich;2018;Text collection;Written Corpus;Corpus of Proceedings of the European Parliament;text/plain;clarind-uds:europarl-uds;hdl:21.11119/0000-0000-D5EE-4;eng;Alina Karakanta, Mihaela Vela, and Elke Teich. 2018. \u201cEuroParl-Uds: Preserving and Extending Metadata in Parliamentary Debates\u201d. Proceedings of the LREC 2018. Miyazaki, Japan.;1999/2016;European Union;Parliamentary Debates;CC-BY-SA-NC-4.0",
    "group": "clarin",
    "groups": [
        {
            "name": "clarin"
        }
    ],
    "name": "9d3d5c11-57c9-57b0-9f41-132da55f1322",
    "notes": [
        "The **EuroParl-UdS** corpus is a parallel corpus consisting of parliamentary debates of the European Parliament containing texts filtered based of native speakers. It is presently available for English, German and Spanish and the data is in plain text format. It contains texts of the European Parliament that were produced between 1999-2017. More specifically it consists of parallel (sentence-aligned) corpora for English into German and English into Spanish, where the source side contains texts only by native English speakers, and comparable monolingual corpora for English, German and Spanish, containing texts only by native speakers of each language."
    ],
    "oai_identifier": [
        "oai:fedora.clarin-d.uni-saarland.de:clarind-uds:europarl-uds"
    ],
    "oai_set": "",
    "state": "active",
    "tags": [
        {
            "name": "Parliamentary debates"
        },
        {
            "name": "Proceedings European Parliament"
        },
        {
            "name": "Parallel corpus"
        },
        {
            "name": "Properties translations"
        },
        {
            "name": "Monolingual comparable corpora"
        },
        {
            "name": "Translationese"
        }
    ],
    "title": [
        "EuroParl-Uds"
    ],
    "url": ""
}