{
    "Contact": [
        "Jo\u017eef Stefan Institute"
    ],
    "DiscHierarchy": [
        "1.4",
        "Humanities",
        "Linguistics"
    ],
    "Discipline": "Linguistics",
    "Format": [
        "text/csv",
        "text/plain; charset=utf-8",
        "downloadable_files_count: 6",
        "text/plain",
        "application/octet-stream"
    ],
    "Language": [
        "Multiple languages"
    ],
    "MetaDataAccess": "https://clarin-pl.eu/oai/request?verb=GetRecord&metadataPrefix=oai_dc&identifier=oai:www.clarin.si:11356/1071",
    "MetadataAccess": [
        "oai:www.clarin.si:11356/1071"
    ],
    "PID": "http://hdl.handle.net/11356/1071",
    "PublicationTimestamp": "2016-08-05T11:59:59Z",
    "PublicationYear": [
        "2016"
    ],
    "Publisher": [
        "Jo\u017eef Stefan Institute"
    ],
    "RelatedIdentifier": [
        "info:eu-repo/grantAgreement/EC/H2020/640772"
    ],
    "ResourceType": [
        "corpus"
    ],
    "Rights": [
        "Creative Commons - Attribution-ShareAlike 4.0 International (CC BY-SA 4.0)",
        "https://creativecommons.org/licenses/by-sa/4.0/",
        "PUB"
    ],
    "author": [
        "Cherepnalkoski, Darko",
        "Karpf, Andreas",
        "Gr\u010dar, Miha",
        "Mozeti\u010d, Igor"
    ],
    "fulltext": "oai:www.clarin.si:11356/1071;2018-05-28T11:29:05Z;hdl_11356_1023;hdl_11356_1024;Dataset of European Parliament roll-call votes and Twitter activities MEP 1.0;Cherepnalkoski, Darko;Karpf, Andreas;Mozeti\u010d, Igor;Gr\u010dar, Miha;European parliament;roll-call votes;Twitter;multilingual;The resource consists of two datasets related to Members of the 8th European Parliament (MEPs). The first one is a dataset of 2,535 roll-call votes of MEPs until 2016-03-01. The second one is a dataset of 26,133 retweets between MEPs in the period between 2014-10-01 and 2016-03-01. The data can be used to examine the patterns of covoting and retweeting of MEPs and analyze the extent to which they are similar.\r\nThe resource is presented and used in the paper:\r\n\r\nDarko Cherepnalkoski, Andreas Karpf, Igor Mozeti\u010d, Miha Gr\u010dar \"Cohesion and coalition formation in the European Parliament: Roll-call votes and Twitter activities\". PLoS ONE 11(11): e0166586, 2016. http://dx.doi.org/10.1371/journal.pone.0166586\r\n\r\nThe dataset contains 5 files, of which 3 contain metadata and 2 data.\r\nThe metadata comprises information about the Members of 8th European Parliament (MEPs) until 2016-03-01, about roll-call votes (RCV) and possible actions during a RCV. The first data file contains a matrix with the votes of all MEPs during all RCVs while the second contains the retweets between the MEPs.;2016-08-05;corpus;http://hdl.handle.net/11356/1071;mul;info:eu-repo/grantAgreement/EC/H2020/640772;Creative Commons - Attribution-ShareAlike 4.0 International (CC BY-SA 4.0);https://creativecommons.org/licenses/by-sa/4.0/;PUB;text/plain;application/octet-stream;application/octet-stream;text/csv;text/csv;text/csv;text/plain; charset=utf-8;downloadable_files_count: 6;Jo\u017eef Stefan Institute",
    "group": "clarin",
    "groups": [
        {
            "name": "clarin"
        }
    ],
    "name": "a6639d2a-ee17-5abc-ba9c-f3fdfc8029b9",
    "notes": [
        "The resource consists of two datasets related to Members of the 8th European Parliament (MEPs). The first one is a dataset of 2,535 roll-call votes of MEPs until 2016-03-01. The second one is a dataset of 26,133 retweets between MEPs in the period between 2014-10-01 and 2016-03-01. The data can be used to examine the patterns of covoting and retweeting of MEPs and analyze the extent to which they are similar.\r\nThe resource is presented and used in the paper:\r\n\r\nDarko Cherepnalkoski, Andreas Karpf, Igor Mozeti\u010d, Miha Gr\u010dar \"Cohesion and coalition formation in the European Parliament: Roll-call votes and Twitter activities\". PLoS ONE 11(11): e0166586, 2016. http://dx.doi.org/10.1371/journal.pone.0166586\r\n\r\nThe dataset contains 5 files, of which 3 contain metadata and 2 data.\r\nThe metadata comprises information about the Members of 8th European Parliament (MEPs) until 2016-03-01, about roll-call votes (RCV) and possible actions during a RCV. The first data file contains a matrix with the votes of all MEPs during all RCVs while the second contains the retweets between the MEPs."
    ],
    "oai_identifier": [
        "oai:www.clarin.si:11356/1071"
    ],
    "oai_set": [
        "hdl_11356_1023",
        "hdl_11356_1024"
    ],
    "state": "active",
    "tags": [
        {
            "name": "European parliament"
        },
        {
            "name": "roll-call votes"
        },
        {
            "name": "Twitter"
        },
        {
            "name": "multilingual"
        }
    ],
    "title": [
        "Dataset of European Parliament roll-call votes and Twitter activities MEP 1.0"
    ],
    "url": ""
}