{
    "Contact": [
        "Lehrstuhl Englische Sprach- und \u00dcbersetzungswissenschaft, Fakult\u00e4t P, Fachrichtung Sprachwissenschaft und Sprachtechnologie, Universit\u00e4t des Saarlandes, Campus A2.2, 66123 Saarbr\u00fccken, Germany"
    ],
    "Contributor": [
        "Ashraf Khamis",
        "J\u00f6rg Knappen",
        "Stefan Fischer",
        "Stefania Degaetano-Ortlieb",
        "Elke Teich",
        "Hannah Kermes"
    ],
    "DiscHierarchy": [
        "1.4",
        "Humanities",
        "Linguistics"
    ],
    "Discipline": "Linguistics",
    "Format": [
        "text/xml"
    ],
    "Language": [
        "English"
    ],
    "MetaDataAccess": "https://clarin-pl.eu/oai/request?verb=GetRecord&metadataPrefix=oai_dc&identifier=oai:fedora.clarin-d.uni-saarland.de:clarind-uds:rsc",
    "MetadataAccess": [
        "oai:fedora.clarin-d.uni-saarland.de:clarind-uds:rsc"
    ],
    "PID": "http://hdl.handle.net/11858/00-246C-0000-0023-8D26-7",
    "PublicationTimestamp": "2016-07-01T11:59:59Z",
    "PublicationYear": [
        "2016"
    ],
    "Publisher": [
        "Lehrstuhl Englische Sprach- und \u00dcbersetzungswissenschaft, Fakult\u00e4t P, Fachrichtung Sprachwissenschaft und Sprachtechnologie, Universit\u00e4t des Saarlandes, Campus A2.2, 66123 Saarbr\u00fccken, Germany"
    ],
    "RelatedIdentifier": [
        "Kermes, Hannah, Stefania Degaetano, Ashraf Khamis, J\u00f6rg Knappen, and Elke Teich. 2016. \u201cThe Royal Society Corpus: From Uncharted Data to Corpus.\u201d In Proceedings of the LREC 2016. Portoroz, Slovenia. http://www.lrec-conf.org/proceedings/lrec2016/summaries/792.html"
    ],
    "ResourceType": [
        "Collection",
        "Written Corpus",
        "Diachronic Corpus"
    ],
    "Rights": [
        "CC-BY-SA-NC-4.0"
    ],
    "SpatialCoverage": [
        "1665/1869",
        "United Kingdom"
    ],
    "TemporalCoverage": " period : ( 1665-07-01T11:59:59Z - None ) ",
    "author": [
        "Elke Teich, Lehrstuhl Englische Sprach- und \u00dcbersetzungswissenschaft, Fakult\u00e4t P, Fachrichtung Sprachwissenschaft und Sprachtechnologie, Universit\u00e4t des Saarlandes, Campus A2.2, 66123 Saarbr\u00fccken, Germany"
    ],
    "fulltext": "oai:fedora.clarin-d.uni-saarland.de:clarind-uds:rsc;2016-10-25T15:13:24Z;The Royal Society Corpus;Elke Teich, Lehrstuhl Englische Sprach- und \u00dcbersetzungswissenschaft, Fakult\u00e4t P, Fachrichtung Sprachwissenschaft und Sprachtechnologie, Universit\u00e4t des Saarlandes, Campus A2.2, 66123 Saarbr\u00fccken, Germany;Early Modern English;Late Modern English;Science;Scientific English;Language change;The Royal Society Corpus (RSC) is based on the first two centuries of the Philosophical Transactions of the Royal Society of London from its beginning in 1665 to 1869. It includes all publications of the journal written mainly in English and containing running text. The Philosophical Transactions was the first periodical of scientific writing in England.\n\nThe RSC consists of approximately 35 million token and is encoded for text type (abstracts, articles), author, year of publication. Information about decade and 50-year periods are also available allowing for a diachronic analysis of different granularity.\n\nThe corpus is tokenized and linguistically annotated for lemma and part-of-speech using TreeTagger (Schmid 1994, Schmid 1995). For spelling normalization we use a trained model of VARD (Baron and Rayson 2008). As a special feature, we encode with each unit (word token) its average surprisal, i.e. the average amount of information it encodes in number of bits, with words as units and trigram as contexts [cf. Genzel and Charniak 2002).;Lehrstuhl Englische Sprach- und \u00dcbersetzungswissenschaft, Fakult\u00e4t P, Fachrichtung Sprachwissenschaft und Sprachtechnologie, Universit\u00e4t des Saarlandes, Campus A2.2, 66123 Saarbr\u00fccken, Germany;Elke Teich;Stefania Degaetano-Ortlieb;Stefan Fischer;Hannah Kermes;Ashraf Khamis;J\u00f6rg Knappen;2016;Collection;Written Corpus;Diachronic Corpus;text/xml;clarind-uds:rsc;hdl:11858/00-246C-0000-0023-8D26-7;eng;Kermes, Hannah, Stefania Degaetano, Ashraf Khamis, J\u00f6rg Knappen, and Elke Teich. 2016. \u201cThe Royal Society Corpus: From Uncharted Data to Corpus.\u201d In Proceedings of the LREC 2016. Portoroz, Slovenia. http://www.lrec-conf.org/proceedings/lrec2016/summaries/792.html;1665/1869;United Kingdom;CC-BY-SA-NC-4.0",
    "group": "clarin",
    "groups": [
        {
            "name": "clarin"
        }
    ],
    "name": "a68e94b4-9de7-5f5c-bb98-05190e734f2f",
    "notes": [
        "The Royal Society Corpus (RSC) is based on the first two centuries of the Philosophical Transactions of the Royal Society of London from its beginning in 1665 to 1869. It includes all publications of the journal written mainly in English and containing running text. The Philosophical Transactions was the first periodical of scientific writing in England.\n\nThe RSC consists of approximately 35 million token and is encoded for text type (abstracts, articles), author, year of publication. Information about decade and 50-year periods are also available allowing for a diachronic analysis of different granularity.\n\nThe corpus is tokenized and linguistically annotated for lemma and part-of-speech using TreeTagger (Schmid 1994, Schmid 1995). For spelling normalization we use a trained model of VARD (Baron and Rayson 2008). As a special feature, we encode with each unit (word token) its average surprisal, i.e. the average amount of information it encodes in number of bits, with words as units and trigram as contexts [cf. Genzel and Charniak 2002)."
    ],
    "oai_identifier": [
        "oai:fedora.clarin-d.uni-saarland.de:clarind-uds:rsc"
    ],
    "oai_set": "",
    "state": "active",
    "tags": [
        {
            "name": "Early Modern English"
        },
        {
            "name": "Late Modern English"
        },
        {
            "name": "Science"
        },
        {
            "name": "Scientific English"
        },
        {
            "name": "Language change"
        }
    ],
    "title": [
        "The Royal Society Corpus"
    ],
    "url": ""
}