{
    "Contact": [
        "Giellatekno - Saami Language Technology"
    ],
    "DiscHierarchy": [
        "1.4",
        "Humanities",
        "Linguistics"
    ],
    "Discipline": "Linguistics",
    "Format": [
        "application/zip",
        "text/xml",
        "downloadable_files_count: 1",
        "text/plain; charset=utf-8"
    ],
    "Language": [
        "Finnish",
        "Northern Sami"
    ],
    "MetaDataAccess": "https://clarin-pl.eu/oai/request?verb=GetRecord&metadataPrefix=oai_dc&identifier=oai:repo.clarino.uib.no:11509/91",
    "MetadataAccess": [
        "oai:repo.clarino.uib.no:11509/91"
    ],
    "PID": "http://hdl.handle.net/11509/91",
    "PublicationTimestamp": "2015-07-01T11:59:59Z",
    "PublicationYear": [
        "2015"
    ],
    "Publisher": [
        "Giellatekno - Saami Language Technology"
    ],
    "ResourceType": [
        "lexicalConceptualResource"
    ],
    "Rights": [
        "Creative Commons - Attribution 3.0 Unported (CC BY 3.0)",
        "CC",
        "http://creativecommons.org/licenses/by/3.0/"
    ],
    "author": [
        "Giellatekno - Saami Language Technology, UiT The Arctic University of Norway"
    ],
    "fulltext": "oai:repo.clarino.uib.no:11509/91;2016-09-06T12:38:54Z;hdl_11509_1;hdl_11509_2;Finnish-North Saami dictionary;Giellatekno - Saami Language Technology, UiT The Arctic University of Norway;Dictionary;Machine-readable Lexicon;Bilingual Dictionary;The Finnish-North Saami dictionary is the work done by Giellatekno at UiT The Arctic University of Norway, Kotus in Helsinki, and members of the language communities. In particular, the following colleagues have contributed to the creation of the ressource: Trond Trosterud and Ciprian Gerstenberger. It contains 12594 entries in Giellatekno's dictionary xml format. In spite of the extensive quality control, it may contain entries with objectionable translations. If you find any errors or want to add more words, download the file, edit it, and send it back to giellatekno@uit.no.\r\nPlease note that the Giellatekno resources are dynamic in nature. To ensure that you have a completely updated version, please contact Giellatekno.;2015;lexicalConceptualResource;http://hdl.handle.net/11509/91;fin;sme;Creative Commons - Attribution 3.0 Unported (CC BY 3.0);CC;http://creativecommons.org/licenses/by/3.0/;application/zip;text/plain; charset=utf-8;text/xml;downloadable_files_count: 1;Giellatekno - Saami Language Technology;http://giellatekno.uit.no/index.eng.html",
    "group": "clarin",
    "groups": [
        {
            "name": "clarin"
        }
    ],
    "name": "a7f2aa47-2563-56d9-98c8-a16aa11ebb75",
    "notes": [
        "The Finnish-North Saami dictionary is the work done by Giellatekno at UiT The Arctic University of Norway, Kotus in Helsinki, and members of the language communities. In particular, the following colleagues have contributed to the creation of the ressource: Trond Trosterud and Ciprian Gerstenberger. It contains 12594 entries in Giellatekno's dictionary xml format. In spite of the extensive quality control, it may contain entries with objectionable translations. If you find any errors or want to add more words, download the file, edit it, and send it back to giellatekno@uit.no.\r\nPlease note that the Giellatekno resources are dynamic in nature. To ensure that you have a completely updated version, please contact Giellatekno."
    ],
    "oai_identifier": [
        "oai:repo.clarino.uib.no:11509/91"
    ],
    "oai_set": [
        "hdl_11509_1",
        "hdl_11509_2"
    ],
    "state": "active",
    "tags": [
        {
            "name": "Dictionary"
        },
        {
            "name": "Machine-readable Lexicon"
        },
        {
            "name": "Bilingual Dictionary"
        }
    ],
    "title": [
        "Finnish-North Saami dictionary"
    ],
    "url": ""
}