{
    "Contact": [
        "Summer Institute of Linguistics (SIL), Inc"
    ],
    "DiscHierarchy": [
        "1.4",
        "Humanities",
        "Linguistics"
    ],
    "Discipline": "Linguistics",
    "Format": [
        "downloadable_files_count: 0"
    ],
    "MetaDataAccess": "https://clarin-pl.eu/oai/request?verb=GetRecord&metadataPrefix=oai_dc&identifier=oai:lindat.mff.cuni.cz:11372/LRT-301",
    "MetadataAccess": [
        "oai:lindat.mff.cuni.cz:11372/LRT-301"
    ],
    "PID": "http://hdl.handle.net/11372/LRT-301",
    "PublicationTimestamp": "2014-07-30T11:59:59Z",
    "PublicationYear": [
        "2014"
    ],
    "Publisher": [
        "Summer Institute of Linguistics (SIL), Inc"
    ],
    "ResourceType": [
        "toolService"
    ],
    "fulltext": "oai:lindat.mff.cuni.cz:11372/LRT-301;2016-04-06T16:39:55Z;hdl_11858_00-097C-0000-0007-710A-A;hdl_11858_00-097C-0000-0007-710B-8;SIL FieldWorks;corpus management;FieldWorks consists of software tools that help you manage linguistic and cultural data. FieldWorks supports tasks ranging from the initial entry of collected data through to the preparation of data for publication:  * dictionary development  * interlinearization of texts  * cultural records, which can be categorized using the Outline of Cultural Materials  * bulk editing of many fields  * morphological analysis  * complex non-Roman scripts using Unicode and SIL-developed Graphite  * multi-user editing capability over a local area network.;2014-07-30;toolService;http://hdl.handle.net/11372/LRT-301;downloadable_files_count: 0;Summer Institute of Linguistics (SIL), Inc;http://fieldworks.sil.org/",
    "group": "clarin",
    "groups": [
        {
            "name": "clarin"
        }
    ],
    "name": "ab75df7d-ab60-5296-8794-86779434202e",
    "notes": [
        "FieldWorks consists of software tools that help you manage linguistic and cultural data. FieldWorks supports tasks ranging from the initial entry of collected data through to the preparation of data for publication:  * dictionary development  * interlinearization of texts  * cultural records, which can be categorized using the Outline of Cultural Materials  * bulk editing of many fields  * morphological analysis  * complex non-Roman scripts using Unicode and SIL-developed Graphite  * multi-user editing capability over a local area network."
    ],
    "oai_identifier": [
        "oai:lindat.mff.cuni.cz:11372/LRT-301"
    ],
    "oai_set": [
        "hdl_11858_00-097C-0000-0007-710A-A",
        "hdl_11858_00-097C-0000-0007-710B-8"
    ],
    "state": "active",
    "tags": [
        {
            "name": "corpus management"
        }
    ],
    "title": [
        "SIL FieldWorks"
    ],
    "url": ""
}