{
    "Contact": [
        "European Commission",
        "Centre for Language Technology, NorS, University of Copenhagen"
    ],
    "DiscHierarchy": [
        "1.4",
        "Humanities",
        "Linguistics"
    ],
    "Discipline": "Linguistics",
    "Format": [
        "text/plain; charset=utf-8",
        "text/xml",
        "downloadable_files_count: 10",
        "application/pdf",
        "application/zip"
    ],
    "Language": [
        "Danish",
        "English"
    ],
    "MetaDataAccess": "https://clarin-pl.eu/oai/request?verb=GetRecord&metadataPrefix=oai_dc&identifier=oai:repository.clarin.dk:20.500.12115/29",
    "MetadataAccess": [
        "oai:repository.clarin.dk:20.500.12115/29"
    ],
    "PID": "http://hdl.handle.net/20.500.12115/29",
    "PublicationTimestamp": "2011-07-01T11:59:59Z",
    "PublicationYear": [
        "2011"
    ],
    "Publisher": [
        "European Commission",
        "Centre for Language Technology, NorS, University of Copenhagen"
    ],
    "ResourceType": [
        "corpus"
    ],
    "Rights": [
        "Creative Commons - Attribution 4.0 International (CC BY 4.0)",
        "http://creativecommons.org/licenses/by/4.0/",
        "PUB"
    ],
    "author": [
        "Hansen, Dorte Haltrup",
        "Offersgaard, Lene"
    ],
    "fulltext": "oai:repository.clarin.dk:20.500.12115/29;2018-06-28T13:28:29Z;hdl_20.500.12115_1;hdl_20.500.12115_3;DK-CLARIN JRC-Acquis Parallel Corpus 1958-2003 (da-en);Hansen, Dorte Haltrup;Offersgaard, Lene;legal;EU;The DK-CLARIN JRC-Acquis Parallel Corpus (da, en) is a part of the JRC-Acquis mulilingual parallel corpus, containing documents from The Acquis Communautaire (AC) which is the total body of European Union (EU) law applicable in the the EU Member States (see: https://ec.europa.eu/jrc/en/language-technologies/jrc-acquis). The data comes with one or more Eurovoc class codes added in the metadata from the European Commission. \r\nEach language corpus (English and Danish) contains app. 20 million words.\r\n\r\nAll texts are in XML TEIP5 format (TEIP5DKCLARIN-format), with tokenisation, pos-tagging, sentence and paragraph segmentation, lemmatisation and for Danish also termhood annotation. The annotations are placed in separate text external spangroups.\r\n\r\nThe corpus was collected and processed in the work package 2.6 of the Danish CLARIN project (see http://dkclarin.ku.dk/english) by University of Copenhagen, Centre for Language Technology.\r\nThe aim of the Danish CLARIN consortium was to construct a Danish research infrastructure for the humanities integrating written, spoken, and visual records into a coherent and systematic digital repository. \r\nThe project ran from January 2008 until the end of 2010.;2011;corpus;http://hdl.handle.net/20.500.12115/29;dan;eng;Creative Commons - Attribution 4.0 International (CC BY 4.0);http://creativecommons.org/licenses/by/4.0/;PUB;text/plain; charset=utf-8;application/zip;application/zip;application/zip;application/zip;application/zip;application/zip;application/zip;application/pdf;application/pdf;text/xml;downloadable_files_count: 10;Centre for Language Technology, NorS, University of Copenhagen;European Commission",
    "group": "clarin",
    "groups": [
        {
            "name": "clarin"
        }
    ],
    "name": "ade7c2fc-bae1-5c66-9f2a-a795360d8119",
    "notes": [
        "The DK-CLARIN JRC-Acquis Parallel Corpus (da, en) is a part of the JRC-Acquis mulilingual parallel corpus, containing documents from The Acquis Communautaire (AC) which is the total body of European Union (EU) law applicable in the the EU Member States (see: https://ec.europa.eu/jrc/en/language-technologies/jrc-acquis). The data comes with one or more Eurovoc class codes added in the metadata from the European Commission. \r\nEach language corpus (English and Danish) contains app. 20 million words.\r\n\r\nAll texts are in XML TEIP5 format (TEIP5DKCLARIN-format), with tokenisation, pos-tagging, sentence and paragraph segmentation, lemmatisation and for Danish also termhood annotation. The annotations are placed in separate text external spangroups.\r\n\r\nThe corpus was collected and processed in the work package 2.6 of the Danish CLARIN project (see http://dkclarin.ku.dk/english) by University of Copenhagen, Centre for Language Technology.\r\nThe aim of the Danish CLARIN consortium was to construct a Danish research infrastructure for the humanities integrating written, spoken, and visual records into a coherent and systematic digital repository. \r\nThe project ran from January 2008 until the end of 2010."
    ],
    "oai_identifier": [
        "oai:repository.clarin.dk:20.500.12115/29"
    ],
    "oai_set": [
        "hdl_20.500.12115_1",
        "hdl_20.500.12115_3"
    ],
    "state": "active",
    "tags": [
        {
            "name": "legal"
        },
        {
            "name": "EU"
        }
    ],
    "title": [
        "DK-CLARIN JRC-Acquis Parallel Corpus 1958-2003 (da-en)"
    ],
    "url": ""
}