{
    "Contact": [
        "Charles University, Faculty of Mathematics and Physics, Institute of Formal and Applied Linguistics (UFAL)"
    ],
    "DiscHierarchy": [
        "1.4",
        "Humanities",
        "Linguistics"
    ],
    "Discipline": "Linguistics",
    "Format": [
        "text/plain; charset=utf-8",
        "application/x-gzip",
        "downloadable_files_count: 1"
    ],
    "Language": [
        "Czech",
        "English"
    ],
    "MetaDataAccess": "https://clarin-pl.eu/oai/request?verb=GetRecord&metadataPrefix=oai_dc&identifier=oai:lindat.mff.cuni.cz:11858/00-097C-0000-0023-7AEB-4",
    "MetadataAccess": [
        "oai:lindat.mff.cuni.cz:11858/00-097C-0000-0023-7AEB-4"
    ],
    "PID": "http://hdl.handle.net/11858/00-097C-0000-0023-7AEB-4",
    "PublicationTimestamp": "2014-04-05T11:59:59Z",
    "PublicationYear": [
        "2014"
    ],
    "Publisher": [
        "Charles University, Faculty of Mathematics and Physics, Institute of Formal and Applied Linguistics (UFAL)"
    ],
    "RelatedIdentifier": [
        "info:eu-repo/grantAgreement/EC/FP7/610516",
        "info:eu-repo/grantAgreement/EC/FP7/247762",
        "http://hdl.handle.net/11234/1-1480"
    ],
    "ResourceType": [
        "toolService"
    ],
    "Rights": [
        "Artistic License 2.0",
        "http://opensource.org/licenses/Artistic-2.0",
        "PUB"
    ],
    "author": [
        "Rosa, Rudolf"
    ],
    "fulltext": "oai:lindat.mff.cuni.cz:11858/00-097C-0000-0023-7AEB-4;2018-07-02T22:05:51Z;hdl_11858_00-097C-0000-0001-486F-D;hdl_11858_00-097C-0000-0001-4877-A;MSTperl parser;Rosa, Rudolf;parser;NLP;Treex;parsing;dependency;MSTperl is a Perl reimplementation of the MST parser of Ryan McDonald (http://www.seas.upenn.edu/~strctlrn/MSTParser/MSTParser.html).\r\n\r\nMST parser (Maximum Spanning Tree parser) is a state-of-the-art natural language dependency parser -- a tool that takes a sentence and returns its dependency tree.\r\n\r\nIn MSTperl, only some functionality was implemented; the limitations include the following:\r\nthe parser is a non-projective one, curently with no possibility of enforcing the requirement of projectivity of the parse trees;\r\nonly first-order features are supported, i.e. no second-order or third-order features are possible;\r\nthe implementation of MIRA is that of a single-best MIRA, with a closed-form update instead of using quadratic programming.\r\n\r\nOn the other hand, the parser supports several advanced features:\r\nparallel features, i.e. enriching the parser input with word-aligned sentence in other language;\r\nadding large-scale information, i.e. the feature set enriched with features corresponding to pointwise mutual information of word pairs in a large corpus (CzEng).\r\n\r\nThe MSTperl parser is tuned for parsing Czech. Trained models are available for Czech, English and German. We can train the parser for other languages on demand, or you can train it yourself -- the guidelines are part of the documentation.\r\n\r\nThe parser, together with detailed documentation, is avalable on CPAN (http://search.cpan.org/~rur/Treex-Parser-MSTperl/).;2014-04-05;toolService;http://hdl.handle.net/11858/00-097C-0000-0023-7AEB-4;ces;eng;info:eu-repo/grantAgreement/EC/FP7/610516;info:eu-repo/grantAgreement/EC/FP7/247762;http://hdl.handle.net/11234/1-1480;Artistic License 2.0;http://opensource.org/licenses/Artistic-2.0;PUB;application/x-gzip;text/plain; charset=utf-8;downloadable_files_count: 1;Charles University, Faculty of Mathematics and Physics, Institute of Formal and Applied Linguistics (UFAL);https://ufal.mff.cuni.cz/tools/mstperl-parser",
    "group": "clarin",
    "groups": [
        {
            "name": "clarin"
        }
    ],
    "name": "ae64bfac-e767-5752-b59e-c62236185829",
    "notes": [
        "MSTperl is a Perl reimplementation of the MST parser of Ryan McDonald (http://www.seas.upenn.edu/~strctlrn/MSTParser/MSTParser.html).\r\n\r\nMST parser (Maximum Spanning Tree parser) is a state-of-the-art natural language dependency parser -- a tool that takes a sentence and returns its dependency tree.\r\n\r\nIn MSTperl, only some functionality was implemented; the limitations include the following:\r\nthe parser is a non-projective one, curently with no possibility of enforcing the requirement of projectivity of the parse trees;\r\nonly first-order features are supported, i.e. no second-order or third-order features are possible;\r\nthe implementation of MIRA is that of a single-best MIRA, with a closed-form update instead of using quadratic programming.\r\n\r\nOn the other hand, the parser supports several advanced features:\r\nparallel features, i.e. enriching the parser input with word-aligned sentence in other language;\r\nadding large-scale information, i.e. the feature set enriched with features corresponding to pointwise mutual information of word pairs in a large corpus (CzEng).\r\n\r\nThe MSTperl parser is tuned for parsing Czech. Trained models are available for Czech, English and German. We can train the parser for other languages on demand, or you can train it yourself -- the guidelines are part of the documentation.\r\n\r\nThe parser, together with detailed documentation, is avalable on CPAN (http://search.cpan.org/~rur/Treex-Parser-MSTperl/)."
    ],
    "oai_identifier": [
        "oai:lindat.mff.cuni.cz:11858/00-097C-0000-0023-7AEB-4"
    ],
    "oai_set": [
        "hdl_11858_00-097C-0000-0001-486F-D",
        "hdl_11858_00-097C-0000-0001-4877-A"
    ],
    "state": "active",
    "tags": [
        {
            "name": "parser"
        },
        {
            "name": "NLP"
        },
        {
            "name": "Treex"
        },
        {
            "name": "parsing"
        },
        {
            "name": "dependency"
        }
    ],
    "title": [
        "MSTperl parser"
    ],
    "url": ""
}