{
    "Contributor": [
        "Manfred Pinkal",
        "Michael Roth",
        "Stefan Thater",
        "Simon Ostermann",
        "Ashutosh Modi"
    ],
    "DiscHierarchy": [
        "1.4",
        "Humanities",
        "Linguistics"
    ],
    "Discipline": "Linguistics",
    "Format": [
        "text/xml"
    ],
    "Language": [
        "English"
    ],
    "MetaDataAccess": "https://clarin-pl.eu/oai/request?verb=GetRecord&metadataPrefix=oai_dc&identifier=oai:fedora.clarin-d.uni-saarland.de:clarind-uds:mcscript",
    "MetadataAccess": [
        "oai:fedora.clarin-d.uni-saarland.de:clarind-uds:mcscript"
    ],
    "PID": "http://hdl.handle.net/21.11119/0000-0001-D3A7-4",
    "PublicationTimestamp": "2018-07-01T11:59:59Z",
    "PublicationYear": [
        "2018"
    ],
    "RelatedIdentifier": [
        "Simon Ostermann, Ashutosh Modi, Michael Roth, Stefan Thater and Manfred Pinkal (2018): \"MCScript: A Novel Dataset for Assessing Machine Comprehension Using Script Knowledge\". In Proceedings of the 11th International Conference on Language Resources and Evaluation, Miyazaki, Japan. http://www.lrec-conf.org/proceedings/lrec2018/pdf/225.pdf"
    ],
    "ResourceType": [
        "Collection",
        "Dataset",
        "Text"
    ],
    "Rights": [
        "CC-BY-SA-NC-4.0"
    ],
    "author": [
        "Simon Ostermann, Fachrichtung Sprachwissenschaft und Sprachtechnologie, Universit\u00e4t des Saarlandes, Campus C7.4, 66123 Saarbr\u00fccken"
    ],
    "fulltext": "oai:fedora.clarin-d.uni-saarland.de:clarind-uds:mcscript;2018-07-10T13:05:37Z;McScript: A Novel Dataset for Assessing Machine Comprehension Using Script Knowledge;Simon Ostermann, Fachrichtung Sprachwissenschaft und Sprachtechnologie, Universit\u00e4t des Saarlandes, Campus C7.4, 66123 Saarbr\u00fccken;Scripts;Script Knowledge;Narrative Texts;Commonsense Knowledge;Crowdsourcing;The MCScript corpus is a large dataset of narrative texts and questions about these texts, intended to be used in a machine comprehension task that requires reasoning using \ncommonsense knowledge. Our dataset complements similar datasets in that we focus on \nstories about everyday activities, such as going to the movies or working in the garden, and \nthat the questions require commonsense knowledge, or more specifically, script knowledge, \nto be answered. We show that our mode of data collection via crowdsourcing results in a \nsubstantial amount of such inference questions. The dataset forms the basis of a shared task \non commonsense and script knowledge organized at SemEval 2018 and provides \nchallenging test cases for the broader natural language understanding community.;Simon Ostermann;Ashutosh Modi;Michael Roth;Stefan Thater;Manfred Pinkal;2018;Collection;Dataset;Text;text/xml;clarind-uds:mcscript;hdl:21.11119/0000-0001-D3A7-4;eng;Simon Ostermann, Ashutosh Modi, Michael Roth, Stefan Thater and Manfred Pinkal (2018): \"MCScript: A Novel Dataset for Assessing Machine Comprehension Using Script Knowledge\". In Proceedings of the 11th International Conference on Language Resources and Evaluation, Miyazaki, Japan. http://www.lrec-conf.org/proceedings/lrec2018/pdf/225.pdf;CC-BY-SA-NC-4.0",
    "group": "clarin",
    "groups": [
        {
            "name": "clarin"
        }
    ],
    "name": "b2e37a2e-48a0-577c-9933-5c887b6d1645",
    "notes": [
        "The MCScript corpus is a large dataset of narrative texts and questions about these texts, intended to be used in a machine comprehension task that requires reasoning using \ncommonsense knowledge. Our dataset complements similar datasets in that we focus on \nstories about everyday activities, such as going to the movies or working in the garden, and \nthat the questions require commonsense knowledge, or more specifically, script knowledge, \nto be answered. We show that our mode of data collection via crowdsourcing results in a \nsubstantial amount of such inference questions. The dataset forms the basis of a shared task \non commonsense and script knowledge organized at SemEval 2018 and provides \nchallenging test cases for the broader natural language understanding community."
    ],
    "oai_identifier": [
        "oai:fedora.clarin-d.uni-saarland.de:clarind-uds:mcscript"
    ],
    "oai_set": "",
    "state": "active",
    "tags": [
        {
            "name": "Scripts"
        },
        {
            "name": "Script Knowledge"
        },
        {
            "name": "Narrative Texts"
        },
        {
            "name": "Commonsense Knowledge"
        },
        {
            "name": "Crowdsourcing"
        }
    ],
    "title": [
        "McScript: A Novel Dataset for Assessing Machine Comprehension Using Script Knowledge"
    ],
    "url": ""
}