{
    "Contact": [
        "Centre for Language Resources and Technologies, University of Ljubljana"
    ],
    "DiscHierarchy": [
        "1.4",
        "Humanities",
        "Linguistics"
    ],
    "Discipline": "Linguistics",
    "Format": [
        "application/zip",
        "downloadable_files_count: 3",
        "text/plain; charset=utf-8"
    ],
    "Language": [
        "Slovenian"
    ],
    "MetaDataAccess": "https://clarin-pl.eu/oai/request?verb=GetRecord&metadataPrefix=oai_dc&identifier=oai:www.clarin.si:11356/1035",
    "MetadataAccess": [
        "oai:www.clarin.si:11356/1035"
    ],
    "PID": "http://hdl.handle.net/11356/1035",
    "PublicationTimestamp": "2013-09-30T11:59:59Z",
    "PublicationYear": [
        "2013"
    ],
    "Publisher": [
        "Centre for Language Resources and Technologies, University of Ljubljana"
    ],
    "ResourceType": [
        "corpus"
    ],
    "Rights": [
        "Creative Commons - Attribution-NonCommercial-ShareAlike 4.0 International (CC BY-NC-SA 4.0)",
        "https://creativecommons.org/licenses/by-nc-sa/4.0/",
        "PUB"
    ],
    "author": [
        "Krek, Simon",
        "Holozan, Peter",
        "Erjavec, Toma\u017e",
        "Gr\u010dar, Miha",
        "Logar, Nata\u0161a"
    ],
    "fulltext": "oai:www.clarin.si:11356/1035;2017-09-29T13:48:01Z;hdl_11356_1023;hdl_11356_1024;Written corpus ccGigafida 1.0;Logar, Nata\u0161a;Erjavec, Toma\u017e;Krek, Simon;Gr\u010dar, Miha;Holozan, Peter;TEI;Corpus ccGigafida consists of paragraph samples from 31,722 documents, each containing information about the source (e.g. newspapers, magazines), year of publication, text type (fiction, newspaper), the title and author if they are known. The corpus is annotated with morphosyntactic descriptions (PoS-tagged) and lemmatised. It is encoded in XML TEI format (Text Encoding Initiative P5). The ccGigafida corpus contains approximately 9% of the Gigafida corpus, a reference corpus of Slovene: http://eng.slovenscina.eu/korpusi/gigafida.\r\n\r\nThe corpus is available in source TEI-like XML and in the simpler and smaller vertical format, used by various concordancers. The XML file has PoS (MSD) tags in Slovenian only, while the vertical file has tags both in Slovenian and English. The corpus is also available as plain text, on file per text.;2013-09-30;corpus;http://hdl.handle.net/11356/1035;slv;Creative Commons - Attribution-NonCommercial-ShareAlike 4.0 International (CC BY-NC-SA 4.0);https://creativecommons.org/licenses/by-nc-sa/4.0/;PUB;application/zip;application/zip;application/zip;text/plain; charset=utf-8;downloadable_files_count: 3;Centre for Language Resources and Technologies, University of Ljubljana;http://eng.slovenscina.eu/korpusi/proste-zbirke",
    "group": "clarin",
    "groups": [
        {
            "name": "clarin"
        }
    ],
    "name": "b4b9bd30-a359-56eb-a9cf-b45101dbd6ca",
    "notes": [
        "Corpus ccGigafida consists of paragraph samples from 31,722 documents, each containing information about the source (e.g. newspapers, magazines), year of publication, text type (fiction, newspaper), the title and author if they are known. The corpus is annotated with morphosyntactic descriptions (PoS-tagged) and lemmatised. It is encoded in XML TEI format (Text Encoding Initiative P5). The ccGigafida corpus contains approximately 9% of the Gigafida corpus, a reference corpus of Slovene: http://eng.slovenscina.eu/korpusi/gigafida.\r\n\r\nThe corpus is available in source TEI-like XML and in the simpler and smaller vertical format, used by various concordancers. The XML file has PoS (MSD) tags in Slovenian only, while the vertical file has tags both in Slovenian and English. The corpus is also available as plain text, on file per text."
    ],
    "oai_identifier": [
        "oai:www.clarin.si:11356/1035"
    ],
    "oai_set": [
        "hdl_11356_1023",
        "hdl_11356_1024"
    ],
    "state": "active",
    "tags": [
        {
            "name": "TEI"
        }
    ],
    "title": [
        "Written corpus ccGigafida 1.0"
    ],
    "url": ""
}