{
    "Contact": [
        "Centre for Language Resources and Technologies, University of Ljubljana"
    ],
    "DiscHierarchy": [
        "1.4",
        "Humanities",
        "Linguistics"
    ],
    "Discipline": "Linguistics",
    "Format": [
        "application/zip",
        "downloadable_files_count: 3",
        "text/plain; charset=utf-8"
    ],
    "Language": [
        "Slovenian"
    ],
    "MetaDataAccess": "https://clarin-pl.eu/oai/request?verb=GetRecord&metadataPrefix=oai_dc&identifier=oai:www.clarin.si:11356/1192",
    "MetadataAccess": [
        "oai:www.clarin.si:11356/1192"
    ],
    "PID": "http://hdl.handle.net/11356/1192",
    "PublicationTimestamp": "2018-08-01T11:59:59Z",
    "PublicationYear": [
        "2018"
    ],
    "Publisher": [
        "Centre for Language Resources and Technologies, University of Ljubljana"
    ],
    "ResourceType": [
        "lexicalConceptualResource"
    ],
    "Rights": [
        "Creative Commons - Attribution-ShareAlike 4.0 International (CC BY-SA 4.0)",
        "https://creativecommons.org/licenses/by-sa/4.0/",
        "PUB"
    ],
    "author": [
        "Dobrovoljc, Kaja"
    ],
    "fulltext": "oai:www.clarin.si:11356/1192;2018-08-01T17:32:32Z;hdl_11356_1023;hdl_11356_1024;Janes corpus n-grams 1.0;Dobrovoljc, Kaja;n-grams;wordlist;multiword expressions;A collection of n-grams extracted from the Janes corpus of Slovenian user-generated content version 1.0 (cf. http://nl.ijs.si/janes/). Three sets of n-gram lists are provided for lowercased word n-grams of length 1 to 5:\r\n- extensive frequency lists of all extracted n-grams\r\n- filtered frequency lists of n-grams with minimum frequency 10/mil.\r\n- adjusted frequency list of all n-grams with minimum frequency 10/mil.\r\n\r\nOnly n-grams within sentences have been counted, ignoring punctuation. For the filtered and adjusted list, only n-grams occurring in at least 2 different texts have been extracted.\r\n\r\nKey references:\r\n- K. Dobrovoljc, 2018. N-gram frequency lists for reference corpora of Slovenian language. Proceedings of the Language Technologies & Digital Humanities Conference 2018.\r\n- T. Erjavec, N. Ljube\u0161i\u0107, D. Fi\u0161er, 2018. Korpus slovenskih spletnih uporabni\u0161kih vsebin Janes. V: FI\u0160ER, Darja (ur.). Viri, orodja in metode za analizo spletne sloven\u0161\u010dine. Znanstvena zalo\u017eba Filozofske fakultete Univerze v Ljubljani. https://e-knjige.ff.uni-lj.si/znanstvena-zalozba/catalog/book/111\r\n- M. B. O\u2019Donnell, 2010. The adjusted frequency list: A method to produce cluster-sensitive frequency lists. ICAME Journal 35, 135\u2013169.;2018-08-01;lexicalConceptualResource;http://hdl.handle.net/11356/1192;slv;Creative Commons - Attribution-ShareAlike 4.0 International (CC BY-SA 4.0);https://creativecommons.org/licenses/by-sa/4.0/;PUB;application/zip;application/zip;application/zip;text/plain; charset=utf-8;downloadable_files_count: 3;Centre for Language Resources and Technologies, University of Ljubljana",
    "group": "clarin",
    "groups": [
        {
            "name": "clarin"
        }
    ],
    "name": "b5633112-5908-584e-9c14-941f329f0e7e",
    "notes": [
        "A collection of n-grams extracted from the Janes corpus of Slovenian user-generated content version 1.0 (cf. http://nl.ijs.si/janes/). Three sets of n-gram lists are provided for lowercased word n-grams of length 1 to 5:\r\n- extensive frequency lists of all extracted n-grams\r\n- filtered frequency lists of n-grams with minimum frequency 10/mil.\r\n- adjusted frequency list of all n-grams with minimum frequency 10/mil.\r\n\r\nOnly n-grams within sentences have been counted, ignoring punctuation. For the filtered and adjusted list, only n-grams occurring in at least 2 different texts have been extracted.\r\n\r\nKey references:\r\n- K. Dobrovoljc, 2018. N-gram frequency lists for reference corpora of Slovenian language. Proceedings of the Language Technologies & Digital Humanities Conference 2018.\r\n- T. Erjavec, N. Ljube\u0161i\u0107, D. Fi\u0161er, 2018. Korpus slovenskih spletnih uporabni\u0161kih vsebin Janes. V: FI\u0160ER, Darja (ur.). Viri, orodja in metode za analizo spletne sloven\u0161\u010dine. Znanstvena zalo\u017eba Filozofske fakultete Univerze v Ljubljani. https://e-knjige.ff.uni-lj.si/znanstvena-zalozba/catalog/book/111\r\n- M. B. O\u2019Donnell, 2010. The adjusted frequency list: A method to produce cluster-sensitive frequency lists. ICAME Journal 35, 135\u2013169."
    ],
    "oai_identifier": [
        "oai:www.clarin.si:11356/1192"
    ],
    "oai_set": [
        "hdl_11356_1023",
        "hdl_11356_1024"
    ],
    "state": "active",
    "tags": [
        {
            "name": "n-grams"
        },
        {
            "name": "wordlist"
        },
        {
            "name": "multiword expressions"
        }
    ],
    "title": [
        "Janes corpus n-grams 1.0"
    ],
    "url": ""
}