{
    "Contact": [
        "Charles University, Faculty of Mathematics and Physics, Institute of Formal and Applied Linguistics (UFAL)"
    ],
    "DiscHierarchy": [
        "1.4",
        "Humanities",
        "Linguistics"
    ],
    "Discipline": "Linguistics",
    "Format": [
        "application/zip",
        "downloadable_files_count: 2",
        "application/pdf",
        "text/plain; charset=utf-8"
    ],
    "Language": [
        "Czech"
    ],
    "MetaDataAccess": "https://clarin-pl.eu/oai/request?verb=GetRecord&metadataPrefix=oai_dc&identifier=oai:lindat.mff.cuni.cz:11234/1-1507",
    "MetadataAccess": [
        "oai:lindat.mff.cuni.cz:11234/1-1507"
    ],
    "PID": "http://hdl.handle.net/11234/1-1507",
    "PublicationTimestamp": "2015-07-16T11:59:59Z",
    "PublicationYear": [
        "2015"
    ],
    "Publisher": [
        "Charles University, Faculty of Mathematics and Physics, Institute of Formal and Applied Linguistics (UFAL)"
    ],
    "ResourceType": [
        "corpus"
    ],
    "Rights": [
        "Attribution-NonCommercial-ShareAlike 3.0 Unported (CC BY-NC-SA 3.0)",
        "http://creativecommons.org/licenses/by-nc-sa/3.0/",
        "PUB"
    ],
    "author": [
        "Fiala, Ond\u0159ej"
    ],
    "fulltext": "oai:lindat.mff.cuni.cz:11234/1-1507;2018-07-02T22:05:51Z;hdl_11858_00-097C-0000-0001-486F-D;hdl_11858_00-097C-0000-0001-4877-A;Aspect-Term Annotated Customer Reviews in Czech;Fiala, Ond\u0159ej;sentiment analysis;opinion target;customer review;This dataset contains a number of user product reviews which are publicly available on the website of an established Czech online shop with electronic devices. Each review consists of negative and positive aspects of the product. This setting pushes the customer to rate important characteristics.\r\n\r\nWe have selected 2000 positive and negative segments from these reviews and manually tagged their targets. Additionally, we selected 200 of the longest reviews and annotated them in the same way. The targets were either aspects of the evaluated product or some general attributes (e.g. price, ease of use).;2015-07-16;corpus;http://hdl.handle.net/11234/1-1507;ces;Attribution-NonCommercial-ShareAlike 3.0 Unported (CC BY-NC-SA 3.0);http://creativecommons.org/licenses/by-nc-sa/3.0/;PUB;application/pdf;application/zip;text/plain; charset=utf-8;downloadable_files_count: 2;Charles University, Faculty of Mathematics and Physics, Institute of Formal and Applied Linguistics (UFAL)",
    "group": "clarin",
    "groups": [
        {
            "name": "clarin"
        }
    ],
    "name": "b8f0b36e-c559-5aee-a4e6-12f136cf2b3d",
    "notes": [
        "This dataset contains a number of user product reviews which are publicly available on the website of an established Czech online shop with electronic devices. Each review consists of negative and positive aspects of the product. This setting pushes the customer to rate important characteristics.\r\n\r\nWe have selected 2000 positive and negative segments from these reviews and manually tagged their targets. Additionally, we selected 200 of the longest reviews and annotated them in the same way. The targets were either aspects of the evaluated product or some general attributes (e.g. price, ease of use)."
    ],
    "oai_identifier": [
        "oai:lindat.mff.cuni.cz:11234/1-1507"
    ],
    "oai_set": [
        "hdl_11858_00-097C-0000-0001-486F-D",
        "hdl_11858_00-097C-0000-0001-4877-A"
    ],
    "state": "active",
    "tags": [
        {
            "name": "sentiment analysis"
        },
        {
            "name": "opinion target"
        },
        {
            "name": "customer review"
        }
    ],
    "title": [
        "Aspect-Term Annotated Customer Reviews in Czech"
    ],
    "url": ""
}