{
    "Contact": [
        "Research Institute for Artificial Intelligence, Romanian Academy of Sciences"
    ],
    "Contributor": [
        "Tufi\u015f, Dan",
        "Ion, Radu"
    ],
    "DiscHierarchy": [
        "1.4",
        "Humanities",
        "Linguistics"
    ],
    "Discipline": "Linguistics",
    "Format": [
        "downloadable_files_count: 0"
    ],
    "Language": [
        "English",
        "Romanian"
    ],
    "MetaDataAccess": "https://clarin-pl.eu/oai/request?verb=GetRecord&metadataPrefix=oai_dc&identifier=oai:lindat.mff.cuni.cz:11372/LRT-1300",
    "MetadataAccess": [
        "oai:lindat.mff.cuni.cz:11372/LRT-1300"
    ],
    "PID": "http://hdl.handle.net/11372/LRT-1300",
    "PublicationTimestamp": "2014-07-30T11:59:59Z",
    "PublicationYear": [
        "2014"
    ],
    "Publisher": [
        "Research Institute for Artificial Intelligence, Romanian Academy of Sciences"
    ],
    "ResourceType": [
        "toolService"
    ],
    "fulltext": "oai:lindat.mff.cuni.cz:11372/LRT-1300;2016-04-06T16:39:51Z;hdl_11858_00-097C-0000-0007-710A-A;hdl_11858_00-097C-0000-0007-710B-8;YAWA - Yet Another Word Aligner;Tufi\u015f, Dan;Ion, Radu;word aligner;YAWA is a four stage lexical aligner that uses bilingual translation lexicons produced by [[http://www.clarin.eu/tools/translation-equivalents-extractor|TREQ]] and phrase boundaries detection to align words of a given bitext. Using this alignment, in stage 2 a language dependent module takes over and produces alignments of the remaining lexical tokens within aligned chunks. Stage 3 is specialized in aligning blocks of consecutive unaligned tokens and stage 4 deletes alignments that are likely to be wrong.\r\nDeveloped in PERL, YAWA is language independent, except for the modules that realise alignments specific to the pairs of aligned languages. So far, it works just for Ro-En pair of languages. It requires a parallel corpus in [[http://www.xces.org|XCES]] format, morpho-syntactically annotated and lemmatized (using [[http://www.clarin.eu/tools/ttl-tokenizing-tagging-and-lemmatizing-free-running-texts|TTL]]), and translation dictionaries produced by [[http://www.clarin.eu/tools/translation-equivalents-extractor|TREQ]].\r\nYAWA\u2019s individual F-measure is 81.22%. Currently YAWA is a part of the [[http://www.clarin.eu/tools/cowal-combined-word-aligner|COWAL]] combined lexical alignment platform.\r\nMore detailed descriptions are available in [[http://www.racai.ro/~tufis/papers|the following papers]]: \r\n  -- Radu Ion (2007). Word Sense Disambiguation Methods Applied to English and Romanian. (in Romanian). PhD thesis. Romanian Academy, Bucharest\r\n  -- Dan Tufi\u015f (2007). Exploiting Aligned Parallel Corpora in Multilingual Studies and Applications. In Toru Ishida, Susan R. Fussell, and Piek T.J.M. Vossen (eds.), Intercultural Collaboration. First International Workshop (IWIC 2007), volume 4568 of Lecture Notes in Computer Science, pp. 103-117. Springer-Verlag, August 2007. ISBN 978-3-540-73999-9. \r\n  -- Dan Tufi\u015f, Radu Ion, Alexandru Ceau\u015fu, and Dan \u015etef\u0103nescu (2006). Improved Lexical Alignment by Combining Multiple Reified Alignments. In Toru Ishida, Susan R. Fussell, and Piek T.J.M. Vossen (eds.), Proceedings of the 11th Conference EACL2006, pp. 153-160, Trento, Italy, April 2006. Association for Computational Linguistics. ISBN 1-9324-32-61-2.;2014-07-30;toolService;http://hdl.handle.net/11372/LRT-1300;eng;ron;downloadable_files_count: 0;Research Institute for Artificial Intelligence, Romanian Academy of Sciences",
    "group": "clarin",
    "groups": [
        {
            "name": "clarin"
        }
    ],
    "name": "baf670e5-281a-56be-933c-71b11006f01f",
    "notes": [
        "YAWA is a four stage lexical aligner that uses bilingual translation lexicons produced by [[http://www.clarin.eu/tools/translation-equivalents-extractor|TREQ]] and phrase boundaries detection to align words of a given bitext. Using this alignment, in stage 2 a language dependent module takes over and produces alignments of the remaining lexical tokens within aligned chunks. Stage 3 is specialized in aligning blocks of consecutive unaligned tokens and stage 4 deletes alignments that are likely to be wrong.\r\nDeveloped in PERL, YAWA is language independent, except for the modules that realise alignments specific to the pairs of aligned languages. So far, it works just for Ro-En pair of languages. It requires a parallel corpus in [[http://www.xces.org|XCES]] format, morpho-syntactically annotated and lemmatized (using [[http://www.clarin.eu/tools/ttl-tokenizing-tagging-and-lemmatizing-free-running-texts|TTL]]), and translation dictionaries produced by [[http://www.clarin.eu/tools/translation-equivalents-extractor|TREQ]].\r\nYAWA\u2019s individual F-measure is 81.22%. Currently YAWA is a part of the [[http://www.clarin.eu/tools/cowal-combined-word-aligner|COWAL]] combined lexical alignment platform.\r\nMore detailed descriptions are available in [[http://www.racai.ro/~tufis/papers|the following papers]]: \r\n  -- Radu Ion (2007). Word Sense Disambiguation Methods Applied to English and Romanian. (in Romanian). PhD thesis. Romanian Academy, Bucharest\r\n  -- Dan Tufi\u015f (2007). Exploiting Aligned Parallel Corpora in Multilingual Studies and Applications. In Toru Ishida, Susan R. Fussell, and Piek T.J.M. Vossen (eds.), Intercultural Collaboration. First International Workshop (IWIC 2007), volume 4568 of Lecture Notes in Computer Science, pp. 103-117. Springer-Verlag, August 2007. ISBN 978-3-540-73999-9. \r\n  -- Dan Tufi\u015f, Radu Ion, Alexandru Ceau\u015fu, and Dan \u015etef\u0103nescu (2006). Improved Lexical Alignment by Combining Multiple Reified Alignments. In Toru Ishida, Susan R. Fussell, and Piek T.J.M. Vossen (eds.), Proceedings of the 11th Conference EACL2006, pp. 153-160, Trento, Italy, April 2006. Association for Computational Linguistics. ISBN 1-9324-32-61-2."
    ],
    "oai_identifier": [
        "oai:lindat.mff.cuni.cz:11372/LRT-1300"
    ],
    "oai_set": [
        "hdl_11858_00-097C-0000-0007-710A-A",
        "hdl_11858_00-097C-0000-0007-710B-8"
    ],
    "state": "active",
    "tags": [
        {
            "name": "word aligner"
        }
    ],
    "title": [
        "YAWA - Yet Another Word Aligner"
    ],
    "url": ""
}