{
    "Contact": [
        "Istituto di Linguistica Computazionale \u201cA. Zampolli\u201d - Consiglio Nazionale delle Ricerche (ILC-CNR)"
    ],
    "DiscHierarchy": [
        "1.4",
        "Humanities",
        "Linguistics"
    ],
    "Discipline": "Linguistics",
    "Format": [
        "downloadable_files_count: 0"
    ],
    "MetaDataAccess": "https://clarin-pl.eu/oai/request?verb=GetRecord&metadataPrefix=oai_dc&identifier=oai:dspace-clarin-it.ilc.cnr.it:20.500.11752/ILC-91",
    "MetadataAccess": [
        "oai:dspace-clarin-it.ilc.cnr.it:20.500.11752/ILC-91"
    ],
    "PID": "http://hdl.handle.net/20.500.11752/ILC-91",
    "PublicationTimestamp": "2012-12-12T11:59:59Z",
    "PublicationYear": [
        "2012"
    ],
    "Publisher": [
        "Istituto di Linguistica Computazionale \u201cA. Zampolli\u201d - Consiglio Nazionale delle Ricerche (ILC-CNR)"
    ],
    "RelatedIdentifier": [
        "info:eu-repo/grantAgreement/EC/FP7/248064",
        "http://www.aclweb.org/anthology/C12-1140"
    ],
    "ResourceType": [
        "toolService"
    ],
    "author": [
        "Rubino, Francesco",
        "Quochi, Valeria",
        "Frontini, Francesca"
    ],
    "fulltext": "oai:dspace-clarin-it.ilc.cnr.it:20.500.11752/ILC-91;2018-12-05T08:40:42Z;hdl_000-c0-111_38;hdl_000-c0-111_49;Multiword Extractor;Rubino, Francesco;Quochi, Valeria;Frontini, Francesca;Multiword Extraction;Automatic lexical acquisition;This is a lexical acquisition web-service for the automatic extraction of multiword expressions from large corpora. The service takes in input a POS-tagged corpus in CoNLL-X format plus a pair of POS-tags for the first and last word of a MWE, and outputs a list of extracted (candidate) multiword expressions with a set of linguistic and statistical information.\r\nThe output can then be post-processed through filters that will refine and improve the accuracy of the extraction, and finally converted to an LMF-compliant XML lexical resource.\r\nThe tool code is available open-source at https://github.com/francescafrontini/MWExtractor.\r\nFurther details can be found in: \r\n    Quochi Valeria & Frontini Francesca & Rubino Francesco. 2012. A MWE Acquisition and Lexicon Builder Web Service. In Proceedings of the 24th International Conference on Computational Linguistics (COLING 2012), December 10-14 2012, IIT Bombay, Mumbai, India.\r\n    Frontini Francesca  & Rubino Francesco & Quochi Valeria. 2012. Automatic Creation of quality multi-word Lexica from noisy text data. In Proceedings of the Sixth Workshop on Analytics for Noisy Unstructured Text Data (AND2012). December 9, 2012, IIT Bombay, Mumbai, India (Co-located with COLING2012).;2012-12-12;toolService;http://hdl.handle.net/20.500.11752/ILC-91;info:eu-repo/grantAgreement/EC/FP7/248064;http://www.aclweb.org/anthology/C12-1140;downloadable_files_count: 0;Istituto di Linguistica Computazionale \u201cA. Zampolli\u201d - Consiglio Nazionale delle Ricerche (ILC-CNR);http://www.panacea-lr.eu/system/deliverables/PANACEA_D6.2.pdf",
    "group": "clarin",
    "groups": [
        {
            "name": "clarin"
        }
    ],
    "name": "c5b88988-022e-5392-b4b0-e7bb2ab74ce1",
    "notes": [
        "This is a lexical acquisition web-service for the automatic extraction of multiword expressions from large corpora. The service takes in input a POS-tagged corpus in CoNLL-X format plus a pair of POS-tags for the first and last word of a MWE, and outputs a list of extracted (candidate) multiword expressions with a set of linguistic and statistical information.\r\nThe output can then be post-processed through filters that will refine and improve the accuracy of the extraction, and finally converted to an LMF-compliant XML lexical resource.\r\nThe tool code is available open-source at https://github.com/francescafrontini/MWExtractor.\r\nFurther details can be found in: \r\n    Quochi Valeria & Frontini Francesca & Rubino Francesco. 2012. A MWE Acquisition and Lexicon Builder Web Service. In Proceedings of the 24th International Conference on Computational Linguistics (COLING 2012), December 10-14 2012, IIT Bombay, Mumbai, India.\r\n    Frontini Francesca  & Rubino Francesco & Quochi Valeria. 2012. Automatic Creation of quality multi-word Lexica from noisy text data. In Proceedings of the Sixth Workshop on Analytics for Noisy Unstructured Text Data (AND2012). December 9, 2012, IIT Bombay, Mumbai, India (Co-located with COLING2012)."
    ],
    "oai_identifier": [
        "oai:dspace-clarin-it.ilc.cnr.it:20.500.11752/ILC-91"
    ],
    "oai_set": [
        "hdl_000-c0-111_38",
        "hdl_000-c0-111_49"
    ],
    "state": "active",
    "tags": [
        {
            "name": "Multiword Extraction"
        },
        {
            "name": "Automatic lexical acquisition"
        }
    ],
    "title": [
        "Multiword Extractor"
    ],
    "url": ""
}