{
    "Contact": [
        "Istituto di Linguistica Computazionale \u201cA. Zampolli\u201d - Consiglio Nazionale delle Ricerche (ILC-CNR)"
    ],
    "DiscHierarchy": [
        "1.4",
        "Humanities",
        "Linguistics"
    ],
    "Discipline": "Linguistics",
    "Format": [
        "downloadable_files_count: 0"
    ],
    "MetaDataAccess": "https://clarin-pl.eu/oai/request?verb=GetRecord&metadataPrefix=oai_dc&identifier=oai:dspace-clarin-it.ilc.cnr.it:20.500.11752/ILC-71",
    "MetadataAccess": [
        "oai:dspace-clarin-it.ilc.cnr.it:20.500.11752/ILC-71"
    ],
    "PID": "http://hdl.handle.net/20.500.11752/ILC-71",
    "PublicationTimestamp": "2017-06-30T11:59:59Z",
    "PublicationYear": [
        "2017"
    ],
    "Publisher": [
        "Istituto di Linguistica Computazionale \u201cA. Zampolli\u201d - Consiglio Nazionale delle Ricerche (ILC-CNR)"
    ],
    "ResourceType": [
        "toolService"
    ],
    "author": [
        "Del Gratta, Riccardo"
    ],
    "fulltext": "oai:dspace-clarin-it.ilc.cnr.it:20.500.11752/ILC-71;2018-07-23T09:13:43Z;hdl_000-c0-111_38;hdl_000-c0-111_49;Lre Map;Del Gratta, Riccardo;Language Resource;Lre Map;Initiated by ELRA and FlaReNet and introduced at LREC 2010, the LRE Map is a new mechanism intended to monitor the use and creation of language resources by collecting information on both existing and newly-created resources during the submission process. It is a collective enterprise of the LREC community, as a first step towards the creation of a very broad, community-built, Open Resource Infrastructure. It is meant to become an essential instrument to monitor the field and to identify shifts in shifts in the production, use, and evaluation of LRs and LTs over the years.\r\n\r\nAt LREC 2010, nearly 2,000 language resource forms have been filled in. Apart from providing a portrait of the resources behind the community, of their uses and usability, the LRE Map intends to be a measuring instrument for monitoring the field of language resources.\r\n\r\nThe feature has been so successful that it has been implemented also at COLING 2010 and EMNLP 2010, while other major conferences are in the pipeline, in addition to the LRE Journal.\r\nThe demo url contains only a part of the data.;2017-06-30;toolService;http://hdl.handle.net/20.500.11752/ILC-71;downloadable_files_count: 0;Istituto di Linguistica Computazionale \u201cA. Zampolli\u201d - Consiglio Nazionale delle Ricerche (ILC-CNR)",
    "group": "clarin",
    "groups": [
        {
            "name": "clarin"
        }
    ],
    "name": "c82d0944-de80-5956-a4f1-c0120d251f60",
    "notes": [
        "Initiated by ELRA and FlaReNet and introduced at LREC 2010, the LRE Map is a new mechanism intended to monitor the use and creation of language resources by collecting information on both existing and newly-created resources during the submission process. It is a collective enterprise of the LREC community, as a first step towards the creation of a very broad, community-built, Open Resource Infrastructure. It is meant to become an essential instrument to monitor the field and to identify shifts in shifts in the production, use, and evaluation of LRs and LTs over the years.\r\n\r\nAt LREC 2010, nearly 2,000 language resource forms have been filled in. Apart from providing a portrait of the resources behind the community, of their uses and usability, the LRE Map intends to be a measuring instrument for monitoring the field of language resources.\r\n\r\nThe feature has been so successful that it has been implemented also at COLING 2010 and EMNLP 2010, while other major conferences are in the pipeline, in addition to the LRE Journal.\r\nThe demo url contains only a part of the data."
    ],
    "oai_identifier": [
        "oai:dspace-clarin-it.ilc.cnr.it:20.500.11752/ILC-71"
    ],
    "oai_set": [
        "hdl_000-c0-111_38",
        "hdl_000-c0-111_49"
    ],
    "state": "active",
    "tags": [
        {
            "name": "Language Resource"
        },
        {
            "name": "Lre Map"
        }
    ],
    "title": [
        "Lre Map"
    ],
    "url": ""
}