{
    "Contact": [
        "Wroclaw University of Technology"
    ],
    "DiscHierarchy": [
        "1.4",
        "Humanities",
        "Linguistics"
    ],
    "Discipline": "Linguistics",
    "Format": [
        "text/plain; charset=utf-8",
        "downloadable_files_count: 2",
        "application/octet-stream"
    ],
    "Language": [
        "Polish",
        "English"
    ],
    "MetaDataAccess": "https://clarin-pl.eu/oai/request?verb=GetRecord&metadataPrefix=oai_dc&identifier=oai:clarin-pl.eu:11321/273",
    "MetadataAccess": [
        "oai:clarin-pl.eu:11321/273"
    ],
    "PID": "http://hdl.handle.net/11321/273",
    "PublicationTimestamp": "2016-04-26T11:59:59Z",
    "PublicationYear": [
        "2016"
    ],
    "Publisher": [
        "Wroclaw University of Technology"
    ],
    "ResourceType": [
        "lexicalConceptualResource"
    ],
    "Rights": [
        "plWordNet",
        "http://clarin-pl.eu/en/licenses/plwordnet-2/",
        "PUB"
    ],
    "author": [
        "Wroclaw University of Technology"
    ],
    "fulltext": "oai:clarin-pl.eu:11321/273;2016-09-20T12:48:40Z;hdl_11321_3;hdl_11321_4;plWordNet 3.0;S\u0142owosie\u0107 3.0;Wroclaw University of Technology;lexical unit;lexico-semantic relations;mapping;Princeton WordNet;bilingual;plWordNet;plWordNet is a lexico-semantic network which reflects the lexical system of the Polish language. plWN currently contains 178 000 nouns, verbs, adjectives, and adverbs, 259 000 word senses, and over 600 000 relations and 240 000 inter-lingual relations between lexical units. It is now the largest wordnet in the world and is still growing.\r\n\r\nSenses in plWordNet are interconnected by relations. In the resulting network, each word is defined implicitly in reference to other words. For example, samoch\u00f3d 'car' is a kind of pojazd drogowy 'road vehicle'; it is a whole consisting of silnik 'engine', spryskiwacz 'windscreen washer', podwozie 'chassis' and so on; its close counterpart is the colloquial fura 'wheels'.\r\n\r\nAmong plWordNet's numerous applications there is its use as a Polish-English and English-Polish dictionary -- the effect of mapping onto Princeton WordNet (the first and for many years the largest wordnet in the world). plWordNet is also an important resource in natural language processing and in artificial intelligence research. For example, it is used by Google Translate for the purpose of machine translation.\r\n\r\nThe University has made plWordNet available free of charge for all applications, including commercial ones, on a licence modelled on the Princeton WordNet licence. Users may browse plWordNet via mobile version and via WordNetLoom-Viewer (application enabling display of plWN entries), as well as download source files. Programmers may access plWordNet via Web service.\r\n\r\nWe provide (currently only in download version) 31 000 lexical units marked with their sentiment values: positive, negative, ambiguous or neutral.;2016-04-26;lexicalConceptualResource;http://hdl.handle.net/11321/273;pol;eng;plWordNet;http://clarin-pl.eu/en/licenses/plwordnet-2/;PUB;text/plain; charset=utf-8;application/octet-stream;application/octet-stream;application/octet-stream;application/octet-stream;downloadable_files_count: 2;Wroclaw University of Technology;http://plwordnet.pwr.wroc.pl/wordnet/",
    "group": "clarin",
    "groups": [
        {
            "name": "clarin"
        }
    ],
    "name": "c94af378-16c3-5356-99b4-dbe16dd929cb",
    "notes": [
        "plWordNet is a lexico-semantic network which reflects the lexical system of the Polish language. plWN currently contains 178 000 nouns, verbs, adjectives, and adverbs, 259 000 word senses, and over 600 000 relations and 240 000 inter-lingual relations between lexical units. It is now the largest wordnet in the world and is still growing.\r\n\r\nSenses in plWordNet are interconnected by relations. In the resulting network, each word is defined implicitly in reference to other words. For example, samoch\u00f3d 'car' is a kind of pojazd drogowy 'road vehicle'; it is a whole consisting of silnik 'engine', spryskiwacz 'windscreen washer', podwozie 'chassis' and so on; its close counterpart is the colloquial fura 'wheels'.\r\n\r\nAmong plWordNet's numerous applications there is its use as a Polish-English and English-Polish dictionary -- the effect of mapping onto Princeton WordNet (the first and for many years the largest wordnet in the world). plWordNet is also an important resource in natural language processing and in artificial intelligence research. For example, it is used by Google Translate for the purpose of machine translation.\r\n\r\nThe University has made plWordNet available free of charge for all applications, including commercial ones, on a licence modelled on the Princeton WordNet licence. Users may browse plWordNet via mobile version and via WordNetLoom-Viewer (application enabling display of plWN entries), as well as download source files. Programmers may access plWordNet via Web service.\r\n\r\nWe provide (currently only in download version) 31 000 lexical units marked with their sentiment values: positive, negative, ambiguous or neutral."
    ],
    "oai_identifier": [
        "oai:clarin-pl.eu:11321/273"
    ],
    "oai_set": [
        "hdl_11321_3",
        "hdl_11321_4"
    ],
    "state": "active",
    "tags": [
        {
            "name": "lexical unit"
        },
        {
            "name": "lexico-semantic relations"
        },
        {
            "name": "mapping"
        },
        {
            "name": "Princeton WordNet"
        },
        {
            "name": "bilingual"
        },
        {
            "name": "plWordNet"
        }
    ],
    "title": [
        "plWordNet 3.0",
        "S\u0142owosie\u0107 3.0"
    ],
    "url": ""
}