{
    "Contact": [
        "Charles University, Faculty of Mathematics and Physics, Institute of Formal and Applied Linguistics (UFAL)"
    ],
    "DiscHierarchy": [
        "1.4",
        "Humanities",
        "Linguistics"
    ],
    "Discipline": "Linguistics",
    "Format": [
        "application/zip",
        "downloadable_files_count: 1",
        "text/plain; charset=utf-8"
    ],
    "Language": [
        "English"
    ],
    "MetaDataAccess": "https://clarin-pl.eu/oai/request?verb=GetRecord&metadataPrefix=oai_dc&identifier=oai:lindat.mff.cuni.cz:11234/1-1794",
    "MetadataAccess": [
        "oai:lindat.mff.cuni.cz:11234/1-1794"
    ],
    "PID": "http://hdl.handle.net/11234/1-1794",
    "PublicationTimestamp": "2015-12-01T11:59:59Z",
    "PublicationYear": [
        "2015"
    ],
    "Publisher": [
        "Charles University, Faculty of Mathematics and Physics, Institute of Formal and Applied Linguistics (UFAL)"
    ],
    "ResourceType": [
        "lexicalConceptualResource"
    ],
    "Rights": [
        "Creative Commons - Attribution 4.0 International (CC BY 4.0)",
        "http://creativecommons.org/licenses/by/4.0/",
        "PUB"
    ],
    "author": [
        "Cinkov\u00e1, Silvie",
        "Baisa, V\u00edt",
        "Krej\u010dov\u00e1, Ema",
        "Vernerov\u00e1, Anna"
    ],
    "fulltext": "oai:lindat.mff.cuni.cz:11234/1-1794;2018-07-02T22:05:51Z;hdl_11858_00-097C-0000-0001-486F-D;hdl_11858_00-097C-0000-0001-4877-A;VPS-GradeUp (2016-10-10);Baisa, V\u00edt;Cinkov\u00e1, Silvie;Krej\u010dov\u00e1, Ema;Vernerov\u00e1, Anna;Pattern Dictionary of English Verbs;usage patterns;lexical semantics;dictionaries;clustering;Corpus Pattern Analysis;verbs;graded decisions;Likert scale;Word Sense Disambiguation;VPS-GradeUp is a collection of triple manual annotations of 29 English verbs based on the Pattern Dictionary of English Verbs (PDEV) and comprising the following lemmas: abolish, act, adjust, advance, answer, approve, bid, cancel, conceive, cultivate, cure, distinguish, embrace, execute, hire, last, manage, murder, need, pack, plan, point, praise, prescribe, sail, seal, see, talk, urge . It contains results from two different tasks:\r\n\r\n 1.   Graded decisions\r\n 2.   Best-fit pattern (WSD) .\r\n\r\nIn both tasks, the annotators were matching verb senses defined by the PDEV patterns with 50 actual uses of each verb (using concordances from the BNC [2]). The verbs were randomly selected from a list of completed PDEV lemmas with at least 3 patterns and at least 100 BNC concordances not previously annotated by PDEV\u2019s own annotators. Also, the selection excluded verbs contained in VPS-30-En[3], a data set we developed earlier. This data set was built within the project Reviving Zellig S. Harris: more linguistic information for distributional lexical analysis of English and Czech and in connection with the SemEval-2015 CPA-related task.;2015-12-01;lexicalConceptualResource;http://hdl.handle.net/11234/1-1794;eng;Creative Commons - Attribution 4.0 International (CC BY 4.0);http://creativecommons.org/licenses/by/4.0/;PUB;application/zip;text/plain; charset=utf-8;downloadable_files_count: 1;Charles University, Faculty of Mathematics and Physics, Institute of Formal and Applied Linguistics (UFAL);https://ufal.mff.cuni.cz/vpsgradeup",
    "group": "clarin",
    "groups": [
        {
            "name": "clarin"
        }
    ],
    "name": "ca4d0f4a-3622-5704-bca3-a0a541c60d7f",
    "notes": [
        "VPS-GradeUp is a collection of triple manual annotations of 29 English verbs based on the Pattern Dictionary of English Verbs (PDEV) and comprising the following lemmas: abolish, act, adjust, advance, answer, approve, bid, cancel, conceive, cultivate, cure, distinguish, embrace, execute, hire, last, manage, murder, need, pack, plan, point, praise, prescribe, sail, seal, see, talk, urge . It contains results from two different tasks:\r\n\r\n 1.   Graded decisions\r\n 2.   Best-fit pattern (WSD) .\r\n\r\nIn both tasks, the annotators were matching verb senses defined by the PDEV patterns with 50 actual uses of each verb (using concordances from the BNC [2]). The verbs were randomly selected from a list of completed PDEV lemmas with at least 3 patterns and at least 100 BNC concordances not previously annotated by PDEV\u2019s own annotators. Also, the selection excluded verbs contained in VPS-30-En[3], a data set we developed earlier. This data set was built within the project Reviving Zellig S. Harris: more linguistic information for distributional lexical analysis of English and Czech and in connection with the SemEval-2015 CPA-related task."
    ],
    "oai_identifier": [
        "oai:lindat.mff.cuni.cz:11234/1-1794"
    ],
    "oai_set": [
        "hdl_11858_00-097C-0000-0001-486F-D",
        "hdl_11858_00-097C-0000-0001-4877-A"
    ],
    "state": "active",
    "tags": [
        {
            "name": "Pattern Dictionary English Verbs"
        },
        {
            "name": "usage patterns"
        },
        {
            "name": "lexical semantics"
        },
        {
            "name": "dictionaries"
        },
        {
            "name": "clustering"
        },
        {
            "name": "Corpus Pattern Analysis"
        },
        {
            "name": "verbs"
        },
        {
            "name": "graded decisions"
        },
        {
            "name": "Likert scale"
        },
        {
            "name": "Word Sense Disambiguation"
        }
    ],
    "title": [
        "VPS-GradeUp (2016-10-10)"
    ],
    "url": ""
}