{
    "Contact": [
        "Faculty of Arts, Institute of the Czech National Corpus, Charles University in Prague"
    ],
    "DiscHierarchy": [
        "1.4",
        "Humanities",
        "Linguistics"
    ],
    "Discipline": "Linguistics",
    "Format": [
        "text/plain; charset=utf-8",
        "application/x-gzip",
        "downloadable_files_count: 1"
    ],
    "Language": [
        "Czech"
    ],
    "MetaDataAccess": "https://clarin-pl.eu/oai/request?verb=GetRecord&metadataPrefix=oai_dc&identifier=oai:lindat.mff.cuni.cz:11858/00-097C-0000-0023-119C-C",
    "MetadataAccess": [
        "oai:lindat.mff.cuni.cz:11858/00-097C-0000-0023-119C-C"
    ],
    "PID": "http://hdl.handle.net/11858/00-097C-0000-0023-119C-C",
    "PublicationTimestamp": "2006-07-01T11:59:59Z",
    "PublicationYear": [
        "2006"
    ],
    "Publisher": [
        "Faculty of Arts, Institute of the Czech National Corpus, Charles University in Prague"
    ],
    "ResourceType": [
        "corpus"
    ],
    "Rights": [
        "Attribution-NonCommercial-ShareAlike 3.0 Unported (CC BY-NC-SA 3.0)",
        "http://creativecommons.org/licenses/by-nc-sa/3.0/",
        "PUB"
    ],
    "author": [
        "Kop\u0159ivov\u00e1, Marie",
        "Waclawi\u010dov\u00e1, Martina"
    ],
    "fulltext": "oai:lindat.mff.cuni.cz:11858/00-097C-0000-0023-119C-C;2018-07-02T22:05:50Z;hdl_11858_00-097C-0000-0001-486F-D;hdl_11858_00-097C-0000-0001-4877-A;ORAL2006: Corpus of informal spoken Czech;Kop\u0159ivov\u00e1, Marie;Waclawi\u010dov\u00e1, Martina;corpus;informal spoken language;Corpus of informal spoken Czech sized 1 MW. It contains transcriptions of 221 recordings made in 2002\u20132006 in the whole of Bohemia. All the recordings were made in informal situations to ensure prototypically spontaneous spoken language. This means private environment, physical presence of speakers who know each other, unscripted speech and topic not given in advance. The total number of speakers is 754, the metadata include sociolinguistic information about them.\r\n\r\nThe corpus is provided in a (semi-XML) vertical format used as an input to the Manatee query engine. The data thus exactly correspond to the corpus available via query interface to registered users of the CNC.;2006;corpus;http://hdl.handle.net/11858/00-097C-0000-0023-119C-C;ces;Attribution-NonCommercial-ShareAlike 3.0 Unported (CC BY-NC-SA 3.0);http://creativecommons.org/licenses/by-nc-sa/3.0/;PUB;application/x-gzip;text/plain; charset=utf-8;downloadable_files_count: 1;Faculty of Arts, Institute of the Czech National Corpus, Charles University in Prague;https://wiki.korpus.cz/doku.php/cnk:oral2006",
    "group": "clarin",
    "groups": [
        {
            "name": "clarin"
        }
    ],
    "name": "caafec49-1f05-5d39-8e37-47c493e61092",
    "notes": [
        "Corpus of informal spoken Czech sized 1 MW. It contains transcriptions of 221 recordings made in 2002\u20132006 in the whole of Bohemia. All the recordings were made in informal situations to ensure prototypically spontaneous spoken language. This means private environment, physical presence of speakers who know each other, unscripted speech and topic not given in advance. The total number of speakers is 754, the metadata include sociolinguistic information about them.\r\n\r\nThe corpus is provided in a (semi-XML) vertical format used as an input to the Manatee query engine. The data thus exactly correspond to the corpus available via query interface to registered users of the CNC."
    ],
    "oai_identifier": [
        "oai:lindat.mff.cuni.cz:11858/00-097C-0000-0023-119C-C"
    ],
    "oai_set": [
        "hdl_11858_00-097C-0000-0001-486F-D",
        "hdl_11858_00-097C-0000-0001-4877-A"
    ],
    "state": "active",
    "tags": [
        {
            "name": "corpus"
        },
        {
            "name": "informal spoken language"
        }
    ],
    "title": [
        "ORAL2006: Corpus of informal spoken Czech"
    ],
    "url": ""
}