{
    "DiscHierarchy": [
        "1.4",
        "Humanities",
        "Linguistics"
    ],
    "Discipline": "Linguistics",
    "Format": [
        "application/zip",
        "downloadable_files_count: 1"
    ],
    "Language": [
        "German",
        "Spanish"
    ],
    "MetaDataAccess": "https://clarin-pl.eu/oai/request?verb=GetRecord&metadataPrefix=oai_dc&identifier=oai:repo.clarino.uib.no:11509/38",
    "MetadataAccess": [
        "oai:repo.clarino.uib.no:11509/38"
    ],
    "PID": "http://hdl.handle.net/11509/38",
    "PublicationTimestamp": "2012-04-18T11:59:59Z",
    "PublicationYear": [
        "2012"
    ],
    "ResourceType": [
        "corpus"
    ],
    "Rights": [
        "Attribution-NonCommercial-ShareAlike 3.0 Unported (CC BY-NC-SA 3.0)",
        "http://creativecommons.org/licenses/by-nc-sa/3.0/",
        "CC"
    ],
    "author": [
        "Parra Escart\u00edn, Carla"
    ],
    "fulltext": "oai:repo.clarino.uib.no:11509/38;2016-04-15T05:59:20Z;hdl_11509_1;hdl_11509_2;Parallel Corpus of documents from the Technical Regulations Information System for German-Spanish (v0.2);Parra Escart\u00edn, Carla;Corpus;Text;German;Spanish, Castilian;Specialized parallel corpus Spanish-German (ES-ES, DE-AT and DE-DE), texts from the European Commission between 1997-2010. The texts are technical regulations in a variety of domains. To be sentence aligned. The current version 0.2 contains the files for 1999-2010 in the domain B00: Construction (205 files; 70,648 sentences; 1,563,000 words). This version also fixed some formatting errors detected in version 0.1 of the corpus. Versions 0.1 and 0.2 are kept as individual records because they are (currently) intended to be downloaded individually. Neither version are currently available for download, as the licensing terms and the distributor is still under negotiation. The current contact person is therefore the corpus developer, Carla Parra.;2012-04-18;corpus;http://hdl.handle.net/11509/38;ger;spa;Attribution-NonCommercial-ShareAlike 3.0 Unported (CC BY-NC-SA 3.0);http://creativecommons.org/licenses/by-nc-sa/3.0/;CC;application/zip;downloadable_files_count: 1",
    "group": "clarin",
    "groups": [
        {
            "name": "clarin"
        }
    ],
    "name": "d1b2b105-c6bb-54a6-8b61-072f8be2f4eb",
    "notes": [
        "Specialized parallel corpus Spanish-German (ES-ES, DE-AT and DE-DE), texts from the European Commission between 1997-2010. The texts are technical regulations in a variety of domains. To be sentence aligned. The current version 0.2 contains the files for 1999-2010 in the domain B00: Construction (205 files; 70,648 sentences; 1,563,000 words). This version also fixed some formatting errors detected in version 0.1 of the corpus. Versions 0.1 and 0.2 are kept as individual records because they are (currently) intended to be downloaded individually. Neither version are currently available for download, as the licensing terms and the distributor is still under negotiation. The current contact person is therefore the corpus developer, Carla Parra."
    ],
    "oai_identifier": [
        "oai:repo.clarino.uib.no:11509/38"
    ],
    "oai_set": [
        "hdl_11509_1",
        "hdl_11509_2"
    ],
    "state": "active",
    "tags": [
        {
            "name": "Corpus"
        },
        {
            "name": "Text"
        },
        {
            "name": "German"
        },
        {
            "name": "Spanish"
        },
        {
            "name": "Castilian"
        }
    ],
    "title": [
        "Parallel Corpus of documents from the Technical Regulations Information System for German-Spanish (v0.2)"
    ],
    "url": ""
}