{
    "Contact": [
        "Dominik Wojciech Siarkowski"
    ],
    "DiscHierarchy": [
        "1.4",
        "Humanities",
        "Linguistics"
    ],
    "Discipline": "Linguistics",
    "Format": [
        "application/xml"
    ],
    "Language": [
        "Polish",
        "Latin"
    ],
    "MetaDataAccess": "https://clarin-pl.eu/oai/request?verb=GetRecord&metadataPrefix=oai_dc&identifier=oai:fedora.clarin-d.uni-saarland.de:clarind-uds:poldilemma-5946",
    "MetadataAccess": [
        "oai:fedora.clarin-d.uni-saarland.de:clarind-uds:poldilemma-5946"
    ],
    "PID": "http://hdl.handle.net/11858/00-246C-0000-0023-8D2A-0",
    "PublicationTimestamp": "1746-07-01T11:59:59Z",
    "PublicationYear": [
        "1746"
    ],
    "Publisher": [
        "Dominik Wojciech Siarkowski"
    ],
    "RelatedIdentifier": [
        "http://dlibra.bibliotekaelblaska.pl/Content/5946",
        "oai:dlibra.bibliotekaelblaska.pl:publication:6373"
    ],
    "ResourceType": [
        "starodruk",
        "alter Druck"
    ],
    "Rights": [
        "https://creativecommons.org/licenses/by-nc-sa/4.0/",
        "CC-BY-NC-SA-4.0"
    ],
    "author": [
        "Wuykowski Jan Stanis\u0142aw Kostka"
    ],
    "fulltext": "oai:fedora.clarin-d.uni-saarland.de:clarind-uds:poldilemma-5946;2019-03-01T15:54:01Z;Chleb duchowny, wszystkim chrze\u015bcianom na posi\u0142ek w drodze, do Nieba id\u0105cym, wystawiony albo raczey katechizm\u2026;Chleb duchowny, wszystkim chrze\u015bcianom na posi\u0142ek w drodze, do Nieba id\u0105cym, wystawiony albo raczey katechizm\u2026;Wuykowski Jan Stanis\u0142aw Kostka;Wuykowski Jan Stanis\u0142aw Kostka;modlitewnik katolicki;nauki chrze\u015bcija\u0144skie - podr\u0119cznik;katholisches Gebetbuch;christliche Lehre - Handbuch;Na karcie przedtytu\u0142owej odr\u0119czne \u0142aci\u0144skie zapiski . Za kart\u0105 tytu\u0142ow\u0105 widniej\u0105 cytaty \u0142aci\u0144skie oraz pozwolenie i aprobata na wydruk owego dzie\u0142a, wystawione 20 listopada 1744 r. w Krakowie i zatwierdzaj\u0105ce druk do publikacji przez doktora, profesora, kanonika katedry krakowskiej ks. Macieja Zi\u0119tkiewicza. Podr\u0119cznik do nauk chrze\u015bcija\u0144skich (katechizm) oparty na zadawaniu pyta\u0144 oraz odpowiedziach m. in. : pytanie: Kt\u00f3ra rzecz jest najgorsza na tym \u015bwiecie ? odp. : grzech etc. Starodruk wsp\u00f3\u0142oprawny : XVIII. 146 adl. 1-2 (adl. 2 - \"Przewodnik na drog\u0119 wiecznosci dla du\u00df ludzkich\u2026\"), wydany w drukarni Dominika Wojciecha Siarkowskiego, w formacie 4\u00b0. Oprawa zniszczona.;Auf dem Vortitelblatt handgeschriebene lateinische Notizen. Auf dem n\u00e4chsten Blatt lateinische Spr\u00fcche und Zulassung des Werkes zum Druck vom Professor Dr. Kanoniker der Wawelkathedrale Maciej Zi\u0119tkiewicz. Das Handbuch zur christlichen Lehre (Katechismus) mit Fragen und Antworten (z. B. \u201e-Was ist am schlimmsten auf der ganzen Welt?\u201c \u201eS\u00fcnde\u201c. Das zusammen eingebundene Druckerzeugnis: XVIII. 146 adl. 1-2 (adl. 2 - \"Przewodnik na drog\u0119 wieczno\u015bci dla du\u00df ludzkich\u2026\"), in der Druckerei von Dominik Wojciech Siarkowski, im Buchformat 4\u00ba. Besch\u00e4digter Einband.;Dominik Wojciech Siarkowski;Dominik Wojciech Siarkowski;1746;1746;starodruk;alter Druck;application/xml;clarind-uds:poldilemma-5946;hdl:11858/00-246C-0000-0023-8D2A-0;XVIII. 146;XVIII. 146;pol;lat;http://dlibra.bibliotekaelblaska.pl/Content/5946;oai:dlibra.bibliotekaelblaska.pl:publication:6373;https://creativecommons.org/licenses/by-nc-sa/4.0/;CC-BY-NC-SA-4.0",
    "group": "clarin",
    "groups": [
        {
            "name": "clarin"
        }
    ],
    "name": "d34b9db8-e8bf-5be0-b443-14ddd26fdd46",
    "notes": [
        "Na karcie przedtytu\u0142owej odr\u0119czne \u0142aci\u0144skie zapiski . Za kart\u0105 tytu\u0142ow\u0105 widniej\u0105 cytaty \u0142aci\u0144skie oraz pozwolenie i aprobata na wydruk owego dzie\u0142a, wystawione 20 listopada 1744 r. w Krakowie i zatwierdzaj\u0105ce druk do publikacji przez doktora, profesora, kanonika katedry krakowskiej ks. Macieja Zi\u0119tkiewicza. Podr\u0119cznik do nauk chrze\u015bcija\u0144skich (katechizm) oparty na zadawaniu pyta\u0144 oraz odpowiedziach m. in. : pytanie: Kt\u00f3ra rzecz jest najgorsza na tym \u015bwiecie ? odp. : grzech etc. Starodruk wsp\u00f3\u0142oprawny : XVIII. 146 adl. 1-2 (adl. 2 - \"Przewodnik na drog\u0119 wiecznosci dla du\u00df ludzkich\u2026\"), wydany w drukarni Dominika Wojciecha Siarkowskiego, w formacie 4\u00b0. Oprawa zniszczona.",
        "Auf dem Vortitelblatt handgeschriebene lateinische Notizen. Auf dem n\u00e4chsten Blatt lateinische Spr\u00fcche und Zulassung des Werkes zum Druck vom Professor Dr. Kanoniker der Wawelkathedrale Maciej Zi\u0119tkiewicz. Das Handbuch zur christlichen Lehre (Katechismus) mit Fragen und Antworten (z. B. \u201e-Was ist am schlimmsten auf der ganzen Welt?\u201c \u201eS\u00fcnde\u201c. Das zusammen eingebundene Druckerzeugnis: XVIII. 146 adl. 1-2 (adl. 2 - \"Przewodnik na drog\u0119 wieczno\u015bci dla du\u00df ludzkich\u2026\"), in der Druckerei von Dominik Wojciech Siarkowski, im Buchformat 4\u00ba. Besch\u00e4digter Einband."
    ],
    "oai_identifier": [
        "oai:fedora.clarin-d.uni-saarland.de:clarind-uds:poldilemma-5946"
    ],
    "oai_set": "",
    "state": "active",
    "tags": [
        {
            "name": "modlitewnik katolicki"
        },
        {
            "name": "modlitewnik katolicki"
        },
        {
            "name": "katholisches Gebetbuch"
        },
        {
            "name": "christliche Lehre - Handbuch"
        }
    ],
    "title": [
        "Chleb duchowny, wszystkim chrze\u015bcianom na posi\u0142ek w drodze, do Nieba id\u0105cym, wystawiony albo raczey katechizm\u2026",
        "Chleb duchowny, wszystkim chrze\u015bcianom na posi\u0142ek w drodze, do Nieba id\u0105cym, wystawiony albo raczey katechizm\u2026"
    ],
    "url": ""
}