{
    "Contact": [
        "ZRC SAZU"
    ],
    "DiscHierarchy": [
        "1.4",
        "Humanities",
        "Linguistics"
    ],
    "Discipline": "Linguistics",
    "Format": [
        "application/zip",
        "downloadable_files_count: 1",
        "text/plain; charset=utf-8"
    ],
    "Language": [
        "Slovenian"
    ],
    "MetaDataAccess": "https://clarin-pl.eu/oai/request?verb=GetRecord&metadataPrefix=oai_dc&identifier=oai:www.clarin.si:11356/1141",
    "MetadataAccess": [
        "oai:www.clarin.si:11356/1141"
    ],
    "PID": "http://hdl.handle.net/11356/1141",
    "PublicationTimestamp": "2017-07-01T11:59:59Z",
    "PublicationYear": [
        "2017"
    ],
    "Publisher": [
        "ZRC SAZU"
    ],
    "ResourceType": [
        "lexicalConceptualResource"
    ],
    "Rights": [
        "Creative Commons - Attribution 4.0 International (CC BY 4.0)",
        "https://creativecommons.org/licenses/by/4.0/",
        "PUB"
    ],
    "author": [
        "Jakopin, Primo\u017e"
    ],
    "fulltext": "oai:www.clarin.si:11356/1141;2017-09-25T10:21:07Z;hdl_11356_1023;hdl_11356_1024;Beseda Corpus Lemmatisation Lexicon;Jakopin, Primo\u017e;morphology;inflection;word forms;lemmatisation;Beseda Corpus Lemmatisation Lexicon for Slovenian language was generated at the Fran Ramov\u0161 Institute of Slovenian Language, primarily through inflection of open class words from the Dictionary of Standard Slovenian (Slovar slovenskega knji\u017enega jezika), augmented by wordforms, their part of speech tags and their lemmas used during the PoS tagging and lemmatization of the Beseda corpus. It was initially (2000) composed of 1 million words from the following texts:\r\n\r\nCiril Kosma\u010d Opus - 408,000 words\r\nTomo Kri\u017enar: O iskanju ljubezni / On Search for Love or Around the World by Bicycle - 132,000 words\r\nGeorge Orwell: 1984 / 1984 - 91,000 words\r\nPlato: Dr\u017eava / Republic - 93,000 words\r\nSveto pismo Nove zaveze / The Bible - New Testament - 150,000 words\r\nGustave Flaubert: Bouvard in P\u00e9cuchet / Bouvard and P\u00e9cuchet - 86,000 words\r\n\u010casopis DELO na internetu (vzorec iz 6.5.1997 - 17.6.1997) / Newspaper DELO on Internet (a sample from 5/6/1997 - 6/17/1997) - 52,000 words\r\n\r\nAfter 2000 the following texts were added:\r\n\r\nMarko Ur\u0161i\u010d: \u0160tirje \u010dasi / Four Seasons - 171,000 words\r\nDr\u017eavni zbor RS 3. sklica - dobesedni zapisi sej: 29. redna seja, zasedanje 01.10.2003 / National Assembly of the Republic of Slovenia - session transcripts: 29th regular session, meeting of 10/1/2003 - 47,000 words\r\n\u010casopis DELO za 3.1.2004 / Newspaper DELO for 1/3/2004 - 75,000 words\r\n\r\nto round the corpus to 1,300,000 words.\r\n\r\nCurrent lexicon was taken from the database of the online \"Determination of Lemmas and PoS Tags for a List of Words\" service at the Institute, available through the web page: http://bos.zrc-sazu.si/dol_lem1.html Wordform frequencies were compiled from the latest update of the abovementioned corpus (version 138, 1,300,626 words, August 2017) and are therefore approximate.\r\n\r\nLexicon is UTF-8 coded, has 3,228,128 lines, each of the following 4 data fields, tab separated:\r\n\r\n1. wordform\r\n2. lemma (102,346 different lemmas)\r\n3. PoS tag (explained at http://bos.zrc-sazu.si/bibliografija/o_oznake.html - in Slovenian)\r\n4. approximate corpus frequency; wordform-lemma-PoS entries not in corpus have zero frequency;2017;lexicalConceptualResource;http://hdl.handle.net/11356/1141;slv;Creative Commons - Attribution 4.0 International (CC BY 4.0);https://creativecommons.org/licenses/by/4.0/;PUB;application/zip;text/plain; charset=utf-8;downloadable_files_count: 1;ZRC SAZU;http://bos.zrc-sazu.si/dol_lem1.html",
    "group": "clarin",
    "groups": [
        {
            "name": "clarin"
        }
    ],
    "name": "d67a3b1f-b39f-5e18-8cc3-cdf4a90e4f5c",
    "notes": [
        "Beseda Corpus Lemmatisation Lexicon for Slovenian language was generated at the Fran Ramov\u0161 Institute of Slovenian Language, primarily through inflection of open class words from the Dictionary of Standard Slovenian (Slovar slovenskega knji\u017enega jezika), augmented by wordforms, their part of speech tags and their lemmas used during the PoS tagging and lemmatization of the Beseda corpus. It was initially (2000) composed of 1 million words from the following texts:\r\n\r\nCiril Kosma\u010d Opus - 408,000 words\r\nTomo Kri\u017enar: O iskanju ljubezni / On Search for Love or Around the World by Bicycle - 132,000 words\r\nGeorge Orwell: 1984 / 1984 - 91,000 words\r\nPlato: Dr\u017eava / Republic - 93,000 words\r\nSveto pismo Nove zaveze / The Bible - New Testament - 150,000 words\r\nGustave Flaubert: Bouvard in P\u00e9cuchet / Bouvard and P\u00e9cuchet - 86,000 words\r\n\u010casopis DELO na internetu (vzorec iz 6.5.1997 - 17.6.1997) / Newspaper DELO on Internet (a sample from 5/6/1997 - 6/17/1997) - 52,000 words\r\n\r\nAfter 2000 the following texts were added:\r\n\r\nMarko Ur\u0161i\u010d: \u0160tirje \u010dasi / Four Seasons - 171,000 words\r\nDr\u017eavni zbor RS 3. sklica - dobesedni zapisi sej: 29. redna seja, zasedanje 01.10.2003 / National Assembly of the Republic of Slovenia - session transcripts: 29th regular session, meeting of 10/1/2003 - 47,000 words\r\n\u010casopis DELO za 3.1.2004 / Newspaper DELO for 1/3/2004 - 75,000 words\r\n\r\nto round the corpus to 1,300,000 words.\r\n\r\nCurrent lexicon was taken from the database of the online \"Determination of Lemmas and PoS Tags for a List of Words\" service at the Institute, available through the web page: http://bos.zrc-sazu.si/dol_lem1.html Wordform frequencies were compiled from the latest update of the abovementioned corpus (version 138, 1,300,626 words, August 2017) and are therefore approximate.\r\n\r\nLexicon is UTF-8 coded, has 3,228,128 lines, each of the following 4 data fields, tab separated:\r\n\r\n1. wordform\r\n2. lemma (102,346 different lemmas)\r\n3. PoS tag (explained at http://bos.zrc-sazu.si/bibliografija/o_oznake.html - in Slovenian)\r\n4. approximate corpus frequency; wordform-lemma-PoS entries not in corpus have zero frequency"
    ],
    "oai_identifier": [
        "oai:www.clarin.si:11356/1141"
    ],
    "oai_set": [
        "hdl_11356_1023",
        "hdl_11356_1024"
    ],
    "state": "active",
    "tags": [
        {
            "name": "morphology"
        },
        {
            "name": "inflection"
        },
        {
            "name": "word forms"
        },
        {
            "name": "lemmatisation"
        }
    ],
    "title": [
        "Beseda Corpus Lemmatisation Lexicon"
    ],
    "url": ""
}