{
    "Contact": [
        "Universit\u00e4t des Saarlandes"
    ],
    "Contributor": [
        "Andrea Wurm"
    ],
    "DiscHierarchy": [
        "1.4",
        "Humanities",
        "Linguistics"
    ],
    "Discipline": "Linguistics",
    "Format": [
        "text/xml"
    ],
    "Language": [
        "German"
    ],
    "MetaDataAccess": "https://clarin-pl.eu/oai/request?verb=GetRecord&metadataPrefix=oai_dc&identifier=oai:fedora.clarin-d.uni-saarland.de:clarind-uds:sacoco",
    "MetadataAccess": [
        "oai:fedora.clarin-d.uni-saarland.de:clarind-uds:sacoco"
    ],
    "PID": "http://hdl.handle.net/11858/00-246C-0000-001F-7C43-1",
    "PublicationTimestamp": "2013-07-01T11:59:59Z",
    "PublicationYear": [
        "2013"
    ],
    "Publisher": [
        "Universit\u00e4t des Saarlandes"
    ],
    "RelatedIdentifier": [
        "Wurm, A. (2008). Translatorische Wirkung: ein Beitrag zum Verst\u00e4ndnis von \u00dcbersetzungsgeschichte als Kulturgeschichte am Beispiel deutscher \u00dcbersetzungen franz\u00f6sischer Kochb\u00fccher in der Fr\u00fchen Neuzeit. (A. Gil, J. Haller, & E. Steiner, Eds.) (p. 228). Frankfurt am Main, Berlin, Bern, Bruxelles, New York, Oxford, Wien: Peter Lang.",
        "Amoia, M., Mart\u00ednez Mart\u00ednez, J. M., Teich, E., Kermes, H., Knappen, J. & A. Wurm (2013). A Diachronic Comparable Corpus of German Recipes. In Proceedings of the Conference on Corpora and Tools in Linguistics, Languages, and Speech, July 2013, Strasbourg, France.",
        "Amoia, M. & Mart\u00ednez Mart\u00ednez, J. M. (2013). Using Comparable Collections of Historical Texts for Building a Diachronic Dictionary for Spelling Normalization. In Proceedings of the ACL 2013 workshop on Language Technology for Cultural Heritage, Social Sciences, and Humanities (LaTeCH 2013), August 2013, Sofia, Bulgaria.",
        "Schmid, H. (1994). Probabilistic Part-of-Speech Tagging Using Decision Trees. Proceedings of International Conference on New Methods in Language Processing. Manchester.",
        "STTS tagset http://www.ims.uni-stuttgart.de/forschung/ressourcen/lexika/TagSets/stts-table.html",
        "CLARIN-D/SfS-Uni. T\u00fcbingen. 2012. WebLicht: Web-Based Linguistic Chaining Tool. Online. Date Accessed: 18 Jun 2013. URL https://weblicht.sfs.uni-tuebingen.de"
    ],
    "ResourceType": [
        "Dataset"
    ],
    "Rights": [
        "The SaCoCo Diachronic Corpus as a whole is released under a Creative Commons Attribution - Non Commercial - Share Alike 3.0 Unported License. (CC BY NC SA 3.0) http://creativecommons.org/licenses/by-nc-sa/3.0/",
        "The recipes belonging to Knopf 1800, Franckfurt 1789 and Gr\u00e4z 1686 contained in the SaCoCo Historical Corpus are released under a Creative Commons Attribution - Non Commercial - Share Alike 3.0 Unported License. (CC BY NC SA 3.0) http://creativecommons.org/licenses/by-nc-sa/3.0/",
        "The SaCoCo Contemporary Corpus is released under a Creative Commons Attribution - Share Alike 3.0 Unported License. (CC BY SA 3.0) http://creativecommons.org/licenses/by-sa/3.0/",
        "All the recipes of the SaCoCo Historical Corpus (but Knopf 1800, Franckfurt 1789 and Gr\u00e4z 1686) are released under a Creative Commons Attribution 3.0 Unported License. (CC BY 3.0) http://creativecommons.org/licenses/by/3.0/"
    ],
    "SpatialCoverage": [
        "Germany, Austria and Switzerland."
    ],
    "TemporalCoverage": " point in time : None",
    "author": [
        "Jos\u00e9 Manuel Mart\u00ednez Mart\u00ednez",
        "Marilisa Amoia"
    ],
    "fulltext": "oai:fedora.clarin-d.uni-saarland.de:clarind-uds:sacoco;2014-06-03T13:01:09Z;SaCoCo Saarbr\u00fccken Cookbook Corpora;Marilisa Amoia;Jos\u00e9 Manuel Mart\u00ednez Mart\u00ednez;corpus linguistics;historical linguistics;early modern age;cooking recipe;cookbook;The Saarbr\u00fccken Cookbook Corpus is a diachronic corpus made up of cooking recipes organized into two different collections: historical and contemporary.\nThe historical component contains a selection of recipes from different works. The full nomina of sources can be found listed as sources in the metadata. These recipes were collected and transcribed by Andrea Wurm as part of her PhD. For more information see Wurm 2007.\nThe contemporary component contains cooking recipes from rezeptewiki.org. The selection criteria were temporal (only the last version of the recipe) and geographical (only recipes belonging to German speaking regions). The address of the wiki dump is provided in sources.\n\nANNOTATION:\nThe corpus contains two types of annotation: structural and positional.\n\nStructural annotation is written in XML and provides a description of the textual structure, on the one hand, and metatextual information and shallow semantics, on the other hand.\n\nSTRUCTURAL ATTRIBUTES:\nmetadata: id, collection, source, url, year, decade, period, language, ref;\nshallow semantics: type, course, cuisine, ingredient, method;\nstructure: title, body, segment, paragraph, sentence.\n\nPositional annotation is provided at token level containing linguistic information.\n\nPOSITIONAL ATTRIBUTES:\nword form;\nPOS (TreeTagger, STTS tagset);\nlemma (TreeTagger);\nnormalized form (automatic normalization using the algorithm described in Amoia and Mart\u00ednez Mart\u00ednez 2013).;Universit\u00e4t des Saarlandes;Andrea Wurm;2013;Dataset;text/xml;clarind-uds:sacoco;hdl:11858/00-246C-0000-001F-7C43-1;Staindl 1569.\n    Author: Staindl, Balthasar.\n    Title: Ein sehr K\u00fcnstlichs vnd nutzlichs Kochbuoch / vormals nye in so leicht / Mannen vnnd Frawen personen / von jnen selbst zu lernen / in Truck verfast vnd au\u00dfgangen ist / Artlich in acht B\u00fccher getheilt / sampt etlichen fast nutzen bewehrten Hau\u00dfnotturfften oder k\u00fcnsten. Auch wie man Essig macht / vnd Wein guot behelt. Balthasar Staindl von Dillingen. M.D.LXVIIII. [1569 Augsburg: Matth\u00e4us Franck].\nFirst edition: 1544 Augsburg: H. Steiner (Weiss 1996:511, Nr. 3683).\nFurther editions: 1547 Augsburg: Valentin Ottmar, 1549 Frankfurt: Herman G\u00fclfferich; 1552 Augsburg: Valentin Ottmar; 1575 Augsburg: M. Manger; 1575 Augsburg: Francke; 1582 Augsburg; 1586 Augsburg: Manger; 1596 Augsburg: Manger; 1608 Francke (Weiss 1996:511f., Nr. 3684f.); Ruf (1993:69) refers two editions in 1548 and 1589, probably Kudriaffsky.\nComments: the edition used for this corpus is a reprint of the 1569 edition 1569 published in 1979 by Josef Stocker in Dietikon-Z\u00fcrich.;Koch vnd Kellermeisterey 1574.\nAuthor: anon.\nTitle: Koch vnd Kellermeisterey. Von allen Speisen vnd Getr\u00e4ncken / viel guter heimlicher k\u00fcnst / Auch wie man Latwergen / Salsen / Confect / Conseruen / vnnd Einbeytzung machen sol / Von mancherley Fr\u00fcchten / Bl\u00fcmen / Kr\u00e4utern / vnd Wurtzelen / Einem jeden im Hau\u00df sehr notwendig vn[-] n\u00fctzlich zugebrauchen. Jetzund von neuwem wider ersehen / vnd mit lustigen Figuren durchau\u00df geziret. Getruckt zu Franckfort am Mayn / M. D. LXXIIII.\nFirst edition: ca. 1485.\nFurther editions: 1547 Frankfurt a. M.: Hermann G\u00fclfferich, 1551 ibid., 1554 ibid., ca. 1556 Frankfurt a. M.: Han Weygand, 1557 ibid., 1559 Stra\u00dfburg: Christian M\u00fcller, ca. 1562 Frankfurt a. M.: Han Weygand und Georg Raben, 1564 Frankfurt a. M.: Egenolffs Erben, 1566 Frankfurt a. M.: Thomas Rebart, 1566 [Frankfurt a. M.: Egenolffs Erben], 1570 [Frankfurt a. M.: Thomas Rebart?], 1571 Frankfurt a. M.: Catherine Rebart f\u00fcr Kil. Han, 1574 Frankfurt a. M.: Egenolffs Erben, 1576 Frankfurt a. M.: Nicholas Basse, 1581 Frankfurt a. M.: Egenolffs Erben, 1581 Stra\u00dfburg: Christian M\u00fcllers Erben, 1587 Frankfurt a. M.: Nicholas Basse, 1660 Erfurt, 1581 Frankfurt a. M.: Feyerabend (= Meister Sebastian, s. dort), 1674 Basel: E. K\u00f6nig und Sohn (= Neu wolzugerichtetes Kochb\u00fcchlein...), 1684 Magdeburg.\nComments: the edition used for this corpus is the copy at Herzog August Bibliothek of 1574.;Colerus 1602.\nAuthor: Coler(us), Johannes.\nTitle: OECONOMIA. Oder Hauszbuch. M: IOHANNIS COLERI. Erste Theil. Zum Calendario Oeconomico & perpetuo geh\u00f6rig. Darinnen begriffen vnnd au\u00dff\u00fchrlichen erkleret ist / Wie ein Hauswirth nach dem jhn Gott der Allmechtige gesegnet / ferner seine Nahrung nechst Gott anstellen sol / auch fruchtbarlichen geniessen vnd gebrauchen: Aldieweil in solchem angezeigt wird / wie ein Hauswirth erstlich sein Gesinde wol regieren sol / hernach / von allerley sachen zur Hau\u00dfhaltung geh\u00f6rig / Als von Brawen / Backen / Bleichen / Wein-bergen / G\u00e4rten / H\u00f6ltzung / Ackerbaw / Viehzucht / Jagten / Fisch vnd Vogelfang / Endlich von einer Hau\u00dfartzney oder Hau\u00dfapotecken vor den gemeinen Man. Jetzd auffs New vbersehen / corrigirt vnd verbessert in Druck gegeben. Mit R\u00f6m. Key. May. Freyheit nicht nachzudrucken. Wittemberg / In vorlegung Paul Helwigs Buchf\u00fchrers daselbst. Anno 1602.\nFirst edition: Kalender 1593, the three parts of the Oeconomia 1596, 1598 und 1600.\nFurther editions: it is difficult to keep track of them. Numerous editions during S. XVI and XVII with variations regarding to title, place and editor: 1602, 1604\u201307, 1620, 1645\u201356, 1665, 1672, 1680, 1692, 1711.\nComments: the edition for this corpus is the 1602 one, which contains a cookbook with 200 recipes.;Deckhardt 1611.\nAuthor: Deckhardt, Johann.\nTitle: New / Kunstreich vnd N\u00fctzliches Kochbuch Darinn allerley n\u00fctzliche vnd seltzame Speisen vnd Trachten / nicht allein von Wildpret / Vogeln / Fischen vnd Fleisch / sondern auch gebackener / al\u00df M\u00fcrtzepanen / Dortten / Pastetten / Kuchen vnd dergleichen / f\u00fcr allerley Stands personen / Auch in allerley Hau\u00dfhaltungen / vnd nach gelegenheit der zeit / Gasterey vnd Pancketen / oder sonsten / wie dergleichen vffn nohtfall f\u00fcr krancke Leute schnell vnd balde / mit geringen vnd leichten Vnkosten zuvorfertigen / Beschrieben durch Johan[-] Deckhardt / weiland Churf: S\u00e4ch\u00df: K\u00fcchenschreiben zu Dre\u00dfden. Gedruckt / in verlegung Henning Gro\u00dfen des \u00e4ltern / Buchh\u00e4ndlers zu Leipzig. Anno M. DC. XI.\nFirst edition: unknown.\nFurther editions: unknown.\nComments: the edition for this corpus is the copy at NLB Hannover.;Stockholm 1647.\nAuthor: D[ietlev] M[ajus].\nTitle: D. M. Stockholmisch Koch Gespreches Vortrab / zwischen zweyen K\u00fcchinnen / von vnterscheidt / Ahrt / Natur vnd eigenschaft / zu auffenthalt Leibes vnd Lebendes / der Victualien, Vegetabilien Gew\u00fcrtzen / Perselen vnd Accidentalien, hiesiger vnd Au\u00dfl\u00e4ndischer / wie dieselbige recht Ihrer Natur nach / zubereite[-] / Das geringe f\u00fcr dem guten zuerkennen vnd zuvnterzuscheiden. Auff guthertziger Leute Begeren zum andern mahl Gedruckt / vnd verleget Durch Peter Van Selow Stockholm Anno 1647.\n[auf der R\u00fcckseite des Titelblattes handschriftlich erg\u00e4nzt (modern, Bleistift): \u201eD[ietlev] M[ajus]\u201c].\nFirst edition: unknown.\nFurther editions: unknown.\nComments: the edition for this corpus is the copy at Herzog August Bibliothek.;Prasmofsky 1671.\nAuthor: Prasmofsky, Stanislaus.\nTitle: Neu=verfertigtes vollst\u00e4ndiges Koch=Buch / Das ist : Gr\u00fcndliche Beschreibung / oder deutliche Anweisung / wie man allerley herrlich= und geringe Fleisch= Fisch= Gefl\u00fcgel= Wildbrett= gesottene= gebratene= gebachene= auch Pasteten=Speisen / sambt mancherley Zugem\u00fcsen oder Zwischen=Gerichten / k\u00f6stlich / delicat, und k\u00fcnstlich bey Hochzeiten / Kind=Tauffen / Gastereyen / auch sonsten ins gemein f\u00fcr Gesunde und Krancke / auf ein-heimische und frembde Manier kochen und zubereiten kan. Mit beygef\u00fcgtem Unterricht / Allerhand Confect / Latwergen / S\u00e4fft und andere eingemachte Sachen zuzurichten. Darbey auch ein vollst\u00e4ndiges und n\u00fctzliches Register zu finden / Durch Stanislaum Prasmofsky, E. H. J. gewesnen Mund=Koch. N\u00fcrnberg / Gedruckt und verlegt bey Johan[-] Philip Milten-berger / 1671.\nFirst edition: 1671.\nFurther editions: 1685 N\u00fcrnberg: Joh. Hofmann.\nComments: the edition for this corpus is the copy at Herzog August Bibliothek of the 1671.;Wecker 1679.\nAuthor: Wecker, Anna.\nTitle: Neu / k\u00f6stlich vnd nutzliches Koch=Buch / Jn welchem kurtzlich begriffen / Wie aller-hand k\u00fcnstliche Speisen / so wol von zahmen als wilden Thieren: V\u00f6gel vnd Federwildbr\u00e4t ... [2. Teil mit neuem Titelblatt]: Parisische K\u00fcchenmeister / Das ist: Jetziger Zeit verleckerte Franz\u00f6sische Art un[-] Manier / Allerhand Speisen bey k\u00f6stlichen Pancketen und Haus-haltungen zu kochen und zuzurichten. [1679 Basel: Emanuel K\u00f6nig und S\u00f6hne].\nFirst edition: in this form 1667 ibid., originally 1597 Amberg: Forster.\nFurther editions: in this form 1697 Hamburg, originally see Wecker 1598.\nComments: the edition for this corpus is the copy at Herzog August Bibliothek of the 1679. Moreover, was analyzed Wecker 1598.;Thieme 1682.\nAuthor: Thieme, Johann Christoph.\nTitle: Haus= Feld= Arzney= Koch= Kunst= und Wunder=Buch. Das ist: Ausf\u00fchrliche Beschreib= und Vorstellung / Wie ein kluger Hausvatter und sorgf\u00e4ltige Hausmutter / wes Standes und W\u00fcrden sie auch immermehr seyn m\u00f6gen / mit vortrefflichem Nutzen und er-sprie\u00dflichem Nahrungs=Aufnehmen / ihr Haus=Wesen f\u00fchren / und / durch Gottes reichen Segen / auf ihre Nachkommen h\u00f6chst=gl\u00fccklich fortpflanzen m\u00f6gen. Alles / um richtiger Ordnung willen / in zwanzig Abtheilungen enthalten / Darinn folgende Sachen abgehandelt werden: I. Von der Haushaltung insgemein. II. Vom Feld= und Ackerbau. III. Vom Gartenbau. IV. Vom Weinbau. V. Vom Haus= Feld= und Garten=Kalender. VI. Vom Bierbrauen. VII. Vom Kochen. IIX. Vom Trinchiren. IX. Vom Confitiren / Candiren und Zuckerbachen. X. Von den Bienen. XI. Vom Wild= und Waidwerk. XII. Von Pfleg= und Wartung der Pferde. XIII. Von der Viehzucht. XIV. Vom Vogelfang. XV. Von der Fischerey. XVI. Von be-w\u00e4hrten Arzneyen / sowol f\u00fcr Manns= als Weibspersonen. XVII. Vom Distilliren. XIIX. Von heilsamen Kr\u00e4utern. XIX. Von Rarit\u00e4ten und Wunder=K\u00fcnsten. XX. Von zierlicher Brief-stellung. Wo [ein Wort unleserlich] zusamm getragen / und mit sch\u00f6nen hierzu dienlichen Kupfern gezieret / von Johann Christoph Thiemen. Mit R\u00f6m. K\u00e4iserl. Majest\u00e4t Gn\u00e4digstem Privilegio. N\u00fcrnberg / In Verlegung Johann Hofmanns / Buch= und Kunsth\u00e4ndlers. Daselbst gedruckt bey Andreas Knorzen. Im Jahr Christi 1682.\n[Title of the cookbook:] De\u00df Haus= Feld= Arzney= Koch= Kunst= und Wunder= Buchs Siebender Theil / Vom Kochen. Wie man nemlich auf unterschiedliche Art und Weise allerhand Fleisch / Wildpret / Gefl\u00fcgel / Fisch / Eyer / und Garten=Speisen wolgeschmacklich zubereiten solle.\nFirst edition: 1682.\nFurther editions: 1687, 1690, 1694, 1700.\nComments: the edition for this corpus is the copy at the Herzog August Bibliothek of 1682.;Gr\u00e4tz 1686.\nAuthor: anon.\nTitle: Ein Koch= Und Artzney=Buch. Gedruckt zu Gr\u00e4tz / Bey denen Widmanstetterischen Erben. 1686.\nFirst edition: 1686 (Weiss 1996:271, Nr. 1982).\nFurther editions: 1688, 1696 (gleicher Verlag); die 3. Aufl. 1696 unter dem Titel \u201aEin sehr nutzbares Koch- und Arzneybuch\u2018 (Weiss 1996:271, Nr. 1982).\nComments: the edition for this corpus is the version of 1789 as transcribed and published by Thomas Gloning. http://www.uni-giessen.de/gloning/tx/graz2.htm;Osnabr\u00fcck 1687.\nAuthor: anon.\nTitle: Gantz neu=vermehrter Sorgf\u00e4ltiger Hau\u00df=Halter/ Begreiffend einen Nutz= und Lust= bringenden Baum= K\u00fcchen= und Blumen=Garten Welcher gestalt solcher nach bester Form gegr\u00fcndet / getheilet / ged\u00fcnget / bes\u00e4et / bepflantzet / rc. mit sch\u00f6nem Teutsch= und Frantz\u00f6sischen Laubwerck / Blumen=Feldern / Lust=G\u00e4ngen und H\u00fctten / Pyramiden und Sonnen Uhren gezieret / auch was sonsten im Hau\u00dfwesen durchs gantze Jahr Monatlich be-obachtet und n\u00fctzlichst gebraucht werden k\u00f6nne; Sambt einem Dreyfachen (1) Dessen Abtheilung= (2) Benahmung= und (3) Medicinischen Gebrauch in sich enthaltendem Register; Deme beygef\u00fcgt ein sch\u00f6nes nach Teutsch= und Frantz\u00f6sischer Manier eingerichttes Koch= Condir- und Distillir-Buch / Nebst Noch einem zwar kleinen doch auserlesnen Artzney= B\u00fcch-lein Dessen man / sonderlich auff dem Lande / in Ermanglung eines Medici, oder anderer grosser Kosten / f\u00fcr sich und sein unterhabendes Vieh / als Pferde / K\u00fche / Schaf und Schwein / rc. allen falls heilsamlich zu bedienen; Allen vielf\u00e4ltig=hiernach verlangten Lieb-habern Zu sonderbarem n\u00fctzlichen Vergn\u00fcgen mit grossem Flei\u00df durch und durch verbessert / und mit vielen neuen deutlichern Figuren vermehrt herau\u00df gegeben. Osnabr\u00fcck / Druckt und verlegt von J. Wolffg. Distner / 16[?]7. \nFirst edition: unknown, but probably 1674 Osnabr\u00fcck: Schw\u00e4nder.\nFurther editions: 1677, 1678 (Osnabr\u00fcck: Schw\u00e4nder), 1696 (Osnabr\u00fcck: Krum-bein/Schorlemer).\nComments: the edition for this corpus is the copy at the Herzog August Bibliothek of 1687.;Schuppe 1698.\nAuthor: Schuppe, Hans.\nTitle: Traiteur \u00e0 la mode, Welcher der delicaten und neu begierigen Welt zu sonderbaren Nutzen darleget. Ein neu woleingerichtetes oder zusammen=getragenes Koch=Buch / Worinn mit h\u00f6chster Lust zu finden / Wie man / so wol Hoch=F\u00fcrstlich= als anderer vornehmer H\u00f6fe Taffeln / nach bester Manier des heutigen Etats / mit wolschmeckenden Speisen galant be-stellen und versehen k\u00f6nne / Als: Mit Potagen von allerhand Wildpret und zahmen Fleisch / Wild und zahmen Gefl\u00fcgel=Werck / Fisch und Garten=Gew\u00e4chsen / wie auch Tarten / Past\u00e4ten / und ander Gebackens; imgleichen Milch=Speisen / Gallerten / Fricass\u00e9en, Ragoun, Mandeln / Eyer / Morcheln und Champignons und also bi\u00df 374 Species, welche im Register aufzuschlagen sind; Item: Von allerhand Braten / Wie dieselben ordinirt und angerichtet werden sollen / Worbey ein und zwantzig curieuse Taffeln / in guten Form= und Ordnungen / darauff die angerichtete Speisen schicklich in ein=ander zu setzen / zu finden / Auf viel-f\u00e4ltiges Ansuchen / jederm\u00e4nniglich / absonderlich der Koch=Kunst Liebhabern / mitgetheilet von Hans Schuppen [/ der Hochf\u00fcrstl [sic, ohne Punkt] Durch. zu Holstein Pl\u00f6en / itziger Zeit bestalten Mund=Koch. L\u00fcbeck und Leiptzig / bey Peter B\u00f6ckmann. PLOEN / Gedruckt durch Tobias Schmidt / F\u00fcrstl. Buchdr. 1698.].\nFirst edition: 1698.\nFurther editions: 1702 L\u00fcbeck und Leipzig: Peter B\u00f6ckmann, 1709 ibid., 1729 ibid.\nComments: the edition for this corpus is the copy at the Herzog August Bibliothek of 1698.;Buchinger 1700.\nAuthor: [Buchinger, Bernardin (Bernhard)].\nTitle: Koch=buch So wol F\u00fcr Geistliche als auch Weltliche grosse und geringe Hau\u00dfhaltungen / wie bey denen t\u00e4glich vil Leut am f\u00fcglichsten abgespeiset werden. Darinn \u00dcber die achthunderterley Fleisch / Wildprett / Gefl\u00fcgel / Fisch // Eyer / und Garten=Speisen / auch die Manier und Wei\u00df selbige zubereiten / Neben anderen nutzlichen Hau\u00dfhaltung= St\u00fccklein / zu finden und begriffen sind. Durch Einen geistlichen Kuchen=Meister de\u00df Gottshauses L\u00fctzel beschriben und practicirt. Zum dritten mal auffgelegt und vermehrt. Lautterbach. Basel / bey Johann Conrad von Mechel / Im Jahr 1700.\nFirst edition: 1671, Molsheim: Straubhaar.\nFurther editions: 1672 M\u00fchlhausen: Meyer; 1700 Lautterbach; 1706 Basel.\nComments: the edition for this corpus is the copy at the Herzog August Bibliothek of 1700.;Keyl 1705.\nAuthor: Blancard, Stephan; translated by Georg von Keyl, called Cunaeus.\nTitle: STEPH. BLANCARDI, Med. Doct. H\u00f6chst=n\u00fctzliches und zu einem langwierigen Leben anleitendes Speise= und Tisch=B\u00fcchlein / Wie man ohne Kranckheit leben k\u00f6nne / Darinnen von jeder Speise und Tranck insonderheit gehandelt wird / und nach Teutschlandes Gelegen-heit mit Flei\u00df eingerichtet / und aus der Niederl\u00e4ndischen in die Hochteutsche Sprache \u00fcber-setzet von Georg von Keyl / genandt CUN\u00c6US, Med. Doct. deme noch beygef\u00fcget / Der allzeitfertige Koch / und perfecte Speisemeister / Handelt / wie und auf was Art und Weise so wohl Teutsch= Englisch= Polnisch= als Frantz\u00f6sische Spei[mit Signatur \u00fcberklebt] niedlich und wohl zuzurichten / [..., siehe Titelblatt Koch und Speisemeister] Franckfurth und Leipzig / [???] Gottfried Freytag / Buchh\u00e4ndler Hannover und Wolffenb\u00fcttel / 1705.\n[Mit eigenem Titelblatt nach S. 80 des Werkes von Blancard:] Der allzeit fertige Koch / und Perfecte Speise= Meister / Auf was Art und Weise / so wohl Teutsche / Englische / Polen /als Frantzosen ihre Speisen niedlich und wohl zurichten. Allen Hau\u00df=V\u00e4tern und M\u00fcttern h\u00f6chst=n\u00f6thig und diensam.\nFirst edition: 1659, 1689.\nFurther editions: 1695 in Frankfurt and Leipzig.\nComments: the edition for this corpus is the copy at the Herzog August Bibliothek of 1705.;Hohberg 1715.\nAuthor: Hohberg, Wolf Helmhard von.\nTitle: Herrn von Hohbergs GEORGICA CURIOSA AUCTA. Oder: Adelichen Land= und Feld=Lebens Auf alle in Teutschland \u00fcbliche Land= und Haus=Wirthschafften / in Zw\u00f6lff B\u00fcchern wohleingericht=Neuerfundener Dritter Theil / In welchem / gantz besondere zu diesem Zweck / sehr curiose Materien / deren man sich / mit grossem Nutzen / und seiner Vergn\u00fcgung bedienen kan / enthalten; auch was / bevorab in den beeden Theilen / kurtz oder gar nicht ber\u00fchrt / nunmehro vollst\u00e4ndig / deutlich / und aufs accurateste elaborirt; Nebenst allerhand raren Erfindungen und Experimentis, auch mit m\u00f6glichstem Flei\u00df ausgef\u00fchret worden. Deme zum Beschlu\u00df / Ein bew\u00e4hrtes / meistens aus eigener Erfahrenheit / und unter-schiedlich=practicirten Manuscriptis, wohleingericht=sehr nutzliches Koch=Buch beygef\u00fcget ist. Alles / mit hierzu beh\u00f6rigen vollkommenen Registern / auch dienlichen Kupffern bestens versehen. Cum Gratia & Privilegio Sacr\u00e6 C\u00e6sare\u00e6 & Catholic\u00e6 Majestatis. N\u00fcrnberg / Jn Verlegung Martin Endters. Jm Jahr Christi 1715.\n[Das Kochbuch hat ein eigenes Titelblatt:] Bew\u00e4hrtes wohleingerichtetes Koch=Buch / Welches Von einer sorgf\u00e4ltigen Liebhaberin dieser sch\u00f6nen Wissenschaft / meistens selbst practicirt / mit ohnerm\u00fcdetem Flei\u00df zusammen getragen / und in 16. Capiteln eingetheilet worden. Ingleichen ist aus denen Kupffern / wie eine Tafel / auf unterschiedliche Arten / mit Speissen / Pyramiden / rc. zierlich und ordentlich zu rangiren / aufzutragen / auch zu changiren / klar und deutlich zu ersehen: Nicht weniger befindet sich am Ende ein voll-kommenes Register / alles Innhalts beygef\u00fcgt.\nFirst edition: 1682.\nFurther editions: 1687, 1695, 1701\u201305; 1749, N\u00fcrnberg.\nComments: the edition for this corpus is the copy at the Herzog August Bibliothek of 1715.;Danckwerth 1729.\nAuthor: Danckwerth, Christian Heinrich.\nTitle: Wohleingerichtetes Koch=Buch, Oder: Gr\u00fcndliche Anweisung.\nI. Die Speisen auf mancherley Art und Weise angenehm und wohlschmeckend, nicht weniger zur Gesundheit dienlich zuzurichten.\nII. Ferner von Conservation der in der Hau\u00df=//haltung und K\u00fcchen v\u00f6thigen Speisen und Victualien.\nIII. Zur Wissenschaft der Candier- und Confitier-Kunst.\nIV. Unterricht, Wolle und leinen Garn, Tuch und Zeuge nach allerhand Couleuren zu f\u00e4rben, zum Druck bef\u00f6rdert durch Christian Heinrich Danckwerth.\nHANOVER Verlegts Nicolaus F\u00f6rster und Sohn, 1729.\nFirst edition: probably 1729.\nFurther editions: 1769.\nComments: the edition for this corpus is the copy at the Herzog August Bibliothek of 1729.;Franckfurt 1789.\nAuthor: anon.\nTitle: Das kleine jedermann n\u00fctzliche und wohleingerichtete Franckfurter Koch=Buch, worinnen ganz leicht zu erlernen, wie allerley Speisen gut und schmackhaft zuzubereiten sind, Ehedem von einer in der Koch=Kunst erfahrnen angesehenen hiesigen Haus=Frau zum eigenen Gebrauch in Druck gegeben, Nunmehro aber wegen dessen allgemeinen Nutzen \u00f6ffentlich und in etwas vermehrt auch von Fehlern gereinigt herausgegeben. Vierte Auflage. Franckfurt am Mayn, in der J\u00e4gernschen Buchhandlung, 1789.\nFirst edition: unknown.\nFurther editions: 1804 Frankfurt.\nComments: the edition for this corpus is the version of 1789 as transcribed and published by Silvia Micha, Christina Muth, Mascha Schacht and Thomas Gloning. http://www.uni-giessen.de/gloning/tx/1789ffkb.htm;Knopf 1800.\nAuthor: J.D. Knopf\nTitle: Neues / Hann\u00f6verisches / Kochbuch. / Jn zwey Theilen. / Verbessert und vermehret / von / einem praktischen Koche. / Neueste Ausgabe. / Hannover, / bey den Gebr\u00fcdern Hahn. / 1800. \nFirst edition: unknown.\nFurther editions: unknown.\nComments: the edition for this corpus is the version of 1800 as transcribed and published by Katrin Leppert, Kristin L\u00fcckel and Thomas Gloning. http://www.uni-giessen.de/gloning/tx/1800hakb.htm;rezeptewiki\nTitle: Rezepte-Wiki\nComments: the edition for this corpus is the XML dump (06/11/2012) provided at http://www.rezeptewiki.org/wiki/Rezepte-Wiki:Offline#XML-Dump;deu;Wurm, A. (2008). Translatorische Wirkung: ein Beitrag zum Verst\u00e4ndnis von \u00dcbersetzungsgeschichte als Kulturgeschichte am Beispiel deutscher \u00dcbersetzungen franz\u00f6sischer Kochb\u00fccher in der Fr\u00fchen Neuzeit. (A. Gil, J. Haller, & E. Steiner, Eds.) (p. 228). Frankfurt am Main, Berlin, Bern, Bruxelles, New York, Oxford, Wien: Peter Lang.;Amoia, M., Mart\u00ednez Mart\u00ednez, J. M., Teich, E., Kermes, H., Knappen, J. & A. Wurm (2013). A Diachronic Comparable Corpus of German Recipes. In Proceedings of the Conference on Corpora and Tools in Linguistics, Languages, and Speech, July 2013, Strasbourg, France.;Amoia, M. & Mart\u00ednez Mart\u00ednez, J. M. (2013). Using Comparable Collections of Historical Texts for Building a Diachronic Dictionary for Spelling Normalization. In Proceedings of the ACL 2013 workshop on Language Technology for Cultural Heritage, Social Sciences, and Humanities (LaTeCH 2013), August 2013, Sofia, Bulgaria.;Schmid, H. (1994). Probabilistic Part-of-Speech Tagging Using Decision Trees. Proceedings of International Conference on New Methods in Language Processing. Manchester.;STTS tagset http://www.ims.uni-stuttgart.de/forschung/ressourcen/lexika/TagSets/stts-table.html;CLARIN-D/SfS-Uni. T\u00fcbingen. 2012. WebLicht: Web-Based Linguistic Chaining Tool. Online. Date Accessed: 18 Jun 2013. URL https://weblicht.sfs.uni-tuebingen.de;Germany, Austria and Switzerland.;The SaCoCo Diachronic Corpus as a whole is released under a Creative Commons Attribution - Non Commercial - Share Alike 3.0 Unported License. (CC BY NC SA 3.0) http://creativecommons.org/licenses/by-nc-sa/3.0/;The recipes belonging to Knopf 1800, Franckfurt 1789 and Gr\u00e4z 1686 contained in the SaCoCo Historical Corpus are released under a Creative Commons Attribution - Non Commercial - Share Alike 3.0 Unported License. (CC BY NC SA 3.0) http://creativecommons.org/licenses/by-nc-sa/3.0/;The SaCoCo Contemporary Corpus is released under a Creative Commons Attribution - Share Alike 3.0 Unported License. (CC BY SA 3.0) http://creativecommons.org/licenses/by-sa/3.0/;All the recipes of the SaCoCo Historical Corpus (but Knopf 1800, Franckfurt 1789 and Gr\u00e4z 1686) are released under a Creative Commons Attribution 3.0 Unported License. (CC BY 3.0) http://creativecommons.org/licenses/by/3.0/",
    "group": "clarin",
    "groups": [
        {
            "name": "clarin"
        }
    ],
    "name": "dc07d2a2-b244-5216-83fd-a0d1f993c7a7",
    "notes": [
        "The Saarbr\u00fccken Cookbook Corpus is a diachronic corpus made up of cooking recipes organized into two different collections: historical and contemporary.\nThe historical component contains a selection of recipes from different works. The full nomina of sources can be found listed as sources in the metadata. These recipes were collected and transcribed by Andrea Wurm as part of her PhD. For more information see Wurm 2007.\nThe contemporary component contains cooking recipes from rezeptewiki.org. The selection criteria were temporal (only the last version of the recipe) and geographical (only recipes belonging to German speaking regions). The address of the wiki dump is provided in sources.\n\nANNOTATION:\nThe corpus contains two types of annotation: structural and positional.\n\nStructural annotation is written in XML and provides a description of the textual structure, on the one hand, and metatextual information and shallow semantics, on the other hand.\n\nSTRUCTURAL ATTRIBUTES:\nmetadata: id, collection, source, url, year, decade, period, language, ref;\nshallow semantics: type, course, cuisine, ingredient, method;\nstructure: title, body, segment, paragraph, sentence.\n\nPositional annotation is provided at token level containing linguistic information.\n\nPOSITIONAL ATTRIBUTES:\nword form;\nPOS (TreeTagger, STTS tagset);\nlemma (TreeTagger);\nnormalized form (automatic normalization using the algorithm described in Amoia and Mart\u00ednez Mart\u00ednez 2013)."
    ],
    "oai_identifier": [
        "oai:fedora.clarin-d.uni-saarland.de:clarind-uds:sacoco"
    ],
    "oai_set": "",
    "state": "active",
    "tags": [
        {
            "name": "corpus linguistics"
        },
        {
            "name": "historical linguistics"
        },
        {
            "name": "early modern age"
        },
        {
            "name": "cooking recipe"
        },
        {
            "name": "cookbook"
        }
    ],
    "title": [
        "SaCoCo Saarbr\u00fccken Cookbook Corpora"
    ],
    "url": ""
}