{
    "Contact": [
        "Charles University, Faculty of Mathematics and Physics, Institute of Formal and Applied Linguistics (UFAL)"
    ],
    "DiscHierarchy": [
        "1.4",
        "Humanities",
        "Linguistics"
    ],
    "Discipline": "Linguistics",
    "Format": [
        "application/zip",
        "downloadable_files_count: 1",
        "text/plain; charset=utf-8"
    ],
    "Language": [
        "Czech"
    ],
    "MetaDataAccess": "https://clarin-pl.eu/oai/request?verb=GetRecord&metadataPrefix=oai_dc&identifier=oai:lindat.mff.cuni.cz:11234/1-2542",
    "MetadataAccess": [
        "oai:lindat.mff.cuni.cz:11234/1-2542"
    ],
    "PID": "http://hdl.handle.net/11234/1-2542",
    "PublicationTimestamp": "2017-07-01T11:59:59Z",
    "PublicationYear": [
        "2017"
    ],
    "Publisher": [
        "Charles University, Faculty of Mathematics and Physics, Institute of Formal and Applied Linguistics (UFAL)"
    ],
    "ResourceType": [
        "toolService"
    ],
    "Rights": [
        "Creative Commons - Attribution-NonCommercial-ShareAlike 4.0 International (CC BY-NC-SA 4.0)",
        "http://creativecommons.org/licenses/by-nc-sa/4.0/",
        "PUB"
    ],
    "author": [
        "Bej\u010dek, Eduard",
        "Mikulov\u00e1, Marie"
    ],
    "fulltext": "oai:lindat.mff.cuni.cz:11234/1-2542;2018-07-02T22:05:49Z;hdl_11858_00-097C-0000-0001-486F-D;hdl_11858_00-097C-0000-0001-4877-A;ForFun 1.0;Mikulov\u00e1, Marie;Bej\u010dek, Eduard;form;function;database;syntax;ForFun is a database of linguistic forms and their syntactic functions built with the use of the multi-layer annotated corpora of Czech, the Prague Dependency Treebanks. The purpose of the Prague Database of Forms and Functions (ForFun) is to help the linguists to study the form-function relation, which we assume to be one of the principal tasks of both theoretical linguistics and natural language processing.\r\n\r\nA prototypical question to be asked is \"What purposes does a preposition 'po' serve for\" or \"What are the linguistic means in the sentence that can express the meaning 'a destination of an action'?\". There are almost 1500 distinct forms (besides the 'po' preposition) and 65 distinct functions (besides the 'destination').;2017-12;toolService;http://hdl.handle.net/11234/1-2542;ces;Creative Commons - Attribution-NonCommercial-ShareAlike 4.0 International (CC BY-NC-SA 4.0);http://creativecommons.org/licenses/by-nc-sa/4.0/;PUB;application/zip;text/plain; charset=utf-8;downloadable_files_count: 1;Charles University, Faculty of Mathematics and Physics, Institute of Formal and Applied Linguistics (UFAL);https://ufal.mff.cuni.cz/ForFun",
    "group": "clarin",
    "groups": [
        {
            "name": "clarin"
        }
    ],
    "name": "dca0efbd-342c-5548-aad0-88f6027149ef",
    "notes": [
        "ForFun is a database of linguistic forms and their syntactic functions built with the use of the multi-layer annotated corpora of Czech, the Prague Dependency Treebanks. The purpose of the Prague Database of Forms and Functions (ForFun) is to help the linguists to study the form-function relation, which we assume to be one of the principal tasks of both theoretical linguistics and natural language processing.\r\n\r\nA prototypical question to be asked is \"What purposes does a preposition 'po' serve for\" or \"What are the linguistic means in the sentence that can express the meaning 'a destination of an action'?\". There are almost 1500 distinct forms (besides the 'po' preposition) and 65 distinct functions (besides the 'destination')."
    ],
    "oai_identifier": [
        "oai:lindat.mff.cuni.cz:11234/1-2542"
    ],
    "oai_set": [
        "hdl_11858_00-097C-0000-0001-486F-D",
        "hdl_11858_00-097C-0000-0001-4877-A"
    ],
    "state": "active",
    "tags": [
        {
            "name": "form"
        },
        {
            "name": "function"
        },
        {
            "name": "database"
        },
        {
            "name": "syntax"
        }
    ],
    "title": [
        "ForFun 1.0"
    ],
    "url": ""
}