{
    "Contact": [
        "Jazykovedn\u00fd \u00fastav \u013d. \u0160t\u00fara Slovenskej akad\u00e9mie vied"
    ],
    "DiscHierarchy": [
        "1.4",
        "Humanities",
        "Linguistics"
    ],
    "Discipline": "Linguistics",
    "Format": [
        "text/plain; charset=utf-8",
        "application/x-gzip",
        "downloadable_files_count: 1"
    ],
    "Language": [
        "Slovak"
    ],
    "MetaDataAccess": "https://clarin-pl.eu/oai/request?verb=GetRecord&metadataPrefix=oai_dc&identifier=oai:lindat.mff.cuni.cz:11234/1-1822",
    "MetadataAccess": [
        "oai:lindat.mff.cuni.cz:11234/1-1822"
    ],
    "PID": "http://hdl.handle.net/11234/1-1822",
    "PublicationTimestamp": "2016-11-07T11:59:59Z",
    "PublicationYear": [
        "2016"
    ],
    "Publisher": [
        "Jazykovedn\u00fd \u00fastav \u013d. \u0160t\u00fara Slovenskej akad\u00e9mie vied"
    ],
    "ResourceType": [
        "corpus"
    ],
    "Rights": [
        "Creative Commons - Attribution-ShareAlike 4.0 International (CC BY-SA 4.0)",
        "http://creativecommons.org/licenses/by-sa/4.0/",
        "PUB"
    ],
    "author": [
        "Gajdo\u0161ov\u00e1, Katar\u00edna",
        "\u0160imkov\u00e1, M\u00e1ria",
        "et al."
    ],
    "fulltext": "oai:lindat.mff.cuni.cz:11234/1-1822;2018-07-02T22:05:49Z;hdl_11858_00-097C-0000-0001-486F-D;hdl_11858_00-097C-0000-0001-4877-A;Slovak Dependency Treebank;Gajdo\u0161ov\u00e1, Katar\u00edna;\u0160imkov\u00e1, M\u00e1ria;et al.;dependency;treebank;syntax;morphology;Slovak Dependency Treebank (Slovensk\u00fd z\u00e1vislostn\u00fd korpus) was created as part of the Slovak National Corpus at the \u013d. \u0160t\u00far Institute of the Slovak Academy of Sciences. The annotation follows the guidelines of the Prague Dependency Treebank (Czech), slightly modified in the spirit of Slovak grammatical tradition. Morphological tags, lemmas and dependency relations have been assigned manually to every word.\r\n\r\nThe present dataset is a subset of the original treebank. We automatically selected the sentences where the two human annotators 100% agreed on the analysis. This increases the quality and trustworthiness of the data but it also results in selecting short sentences most of the time. An extended version may be published in the future when manually merged and checked annotation is available.\r\n\r\nThe selected sentences have been converted to the CoNLL-X file format (original token IDs are preserved in the FEATS column). This PDT-style annotation will serve as the source for the first Slovak dataset in the Universal Dependencies (to be published separately).;2016-11-07;corpus;http://hdl.handle.net/11234/1-1822;slk;Creative Commons - Attribution-ShareAlike 4.0 International (CC BY-SA 4.0);http://creativecommons.org/licenses/by-sa/4.0/;PUB;application/x-gzip;text/plain; charset=utf-8;downloadable_files_count: 1;Jazykovedn\u00fd \u00fastav \u013d. \u0160t\u00fara Slovenskej akad\u00e9mie vied;http://korpus.juls.savba.sk/",
    "group": "clarin",
    "groups": [
        {
            "name": "clarin"
        }
    ],
    "name": "ddbc6e1f-c1f4-51d5-8186-6c7ac58588e7",
    "notes": [
        "Slovak Dependency Treebank (Slovensk\u00fd z\u00e1vislostn\u00fd korpus) was created as part of the Slovak National Corpus at the \u013d. \u0160t\u00far Institute of the Slovak Academy of Sciences. The annotation follows the guidelines of the Prague Dependency Treebank (Czech), slightly modified in the spirit of Slovak grammatical tradition. Morphological tags, lemmas and dependency relations have been assigned manually to every word.\r\n\r\nThe present dataset is a subset of the original treebank. We automatically selected the sentences where the two human annotators 100% agreed on the analysis. This increases the quality and trustworthiness of the data but it also results in selecting short sentences most of the time. An extended version may be published in the future when manually merged and checked annotation is available.\r\n\r\nThe selected sentences have been converted to the CoNLL-X file format (original token IDs are preserved in the FEATS column). This PDT-style annotation will serve as the source for the first Slovak dataset in the Universal Dependencies (to be published separately)."
    ],
    "oai_identifier": [
        "oai:lindat.mff.cuni.cz:11234/1-1822"
    ],
    "oai_set": [
        "hdl_11858_00-097C-0000-0001-486F-D",
        "hdl_11858_00-097C-0000-0001-4877-A"
    ],
    "state": "active",
    "tags": [
        {
            "name": "dependency"
        },
        {
            "name": "treebank"
        },
        {
            "name": "syntax"
        },
        {
            "name": "morphology"
        }
    ],
    "title": [
        "Slovak Dependency Treebank"
    ],
    "url": ""
}