{
    "Contact": [
        "Oxford Text Archive, University of Oxford"
    ],
    "Contributor": [
        "Arts and Humanities Research Board (AHRB)",
        "British Academy",
        "Modern Humanities Research Association",
        "Magner, Carol",
        "Yeandle, David N."
    ],
    "DiscHierarchy": [
        "1.4",
        "Humanities",
        "Linguistics"
    ],
    "Discipline": "Linguistics",
    "Format": [
        "(1 file : tbc)"
    ],
    "Language": [
        "German"
    ],
    "MetaDataAccess": "https://clarin-pl.eu/oai/request?verb=GetRecord&metadataPrefix=oai_dc&identifier=oai:ota:oucs:2459",
    "MetadataAccess": [
        "oai:ota:oucs:2459"
    ],
    "PublicationTimestamp": "2002-07-01T11:59:59Z",
    "PublicationYear": [
        "2002"
    ],
    "Publisher": [
        "Oxford Text Archive, University of Oxford"
    ],
    "ResourceType": [
        "Text",
        "Myths and legends--13th century"
    ],
    "Rights": [
        "Use of this resource is restricted in some manner. Usually this means that it is available for non-commercial use only with prior permission of the depositor and on condition that this header is included in its entirety with any copy distributed.",
        "http://www.ota.ox.ac.uk/documents/user_agreement.xml"
    ],
    "author": [
        "Eschenbach, Wolfram von, 12th century"
    ],
    "fulltext": "oai:ota:oucs:2459;2018-02-16T10:42:05Z;http://ota.ox.ac.uk/headers/2459.xml;Stellenbibliographie zum \"Parzifal\" Wolframs von Eschenbach f\u00c3\u00bcr die Jahrg\u00c3\u00a4nge 1984-1996;Eschenbach, Wolfram von, 12th century;2002;text_and_corpus_linguistics;German literature--Bibliography;German literature--Middle High German, 1050-1500;deu;This database provides the complete text of the Middle High German Arthurian Romance Parzival by Wolfram von Eschenbach (ca. 1200-1210), together with a complete bibliography of literature referring to individual lines of his work for the period 1984-1996. Future editions will increase the period covered. The text of Parzival is accompanied by line-by-line bibliographical references. These are groups thematically and thereafter chronologically. From this display, hyperlinks lead to full bibliographical details of works and to a complete listing of individual topics. From the main index, there are links to the following additional indices: topics (enabling hierarchical and alphabetic thematic searching), authors (where all line references are grouped thematically for a given author's work), words in secondary literature titles (enabling specific searches for individual concepts), work types (enabling the user to search e.g.for books, articles, translations, commentaries), work languages (enabling the user to search e.g. just for works in English), and work dates (enabling the user to refine the search for a specific year or years). In every index, extensive hyperlinks lead the user to further related information. Extensive online help is available at every point. ;Oxford Text Archive, University of Oxford;Yeandle, David N.;Magner, Carol;Arts and Humanities Research Board (AHRB);British Academy;Modern Humanities Research Association;Yeandle, David N.;(1 file : tbc);Text;Myths and legends--13th century;Use of this resource is restricted in some manner. Usually this means that it is available for non-commercial use only with prior permission of the depositor and on condition that this header is included in its entirety with any copy distributed.;http://www.ota.ox.ac.uk/documents/user_agreement.xml",
    "group": "clarin",
    "groups": [
        {
            "name": "clarin"
        }
    ],
    "name": "e04ab04b-6f0c-571f-8667-aa01d7c073e7",
    "notes": [
        "This database provides the complete text of the Middle High German Arthurian Romance Parzival by Wolfram von Eschenbach (ca. 1200-1210), together with a complete bibliography of literature referring to individual lines of his work for the period 1984-1996. Future editions will increase the period covered. The text of Parzival is accompanied by line-by-line bibliographical references. These are groups thematically and thereafter chronologically. From this display, hyperlinks lead to full bibliographical details of works and to a complete listing of individual topics. From the main index, there are links to the following additional indices: topics (enabling hierarchical and alphabetic thematic searching), authors (where all line references are grouped thematically for a given author's work), words in secondary literature titles (enabling specific searches for individual concepts), work types (enabling the user to search e.g.for books, articles, translations, commentaries), work languages (enabling the user to search e.g. just for works in English), and work dates (enabling the user to refine the search for a specific year or years). In every index, extensive hyperlinks lead the user to further related information. Extensive online help is available at every point. "
    ],
    "oai_identifier": [
        "oai:ota:oucs:2459"
    ],
    "oai_set": "",
    "state": "active",
    "tags": [
        {
            "name": "text_and_corpus_linguistics"
        },
        {
            "name": "German literature--Bibliography"
        },
        {
            "name": "German literature--Middle High German"
        }
    ],
    "title": [
        "Stellenbibliographie zum \"Parzifal\" Wolframs von Eschenbach f\u00c3\u00bcr die Jahrg\u00c3\u00a4nge 1984-1996"
    ],
    "url": "http://ota.ox.ac.uk/headers/2459.xml"
}