{
    "Contact": [
        "University of West Bohemia, Department of Cybernetics"
    ],
    "DiscHierarchy": [
        "1.4",
        "Humanities",
        "Linguistics"
    ],
    "Discipline": "Linguistics",
    "Format": [
        "text/plain; charset=utf-8",
        "text/xml",
        "text/plain",
        "downloadable_files_count: 2"
    ],
    "Language": [
        "Czech"
    ],
    "MetaDataAccess": "https://clarin-pl.eu/oai/request?verb=GetRecord&metadataPrefix=oai_dc&identifier=oai:lindat.mff.cuni.cz:11234/1-2585",
    "MetadataAccess": [
        "oai:lindat.mff.cuni.cz:11234/1-2585"
    ],
    "PID": "http://hdl.handle.net/11234/1-2585",
    "PublicationTimestamp": "2017-12-12T11:59:59Z",
    "PublicationYear": [
        "2017"
    ],
    "Publisher": [
        "University of West Bohemia, Department of Cybernetics"
    ],
    "ResourceType": [
        "corpus"
    ],
    "Rights": [
        "Creative Commons - Attribution-NonCommercial-ShareAlike 4.0 International (CC BY-NC-SA 4.0)",
        "http://creativecommons.org/licenses/by-nc-sa/4.0/",
        "PUB"
    ],
    "author": [
        "Tihelka, Daniel",
        "Matou\u0161ek, Jind\u0159ich",
        "J\u016fzov\u00e1, Mark\u00e9ta"
    ],
    "fulltext": "oai:lindat.mff.cuni.cz:11234/1-2585;2018-07-02T22:05:49Z;hdl_11858_00-097C-0000-0001-486F-D;hdl_11858_00-097C-0000-0001-4877-A;High-Coverage Multi-Level Text Corpus for Non-Professional Voice Conservation;J\u016fzov\u00e1, Mark\u00e9ta;Tihelka, Daniel;Matou\u0161ek, Jind\u0159ich;text-to-speech (TTS);voice conservation;voice banking;text corpus;This text corpus contains a carefully optimized set of sentences that could be used in the process of preparing a speech corpus for the development of personalized text-to-speech system. It was designed primarily for the voice conservation procedure that must be performed in a relatively short period before a person loses his/her own voice, typically because of the total laryngectomy.\r\n\r\nTotal laryngectomy is a radical treatment procedure which is often unavoidable to save life of patients who were diagnosed with severe laryngeal cancer. In spite of being very effective with respect to the primary treatment, it significantly handicaps the patients due to the permanent loss of their ability to use voice and produce speech. Luckily, the modern methods of computer text-to-speech (TTS) synthesis offer a possibility for \"digital conservation\" of patient's original voice for his/her future speech communication -- a procedure called voice banking or voice conservation. Moreover, the banking procedure can be undertaken by any person facing voice degradation or loss in farther future, or who is simply is willing to keep his/her voice-print.;2017-12-12;corpus;http://hdl.handle.net/11234/1-2585;ces;Creative Commons - Attribution-NonCommercial-ShareAlike 4.0 International (CC BY-NC-SA 4.0);http://creativecommons.org/licenses/by-nc-sa/4.0/;PUB;text/plain;text/xml;text/plain; charset=utf-8;downloadable_files_count: 2;University of West Bohemia, Department of Cybernetics",
    "group": "clarin",
    "groups": [
        {
            "name": "clarin"
        }
    ],
    "name": "e3d75dff-2741-5721-9eaf-3d0c968118e9",
    "notes": [
        "This text corpus contains a carefully optimized set of sentences that could be used in the process of preparing a speech corpus for the development of personalized text-to-speech system. It was designed primarily for the voice conservation procedure that must be performed in a relatively short period before a person loses his/her own voice, typically because of the total laryngectomy.\r\n\r\nTotal laryngectomy is a radical treatment procedure which is often unavoidable to save life of patients who were diagnosed with severe laryngeal cancer. In spite of being very effective with respect to the primary treatment, it significantly handicaps the patients due to the permanent loss of their ability to use voice and produce speech. Luckily, the modern methods of computer text-to-speech (TTS) synthesis offer a possibility for \"digital conservation\" of patient's original voice for his/her future speech communication -- a procedure called voice banking or voice conservation. Moreover, the banking procedure can be undertaken by any person facing voice degradation or loss in farther future, or who is simply is willing to keep his/her voice-print."
    ],
    "oai_identifier": [
        "oai:lindat.mff.cuni.cz:11234/1-2585"
    ],
    "oai_set": [
        "hdl_11858_00-097C-0000-0001-486F-D",
        "hdl_11858_00-097C-0000-0001-4877-A"
    ],
    "state": "active",
    "tags": [
        {
            "name": "text-to-speech TTS"
        },
        {
            "name": "voice conservation"
        },
        {
            "name": "voice banking"
        },
        {
            "name": "text corpus"
        }
    ],
    "title": [
        "High-Coverage Multi-Level Text Corpus for Non-Professional Voice Conservation"
    ],
    "url": ""
}