{
    "Contact": [
        "Jo\u017eef Stefan Institute"
    ],
    "DiscHierarchy": [
        "1.4",
        "Humanities",
        "Linguistics"
    ],
    "Discipline": "Linguistics",
    "Format": [
        "text/csv",
        "text/plain; charset=utf-8",
        "text/plain",
        "downloadable_files_count: 2"
    ],
    "Language": [
        "English"
    ],
    "MetaDataAccess": "https://clarin-pl.eu/oai/request?verb=GetRecord&metadataPrefix=oai_dc&identifier=oai:www.clarin.si:11356/1188",
    "MetadataAccess": [
        "oai:www.clarin.si:11356/1188"
    ],
    "PID": "http://hdl.handle.net/11356/1188",
    "PublicationTimestamp": "2018-06-15T11:59:59Z",
    "PublicationYear": [
        "2018"
    ],
    "Publisher": [
        "Jo\u017eef Stefan Institute"
    ],
    "RelatedIdentifier": [
        "info:eu-repo/grantAgreement/EC/H2020/640772"
    ],
    "ResourceType": [
        "corpus"
    ],
    "Rights": [
        "Creative Commons - Attribution-ShareAlike 4.0 International (CC BY-SA 4.0)",
        "https://creativecommons.org/licenses/by-sa/4.0/",
        "PUB"
    ],
    "author": [
        "Mozeti\u010d, Igor",
        "de Amicis, Luisa",
        "Kralj Novak, Petra"
    ],
    "fulltext": "oai:www.clarin.si:11356/1188;2018-07-05T06:46:55Z;hdl_11356_1023;hdl_11356_1024;Tweets about impact investing;Kralj Novak, Petra;de Amicis, Luisa;Mozeti\u010d, Igor;Twitter;impact investing;social finance;The corpus contains 668,529 tweets (tweet IDs) relevant to \"impact investing\", accompanied by sentiment labels given by an automated sentiment classifier.\r\n\r\nImpact investing involves investments made into companies, organizations, and funds with the intention to generate social and environmental impact alongside a financial return. The tweets relevant to impact investing were collected in the period from March 28, 2017, to January 28, 2018, through the Twitter Search API, and annotated for sentiment labels \"Negative\", \"Neutral\" or \"Positive\" by a general-purpose English language sentiment classifier.\r\n\r\nThe tweets were collected based on a list of known impact investing Twitter users, relevant keywords and impact investing related events. In particular, the queries include relevant users (@YF_Academy, @esmeefairbairn, @resonanceltd, @Big PotentialSI, etc.), single hashtags (#socfin, #impinv #socialfinance, #impactinvestment, etc.),\r\ncombined hashtags (#social & #finance, #social & #investment, #impact & #assessment, etc.), and hashtags of major impact investing events (#impact2, #socap17, #OxfordIIP, #skollwf, etc.).;2018-06-15;corpus;http://hdl.handle.net/11356/1188;eng;info:eu-repo/grantAgreement/EC/H2020/640772;Creative Commons - Attribution-ShareAlike 4.0 International (CC BY-SA 4.0);https://creativecommons.org/licenses/by-sa/4.0/;PUB;text/csv;text/plain;text/plain; charset=utf-8;downloadable_files_count: 2;Jo\u017eef Stefan Institute",
    "group": "clarin",
    "groups": [
        {
            "name": "clarin"
        }
    ],
    "name": "e3e2615a-0760-5418-a3c2-65be18ec0703",
    "notes": [
        "The corpus contains 668,529 tweets (tweet IDs) relevant to \"impact investing\", accompanied by sentiment labels given by an automated sentiment classifier.\r\n\r\nImpact investing involves investments made into companies, organizations, and funds with the intention to generate social and environmental impact alongside a financial return. The tweets relevant to impact investing were collected in the period from March 28, 2017, to January 28, 2018, through the Twitter Search API, and annotated for sentiment labels \"Negative\", \"Neutral\" or \"Positive\" by a general-purpose English language sentiment classifier.\r\n\r\nThe tweets were collected based on a list of known impact investing Twitter users, relevant keywords and impact investing related events. In particular, the queries include relevant users (@YF_Academy, @esmeefairbairn, @resonanceltd, @Big PotentialSI, etc.), single hashtags (#socfin, #impinv #socialfinance, #impactinvestment, etc.),\r\ncombined hashtags (#social & #finance, #social & #investment, #impact & #assessment, etc.), and hashtags of major impact investing events (#impact2, #socap17, #OxfordIIP, #skollwf, etc.)."
    ],
    "oai_identifier": [
        "oai:www.clarin.si:11356/1188"
    ],
    "oai_set": [
        "hdl_11356_1023",
        "hdl_11356_1024"
    ],
    "state": "active",
    "tags": [
        {
            "name": "Twitter"
        },
        {
            "name": "impact investing"
        },
        {
            "name": "social finance"
        }
    ],
    "title": [
        "Tweets about impact investing"
    ],
    "url": ""
}