{
    "Contact": [
        "Institute of Computer Science, Polish Academy of Sciences"
    ],
    "DiscHierarchy": [
        "1.4",
        "Humanities",
        "Linguistics"
    ],
    "Discipline": "Linguistics",
    "Format": [
        "text/plain; charset=utf-8",
        "downloadable_files_count: 1",
        "application/zip"
    ],
    "Language": [
        "Polish"
    ],
    "MetaDataAccess": "https://clarin-pl.eu/oai/request?verb=GetRecord&metadataPrefix=oai_dc&identifier=oai:clarin-pl.eu:11321/583",
    "MetadataAccess": [
        "oai:clarin-pl.eu:11321/583"
    ],
    "PID": "http://hdl.handle.net/11321/583",
    "PublicationTimestamp": "2018-07-01T11:59:59Z",
    "PublicationYear": [
        "2018"
    ],
    "Publisher": [
        "Institute of Computer Science, Polish Academy of Sciences"
    ],
    "ResourceType": [
        "toolService"
    ],
    "Rights": [
        "BSD 2 Clause",
        "https://opensource.org/licenses/BSD-2-Clause",
        "PUB"
    ],
    "author": [
        "Nito\u0144, Bart\u0142omiej",
        "Bartosiak, Tomasz"
    ],
    "fulltext": "oai:clarin-pl.eu:11321/583;2018-07-26T15:26:20Z;hdl_11321_3;hdl_11321_4;Slowal (2018-06-29);Nito\u0144, Bart\u0142omiej;Bartosiak, Tomasz;syntactic schema;valence dictionary editor;semantic frame;valence dictionary browser;Slowal is a web tool designed for creating, editing and browsing valence dictionaries. So far, it has mainly been used for creating The Polish Valence Dictionary (Walenty).\r\n\r\nSlowal supports the process of creating the dictionary; it also facilitates access by making it possible to browse the dictionary using an advanced built-in filtering system, covering both syntactic and semantic phenomena. Slowal also gives control over the work of lexicographers involved in creating dictionary, for instance by using predefined lists of values, which prevents spelling errors and enforces consistency, as well as by imposing strict validation rules.\r\n\r\nLast but not least, the created dictionary can be exported from Slowal in various formats: plain text, TeX, PDF, and TEI XML.\r\n\r\nThis version was adapted for creating semantics of nouns and adjectives.;2018;toolService;http://hdl.handle.net/11321/583;pol;BSD 2 Clause;https://opensource.org/licenses/BSD-2-Clause;PUB;text/plain; charset=utf-8;application/zip;downloadable_files_count: 1;Institute of Computer Science, Polish Academy of Sciences;http://zil.ipipan.waw.pl/Slowal",
    "group": "clarin",
    "groups": [
        {
            "name": "clarin"
        }
    ],
    "name": "e7f9569d-d96d-5d2b-8b52-4e6de3ae8da7",
    "notes": [
        "Slowal is a web tool designed for creating, editing and browsing valence dictionaries. So far, it has mainly been used for creating The Polish Valence Dictionary (Walenty).\r\n\r\nSlowal supports the process of creating the dictionary; it also facilitates access by making it possible to browse the dictionary using an advanced built-in filtering system, covering both syntactic and semantic phenomena. Slowal also gives control over the work of lexicographers involved in creating dictionary, for instance by using predefined lists of values, which prevents spelling errors and enforces consistency, as well as by imposing strict validation rules.\r\n\r\nLast but not least, the created dictionary can be exported from Slowal in various formats: plain text, TeX, PDF, and TEI XML.\r\n\r\nThis version was adapted for creating semantics of nouns and adjectives."
    ],
    "oai_identifier": [
        "oai:clarin-pl.eu:11321/583"
    ],
    "oai_set": [
        "hdl_11321_3",
        "hdl_11321_4"
    ],
    "state": "active",
    "tags": [
        {
            "name": "syntactic schema"
        },
        {
            "name": "valence dictionary editor"
        },
        {
            "name": "semantic frame"
        },
        {
            "name": "valence dictionary browser"
        }
    ],
    "title": [
        "Slowal (2018-06-29)"
    ],
    "url": ""
}