{
    "Contact": [
        "Charles University, Faculty of Arts, Institute of the Czech National Corpus"
    ],
    "DiscHierarchy": [
        "1.4",
        "Humanities",
        "Linguistics"
    ],
    "Discipline": "Linguistics",
    "Format": [
        "text/plain; charset=utf-8",
        "application/x-gzip",
        "downloadable_files_count: 1"
    ],
    "Language": [
        "Czech"
    ],
    "MetaDataAccess": "https://clarin-pl.eu/oai/request?verb=GetRecord&metadataPrefix=oai_dc&identifier=oai:lindat.mff.cuni.cz:11234/1-1847",
    "MetadataAccess": [
        "oai:lindat.mff.cuni.cz:11234/1-1847"
    ],
    "PID": "http://hdl.handle.net/11234/1-1847",
    "PublicationTimestamp": "2016-12-01T11:59:59Z",
    "PublicationYear": [
        "2016"
    ],
    "Publisher": [
        "Charles University, Faculty of Arts, Institute of the Czech National Corpus"
    ],
    "ResourceType": [
        "corpus"
    ],
    "Rights": [
        "Creative Commons - Attribution-NonCommercial-ShareAlike 4.0 International (CC BY-NC-SA 4.0)",
        "http://creativecommons.org/licenses/by-nc-sa/4.0/",
        "PUB"
    ],
    "author": [
        "Bene\u0161ov\u00e1, Lucie",
        "Waclawi\u010dov\u00e1, Martina",
        "K\u0159en, Michal"
    ],
    "fulltext": "oai:lindat.mff.cuni.cz:11234/1-1847;2018-07-02T22:05:50Z;hdl_11858_00-097C-0000-0001-486F-D;hdl_11858_00-097C-0000-0001-4877-A;ORAL2013: balanced corpus of informal spoken Czech (transcriptions);Bene\u0161ov\u00e1, Lucie;K\u0159en, Michal;Waclawi\u010dov\u00e1, Martina;balanced corpus;spoken language;ORAL2013 is designed as a representation of authentic spoken Czech used in informal situations (private environment, spontaneity, unpreparedness etc.) in the area of the whole Czech Republic. The corpus comprises 835 recordings from 2008\u20132011 that contain 2 785 189 words (i.e. 3 285 508 tokens including punctuation) uttered by 2 544 speakers, out of which 1 297 speakers are unique. ORAL2013 is balanced in the main sociolinguistic categories of speakers (gender, age group, education, region of childhood residence).\r\n\r\nThe corpus is provided in a (semi-XML) vertical format used as an input to the Manatee query engine. The data thus correspond to the corpus available via the KonText query engine to registered users of the CNC at http://www.korpus.cz\r\n\r\nPlease note: this item includes only the transcriptions, audio is available under more restrictive non-CC license at http://hdl.handle.net/11234/1-1848;2016-12-01;corpus;http://hdl.handle.net/11234/1-1847;ces;Creative Commons - Attribution-NonCommercial-ShareAlike 4.0 International (CC BY-NC-SA 4.0);http://creativecommons.org/licenses/by-nc-sa/4.0/;PUB;text/plain; charset=utf-8;application/x-gzip;downloadable_files_count: 1;Charles University, Faculty of Arts, Institute of the Czech National Corpus;http://wiki.korpus.cz/doku.php/cnk:oral2013",
    "group": "clarin",
    "groups": [
        {
            "name": "clarin"
        }
    ],
    "name": "eb2b85df-deb8-5a26-82a3-7966ea6af390",
    "notes": [
        "ORAL2013 is designed as a representation of authentic spoken Czech used in informal situations (private environment, spontaneity, unpreparedness etc.) in the area of the whole Czech Republic. The corpus comprises 835 recordings from 2008\u20132011 that contain 2 785 189 words (i.e. 3 285 508 tokens including punctuation) uttered by 2 544 speakers, out of which 1 297 speakers are unique. ORAL2013 is balanced in the main sociolinguistic categories of speakers (gender, age group, education, region of childhood residence).\r\n\r\nThe corpus is provided in a (semi-XML) vertical format used as an input to the Manatee query engine. The data thus correspond to the corpus available via the KonText query engine to registered users of the CNC at http://www.korpus.cz\r\n\r\nPlease note: this item includes only the transcriptions, audio is available under more restrictive non-CC license at http://hdl.handle.net/11234/1-1848"
    ],
    "oai_identifier": [
        "oai:lindat.mff.cuni.cz:11234/1-1847"
    ],
    "oai_set": [
        "hdl_11858_00-097C-0000-0001-486F-D",
        "hdl_11858_00-097C-0000-0001-4877-A"
    ],
    "state": "active",
    "tags": [
        {
            "name": "balanced corpus"
        },
        {
            "name": "spoken language"
        }
    ],
    "title": [
        "ORAL2013: balanced corpus of informal spoken Czech (transcriptions)"
    ],
    "url": ""
}