{
    "Contact": [
        "Giellatekno - Saami Language Technology"
    ],
    "DiscHierarchy": [
        "1.4",
        "Humanities",
        "Linguistics"
    ],
    "Discipline": "Linguistics",
    "Format": [
        "application/zip",
        "text/xml",
        "downloadable_files_count: 1",
        "text/plain; charset=utf-8"
    ],
    "Language": [
        "Northern Sami",
        "Finnish"
    ],
    "MetaDataAccess": "https://clarin-pl.eu/oai/request?verb=GetRecord&metadataPrefix=oai_dc&identifier=oai:repo.clarino.uib.no:11509/97",
    "MetadataAccess": [
        "oai:repo.clarino.uib.no:11509/97"
    ],
    "PID": "http://hdl.handle.net/11509/97",
    "PublicationTimestamp": "2015-07-01T11:59:59Z",
    "PublicationYear": [
        "2015"
    ],
    "Publisher": [
        "Giellatekno - Saami Language Technology"
    ],
    "ResourceType": [
        "lexicalConceptualResource"
    ],
    "Rights": [
        "Creative Commons - Attribution 3.0 Unported (CC BY 3.0)",
        "CC",
        "http://creativecommons.org/licenses/by/3.0/"
    ],
    "author": [
        "Giellatekno - Saami Language Technology, UiT The Arctic University of Norway"
    ],
    "fulltext": "oai:repo.clarino.uib.no:11509/97;2016-09-06T12:39:26Z;hdl_11509_1;hdl_11509_2;North Saami-Finnish dictionary;Giellatekno - Saami Language Technology, UiT The Arctic University of Norway;Bilingual Lexicon;Swedish;South Saami;Machine-readable Dictionary;The North Saami-Finnish dictionary is the work done by Giellatekno at UiT The Arctic University of Norway, Kotus in Helsinki, and members of the language communities. In particular, the following colleagues have contributed to the creation of the ressource: Trond Trosterud and Ciprian Gerstenberger. It contains 11297 entries in Giellatekno's dictionary xml format. In spite of the extensive quality control, it may contain entries with objectionable translations. If you find any errors or want to add more words, download the file, edit it, and send it back to giellatekno@uit.no.\r\nPlease note that the Giellatekno resources are dynamic in nature. To ensure that you have a completely updated version, please contact Giellatekno (see Contact Info in metadata).;2015;lexicalConceptualResource;http://hdl.handle.net/11509/97;sme;fin;Creative Commons - Attribution 3.0 Unported (CC BY 3.0);CC;http://creativecommons.org/licenses/by/3.0/;text/xml;application/zip;text/plain; charset=utf-8;downloadable_files_count: 1;Giellatekno - Saami Language Technology;http://giellatekno.uit.no/index.eng.html",
    "group": "clarin",
    "groups": [
        {
            "name": "clarin"
        }
    ],
    "name": "ec86ffc0-6573-5240-b7b5-d3dbf568f161",
    "notes": [
        "The North Saami-Finnish dictionary is the work done by Giellatekno at UiT The Arctic University of Norway, Kotus in Helsinki, and members of the language communities. In particular, the following colleagues have contributed to the creation of the ressource: Trond Trosterud and Ciprian Gerstenberger. It contains 11297 entries in Giellatekno's dictionary xml format. In spite of the extensive quality control, it may contain entries with objectionable translations. If you find any errors or want to add more words, download the file, edit it, and send it back to giellatekno@uit.no.\r\nPlease note that the Giellatekno resources are dynamic in nature. To ensure that you have a completely updated version, please contact Giellatekno (see Contact Info in metadata)."
    ],
    "oai_identifier": [
        "oai:repo.clarino.uib.no:11509/97"
    ],
    "oai_set": [
        "hdl_11509_1",
        "hdl_11509_2"
    ],
    "state": "active",
    "tags": [
        {
            "name": "Bilingual Lexicon"
        },
        {
            "name": "Swedish"
        },
        {
            "name": "South Saami"
        },
        {
            "name": "Machine-readable Dictionary"
        }
    ],
    "title": [
        "North Saami-Finnish dictionary"
    ],
    "url": ""
}