{
    "Contact": [
        "Research Institute for Artificial Intelligence, Romanian Academy of Sciences"
    ],
    "DiscHierarchy": [
        "1.4",
        "Humanities",
        "Linguistics"
    ],
    "Discipline": "Linguistics",
    "Format": [
        "downloadable_files_count: 0"
    ],
    "MetaDataAccess": "https://clarin-pl.eu/oai/request?verb=GetRecord&metadataPrefix=oai_dc&identifier=oai:lindat.mff.cuni.cz:11372/LRT-1271",
    "MetadataAccess": [
        "oai:lindat.mff.cuni.cz:11372/LRT-1271"
    ],
    "PID": "http://hdl.handle.net/11372/LRT-1271",
    "PublicationTimestamp": "2014-07-30T11:59:59Z",
    "PublicationYear": [
        "2014"
    ],
    "Publisher": [
        "Research Institute for Artificial Intelligence, Romanian Academy of Sciences"
    ],
    "ResourceType": [
        "toolService"
    ],
    "SpatialCoverage": [
        "Romania"
    ],
    "TemporalCoverage": " point in time : None",
    "author": [
        "Tufi\u015f, Dan",
        "Ion, Radu",
        "Barbu, Ana-Maria"
    ],
    "fulltext": "oai:lindat.mff.cuni.cz:11372/LRT-1271;2016-04-06T16:39:49Z;hdl_11858_00-097C-0000-0007-710A-A;hdl_11858_00-097C-0000-0007-710B-8;Translation Equivalents Extractor;Tufi\u015f, Dan;Ion, Radu;Barbu, Ana-Maria;TREQ exploits the knowledge embedded in the parallel corpora and produces a set of\r\ntranslation equivalents (a translation lexicon), based on a 1:1 mapping\r\nhypothesis. The program uses almost no linguistic knowledge, relying on statistical evidence and some simplifying assumptions. \r\nThe extraction process is based on a testing approach. It generates first a list of translation equivalent candidates and then successively extracts the most likely translation equivalence pairs. It does not require a pre-existing bilingual lexicon for the considered languages. Yet, if such a lexicon exists, it can be used to eliminate spurious candidate translation equivalence pairs and thus to speed up the process and increase its accuracy. The algorithm relies on some pre-processing of the bitext: sentence aligner, tokeniser (using [[(http://www.lpl.univaix.fr/projects/multext/MtSeg|MtSeg]]), a collocation extractor (unaware of translation equivalence), POS-tagger, lemmatiser. \r\nMore detailed descriptions are available in the following paper (http://www.racai.ro/~tufis/papers/): \r\n  -- Dan  Tufi\u015f and Ana-Maria Barbu (2002). Revealing translators knowledge: statistical methods in constructing practical translation lexicons for language and speech processing. In International Journal of Speech Technology, volume 5, pp. 199-209. Kluwer Academic Publishers, November 2002. ISSN 1381-2416. \r\n  -- Dan Tufi\u015f (2002). A cheap and fast way to build useful translation lexicons. In Proceedings of the 19th International Conference on Computational Linguistics (COLING 2002), pp. 1030-1036, Taipei, Taiwan, August 2002. ISBN 1-55860-894. \r\n  -- Dan Tufi\u015f and Ana Maria Barbu (2001). Automatic Construction of Translation Lexicons. In V.V.Kluew, C.E. D'Attellis, and N.E. Mastorakis (eds.), Advances in Automation, Multimedia and Video Systems, and Modern Computer Science, pp. 156-161. WSES Press, December 2001. ISSN 1790-5117. \r\n  -- Dan  Tufi\u015f and Ana Maria Barbu (2001). Extracting Multilingual Lexicons from Parallel Corpora. In Proceedings of the ACH-ALLC conference (ACH-ALLC 2001), New York, USA, June 2001. \r\n  -- Dan  Tufi\u015f and Ana Maria Barbu (2001). Accurate Automatic Extraction of Translation Equivalents from Parallel Corpora. In Paul Rayson, Andrew Wilson, Tony McEnery, Andrew Hardie, and Shereen Khoja., editors, Proceedings of the Corpus Linguistics 2001 Conference (CL 2001), pp. 581-586, Lancaster, UK, March 2001. Lancaster University, Computing Department. ISBN 1-86220-107-2.;2014-07-30;toolService;http://hdl.handle.net/11372/LRT-1271;downloadable_files_count: 0;Romania;Research Institute for Artificial Intelligence, Romanian Academy of Sciences",
    "group": "clarin",
    "groups": [
        {
            "name": "clarin"
        }
    ],
    "name": "ed4a67e6-0eab-57eb-b54d-7f9c57eaa8e3",
    "notes": [
        "TREQ exploits the knowledge embedded in the parallel corpora and produces a set of\r\ntranslation equivalents (a translation lexicon), based on a 1:1 mapping\r\nhypothesis. The program uses almost no linguistic knowledge, relying on statistical evidence and some simplifying assumptions. \r\nThe extraction process is based on a testing approach. It generates first a list of translation equivalent candidates and then successively extracts the most likely translation equivalence pairs. It does not require a pre-existing bilingual lexicon for the considered languages. Yet, if such a lexicon exists, it can be used to eliminate spurious candidate translation equivalence pairs and thus to speed up the process and increase its accuracy. The algorithm relies on some pre-processing of the bitext: sentence aligner, tokeniser (using [[(http://www.lpl.univaix.fr/projects/multext/MtSeg|MtSeg]]), a collocation extractor (unaware of translation equivalence), POS-tagger, lemmatiser. \r\nMore detailed descriptions are available in the following paper (http://www.racai.ro/~tufis/papers/): \r\n  -- Dan  Tufi\u015f and Ana-Maria Barbu (2002). Revealing translators knowledge: statistical methods in constructing practical translation lexicons for language and speech processing. In International Journal of Speech Technology, volume 5, pp. 199-209. Kluwer Academic Publishers, November 2002. ISSN 1381-2416. \r\n  -- Dan Tufi\u015f (2002). A cheap and fast way to build useful translation lexicons. In Proceedings of the 19th International Conference on Computational Linguistics (COLING 2002), pp. 1030-1036, Taipei, Taiwan, August 2002. ISBN 1-55860-894. \r\n  -- Dan Tufi\u015f and Ana Maria Barbu (2001). Automatic Construction of Translation Lexicons. In V.V.Kluew, C.E. D'Attellis, and N.E. Mastorakis (eds.), Advances in Automation, Multimedia and Video Systems, and Modern Computer Science, pp. 156-161. WSES Press, December 2001. ISSN 1790-5117. \r\n  -- Dan  Tufi\u015f and Ana Maria Barbu (2001). Extracting Multilingual Lexicons from Parallel Corpora. In Proceedings of the ACH-ALLC conference (ACH-ALLC 2001), New York, USA, June 2001. \r\n  -- Dan  Tufi\u015f and Ana Maria Barbu (2001). Accurate Automatic Extraction of Translation Equivalents from Parallel Corpora. In Paul Rayson, Andrew Wilson, Tony McEnery, Andrew Hardie, and Shereen Khoja., editors, Proceedings of the Corpus Linguistics 2001 Conference (CL 2001), pp. 581-586, Lancaster, UK, March 2001. Lancaster University, Computing Department. ISBN 1-86220-107-2."
    ],
    "oai_identifier": [
        "oai:lindat.mff.cuni.cz:11372/LRT-1271"
    ],
    "oai_set": [
        "hdl_11858_00-097C-0000-0007-710A-A",
        "hdl_11858_00-097C-0000-0007-710B-8"
    ],
    "state": "active",
    "title": [
        "Translation Equivalents Extractor"
    ],
    "url": ""
}