{
    "Contact": [
        "Charles University, Faculty of Mathematics and Physics, Institute of Formal and Applied Linguistics (UFAL)"
    ],
    "DiscHierarchy": [
        "1.4",
        "Humanities",
        "Linguistics"
    ],
    "Discipline": "Linguistics",
    "Format": [
        "text/plain; charset=utf-8",
        "application/x-gzip",
        "text/plain",
        "downloadable_files_count: 2"
    ],
    "Language": [
        "Czech"
    ],
    "MetaDataAccess": "https://clarin-pl.eu/oai/request?verb=GetRecord&metadataPrefix=oai_dc&identifier=oai:lindat.mff.cuni.cz:11234/1-1665",
    "MetadataAccess": [
        "oai:lindat.mff.cuni.cz:11234/1-1665"
    ],
    "PID": "http://hdl.handle.net/11234/1-1665",
    "PublicationTimestamp": "2016-03-10T11:59:59Z",
    "PublicationYear": [
        "2016"
    ],
    "Publisher": [
        "Charles University, Faculty of Mathematics and Physics, Institute of Formal and Applied Linguistics (UFAL)"
    ],
    "ResourceType": [
        "corpus"
    ],
    "Rights": [
        "Creative Commons - Attribution-ShareAlike 4.0 International (CC BY-SA 4.0)",
        "http://creativecommons.org/licenses/by-sa/4.0/",
        "PUB"
    ],
    "author": [
        "Baran\u010d\u00edkov\u00e1, Petra",
        "Tamchyna, Ale\u0161"
    ],
    "fulltext": "oai:lindat.mff.cuni.cz:11234/1-1665;2018-07-02T22:05:52Z;hdl_11858_00-097C-0000-0001-486F-D;hdl_11858_00-097C-0000-0001-4877-A;Automatic Paraphrases of Czech Reference Sentences for WMT11, 13 and 14;Baran\u010d\u00edkov\u00e1, Petra;Tamchyna, Ale\u0161;machine translation;automatic evaluation;paraphrasing;This dataset contains automatic paraphrases of Czech official reference translations for the Workshop on Statistical Machine Translation shared task. The data covers the years 2011, 2013 and 2014.\r\n\r\nFor each sentence, at most 10000 paraphrases were included (randomly selected from the full set).\r\n\r\nThe goal of using this dataset is to improve automatic evaluation of machine translation outputs.\r\n\r\nIf you use this work, please cite the following paper:\r\n\r\nTamchyna Ale\u0161, Baran\u010d\u00edkov\u00e1 Petra: Automatic and Manual Paraphrases for MT Evaluation. In proceedings of LREC, 2016.;2016-03-10;corpus;http://hdl.handle.net/11234/1-1665;ces;Creative Commons - Attribution-ShareAlike 4.0 International (CC BY-SA 4.0);http://creativecommons.org/licenses/by-sa/4.0/;PUB;application/x-gzip;text/plain;text/plain; charset=utf-8;downloadable_files_count: 2;Charles University, Faculty of Mathematics and Physics, Institute of Formal and Applied Linguistics (UFAL);http://ufal.mff.cuni.cz/grants/deprefset",
    "group": "clarin",
    "groups": [
        {
            "name": "clarin"
        }
    ],
    "name": "f3e60d95-f18e-5df4-8d2a-6b2af3d6cbb9",
    "notes": [
        "This dataset contains automatic paraphrases of Czech official reference translations for the Workshop on Statistical Machine Translation shared task. The data covers the years 2011, 2013 and 2014.\r\n\r\nFor each sentence, at most 10000 paraphrases were included (randomly selected from the full set).\r\n\r\nThe goal of using this dataset is to improve automatic evaluation of machine translation outputs.\r\n\r\nIf you use this work, please cite the following paper:\r\n\r\nTamchyna Ale\u0161, Baran\u010d\u00edkov\u00e1 Petra: Automatic and Manual Paraphrases for MT Evaluation. In proceedings of LREC, 2016."
    ],
    "oai_identifier": [
        "oai:lindat.mff.cuni.cz:11234/1-1665"
    ],
    "oai_set": [
        "hdl_11858_00-097C-0000-0001-486F-D",
        "hdl_11858_00-097C-0000-0001-4877-A"
    ],
    "state": "active",
    "tags": [
        {
            "name": "machine translation"
        },
        {
            "name": "automatic evaluation"
        },
        {
            "name": "paraphrasing"
        }
    ],
    "title": [
        "Automatic Paraphrases of Czech Reference Sentences for WMT11, 13 and 14"
    ],
    "url": ""
}