{
    "Contact": [
        "Faculty of Arts, Institute of the Czech National Corpus, Charles University in Prague"
    ],
    "DiscHierarchy": [
        "1.4",
        "Humanities",
        "Linguistics"
    ],
    "Discipline": "Linguistics",
    "Format": [
        "text/plain; charset=utf-8",
        "application/x-gzip",
        "downloadable_files_count: 1"
    ],
    "Language": [
        "Czech"
    ],
    "MetaDataAccess": "https://clarin-pl.eu/oai/request?verb=GetRecord&metadataPrefix=oai_dc&identifier=oai:lindat.mff.cuni.cz:11858/00-097C-0000-0023-119D-A",
    "MetadataAccess": [
        "oai:lindat.mff.cuni.cz:11858/00-097C-0000-0023-119D-A"
    ],
    "PID": "http://hdl.handle.net/11858/00-097C-0000-0023-119D-A",
    "PublicationTimestamp": "2008-07-01T11:59:59Z",
    "PublicationYear": [
        "2008"
    ],
    "Publisher": [
        "Faculty of Arts, Institute of the Czech National Corpus, Charles University in Prague"
    ],
    "ResourceType": [
        "corpus"
    ],
    "Rights": [
        "Attribution-NonCommercial-ShareAlike 3.0 Unported (CC BY-NC-SA 3.0)",
        "http://creativecommons.org/licenses/by-nc-sa/3.0/",
        "PUB"
    ],
    "author": [
        "Kop\u0159ivov\u00e1, Marie",
        "Waclawi\u010dov\u00e1, Martina",
        "K\u0159en, Michal",
        "V\u00e1lkov\u00e1, Lucie"
    ],
    "fulltext": "oai:lindat.mff.cuni.cz:11858/00-097C-0000-0023-119D-A;2018-07-02T22:05:50Z;hdl_11858_00-097C-0000-0001-486F-D;hdl_11858_00-097C-0000-0001-4877-A;ORAL2008: Balanced corpus of informal spoken Czech;Waclawi\u010dov\u00e1, Martina;Kop\u0159ivov\u00e1, Marie;K\u0159en, Michal;V\u00e1lkov\u00e1, Lucie;informal spoken language;balanced corpus;Balanced corpus of informal spoken Czech sized 1 MW. It contains transcriptions of 297 recordings made in 2002\u20132007 in the whole of Bohemia. All the recordings were made in informal situations to ensure prototypically spontaneous spoken language. This means private environment, physical presence of speakers who know each other, unscripted speech and topic not given in advance. The total number of speakers is 995, the corpus is balanced in their main sociolinguistic categories (gender, age group, education, region of childhood residence).\r\n\r\nThe corpus is provided in a (semi-XML) vertical format used as an input to the Manatee query engine. The data thus exactly correspond to the corpus available via query interface to registered users of the CNC.;2008;corpus;http://hdl.handle.net/11858/00-097C-0000-0023-119D-A;ces;Attribution-NonCommercial-ShareAlike 3.0 Unported (CC BY-NC-SA 3.0);http://creativecommons.org/licenses/by-nc-sa/3.0/;PUB;application/x-gzip;text/plain; charset=utf-8;downloadable_files_count: 1;Faculty of Arts, Institute of the Czech National Corpus, Charles University in Prague;https://wiki.korpus.cz/doku.php/cnk:oral2008",
    "group": "clarin",
    "groups": [
        {
            "name": "clarin"
        }
    ],
    "name": "f7c7f999-f948-511d-b5b8-59e86c8f4d00",
    "notes": [
        "Balanced corpus of informal spoken Czech sized 1 MW. It contains transcriptions of 297 recordings made in 2002\u20132007 in the whole of Bohemia. All the recordings were made in informal situations to ensure prototypically spontaneous spoken language. This means private environment, physical presence of speakers who know each other, unscripted speech and topic not given in advance. The total number of speakers is 995, the corpus is balanced in their main sociolinguistic categories (gender, age group, education, region of childhood residence).\r\n\r\nThe corpus is provided in a (semi-XML) vertical format used as an input to the Manatee query engine. The data thus exactly correspond to the corpus available via query interface to registered users of the CNC."
    ],
    "oai_identifier": [
        "oai:lindat.mff.cuni.cz:11858/00-097C-0000-0023-119D-A"
    ],
    "oai_set": [
        "hdl_11858_00-097C-0000-0001-486F-D",
        "hdl_11858_00-097C-0000-0001-4877-A"
    ],
    "state": "active",
    "tags": [
        {
            "name": "informal spoken language"
        },
        {
            "name": "balanced corpus"
        }
    ],
    "title": [
        "ORAL2008: Balanced corpus of informal spoken Czech"
    ],
    "url": ""
}