{
    "Contact": [
        "Charles University, Faculty of Mathematics and Physics, Institute of Formal and Applied Linguistics (UFAL)"
    ],
    "DiscHierarchy": [
        "1.4",
        "Humanities",
        "Linguistics"
    ],
    "Discipline": "Linguistics",
    "Format": [
        "downloadable_files_count: 0"
    ],
    "Language": [
        "English"
    ],
    "MetaDataAccess": "https://clarin-pl.eu/oai/request?verb=GetRecord&metadataPrefix=oai_dc&identifier=oai:lindat.mff.cuni.cz:11858/00-097C-0000-0023-43CE-E",
    "MetadataAccess": [
        "oai:lindat.mff.cuni.cz:11858/00-097C-0000-0023-43CE-E"
    ],
    "PID": "http://hdl.handle.net/11858/00-097C-0000-0023-43CE-E",
    "PublicationTimestamp": "2014-02-14T11:59:59Z",
    "PublicationYear": [
        "2014"
    ],
    "Publisher": [
        "Charles University, Faculty of Mathematics and Physics, Institute of Formal and Applied Linguistics (UFAL)"
    ],
    "ResourceType": [
        "toolService"
    ],
    "author": [
        "Straka, Milan",
        "Strakov\u00e1, Jana"
    ],
    "fulltext": "oai:lindat.mff.cuni.cz:11858/00-097C-0000-0023-43CE-E;2018-07-02T22:05:51Z;hdl_11858_00-097C-0000-0001-486F-D;hdl_11858_00-097C-0000-0001-4877-A;NameTag;Straka, Milan;Strakov\u00e1, Jana;named entity recognizer;NameTag is an open-source tool for named entity recognition (NER). NameTag identifies proper names in text and classifies them into predefined categories, such as names of persons, locations, organizations, etc. NameTag is distributed as a standalone tool or a library, along with trained linguistic models. In the Czech language, NameTag achieves state-of-the-art performance (Strakov\u00e1 et al. 2013). NameTag is a free software under LGPL license and the linguistic models are free for non-commercial use and distributed under CC BY-NC-SA license, although for some models the original data used to create the model may impose additional licensing conditions.;2014-02-14;toolService;http://hdl.handle.net/11858/00-097C-0000-0023-43CE-E;eng;downloadable_files_count: 0;Charles University, Faculty of Mathematics and Physics, Institute of Formal and Applied Linguistics (UFAL);http://ufal.mff.cuni.cz/nametag",
    "group": "clarin",
    "groups": [
        {
            "name": "clarin"
        }
    ],
    "name": "fa6380e1-0159-5b69-b3e5-910fcd400fee",
    "notes": [
        "NameTag is an open-source tool for named entity recognition (NER). NameTag identifies proper names in text and classifies them into predefined categories, such as names of persons, locations, organizations, etc. NameTag is distributed as a standalone tool or a library, along with trained linguistic models. In the Czech language, NameTag achieves state-of-the-art performance (Strakov\u00e1 et al. 2013). NameTag is a free software under LGPL license and the linguistic models are free for non-commercial use and distributed under CC BY-NC-SA license, although for some models the original data used to create the model may impose additional licensing conditions."
    ],
    "oai_identifier": [
        "oai:lindat.mff.cuni.cz:11858/00-097C-0000-0023-43CE-E"
    ],
    "oai_set": [
        "hdl_11858_00-097C-0000-0001-486F-D",
        "hdl_11858_00-097C-0000-0001-4877-A"
    ],
    "state": "active",
    "tags": [
        {
            "name": "named entity recognizer"
        }
    ],
    "title": [
        "NameTag"
    ],
    "url": ""
}