{
    "Contact": [
        "Faculty of Computer and Information Science, University of Ljubljana"
    ],
    "DiscHierarchy": [
        "1.4",
        "Humanities",
        "Linguistics"
    ],
    "Discipline": "Linguistics",
    "Format": [
        "application/zip",
        "downloadable_files_count: 1",
        "text/plain; charset=utf-8"
    ],
    "Language": [
        "Slovenian"
    ],
    "MetaDataAccess": "https://clarin-pl.eu/oai/request?verb=GetRecord&metadataPrefix=oai_dc&identifier=oai:www.clarin.si:11356/1182",
    "MetadataAccess": [
        "oai:www.clarin.si:11356/1182"
    ],
    "PID": "http://hdl.handle.net/11356/1182",
    "PublicationTimestamp": "2018-03-19T11:59:59Z",
    "PublicationYear": [
        "2018"
    ],
    "Publisher": [
        "Faculty of Computer and Information Science, University of Ljubljana"
    ],
    "ResourceType": [
        "corpus"
    ],
    "Rights": [
        "Creative Commons - Attribution-NonCommercial-ShareAlike 4.0 International (CC BY-NC-SA 4.0)",
        "https://creativecommons.org/licenses/by-nc-sa/4.0/",
        "PUB"
    ],
    "author": [
        "\u017ditnik, Slavko"
    ],
    "fulltext": "oai:www.clarin.si:11356/1182;2018-04-15T17:56:57Z;hdl_11356_1023;hdl_11356_1024;Slovene coreference resolution corpus coref149;\u017ditnik, Slavko;coreference resolution;This corpus contains a subset of the ssj500k v1.4 corpus, http://hdl.handle.net/11356/1052. Each of 149 documents contains a paragraph from ssj500k that contains at least 100 words and at least 6 named entities. The data is in TCF format, exported from the WebAnno tool, https://webanno.github.io/webanno/.\r\n\r\nThe annotated entities are of type person, organization or location. Mentions are annotated as coreference chains without additional classifications of different coreference types. Annotations also include implicit mentions that are specific for the Slovene language - in this case, a verb is tagged. The corpus consists of 1277 entities, 2329 mentions, 831 singleton entities, 40 appositions and 215 overlapping mentions. We also annotated overlapping mentions of the same entity - for example in text [strokovnega direktorja KC [Zorana Arne\u017ea]] we annotate two overlapping mentions that refer to the same entity. There are 97 such mentions in the corpus.\r\n\r\nIn the public source code repository https://bitbucket.org/szitnik/nutie-core class TEIP5Importer contains an additional function to read the dataset and merge it together with the ssj500k dataset.;2018-03-19;corpus;http://hdl.handle.net/11356/1182;slv;Creative Commons - Attribution-NonCommercial-ShareAlike 4.0 International (CC BY-NC-SA 4.0);https://creativecommons.org/licenses/by-nc-sa/4.0/;PUB;application/zip;text/plain; charset=utf-8;downloadable_files_count: 1;Faculty of Computer and Information Science, University of Ljubljana",
    "group": "clarin",
    "groups": [
        {
            "name": "clarin"
        }
    ],
    "name": "fc300b75-0c9d-56fb-9e2c-ff4d3399c0b2",
    "notes": [
        "This corpus contains a subset of the ssj500k v1.4 corpus, http://hdl.handle.net/11356/1052. Each of 149 documents contains a paragraph from ssj500k that contains at least 100 words and at least 6 named entities. The data is in TCF format, exported from the WebAnno tool, https://webanno.github.io/webanno/.\r\n\r\nThe annotated entities are of type person, organization or location. Mentions are annotated as coreference chains without additional classifications of different coreference types. Annotations also include implicit mentions that are specific for the Slovene language - in this case, a verb is tagged. The corpus consists of 1277 entities, 2329 mentions, 831 singleton entities, 40 appositions and 215 overlapping mentions. We also annotated overlapping mentions of the same entity - for example in text [strokovnega direktorja KC [Zorana Arne\u017ea]] we annotate two overlapping mentions that refer to the same entity. There are 97 such mentions in the corpus.\r\n\r\nIn the public source code repository https://bitbucket.org/szitnik/nutie-core class TEIP5Importer contains an additional function to read the dataset and merge it together with the ssj500k dataset."
    ],
    "oai_identifier": [
        "oai:www.clarin.si:11356/1182"
    ],
    "oai_set": [
        "hdl_11356_1023",
        "hdl_11356_1024"
    ],
    "state": "active",
    "tags": [
        {
            "name": "coreference resolution"
        }
    ],
    "title": [
        "Slovene coreference resolution corpus coref149"
    ],
    "url": ""
}