{
    "Contact": [
        "Department of Information Technology, Gauhati University, Assam, India"
    ],
    "DiscHierarchy": [
        "1.4",
        "Humanities",
        "Linguistics"
    ],
    "Discipline": "Linguistics",
    "Format": [
        "downloadable_files_count: 0"
    ],
    "Language": [
        "Assamese"
    ],
    "MetaDataAccess": "https://clarin-pl.eu/oai/request?verb=GetRecord&metadataPrefix=oai_dc&identifier=oai:clarin-pl.eu:11321/615",
    "MetadataAccess": [
        "oai:clarin-pl.eu:11321/615"
    ],
    "PID": "http://hdl.handle.net/11321/615",
    "PublicationTimestamp": "2019-01-08T11:59:59Z",
    "PublicationYear": [
        "2019"
    ],
    "Publisher": [
        "Department of Information Technology, Gauhati University, Assam, India"
    ],
    "ResourceType": [
        "lexicalConceptualResource"
    ],
    "author": [
        "Sarma, Prof. Shikhar Kr."
    ],
    "fulltext": "oai:clarin-pl.eu:11321/615;2019-01-08T10:47:46Z;hdl_11321_3;hdl_11321_610;Assamese Named Entities;Sarma, Prof. Shikhar Kr.;Assamese NLP;Assamese NEs;Assamese Named entities;Gauhati University;A list comprising of 104138 Assamese named entities was developed. The list also comprises of NEs which are categorized as Organization(\u09b8\u09a6\u09cc \u0985\u09b8\u09ae \u099b\u09be\u09a4\u09cd\u09f0 \u09b8\u09a8\u09cd\u09a5\u09be), Person Names(\u09aa\u0999\u09cd\u0995\u099c), Festival(\u09a6\u09c1\u09f0\u09cd\u0997\u09be \u09aa\u09c2\u099c\u09be), Flower(\u0997\u09cb\u09b2\u09be\u09aa\u09ab\u09c1\u09b2), Folk Instruments(\u09ac\u09be\u0981\u09b9\u09c0), Food habits(\u09ad\u09be\u09a4), Games(\u09a2\u09cb\u09aa \u0996\u09c7\u09b2), Honorific title(\u099c\u09df\u09be\u09b2), Measurement(\u09af\u09cb\u0997), Place Name(\u09a4\u09c7\u099c\u09aa\u09c1\u09f0), Plants(\u0986\u0981\u09b9\u09a4 \u0997\u099b), Birds(\u09ad\u09be\u099f\u09cc), Religious Places(\u09aa\u09cb\u09f1\u09be \u09ae\u0995\u09cd\u0995\u09be), Tourist Places(\u0995\u09be\u099c\u09bf\u09f0\u0999\u09be), Institution name(\u0997\u09c1\u09f1\u09be\u09b9\u09be\u099f\u09c0 \u09ac\u09bf\u09b6\u09cd\u09ac\u09ac\u09bf\u09a6\u09cd\u09af\u09be\u09b2\u09df)\r\n\r\n---\r\n\r\n1. These Assamese NLP resources including the Tools and Applications are developed\r\nduring Research and Development Projects as well as Masters and Ph.D. thesis\r\nworks.\r\n2. These are mainly developed or generated at Gauhati University Department of\r\nComputer Science and Department of Information Technology.\r\n3. These resources are used by students and researchers for further studies, researches, as\r\nwell as for design and development of tools and applications.\r\n4. Computational Linguistics in Assamese is not rich, and Natural Language Processing\r\nworks have mainly started during last two decades, and most of the resources are first\r\ngeneration resources, and with ample scope for upgrading, enriching, and purifying.\r\n5. These are very good and essential resources for all the researchers in Assamese NLP, as\r\nthe language requires more and more NLP works to make Assamese a rich media for\r\nthe digital world.\r\n6. Anyone interested, or in need of such resources may express their interest for the\r\nrequired resources, and the way of availability will be advised/informed accordingly.\r\n7. These are purely research materials and could only be used for further research only.\r\n8. Researchers may visit the NLP Lab of Department of Information Technology, Gauhati\r\nUniversity, Guwahati, India or contact us.\r\n9. Researchers interested in collaborative works, and also students for project works, are\r\nwelcome.\r\n10. Contact person is Professor Shikhar Kr. Sarma, Department of Information\r\nTechnology, Gauhati University, Guwahati 781014, Assam, India. Email-\r\nsks@gauhati.ac.in;2019-01-08;lexicalConceptualResource;http://hdl.handle.net/11321/615;asm;downloadable_files_count: 0;Department of Information Technology, Gauhati University, Assam, India",
    "group": "clarin",
    "groups": [
        {
            "name": "clarin"
        }
    ],
    "name": "fe2e6b60-b330-56a1-bf74-24c200ac8282",
    "notes": [
        "A list comprising of 104138 Assamese named entities was developed. The list also comprises of NEs which are categorized as Organization(\u09b8\u09a6\u09cc \u0985\u09b8\u09ae \u099b\u09be\u09a4\u09cd\u09f0 \u09b8\u09a8\u09cd\u09a5\u09be), Person Names(\u09aa\u0999\u09cd\u0995\u099c), Festival(\u09a6\u09c1\u09f0\u09cd\u0997\u09be \u09aa\u09c2\u099c\u09be), Flower(\u0997\u09cb\u09b2\u09be\u09aa\u09ab\u09c1\u09b2), Folk Instruments(\u09ac\u09be\u0981\u09b9\u09c0), Food habits(\u09ad\u09be\u09a4), Games(\u09a2\u09cb\u09aa \u0996\u09c7\u09b2), Honorific title(\u099c\u09df\u09be\u09b2), Measurement(\u09af\u09cb\u0997), Place Name(\u09a4\u09c7\u099c\u09aa\u09c1\u09f0), Plants(\u0986\u0981\u09b9\u09a4 \u0997\u099b), Birds(\u09ad\u09be\u099f\u09cc), Religious Places(\u09aa\u09cb\u09f1\u09be \u09ae\u0995\u09cd\u0995\u09be), Tourist Places(\u0995\u09be\u099c\u09bf\u09f0\u0999\u09be), Institution name(\u0997\u09c1\u09f1\u09be\u09b9\u09be\u099f\u09c0 \u09ac\u09bf\u09b6\u09cd\u09ac\u09ac\u09bf\u09a6\u09cd\u09af\u09be\u09b2\u09df)\r\n\r\n---\r\n\r\n1. These Assamese NLP resources including the Tools and Applications are developed\r\nduring Research and Development Projects as well as Masters and Ph.D. thesis\r\nworks.\r\n2. These are mainly developed or generated at Gauhati University Department of\r\nComputer Science and Department of Information Technology.\r\n3. These resources are used by students and researchers for further studies, researches, as\r\nwell as for design and development of tools and applications.\r\n4. Computational Linguistics in Assamese is not rich, and Natural Language Processing\r\nworks have mainly started during last two decades, and most of the resources are first\r\ngeneration resources, and with ample scope for upgrading, enriching, and purifying.\r\n5. These are very good and essential resources for all the researchers in Assamese NLP, as\r\nthe language requires more and more NLP works to make Assamese a rich media for\r\nthe digital world.\r\n6. Anyone interested, or in need of such resources may express their interest for the\r\nrequired resources, and the way of availability will be advised/informed accordingly.\r\n7. These are purely research materials and could only be used for further research only.\r\n8. Researchers may visit the NLP Lab of Department of Information Technology, Gauhati\r\nUniversity, Guwahati, India or contact us.\r\n9. Researchers interested in collaborative works, and also students for project works, are\r\nwelcome.\r\n10. Contact person is Professor Shikhar Kr. Sarma, Department of Information\r\nTechnology, Gauhati University, Guwahati 781014, Assam, India. Email-\r\nsks@gauhati.ac.in"
    ],
    "oai_identifier": [
        "oai:clarin-pl.eu:11321/615"
    ],
    "oai_set": [
        "hdl_11321_3",
        "hdl_11321_610"
    ],
    "state": "active",
    "tags": [
        {
            "name": "Assamese NLP"
        },
        {
            "name": "Assamese NEs"
        },
        {
            "name": "Assamese Named entities"
        },
        {
            "name": "Gauhati University"
        }
    ],
    "title": [
        "Assamese Named Entities"
    ],
    "url": ""
}