{
    "Contact": [
        "Jan Koco\u0144"
    ],
    "DiscHierarchy": [
        "1.4",
        "Humanities",
        "Linguistics"
    ],
    "Discipline": "Linguistics",
    "Format": [
        "text/plain; charset=utf-8",
        "downloadable_files_count: 1",
        "application/zip"
    ],
    "Language": [],
    "MetaDataAccess": "https://clarin-pl.eu/oai/request?verb=GetRecord&metadataPrefix=oai_dc&identifier=oai:clarin-pl.eu:11321/403",
    "MetadataAccess": [
        "oai:clarin-pl.eu:11321/403"
    ],
    "PID": "http://hdl.handle.net/11321/403",
    "PublicationTimestamp": "2017-06-28T11:59:59Z",
    "PublicationYear": [
        "2017"
    ],
    "Publisher": [
        "Jan Koco\u0144"
    ],
    "ResourceType": [
        "toolService"
    ],
    "Rights": [
        "GNU LGPL 3.0",
        "http://www.gnu.org/licenses/lgpl.html",
        "PUB"
    ],
    "author": [
        "Koco\u0144, Jan"
    ],
    "fulltext": "oai:clarin-pl.eu:11321/403;2017-06-28T09:14:07Z;hdl_11321_3;hdl_11321_4;CorpoGrabber;Koco\u0144, Jan;CorpoGrabber;corpus;acquiring;web scraping;corpora builder;CorpoGrabber: The Toolchain to Automatic Acquiring and Extraction of the Website Content\r\nJan Koco\u0144, Wroclaw University of Technology\r\n\r\nCorpoGrabber is a pipeline of tools to get the most relevant content of the website, including all subsites (up to the user-defined depth). The proposed toolchain can be used to build a big Web corpora of text documents. It requires only the list of the root websites as the input. Tools composing CorpoGrabber are adapted to Polish, but most subtasks are language independent. The whole process can be run in parallel on a single machine and includes the following tasks: downloading of the HTML subpages of each input page URL [1], extracting of plain text from each subpage by removing boilerplate content (such as navigation links, headers, footers, advertisements from HTML pages) [2], deduplication of plain text [2], removing of bad quality documents utilizing Morphological Analysis Converter and Aggregator (MACA) [3], tagging of documents using Wroc\u0142aw CRF Tagger (WCRFT) [4]. Last two steps are available only for Polish. The result is a corpora as a set of tagged documents for each website. \r\n\r\nReferences\r\n[1] https://www.httrack.com/html/faq.html\r\n[2] J. Pomikalek. 2011. Removing Boilerplate and Duplicate Content from Web Corpora. Ph.D. Thesis. Masaryk University, Faculcy of Informatics. Brno.\r\n[3] A. Radziszewski, T. Sniatowski. 2011. Maca \u2013 a configurable tool to integrate Polish morphological data. Proceedings of the Second International Workshop on Free/Open-Source Rule-Based Machine Translation. Barcelona, Spain.\r\n[4] A. Radziszewski. 2013. A tiered CRF tagger for Polish. Intelligent Tools for Building a Scientific Information Platform: Advanced Architectures and Solutions. Springer Verlag.;2017-06-28;toolService;http://hdl.handle.net/11321/403;N/A;GNU LGPL 3.0;http://www.gnu.org/licenses/lgpl.html;PUB;text/plain; charset=utf-8;application/zip;downloadable_files_count: 1;Jan Koco\u0144",
    "group": "clarin",
    "groups": [
        {
            "name": "clarin"
        }
    ],
    "name": "ff0e843a-3190-53bf-a9fe-675c6711fc7c",
    "notes": [
        "CorpoGrabber: The Toolchain to Automatic Acquiring and Extraction of the Website Content\r\nJan Koco\u0144, Wroclaw University of Technology\r\n\r\nCorpoGrabber is a pipeline of tools to get the most relevant content of the website, including all subsites (up to the user-defined depth). The proposed toolchain can be used to build a big Web corpora of text documents. It requires only the list of the root websites as the input. Tools composing CorpoGrabber are adapted to Polish, but most subtasks are language independent. The whole process can be run in parallel on a single machine and includes the following tasks: downloading of the HTML subpages of each input page URL [1], extracting of plain text from each subpage by removing boilerplate content (such as navigation links, headers, footers, advertisements from HTML pages) [2], deduplication of plain text [2], removing of bad quality documents utilizing Morphological Analysis Converter and Aggregator (MACA) [3], tagging of documents using Wroc\u0142aw CRF Tagger (WCRFT) [4]. Last two steps are available only for Polish. The result is a corpora as a set of tagged documents for each website. \r\n\r\nReferences\r\n[1] https://www.httrack.com/html/faq.html\r\n[2] J. Pomikalek. 2011. Removing Boilerplate and Duplicate Content from Web Corpora. Ph.D. Thesis. Masaryk University, Faculcy of Informatics. Brno.\r\n[3] A. Radziszewski, T. Sniatowski. 2011. Maca \u2013 a configurable tool to integrate Polish morphological data. Proceedings of the Second International Workshop on Free/Open-Source Rule-Based Machine Translation. Barcelona, Spain.\r\n[4] A. Radziszewski. 2013. A tiered CRF tagger for Polish. Intelligent Tools for Building a Scientific Information Platform: Advanced Architectures and Solutions. Springer Verlag."
    ],
    "oai_identifier": [
        "oai:clarin-pl.eu:11321/403"
    ],
    "oai_set": [
        "hdl_11321_3",
        "hdl_11321_4"
    ],
    "state": "active",
    "tags": [
        {
            "name": "CorpoGrabber"
        },
        {
            "name": "corpus"
        },
        {
            "name": "acquiring"
        },
        {
            "name": "web scraping"
        },
        {
            "name": "corpora builder"
        }
    ],
    "title": [
        "CorpoGrabber"
    ],
    "url": ""
}