{
    "Contact": [
        "Chandra X-ray Observatory"
    ],
    "DiscHierarchy": [
        "4.2.5",
        "Physics",
        "Astrophysics and Astronomy"
    ],
    "Discipline": "Astrophysics And Astronomy",
    "MetaDataAccess": "http://registry.euro-vo.org/oai.jsp?verb=GetRecord&metadataPrefix=oai_dc&identifier=ivo://cxc.harvard.edu/cda",
    "PublicationTimestamp": "2018-12-21T17:37:19Z",
    "PublicationYear": [
        "2018"
    ],
    "Publisher": [
        "Chandra X-ray Observatory"
    ],
    "RelatedIdentifier": [
        "ivo://cxc.harvard.edu/cda"
    ],
    "ResourceType": [
        "Archive"
    ],
    "author": [
        "Chandra X-ray Center"
    ],
    "fulltext": "ivo://cxc.harvard.edu/cda;2018-12-21T17:37:19Z;Chandra X-ray Observatory Data Archive;ivo://cxc.harvard.edu/cda;Chandra X-ray Observatory;Chandra X-ray Center;X-ray astronomy;galaxies;quasars;stars;X-ray;photometry;spectroscopy;variability;\n        The Chandra X-ray Observatory is the U.S. follow-on to the Einstein\n        Observatory. Chandra was formerly known as AXAF, the Advanced X-ray\n        Astrophysics Facility, but renamed by NASA in December, 1998.\n        Originally three instruments and a high-resolution mirror carried in\n        one spacecraft, the project was reworked in 1992 and 1993. The Chandra\n        spacecraft carries a high resolution mirror, two imaging detectors,\n        and two sets of transmission gratings. Important Chandra features are:\n        an order of magnitude improvement in spatial resolution, good\n        sensitivity from 0.1 to 10 keV, and the capability for high spectral\n        resolution observations over most of this range.\n        ;Archive",
    "group": "ivoa",
    "groups": [
        {
            "name": "ivoa"
        }
    ],
    "name": "0a87b87f-a18b-5568-8254-ba8d2566b622",
    "notes": [
        "\n        The Chandra X-ray Observatory is the U.S. follow-on to the Einstein\n        Observatory. Chandra was formerly known as AXAF, the Advanced X-ray\n        Astrophysics Facility, but renamed by NASA in December, 1998.\n        Originally three instruments and a high-resolution mirror carried in\n        one spacecraft, the project was reworked in 1992 and 1993. The Chandra\n        spacecraft carries a high resolution mirror, two imaging detectors,\n        and two sets of transmission gratings. Important Chandra features are:\n        an order of magnitude improvement in spatial resolution, good\n        sensitivity from 0.1 to 10 keV, and the capability for high spectral\n        resolution observations over most of this range.\n        "
    ],
    "oai_identifier": [
        "ivo://cxc.harvard.edu/cda"
    ],
    "oai_set": "",
    "state": "active",
    "tags": [
        {
            "name": "X-ray astronomy"
        },
        {
            "name": "galaxies"
        },
        {
            "name": "quasars"
        },
        {
            "name": "stars"
        },
        {
            "name": "X-ray"
        },
        {
            "name": "photometry"
        },
        {
            "name": "spectroscopy"
        },
        {
            "name": "variability"
        }
    ],
    "title": [
        "\n        The Chandra X-ray Observatory is the U.S. follow-on to the Einstein\n        Observatory. Chandra was formerly known as AXAF, the Advanced X-ray\n        Astrophysics Facility, but renamed by NASA in December, 1998.\n        Originally three instruments and a high-resolution mirror carried in\n        one spacecraft, the project was reworked in 1992 and 1993. The Chandra\n        spacecraft carries a high resolution mirror, two imaging detectors,\n        and two sets of transmission gratings. Important Chandra features are:\n        an order of magnitude improvement in spatial resolution, good\n        sensitivity from 0.1 to 10 keV, and the capability for high spectral\n        resolution observations over most of this range.\n        "
    ]
}