{
    "Contact": [
        "Michael Preciado <Michael.E.Preciado@nasa.gov>"
    ],
    "DiscHierarchy": [
        "4.2.5",
        "Physics",
        "Astrophysics and Astronomy"
    ],
    "Discipline": "Astrophysics And Astronomy",
    "Format": [
        "text/xml"
    ],
    "MetaDataAccess": "http://dc.g-vo.org/rr/q/pmh/pubreg.xml?verb=GetRecord&metadataPrefix=oai_datacite&identifier=ivo://nasa.heasarc/ipcultsoft",
    "MetadataAccess": [
        "ivo://nasa.heasarc/ipcultsoft"
    ],
    "PublicationTimestamp": "2019-07-01T11:59:59Z",
    "PublicationYear": [
        "2019"
    ],
    "Publisher": [
        "NASA/GSFC HEASARC"
    ],
    "ResourceType": [
        "AstroObjects"
    ],
    "author": [
        "Thompson, Shelton, Arning"
    ],
    "fulltext": "ivo://nasa.heasarc/ipcultsoft;2019-06-17T07:04:24Z;Thompson, Shelton, Arning;Einstein IPC Ultrasoft Sources Catalog;NASA/GSFC HEASARC;2019;Survey Source;Michael Preciado <Michael.E.Preciado@nasa.gov>;AstroObjects;ivo://nasa.heasarc/ipcultsoft;https://heasarc.gsfc.nasa.gov/W3Browse/all/ipcultsoft.html;\n        https://heasarc.gsfc.nasa.gov/cgi-bin/W3Browse/w3query.pl?tablehead=name=heasarc_ipcultsoft&Action=More+Options&Action=Parameter+Search&ConeAdd=1\n      ;text/xml;text/xml;\n      A survey of the entire Einstein IPC database (a total of 5934 sources) has been carried out in order to select objects with strong components of ultrasoft X-ray emission (i.e., emission below 0.5 keV). The selection criteria were based on ratios of counts within three broad energy bands (i.e., X-ray &quot;colors&quot;). A total of 516 objects have been selected, with 202 (39%) having been identified through correlations with other databases. Of the currently identified objects, 45% are active galactic nuclei, 28% are stellar objects, 6% are &quot;normal&quot; galaxies and galaxy clusters, and the remaining 21% are &quot;nonstellar&quot; Galactic objects such as cataclysmic variables, pulsars, and white dwarfs. The selection of sources for this survey was based on the analysis of counts in three broad energy bands defined as C1=0.16-0.56 keV, C2=0.56-1.08 keV, and C3= 1.08-3.5 keV. Ratios of these three bands constituted X-ray 'colors' which in turn were used to estimate the shape of the spectrum over the IPC bandpass. Based on models of X-ray spectra folded through the IPC response function, the following criteria were determined for the selection of ultrasoft sources: C1&gt;0 and R1=C2/C1&lt;0.36. These criteria guarantee an intrinsically soft X-ray spectrum that can be modeled by blackbody temperatures kT&lt;50 keV, power-law spectral indices of &gt;=2, or thermal plasma temperatures T&lt;1 MK (million K). Details of the data analysis can be found in the Thompson et al. (1998) reference.\n    ",
    "group": "ivoa",
    "groups": [
        {
            "name": "ivoa"
        }
    ],
    "name": "0a8c3ec3-4857-538e-bc4c-e91ee3b7c342",
    "notes": [
        "\n      A survey of the entire Einstein IPC database (a total of 5934 sources) has been carried out in order to select objects with strong components of ultrasoft X-ray emission (i.e., emission below 0.5 keV). The selection criteria were based on ratios of counts within three broad energy bands (i.e., X-ray &quot;colors&quot;). A total of 516 objects have been selected, with 202 (39%) having been identified through correlations with other databases. Of the currently identified objects, 45% are active galactic nuclei, 28% are stellar objects, 6% are &quot;normal&quot; galaxies and galaxy clusters, and the remaining 21% are &quot;nonstellar&quot; Galactic objects such as cataclysmic variables, pulsars, and white dwarfs. The selection of sources for this survey was based on the analysis of counts in three broad energy bands defined as C1=0.16-0.56 keV, C2=0.56-1.08 keV, and C3= 1.08-3.5 keV. Ratios of these three bands constituted X-ray 'colors' which in turn were used to estimate the shape of the spectrum over the IPC bandpass. Based on models of X-ray spectra folded through the IPC response function, the following criteria were determined for the selection of ultrasoft sources: C1&gt;0 and R1=C2/C1&lt;0.36. These criteria guarantee an intrinsically soft X-ray spectrum that can be modeled by blackbody temperatures kT&lt;50 keV, power-law spectral indices of &gt;=2, or thermal plasma temperatures T&lt;1 MK (million K). Details of the data analysis can be found in the Thompson et al. (1998) reference.\n    "
    ],
    "oai_identifier": [
        "ivo://nasa.heasarc/ipcultsoft"
    ],
    "oai_set": "",
    "state": "active",
    "tags": [
        {
            "name": "Survey Source"
        }
    ],
    "title": [
        "Einstein IPC Ultrasoft Sources Catalog"
    ],
    "url": "https://heasarc.gsfc.nasa.gov/W3Browse/all/ipcultsoft.html"
}